id,title,job_url,company,company_link,location,published_at,number_of_applicants_applied,employment_duration,work_location_type,work_experience_level,company_type,company_logo,company_description,about_the_job
3814197227,Senior Infrastructure Engineer,https://www.linkedin.com/jobs/view/3814197227,PT Smartfren Telecom Tbk,https://www.linkedin.com/company/smartfren-telecom/life,"Jakarta, Jakarta, Indonesia",1 week ago,17,,On-site,,"1,001-5,000 employees · Telecommunications",https://media.licdn.com/dms/image/C560BAQHrMexZYteoYA/company-logo_100_100/0/1674549809217?e=1715212800&v=beta&t=1Vw151Yk_frwpLvSk1qy9ZARFut8U9lultWL2ZI6Swg,"PT Smartfren Telecom Tbk (IDX:FREN) is one of the fastest growing telecommunication companies in Indonesia. We are pioneers of 4G LTE internet services and VoLTE services. Together, we help Indonesia open opportunities to enter the digital era.

As one of the Sinarmas business groups, Smartfren is the only telecommunications service provider company in Indonesia that operates fully on the 4G network. With a national network coverage area, and more than 43,000 4G BTS spread across over 285 cities throughout Indonesia,

Smartfren has been asked to become the official telco partner for well-known global smartphone brands and a pioneer of various product innovations such as Voice-over-LTE services ( VoLTE) and Digital SIM (eSIM) in Indonesia.

#Smartfren #100PersenUntukIndonesia #MenyatukanYangBerbeda","To perform implementation of ICT Infra (Baremetal Server, Storage, Backup/DRC Solution and Virtualization) products for enterprise customers
To perform technical support for the implemented solution as part of Day 0, Day 1 and Day 2 role
Work together with Project Manager to create Technical document
Conduct Infra assessment and technical site survey to the customer
Understand customer expectation on technical solutioning


Requirements:

Min. 3-5 years experience as Engineer Lead
Implementation hands on and experience in ICT infra technology such as baremetal server, storage (Dell, HPE, Fujitsu, Nutanix), backup/DRC solution and Virtualization
Ability to manage customer satisfaction, commitment and expectations to high service levels
Understand customer expectation on technical solutioning
Industry Certification: Any baremetal server, storage, backup/DRC solution and Virtualization certification. Professional level certification is mandatory"
3801606317,NOC (Network Operation Center),https://www.linkedin.com/jobs/view/3801606317,,,"Karawang, West Java, Indonesia",,0,,On-site,,Your profile matches this job,,,"Company Description: Phanindo Mitra Abadi is an electrical & engine company in Indonesia. And we are constantly trying to upgrade our products and improve our services to suit our customers' requirements. Job Description:

 Bertugas memonitor kondisi jaringan dan data center agar berjalan dengan baik.

Duties and responsibilities

 Mengoperasikan V-Lan
 Mengoperasikan Mikrotik
 Setting Radio
 Mengoperasikan Fiber Optik
 Setting Wireless
 Trouble Shoot Maintance"
3800523931,Staff IT,https://www.linkedin.com/jobs/view/3800523931,,,"Surabaya, East Java, Indonesia",,0,,On-site,,See how you compare to 25 applicants. Try Premium for IDR0,,,"Company Description: Perusahaan Group Yayasan Lembaga Pendidikan Al-Hikmah Surabaya, yang mengurus Unit Bisnis yayasan. Antara lain : Catering, Resto, Swalayan, Toko Seragam & ATK, Sport Centre : Kolam Renang & Lap. Bulu Tangkis. Job Description:

Staff IT"
3787912433,Cybersecurity Specialist,https://www.linkedin.com/jobs/view/3787912433,Kelola Talenta Global,https://www.linkedin.com/company/kelola-talenta-global/life,Jakarta Metropolitan Area,1 month ago,36,,On-site,,11-50 employees · Human Resources Services,https://media.licdn.com/dms/image/C560BAQGcHHHu9AzpeQ/company-logo_100_100/0/1679922836664/kelola_talenta_global_logo?e=1715212800&v=beta&t=WKTrSxRvMl-0vbvyytzZoVtqL8VDu207aJNbjPgwWhw,"We are your partner in providing digital talent solutions. We connect your business with top talent and revolutionize the way work gets done.

Our Mission : ""To provide an innovative, scalable, and effective talent solution that utilizes cutting-edge technology and expertise to streamline the talent procurement process. We strive to be the go-to advisor for businesses seeking to advance and flourish with the support of skilled tech professionals."".

We streamline the talent procurement process for clients. We provide IT Recruitment, IT Outsourcing and Application & Software Development Service where we take care from the IT Talent Supply Chain on behalf of the client.","Information Security, Cyber Threats, Security Tools and technologies, Risk Management, Incident Response, Compliance

Actively monitor the security of the used car sales website's systems and infrastructure to detect security threats, cyberattacks, or suspicious activities.
Respond to and efficiently handle security incidents, including conducting in-depth investigations, identifying root causes, and taking preventive measures to prevent similar incidents in the future.
Conduct routine security analyses and implement security updates and improvements to maintain the reliability and integrity of the system in the face of evolving cyber threats.
Collaborate with the development and management teams to identify and assess security risks, as well as provide recommendations and advice regarding information security policies necessary to protect the used car sales website from potential security threats.

Powered by JazzHR

NIOVW5nQTE"
3607478850,Information Security and Compliance Manager,https://www.linkedin.com/jobs/view/3607478850,Mekari,https://www.linkedin.com/company/mekari/life,"Jakarta, Jakarta, Indonesia",9 months ago,100,,Hybrid,,"1,001-5,000 employees · Software Development",https://media.licdn.com/dms/image/D560BAQEy-QSiDSQhLQ/company-logo_100_100/0/1689148487268/mekari_logo?e=1715212800&v=beta&t=gU4VbJKutHMjhSIjBIlAGhOCgKc70gzZ4O3XjwMCo3g,"Mekari is the #1 Software-as-a-Service (SaaS) company in Indonesia, aiming to empower the progress of businesses and professionals across various industries.

Our innovative cloud-based technology solution in HR (Mekari Talenta), Accounting (Mekari Jurnal), Sales (Mekari Qontak), Tax (Mekari Klikpajak), Electronic Signature (Mekari Sign), and Benefits (Mekari Flex) have been used by tens thousands of businesses in Indonesia.

To reach millions, we need more people like you —those eager to innovate, lead, and win with us.","Mekari is Indonesia's no. 1 Software-as-a-Service (SaaS) company. Our mission is to empower businesses and professionals to progress effortlessly. Our products (Mekari Talenta, Mekari Jurnal, Mekari KlikPajak, Mekari Qontak and Mekari e-Sign that have been used by tens of thousands of businesses in Indonesia.

To reach millions, we need more people like you: entrepreneurs, builders, owners inside the company who are eager to grow at scale. Join us to empower more businesses with technology.

Key Responsibilities

Create and maintain a framework that defines Mekari approach on various key business processes and policy implementations. 
Create and maintain a framework to identify, assess, mitigate, implement, and monitor risks within Mekari. 
Developing, implementing, and maintaining information security and compliance programs to adhere to law, regulation, and internal standards. 
Provide technical leadership and mentoring on governance, risk management, and compliance activity within organization. 
Work with stakeholders across the organization to ensure that security and compliance controls are integrated into business processes and systems 

Requirements

Experience in mature information security and GRC functions, preferably from the initial conception to maturity.
Good communication skill in written and oral to liaise with business stakeholders
Knowledge about Endpoint security management
Excellent teamwork and analytical skills

Our team will review your application and will be in touch if your application is shortlisted to the next stage. If you do not hear from us in 30 days, we will keep your resume on file in case a relevant opportunity opens up.

Don't forget to check our Recruitment FAQ at bit.ly/RecruitmentFAQ-Mekari [ENG] or bit.ly/RekrutmenMekari-FAQ [INA] to find the answers to commonly-asked questions regarding our recruitment process.

We wish you the best. Hope to see you around soon!"
3789546696,System Operation Officer,https://www.linkedin.com/jobs/view/3789546696,Datascrip,https://www.linkedin.com/company/datascrip/life,"Jakarta, Jakarta, Indonesia",1 month ago,10,,On-site,,"1,001-5,000 employees · Retail Office Equipment",https://media.licdn.com/dms/image/D560BAQHfwZ3IDw9Dqw/company-logo_100_100/0/1693532541691/datascrip_logo?e=1715212800&v=beta&t=ou-fJG8wcqTqVVnHR14JZoKfLdmNvHOu4FUuaU11fTw,"Datascrip – Business Solutions
A company that markets and sells machinery, digital devices, furniture, survey tools, stationery, and systems needed in business and offices.


HISTORY
Datascrip started out as a humble stationery store in 1969. The company continued to expand its product lines from stationery to office equipment, office machines, drafting machines, office furniture, computers and printers. In 1979, Office Systems was the company's core business. With its foray into information technology sector, Datascrip is now known as a One-Stop Business Solutions company.

VISION
Our vision is to be the prominent distributor of business products in Indonesia.

MISSION
Our mission is to support customer's business through high quality product provision and excellent customer service, with strong company culture, competent employees, efficient technology and good financial health.

VALUES
We believe and base our actions on the following values:
Succeed Above Success.
CARE - Customer Interest, Attentive, Responsive and Efficient.
CoCoCo - Communication, Cooperation, Coordination.
SMILE - Share, Motivate, Improve, Lead, Efficient.","Company Description: Datascrip adalah perusahaan yang memasarkan dan menjual mesin, perangkat digital, furnitur, alat survey, stationery dan sistem yang diperlukan dalam bisnis dan perkantoran. Job Description:

 Memelihara ERP dan aplikasi internal yang digunakan oleh perusahaan
 Memberikan support dan melakukan analisa terhadap permasalahan sistem/aplikasi yang dihadapi user baik dari sisi bugs aplikasi maupun human error ataupun masalah lainnya serta melakukan analisa untuk perbaikan sistem/aplikasi agar kejadian yang sama tidak terulang
 Menganalisa proses Business maupun System untuk keperluan improvement dan pembuatan program/aplikasi
 Mengerjakan tugas rutin maintenance operasional aplikasi bisnis baik secara harian, mingguan, bulanan dan tahunan
 Membuat design/flowchart, baik menggunakan Visio maupun UML Tools
 Bekerjasama dengan tim developer, tim vendor, maupun tim terkait dalam pembuatan aplikasi/program dan memastikan sudah sesuai dengan kebutuhan dan permintaan user
 Melakukan EUT (End User Training) dan UAT (User Acceptance Test)
 Membantu dan mengawasi implementasi software aplikasi yang dibeli dari vendor
 Memberikan training dan support kepada user serta melakukan troubleshoot terkait permasalahan sistem/aplikasi yang digunakan user
 Melakukan pencatatan ke dalam Helpdesk system terhadap semua permintaan, keluhan user, dan problem yang ditangani oleh IT Operation"
3786708067,SysAdmin / IT Support,https://www.linkedin.com/jobs/view/3786708067,PT. RAKHASA ARTHA WISESA,https://www.linkedin.com/company/rakhasa/life,Jakarta Metropolitan Area,2 months ago,34,,On-site,,11-50 employees · Information Technology & Services,https://media.licdn.com/dms/image/C560BAQG8YwIMsiLl6A/company-logo_100_100/0/1678623590325?e=1715212800&v=beta&t=5-JTn433pmUhVnMjO8msug239Ew1eRF97Rpl7pXIZL8,"Rakhasa is a startup company engaged in Information Technology. We are a global IT Service Solutions Company and IT Consultant, building powerful mobile and desktop applications. Our company was founded in 2020 and has more than 10 years of experience in the field of information technology. The products provided by our company are service-based in graphic and web design, desktop & mobile application development, e-commerce, hosting, and security.

Rakhasa is dominated by young people who are ready to make changes, especially in the Information Technology sphere. The continued development of Information Technology makes it a great opportunity for us to continue to create various kinds of superior products according to the needs of the community, especially in obtaining various information.

OUR VISION : Information technology is a fast growing industry, and the companies need to keep following is an absolute thing to do, but this will need significant amount of cost, there for we are here to provide the best solution for your company to get it done easily at a low cost with the best quality.

OUR MISION : Our Goal is to create world class and the best product for each of our services that suite for our clients needs, a combination of beauty and powerfull product is what we do best.","Requirements

Minimum Bachelor's Degree in Computer Science or equivalent.

Minimum 1 year experience as a System Administrator. Mastering computer network systems (IP Address, SubNetting, Network Configuration and Troubleshooting).

Mastering Mikrotik Router (DNS, Gateway, NAT, Routing, Firewall and Troubleshooting).

Mastering Linux Server (Installation, Package Management, Firewall and Troubleshooting).

Mastering Linux web server configuration (LAMP, LEPP, Nginx as Web Proxy).

Mastering the High Availability server configuration (Failover and Load Balancer).

Mastering Mail Server configuration Mastering database configuration / tuning (MySql and PostgreSql).

Mastering the configuration of Master Slave Replication and Master Master.

Replication databases (MySql, PostgreSql and MongoDB).

Mastering Server Virtualization (VMware, Hyper-V, Proxmox and Virtualizor).

Mastering Server Monitoring configuration (Nagios, Icinga, Zabbix, etc.).

Mastering ELK Stack is a plus.

Mastering the CI / CD (Continuous Integration / Continuous Development) configuration.

Responsibilities

Create Virtual Machine according to the required specifications.

Manage server resources optimally.

Perform regular server optimization.

Monitoring all servers used.

Ensure CI/CD is running properly.

Configuring Web server according to application needs.

Create and manage Mail Server as needed.

Learning new tools / software / systems that are useful for increasing the stability of the current system.

Create complete and detailed documentation."
3677044773,Senior Associate - Risk Assurance - IT Governance or IT Cybersecurity,https://www.linkedin.com/jobs/view/3677044773,PwC,https://www.linkedin.com/company/pwc/life,"Jakarta, Jakarta, Indonesia",7 months ago,66,,On-site,,"10,001+ employees · Professional Services",https://media.licdn.com/dms/image/D4D0BAQH3qXh7nyImoQ/company-logo_100_100/0/1697100791441/pwc_logo?e=1715212800&v=beta&t=9o5nKznvLKK7qPZ4mwRDjLzRwiTfkcip93MZF_QWWmg,"At PwC, our purpose is to build trust in society and solve important problems. We’re a network of firms in 152 countries with over 327,000 people who are committed to delivering quality in assurance, advisory and tax services. Find out more and tell us what matters to you by visiting us at www.pwc.com. PwC refers to the PwC network and/or one or more of its member firms, each of which is a separate legal entity.

Content on this page has been prepared for general information only and is not intended to be relied upon as accounting, tax or professional advice. Please reach out to your advisors for specific advice.","Line of Service
Assurance

Industry/Sector
Not Applicable

Specialism
Assurance

Management Level
Senior Associate

Job Description & Summary
A career in our Cybersecurity practice, within Risk Assurance. Helps business leaders protect and manage their risk related to information regarding technology, people, systems, processes, culture, and physical surroundings. We help clients’ understand their current capability and develop a plan to build cyber security resilience to identify, protect, detect and respond to cybersecurity threats, including advising on various regulatory and data privacy issues.

IT Cybersecurity

Responsibilities:
Perform assessment / design/ implementation related to cybersecurity:
Governance using various standards / frameworks such as NIST, ISO 27000 family, PCI-DSS, COBIT, CIS, and other established standards; or
Various application security and various infrastructure security (e.g operating system, database, firewall, switches, API and other security devices). This includes security assessment on web applications / infrastructures / clouds / mobile applications; or
Cloud security; or
Red teaming exercise; or
Cyber incident response, threat hunting and incident analysis; or
Operation technology security (preferably in energy, mining, utilities or oil & gas industry). 
Provide recommendations / advice to clients.
Train, coach and upskill team members’ capabilities.
Perform active business developments, marketing, proposal preparation process, and lead pursuit of IT-related security projects.
Interacting with clients on solutions and executing projects on client engagements, forming client relationships and demonstrating an understanding of the client’s business.
Preparing concise and accurate documents / report, leveraging and utilizing MS Office (Word, Excel, Access, PowerPoint).

 

Requirements:
Minimum - a bachelor’s degree within a related field.
Three to five years of work experience in a relevant area. Having experience in a cybersecurity consulting firm is an advantage.
Good professional reporting skills in Bahasa Indonesia and English. 
Good knowledge of relevant cybersecurity standards / frameworks.
Good experience and knowledge in general IT technical and controls, network, and security best practises.
Having a related cybersecurity certificate is an advantage e.g.:
Cybersecurity Governance area: Certified Information Systems Security Professional (CISSP) or Certified Information Security Manager (CISM).
Application and Infrastructure security area: Offensive Security Certified Professional (OSCP) or Offensive Security Certified Expert (OSCE).
Cloud security: Certified Cloud Security Professional (CCSP) or advanced security certification from Cloud Service Provider


IT GovernanceRequirements
Minimum - a bachelor’s degree in Computer Science, Management Information Systems, Accounting, or related field.
Three to five years of work experience in a relevant area. Having experience in conducting IT review / assessment and/ or IT regulatory compliance.
Familiar with COBIT framework and IT regulations in Indonesia.
Familiar with technology that supports financial and operational application systems and related business processes.
Ability to identify IT related risks and sufficient controls in business processes.
Strong time management skills, including flexibility to work with shifting priorities and client needs.
Ability to perform coaching and developing junior team members.
Strong communication skills to build client relationships (networking).
Strong presentation and report writing skills (in English and Bahasa).
Fast learning to understand new business and clients.
 Desirable skills:
Control Objectives for Information and Related Technologies (COBIT)/ Certified in Governance of Enterprise IT (CGEIT)/ Certified in Risk and Information Systems Control (CRISC)/ Certified Information Systems Auditor (CISA) qualification, or equivalent is an advantage.
Experience in performing IT review of one of these: financial services / telecommunications / manufacturing / consumer and retail / energy, utilities, and resources / startup companies.
Experience in IT Sarbanes-Oxley review and / or IT Governance review is an advantage.
 

Education (if blank, degree and/or field of study not specified)
Degrees/Field of Study required:

Degrees/Field of Study preferred: Bachelor Degree - Accounting

Certifications (if blank, certifications not specified)

Required Skills

Optional Skills

Desired Languages (If blank, desired languages not specified)

Travel Requirements
Up to 40%

Available for Work Visa Sponsorship?
No

Government Clearance Required?
No

Job Posting End Date"
