id,title,job_url,company,company_link,location,published_at,number_of_applicants_applied,employment_duration,work_location_type,work_experience_level,company_type,company_logo,company_description,about_the_job
3759905823,Sales Manager,https://www.linkedin.com/jobs/view/3759905823,OLIVER Agency,https://www.linkedin.com/company/oliver-agency/life,"Jakarta, Jakarta, Indonesia",2 months ago,22,,On-site,,"1,001-5,000 employees · Advertising Services",https://media.licdn.com/dms/image/C4D0BAQGyrxTGRyFxJA/company-logo_100_100/0/1630557294733/oliver_agency_logo?e=1715212800&v=beta&t=DAHIwi11o2bM4rWx-yxQvaMc43cLVGKZ6nW9Wknklrc,"Established in 2004, we are the first and only company to design, build and run bespoke in-house agencies and ecosystems for brands. Today, we create work that delivers business growth, fame and purpose for over 300 clients in 48 countries and counting.

Our unique model moves at the speed of modern business to drive change from the inside out; working smarter to make our clients’ money go further, and helping them build better solutions, systems and brands. Client solutions include Unilever’s U-Studio (a platform used by almost three-quarters of Unilever's brands globally), adidas’ off-shore hub and PepsiCo’s global digital team.

In 2020 we were ranked #1 in Adweek’s Fastest Growing list (US) and featured in The Drum’s Honours List of the best businesses that helped shape the year.

We are part of the Inside Ideas Group (IIG), which combines specialisms from Adjust Your Set (content and culture), Dare (design, experience and engineering) and Aylesworth Fleming (property marketing). IIG joined marketing technology group, The Brandtech Group (formerly known as You & Mr Jones) in January 2019 to give their clients access to the latest marketing technology solutions. The group includes tech-driven marketing companies, 55, Mofilm, Collectively, Gravity Road, Blood and Mobkoi, and holds strategic investments in leading technology businesses including Pinterest, Niantic, AI Foundation, VidMob, Jivox, Zappar, EVRYTHNG, Automat, Blacktag and Beeswax.","Job Title: Sales Manager.

Location:  Jakarta, Indonesia

A LITTLE BIT ABOUT THE ROLE:

OLIVER Agency requires a Indonesia-based Sales Manager. This is a fast-paced but extremely rewarding role that will allow self-development as well as growth of the overall business. Essentially, the success of the sales department will ultimately be the success of the business as a whole.

WHAT YOU WILL BE DOING :

Responsible for the entire sales cycle from prospect identification to contract implementation 
Selling regional and local in-house content, creative and digital agencies that include a range of services including online and offline end to end creative and design, social and community management media, digital, copywriting, videography, data & analytics etc. 
Creating and designing bespoke agency solutions for clients 
Developing structured sales strategies, sales plans, and profit targets 
Deliver individual and team targets – annual revenue and gross profit targets 
Managing and nurturing the regional sales team 
Maximising new business development opportunities 
Come with an established network of Marketing & Procurement connections in medium to large size businesses 
Increasing business opportunities through various routes to market 
Compiling and analysing sales figures 
Keeping up to date with products and competitors 
Representing the business at conferences, trade fairs and networking events 

WHAT YOU WILL NEED TO BE GREAT IN THIS ROLE :

8-10 years of experience in a sales role, preferably with advertising experience / knowledge 
Proven track record of sales achievements 
Experienced with management of sales teams and targets 
Versatility to manage different stakeholders and industries 
Fantastic presentation, networking and relationship building abilities 
Commercially astute – apt at building commercial solutions and forecasting profitability 
Able to priorities leads and maximize revenue via sales pipeline control 
Face to face and telephone sales experience including negotiation and pitching 
Proficient with Salesforce and Microsoft Office 
Strategic, consultative and solution-based sales approach 
Excellent document creation / sales deck capabilities 
Independent and proactive with strong project management skills 

A LITTLE BIT ABOUT US:

OLIVER provides clients with dedicated agencies. We do this because we believe the traditional agency model is not fit for the speed of modern marketing. Businesses want, and rightly demand, the same quality of strategic and creative thinking the traditional agency provides, but at a speed that befits how they now work.

The traditional agency outside-in model means that huge quantities of time are wasted in the back and forth and linear processes between agencies and clients. OLIVER agencies come to the client, live inside their office and solve their problems collaboratively.

OLIVER agencies are strategic and creative, whilst being agile and adaptive. They cover the full range of integrated marketing, but at the speed that businesses now demand. We allow our clients to work in real time. Creating better work, at pace.

OUR VALUES AND HOW TO LIVE THEM:

Ambition – you look for opportunities to deliver greater value to those around you.

Imagination – you identify a range of solutions to problems.

Inclusion – to be actively pro-inclusive and anti-racist across our community, clients and creations.

Inspiration – you lead by example and encourage others to do the same.

Learning – you have excellent listening skills that helps you to learn from our clients and those around you.

Results – you accept responsibility for your actions.

We've set ambitious, market-leading environmental and social goals around sustainability at OLIVER. We have committed to be net zero by 2030 and take far reaching action on DE&I in the sector. We expect everyone to contribute to our mission, embedding sustainability into every department and through every stage of the project lifecycle. 

Inside Ideas Group and its' affiliates are equal opportunity employers committed to creating an inclusive working environment where all our employees are encouraged to reach their full potential, and individual differences are valued and respected. All [suitable] applicants shall be considered for employment without regard to race, ethnicity, religion, gender, sexual orientation, gender identity, age, neurodiversity, disability status, or any other characteristic protected by local laws."
3737531771,IT Security Architect,https://www.linkedin.com/jobs/view/3737531771,Asuransi Astra,https://www.linkedin.com/company/asuransiastra/life,"Jakarta, Jakarta, Indonesia",4 months ago,39,,Hybrid,,"1,001-5,000 employees · Insurance",https://media.licdn.com/dms/image/C510BAQFYlNnsdNBI4g/company-logo_100_100/0/1630622371687/pt__asuransi_astra_buana_logo?e=1715212800&v=beta&t=mQvGOeXqScnf39EKLVz0JnYZ1U0bn1gXclyQ3w4cDw4,"Asuransi Astra adalah perusahaan asuransi umum yang telah berdiri dan melayani pelanggan sejak 12 September 1956. Asuransi Astra merupakan entitas utama konglomerasi keuangan Astra dan berhasil mendapatkan peringkat kredit Excellent dari AM Best. Perusahaan yang dikenal dengan produk asuransi kendaraan bermotor Garda Oto ini hadir melayani pelanggan melalui jaringan layanan yang tersebar di 29 kantor cabang, serta Unit layanan dan Garda Center yang terus berkembang. Selain asuransi kendaraan bermotor, produk lain dari Asuransi Astra antara lain adalah asuransi industri pertambangan, asuransi industri agribisnis, asuransi properti ruko, asuransi SPBU, asuransi syariah, asuransi kesehatan korporasi Garda Medika, dan asuransi kesehatan perorangan Garda Healthtech. Asuransi Astra juga memiliki asuransi yang dapat dibeli secara online di Gardaoto.com seperti Garda Me, Garda Edu, Garda Home, dan Garda Trip.

Pada 2022, Asuransi Astra berhasil membukukan Premi Bruto sebesar Rp 5,66 triliun.

Kinerja Asuransi Astra selama ini pun telah diakui dengan berbagai penghargaan yang telah diterima, diantaranya: Contact Center Service Excellence Award (2013-2022), Service Quality Award (2007-2013, 2015-2018, 2022), Top Brand Award (2007-2023), Indonesia Best Brand Award (2002-2022), Corporate Image Award (2007-2013, 2015-2022), Infobank Insurance Award (2008-2016, 2017-2022), Insurance Market Leader (2019-2022), Asuransi Terbaik (2014, 2020-2022), Indonesia PR of The Year (2021-2022), Marketeers Editor's Choice Award (2018-2021), OMNI Brands of The Year (2019-2023), Indonesia Most Popular Digital Financial Award (2020-2023), Indonesia Excellence Good Corporate Governance Awards (2022), Indonesia CSR Award (2022), Top CSR Award (2022), Perhumas PR Excellence Award (2022), Indonesia Industry Leadership Award (2023), Astra Corporate Affairs Award (2020-2022).","We're looking for an IT Architect Security Specialist, with main responsibilities are planning, researching & designing the company's IT security architectures. Recommend us with the latest technology, enhancements, reinforcements, and preparing countermeasures that protect our system.

Job Descriptions For IT Architect Security As Follows

Analyzing, planning, researching, and designing company IT Security architectures and giving us the best recommendations for security
Doing Risk Assessments & Implementing recommendations
Enhance and Reinforce IT security
Having a great sense of IT Security
Review and update IT Policy
Managing and tuning force point data leakage protection
Manage Security Management Report

Minimum Qualifications

Candidate must possess at least a Bachelor's Degree in Computer Science/Information Technology or equivalent
At least 3 year(s) of working experience in IT Security Architect fields, both software & hardware
Up-to-date about the latest IT security systems
Familiar with DAST, SAST, standard security systems & frameworks
Deep understanding of security architect & strong technical background"
3760940634,It,https://www.linkedin.com/jobs/view/3760940634,"PT. Bali Towerindo Sentra Tbk,",https://www.linkedin.com/company/pt-bali-towerindo-sentra-tbk/life,"Jakarta, Jakarta, Indonesia",2 months ago,100,,On-site,,"501-1,000 employees · Telecommunications",https://media.licdn.com/dms/image/C4E0BAQG_gO8ejkfi6Q/company-logo_100_100/0/1631329781163?e=1715212800&v=beta&t=qVXVa8nCHa02bwaHpHW21xew7K1NQuchsMDc4dGJ6Hs,"PT. Bali Towerindo Sentra, Tbk also known as BALITOWER is an incorporated company located in Badung, Bali, established in 2006 according to and based on law and regulation applied in Republic of Indonesia.

BALITOWER is a leading telecommunication infrastructure provider in Bali. The company was a pioneering provider of tower equipped with integrated transmitting facilities both through fiber optic and wireless technology.
The portfolio is based on several aspects which are but not limited to, the building of telecommunication tower according to operator’s needs (built to suit), also including site acquisition and tower construction on potential locations. Along with the evolving needs of operators in Indonesia as the tower lessee, this has significantly increased the ratio of collocation.

The portfolio is based on several aspects which are but not limited to, the building of telecommunication tower according to operator’s needs (built to suit), also including site acquisition and tower construction on potential locations. Along with the evolving needs of operators in Indonesia as the tower lessee, this has significantly increased the ratio of collocation.

Currently BALITOWER has begun to develop in several parts of Indonesia, prioritizing on building and operating concepts of Microcell Poles with C-RAN network architecture (Cloud Radio Access Network) to accommodate the ever increasing needs of rapid data communication in today’s community.

BALITOWER is intensively collaborating with local governments in every area with leading edge ideas through advanced Research and Development in order to create prototypes based closely on aesthetics and technology.","Region: Jakarta

Responsibilities

Analyze, Model, and Implement Data Warehouse and Data Marts that could enable our Analyst & Scientist to gain better agility
Develop, Maintain, Monitor, Tune ETL from multiple data sources into our Data Lake, Warehouse, and Marts
Perform Logical Modeling from cross function users’ requirements
Govern data warehouse & data marts access

Requirements

Candidate must possess at least bachelor degree in Computer Science or Information Technology
2 years or more experience performing data warehouse logical modeling and architecture designing
Firm grasp in SQL Queries
Proficient with a variety of data engineering ETL Tools (Pentaho, Talend, SSIS, etc)
Good understanding of the basics of data pipeline, and experience in implementing data-lake/data-warehouse/data-mart, with most recent data tech-stacks

Back Get The Form"
3808534127,IT Advisory Intern,https://www.linkedin.com/jobs/view/3808534127,Grant Thornton Indonesia,https://www.linkedin.com/company/grant-thornton-indonesia/life,"Jakarta, Jakarta, Indonesia",1 month ago,12,,On-site,,"501-1,000 employees · Accounting",https://media.licdn.com/dms/image/C510BAQHRNGb6aAhjOA/company-logo_100_100/0/1630572589451/grant_thornton_indonesia_logo?e=1715212800&v=beta&t=XZ2kLxTixnl158Xt6tKWGV6kx1EezO6i1c5E1bmqPYs,"Grant Thornton firms provide services to clients in all jurisdictions in which they operate. In working with us, you can expect the resources, skills and experience of a large, global organisation, but with the accessibility and attention of a much smaller firm.

Grant Thornton Indonesia first opened doors in Indonesia in 1993. We have more than 600 young and dynamic partners and professional staff in the firm who aim to unlock the potential for growth in our clients, our people and our communities.

Our commitment is to actively contribute to the advancement of the accounting profession and business practices in Indonesia. We work with a broad range of clients - privately held companies, public interest entities, financial institutions and state-owned enterprises.","Are you a final year student that's passionate in doing programming, analysis, and interested for an internship opportunity? If you are, Grant Thornton is currently opening for internship experience for someone who's willing to have a small step for growth in IT Advisory Team. This position offers you to collaborate closely with the team where you are responsible for various tasks that involve skills such as networking, operating systems, cryptography, problem solving, learning agility, and risk assessment.

This program also provides you to to expand your professional networks and experience by putting into practice what you've learnt in college. In addition, you will also received coaching and mentoring by professionals. And at last, you will receive certification after you completed the internship program at Grant Thornton Indonesia.

Qualifications:

Final years student or recent graduate majoring in Information System (IS), Cybersecurity, Information System Audit, or Information Technology with a minimum 3.00 out of 4.00 GPA.
Fast learner, self-initiative.
Committed and responsible attitude.
Strong oral English communication skills, both oral and written.
Have adequate skillset or internship experience in Cybersecurity, Information Security, or Vulnerability Assessment and Penetration Testing.
Available for three months internship extensible into six months as necessary


Responsibilities:

Support IT/Information/Cyber Security Audit, and or IT/Information/Cyber Security Consulting end-to-end engagement.
Develop an understanding of the system to be improved, enhanced, or audited.
Perform audit procedure/technique to certain controls.
Be involved in several small assignments to medium assignment.
Be initially given routine day-to-day assignments and work under the direct supervision of a higher-level official."
3736945291,IT Engineer,https://www.linkedin.com/jobs/view/3736945291,Dikshatek Indonesia,https://www.linkedin.com/company/dikshatek/life,"Jakarta, Jakarta, Indonesia",3 months ago,100,,On-site,,"501-1,000 employees · IT Services and IT Consulting",https://media.licdn.com/dms/image/D560BAQETv3fzwlc2Gg/company-logo_100_100/0/1696481727825/dikshatek_logo?e=1715212800&v=beta&t=NOoXnZ_3L48X9gTmyDYIzQODFFxs2FDMFlVEfE4IdSM,Dikshatek Indonesia provides world-class IT Consultants and Solutions to Tier-1 Indonesian Businesses.,"Job Description

 Job Description: 

 Have experience and skill in SQL Query, Shell Scripting
 Have experience using Windows and Linux OS
 Have experience with Web Server (IIS, Apache)
 Have experience with Database (SQL Server, Oracle, MySql)
 Have good analytical thinking, fast response, can do Mindset, Diligent
 At least 1 year experience
 Can speak english"
3756333667,Sr. Security Engineer,https://www.linkedin.com/jobs/view/3756333667,Staffinc Group,https://www.linkedin.com/company/staffinc-group/life,"Jakarta, Jakarta, Indonesia",3 months ago,9,,On-site,,51-200 employees · IT System Custom Software Development,https://media.licdn.com/dms/image/D560BAQEZwVdDm3_9Nw/company-logo_100_100/0/1665375105622/staffinc_group_logo?e=1715212800&v=beta&t=FjI393A7gzk2OMLbpE3D469Y4fGN61ABtFCKMe0tH9A,"Staffinc is Indonesia’s leading digital staffing platform, covering the end to end workforce needs for established businesses and aspiring enterprises alike.

Our services include:
- Staffing: providing you skilled and curated workers from various industries, managing their recruitments to payrolls.
- HR system: a software suite designed to provide maximum ease and visibility in recruiting, managing, payrolling, and providing benefits for your workers.
- Procurement and rental: Equipping your workers with all the right tools for the job from laptops to vehicles.

Established in 2018, Staffinc employs more than 1.500.000+ workers across 350+ cities in Indonesia, empowering businesses and workers alike to achieve their goals and create meaningful impact. At Staffinc, we pride ourselves in being powered by people, scaled through technology.","Staffinc is a manpower supply service that connects talented professionals with top-tier clients across the industries. We specialize in providing highly skilled individuals who possess a wide range of technical expertise.

We are currently seeking a skilled and experienced Senior Security Engineer that will be responsible for enhancing our security posture and safeguarding our digital assets.

Job Description:

Design, implement, and manage security measures to protect the organization's systems and data.
Collaborate with cross-functional teams to ensure security best practices are integrated into our systems.
Conduct vulnerability assessments and penetration testing to identify and address security weaknesses.
Administer and maintain Web Application Firewalls (WAF) and Next-Gen Firewalls.
Configure and monitor Intrusion Detection and Prevention Systems (IDS/IPS).
Investigate security incidents and provide incident response support.
Stay updated on emerging threats and security technologies to continuously improve our security infrastructure.
Lead and mentor junior security engineers.
Assist in compliance efforts related to ISO27001 or other relevant security standards.


Requirements:

Bachelor's Degree in a related field.
A minimum of 6 years of experience as a Security Engineer.
Proficiency in Cloud Security, including experience with cloud-native security solutions.
Demonstrated expertise in Web Application Firewalls (WAF), Defender, Next-Gen Firewalls, and Intrusion Detection and Prevention Systems (IDS/IPS).
Possession of at least one recognized security certification, such as Certified Ethical Hacker (CEH), CompTIA Security+, Certified Information Systems Security Professional (CISSP), EC-Council Certified Security Analyst (ECSA), ISO27001 Implementer, or another security-relevant certification.
Strong problem-solving and analytical skills with an in-depth understanding of cybersecurity concepts.
Excellent communication skills and the ability to work effectively in a team and interact with stakeholders."
3819325842,Senior Talent Acquisition,https://www.linkedin.com/jobs/view/3819325842,WeNetwork,https://www.linkedin.com/company/wenetworkasia/life,"Jakarta, Indonesia",2 days ago,100,,On-site,,51-200 employees · Staffing and Recruiting,https://media.licdn.com/dms/image/C560BAQHOAEbxvJM-9Q/company-logo_100_100/0/1630670001563?e=1715212800&v=beta&t=dFPNfXOmvSbpYsObO9DGzpmILk0Ijh8Hq1Uq3OHejVM,"Welcome to WeNetwork – your go-to destination for high-quality recruitment services across APAC! With offices strategically located in Jakarta, Singapore, Sydney, and Tokyo, we are a rapidly expanding firm with a focus on delivering unparalleled service in today's dynamic job market.

At WeNetwork, our central values revolve around fostering meaningful relationships with our clients, ensuring the delivery of top-tier talent and roles at scale. Our culture places a strong emphasis on delivery and innovation, positioning us as the preferred partner for individuals looking to advance their careers and organizations seeking top-tier talent throughout APAC.

Our mission is simple yet impactful: to match exceptional individuals with outstanding career opportunities. To achieve this, we've built an ever-growing network of partners, making us a trusted resource for navigating the competitive job market.

Join The Network and embark on a journey where great people meet great jobs. For more information or to become a part of our thriving community, contact us at contact@wenetworkasia.com. Your success story begins with WeNetwork!","About The Company

Our client is One of the biggest players in the FMCG market in Indonesia where the products have become market leaders in over 60 countries around the world.

About The Role

A recruiter helps to identify hiring needs and fill job openings. The responsibilities of a recruiter include identifying future hiring needs by working closely with hiring managers, designing job descriptions, sourcing candidates through databases & job portals, conducting interviews, and filing paperwork (admin).

Job Responsibilities:

Assessing & Identifying future hiring needs and developing job descriptions and qualifications
Collaborating with hiring managers from respective departments to compile a consistent list of job requirements
Attracting suitable candidates through databases, job portals, online employment forums, social networking, etc
Conducting interviews and sorting through applicants to fill open positions
Assessing applicants' knowledge, skills, and experience to match open positions
Completing paperwork for new hires
Promoting and Branding the company's reputation and attractiveness as a good employment opportunity
Providing recruitment reports to team managers.


Key Requirements:

Bachelor's Degree in Human Resources, Business Administration, or related field
At least 2 years of recruiting experience
Ability to communicate effectively, both orally and in writing
Excellent organizational and time management skills
Robust knowledge of applicant tracking and HRIS systems
Ability to manage a wide range of relationships with a variety of stakeholders
Proficient in data analysis for recruitment reporting
Working knowledge of interview techniques and applicant screening methods
A good understanding of employment laws and regulations will be a plus
Familiar with a wide variety of candidate sourcing 


Call for Action To be successful in the role, you will need to be willing to make a positive impact, takes insight, and pushes the boundaries to transform the organization. If you are keen to apply to this role, do send in your updated CV to meirietha@wenetworkasia.com"
