id,title,job_url,company,company_link,location,published_at,number_of_applicants_applied,employment_duration,work_location_type,work_experience_level,company_type,about_the_job
3768990888,Analytics Engineer,htthttps://www.linkedin.com/jobs/view/3768990888,JULO,https://www.linkedin.com/company/juloindonesia/life," ",1 week ago,237,,Hybrid,,"501-1,000 employees · Financial Services","Analytics Engineers at JULO will develop data models that will be the backbone and empower our stakeholders to do reliable analysis and create actionable insights. This person will work in close cooperation with Business Analysts, Data Analysts, Product Managers, and Business teams. You will guide them in their data journey and help them gain insights from their data silos by combining and preparing data for analytical consumption.

Roles and responsibilities:

Develop, implement and maintain data models that are easy and reliable to interpret, use, and consume analytically.
Assess and combine different data models to enable insights across them.
Ensure data quality and consistency by implementing data testing, validation and cleansing.
Implement monitoring solutions to track the health of data models.
Create and maintain data model documentation & definitions, including data dictionaries and process flows.

Job requirements:

Proficiency in SQL as a data analyst or analytics engineer.
Plus point: Experience using data transformation tools such as dbt.
Strong analytical and problem solving skills including ability to independently drive analysis concluding with rationalized recommendations
Strong communications skills for both technical and business purposes
Interest in fintech and high level of curiosity"
3726973280,Software Developer,htthttps://www.linkedin.com/jobs/view/3726973280,Ingenico,https://www.linkedin.com/company/ingenico/life," "," ",259,,Hybrid,,"5,001-10,000 employees · Financial Services","Ingenico is a global leader in the fintech market, with more than three decades of experience and employs over 7,500 people. Its footprint gives scale to projects and talents. Innovation is part of our DNA and our diverse community of experts keep anticipating the evolution of commerce worldwide.
We provide merchants with a comprehensive and innovative range of services and solutions that eliminate payment complexity and make purchasing quick, seamless and secure for consumers, whatever the sales channel or payment method.

JOB PURPOSE/MISSION:
Software Developer to develop payment and other applications to meet clients' needs and requirements. 
To guide and train junior developers as acquired
As a technical consultant to junior members in the team.

KEY RESPONSIBILITIES 
Develop and timely release embedded C/C++ applications on POS
Develop and timely release payment applications on Android POS
Provides support in the day-to-day resolution and fixes on applications for customers and new partners
Provides technical expertise and support to customers with regards to software development/coding / best practice
Train and provide technical guidance to the junior developer
Documents and demonstrates solutions by preparing documentation, flowcharts, layouts, diagrams, charts, code comments and clear code

CORE COMPETENCIES 
Good knowledge/working experience on C/C++ (mandatory) or C-like language such as C#, Java on device development
Good knowledge in Android development (Java, Kotlin,etc) • Has extensive knowledge of Software Development – C/C++, Software Development Lifecycle, Knowledge of credit card processing, developing applications with strict compliance with PCI DSS and EMV standards, POS application development and ISO8583 is a must.
Knowledge of managing and implementing payments processing and banking/financial projects and solutions is an advantage
Good understanding of data exchange format (XML, JSON, CSV, TLV)
Python will be a plus point
Knowledge/experience on software management tool such as JIRA, Bitbucket, Confluence

KEY PERFORMANCE OBJECTIVES/INDICATORS 
Timely and good quality software application releases.
Able to meet client’s expectations
Able to work alongside with Projects Team in achieving the team’s overall objective.

BEHAVIOUR SKILLS 
Detail-oriented
Takes initiative and proactive
Analytical and possess critical thinking
Thrives in both tight deadlines, challenges and opportunities

EDUCATION/EXPERIENCE REQUIREMENTS
Diploma/University: Degree in Computer, Electronic, or Electrical Engineering or proficiency in embedded system, application development or web programming
Years of professional experience required: 7 to 10 years in the payment industry."
3768771985,Software QA Engineer (Yogyakarta),htthttps://www.linkedin.com/jobs/view/3768771985,Privy,https://www.linkedin.com/company/privy-id/life," ",5 days ago,180,,On-site,,201-500 employees · IT Services and IT Consulting,"About us
Privy is Indonesia's market leader in Digital Signature and Digital Identity, with more than 40 million verified users and more than 2.600 enterprise clients. Our Digital Signature is acknowledged by the Ministry of Communication and Informatics. We have just closed our Series C funding led by KKR on November 2022. We are growing more rapidly than ever, and would love to have talented and enthusiastic individuals onboard.

Job Descriptions :
As a Software Quality Assurance (SQA) Engineer, you will work with some of the most talented minds, collaborating with fellow Product Managers, Engineers, User Experience Designers, test and safeguard availability, performance and usability of our business-critical functionalities that delight both internal businesses and external end-users.

- Be involved in whole development life cycle and technical design review
- Test case design and planning
- Functional testing via grey-box and white-box methodologies
- Perform Application Program Interface (API) testing, and API automation testing
- Performance, security, and integration testing for system, module, API, and other tools
- Bug analysis and tracking
- Setting up and maintenance of testing environment
- Development and maintenance of testing tools, automation of testing tools and scripts
- Continuous improvement and research of testing process, skills, techniques, quality, and efficiency
- Define and execute test plans, test cases, and test scripts to ensure comprehensive test coverage
- Collaborate with stakeholders to understand project requirements and develop test strategies accordingly
- Establish and maintain test environments, test data, and test automation frameworks

Job Qualifications :
- Bachelor's degree in Computer Science, Engineering or related fields
- Familiar with at least of the following programming languages: Python, Java, or Golang
- Familiar with at least one API/Unit testing framework
- Strong sense of project ownership and result-oriented
- Good sense of quality, teamwork, and innovation
- Experience with Database querying, using SQL
- Experience in microservices contract testing
- Able to work independently
- Able to list down test cases/scenarios to test any application using the test case design techniques
- Coding experience with automated testing frameworks, tools, services, and physical devices
- Good experience with SDLC practices of Agile or Test-Driven Development (Lean, Scrum, or similar)
- Good CS fundamentals, including good working knowledge of classic algorithms and data structures
- Experience on Automation tools like selenium and Rest Assured
- Excellent communication, collaboration, reporting, analytical and problem solving skills"
3759731332,Phyton Developer ( Project Based ),htthttps://www.linkedin.com/jobs/view/3759731332,Pepper Advantage,https://www.linkedin.com/company/pepper-advantage/life," ",2 weeks ago,127,,Hybrid,,"1,001-5,000 employees · Financial Services","We are seeking a talented Full-Stack Developer with expertise in Python and Angular to join our team, who is motivated to combine the art of design with the art of programming.

Responsibilities:

Translation of the UI/UX design wireframes to actual code that will produce visual elements of the application using Angular 2 framework.
Architect efficient and reusable front-end systems that drive complex web applications.
Unit-test code for robustness, including edge cases, usability, and general reliability.
Design and develop Rest Apis as backend services using python frameworks for Cloud platforms.
Hands on knowledge of Django and REST API concepts
Work in agile environment with product management team to understand and develop product features in the defined technology stack


Skills & Experience:

Bachelor’s degree in Computer Science, Information Technology, or a related field.
Strong communication and collaboration skills within a team environment.
Have a good communication in English is a must
Proficiency in Linux OS
Proficient in Programming languages: Python framework (Flask, Django), TypeScript (Angular)
Familiarity with RDBMS (Postgre SQL, MySQL, SQL Server), NoSQL databases (Redis, MongoDB),
Experience writing REST API.
Proficient use of Git version control system
Experience in designing front-end interfaces using Angular(2) UI framework.
Knowledge and practical experience in cloud development, particularly Azure or Google cloud.
Understanding and experience in CI/CD ( Continuous Integration / Continuous Deployment) development processes.
Familiarity with WebRTC protocols."
3769520947,Remote Full-stack JS Developer,htthttps://www.linkedin.com/jobs/view/3769520947,Scopic Software,https://www.linkedin.com/company/scopic-software/life," ",4 days ago,200,,Remote,,201-500 employees · Software Development,"Scopic is seeking a Full-stack JavaScript Developer with advanced JavaScript skills to join our team of 250+ professionals across 50 countries. The successful applicant will work with a team of talented PMs, developers, designers, and QAs to provide solutions and for industry-leading applications.

Requirements

 3+ years of software development experience both backend and frontend
 2+ years of hands-on experience with modern frameworks (Angular, React, Vue.js...) and a good grasp of architectural styles and implementation patterns
 Knowledge of web sockets, particularly socket.io
 Proficiency in JavaScript is required and Node.js for the backend
 Experience with TypeScript
 Experience with build systems and tooling
 Good knowledge and hands-on experience with HTML5/CSS
 Knoweledge of at least one major *NIX platform (Linux, macOS, FreeBSD, etc.)
 Familiarity with Backbone & Marionette.js
 Proficient in Git
 Proactive and willing to learn new stuff
 Bachelor degree or equivalent experience

The Secret Ingredients That Make Us Special

 Your growth is our growth. We invest in your future with paid training and other professional opportunities.
 We’re industry innovators at the forefront of change. Equipped with the latest technologies and a team of knowledgeable colleagues by your side, you’ll embrace new and interesting challenges.
 Your location. Your schedule — Pick your time-zone, choose your preferred hours, and work from the place where you feel most at home.
 Flexibility and freedom are in our DNA! As long as you have a stable internet connection and the drive to thrive, you can travel and work from anywhere you like.
 A workload you can rely on. We’ll set you enough tasks to keep that mind busy! At Scopic, we’ll ensure you always have a consistent flow of engaging, challenging work to do.
 Recognition and reward. We acknowledge diligence and hard work through annual pay increases for good performance.

Down to business!

 Rate Range: Negotiable depending on your skills, experience and your performance during our recruiting process.
 This is a full-time position.
 Direct communication with the client may be needed.

Our Values

Scopic offers equal opportunity. We value diversity and do not discriminate on the basis of race, religion, color, marital status, national origin, gender, veteran status, sexual orientation, age, or disability status.

Have the skills, the drive, and the passion to join the Scopic family?

Apply today to join our growing team of remote professionals from around the world.

Attention Job Seekers: Please be aware that scammers may be fraudulently using our company's name in hiring scams. To ensure your safety, all legitimate communication regarding job opportunities from our company will only come from email addresses ending with [at]scopicsoftware.com or [at]scopicsoftware.hire.trakstar.com. Please exercise caution and report any suspicious activity to our official channels.

Employment Type: Full-Time"
3752304532,Technical Developer,htthttps://www.linkedin.com/jobs/view/3752304532,PT Lion Super Indo,https://www.linkedin.com/company/superindo/life," ",3 weeks ago,357,,On-site,,"10,001+ employees · Retail","Responsibilities
As a technical consultant, provides a sustainable technical solution. Create, maintain, and improve IT application to meet requirements. Follow Development standards.

Requirements
Min. Bachelor Degree (S1) in IT-related major
3 years experience or more in IT Programming
Understand Unified Modelling Language (UML) System Design
Desktop, Web &SQL Programming
Microsoft .NET MVC (Front-End Programming)
API Development (Back-End Programming)
Deep Analytical Thinking
Good Teamwork
Placement: WFO at South Jakarta (Head Office)"
3680687869,Web Front End Developer,htthttps://www.linkedin.com/jobs/view/3680687869,NTT Ltd.,https://www.linkedin.com/company/global-ntt/life," "," ",1,,Hybrid,,"10,001+ employees · IT Services and IT Consulting","Want to be a part of our team?

Analyzes, designs, programs, debugs, and modifies software enhancements and/or new products used in local, networked, cloud-based, or Internet-related computer programs.

Code may be used in commercial or end-user applications, such as materials management, financial management, HRIS, mobile apps, or desktop applications products.

Using current programming language and technologies, writes code, completes programming, and performs testing and debugging of applications.

Completes documentation and procedures for installation and maintenance.

May interact with users to define system requirements and/or necessary modifications.

Working at NTT

The primary responsibility of the Software Applications Development Engineer is to develop new applications and improve upon existing ones that will our client and business needs.

Key Roles and Responsibilities:

Develop applications that effectively accomplish client objectives and user needs.

Design and write code for applications and maintain applications databases.

Analyze and edit existing software applications to improve and optimize functionality, fix problems, and enable their use on new hardware platforms.

Remodel and adapt applications as needed to optimize performance.

Identify specific customer and client needs and preferences related to the application.

Test applications extensively to ensure they are error and bug-free.

Install applications and act as technical advisor.

Communicate with relevant internal technical stakeholders to obtain information on project limitations, performance requirements, and interfaces.

Consult with clients in the design phase to determine client needs.

Produce software documentation following company software process and templates.

Participates in software product review meetings and team meetings.

Knowledge, Skills, and Attributes:

Broad understanding of computer science, with specific knowledge of computer programming, application design, and user-focused features
Creative problem solvers
Good interpersonal, communication, and organizational skills
Good team players and maintain the integrity and display good attention to detail
Ability to understand and analyze complex systems
Proficient in writing software using the Java Programming Language and a standard object library
Sound knowledge of software development process
Familiarity with agile development such as Scrum
Knowledge of software integrated development environments
Extensive knowledge in various programming languages (Java, Perl, Python, C++, etc.)
Demonstrated analytical, organizational, and project management skills, using relevant information to make timely and critical decisions that affect cross-functional teams
Ability to handle client and customer issues tactfully and professionally

Academic Qualifications and Certifications:

Bachelor's degree in computer science or software engineering
Relevant certifications

Required Experience:

Software Applications Engineering, Software Development experience, or related work experience
Experience with Programming Languages such as C, C++, Java, Python, etc. 
Experienced with Linux or Unix and Windows operating systems
Experience working with SQL
Project management experience and/or experience working in an Agile environment

What will make you a good fit for the role?"
