id,title,job_url,company,company_link,location,published_at,number_of_applicants_applied,employment_duration,work_location_type,work_experience_level,company_type,about_the_job
3772903667,"Software Support Engineer, IgniteTech (Remote) - $60,000/year USD",htthttps://www.linkedin.com/jobs/view/3772903667,Crossover ,https://www.linkedin.com/company/crossover/life," ",,59,,Remote,,"5,001-10,000 employees · IT Services and IT Consulting","Crossover is the world's #1 source of full-time remote jobs. Our clients offer top-tier pay for top-tier talent. We're recruiting this role for our client, IgniteTech. Have you got what it takes?

Are you a front-end developer tired of the same old interfaces and repetitive design tasks that seem to dominate the industry? IgniteTech is looking for a React expert eager to break the mold and redefine user experiences. If you're driven by innovation and eager to unleash your potential in crafting truly unique and engaging digital environments, this is your call to action.

IgniteTech stands apart in an industry where front-end development often falls into a predictable pattern. Our commitment goes beyond standard design principles. We merge sophisticated aesthetics with functional brilliance, infused with cutting-edge AI technology.

As a key player in our dynamic team, you will be crafting high-quality, scalable, and intuitive user interfaces using React. Your role will involve close collaboration with cross-functional teams, contributing to a wide array of software products across diverse domains from web content management systems to e-commerce. Your work will be crucial in shaping the user experiences of our diverse product portfolio, ensuring that each solution is not just functional but a testament to our commitment to excellence and innovation.

If you're ready to leave your mark on the industry and be part of a team that values creativity, innovation, and quality, we want to hear from you.

What You Will Be Doing

Creating high-quality, maintainable, and scalable user interfaces using React, emphasizing both aesthetic appeal and functionality
Collaborating with cross-functional teams to integrate front-end designs with backend logic across a diverse range of products
Leading optimization efforts and UI tests to ensure rapid load times and responsiveness across all platforms

What You Won’t Be Doing

Repetitive templated designs. Here, every project is an opportunity for fresh creativity and innovation

Software Support Engineer Key Responsibilities

Delivering innovative, intuitive, and visually compelling user interfaces that significantly enhance customer experience and satisfaction

Basic Requirements

Professional experience in building web applications using React.js
Professional experience building mobile applications using ReactNative
Familiarity with state management tools like Redux or Context API
A grasp of AI, Large Language Models (LLMs), and prompt engineering, including Chain-of-Thought (CoT) prompting and Self-Consistency in CoT

About IgniteTech

If you want to work hard at a company where you can grow and be a part of a dynamic team, join IgniteTech!

Through our portfolio of leading enterprise software solutions, we ignite business performance for thousands of customers globally. We’re doing it in an entirely remote workplace that is focused on building teams of top talent and operating in a model that provides challenging opportunities and personal flexibility.

A career with IgniteTech is challenging and fast-paced. We are always looking for energetic and enthusiastic employees to join our world-class team.

We offer opportunities for personal contribution and promote career development. IgniteTech is an Affirmative Action, Equal Opportunity Employer that values the strength that diversity brings to the workplace.

There is so much to cover for this exciting role, and space here is limited. Hit the Apply button if you found this interesting and want to learn more. We look forward to meeting you!

Working with Crossover

This is a full-time (40 hours per week), long-term position. The position is immediately available and requires entering into an independent contractor agreement with Crossover. The compensation level for this role is $30 USD/hour, which equates to $60,000 USD/year assuming 40 hours per week and 50 weeks per year. The payment period is weekly. Consult www.crossover.com/help-and-faqs for more details on this topic.

What to expect next:

You will receive an email with a link to start your self-paced, online job application.
Our hiring platform will guide you through a series of online “screening” assessments to check for basic job fit, job-related skills, and finally a few real-world job-specific assignments.

Important! If you do not receive an email from us:

First, emails may take up to 15 minutes to send, refresh and check again.
Second, check your spam and junk folders for an email from Crossover.com, mark as “Not Spam” since you will receive other emails as well.
Third, we will send to whatever email account you indicated on the Apply form - by default, that is the email address you use as your LinkedIn username and it might be different than the one you have already checked.
If all else fails, just reset your password by visiting https://www.crossover.com/auth/password-recovery if you already applied using LinkedIn EasyApply.

Crossover Job Code: LJ-4404-ID-Medan-SoftwareSuppor.005"
3770823176,Senior Backend Engineer,htthttps://www.linkedin.com/jobs/view/3770823176,SawitPRO,https://www.linkedin.com/company/sawitpro/life," ",1 week ago,173,,On-site,,"51-200 employees · Technology, Information and Internet","About SawitPRO

SawitPRO develops an integrated end-to-end agri-platform, creating a win-win-win for people, planet and profit. Our missions are to improve the livelihood of Indonesia’s smallholders, to unlock value for the industry, and to strive in a demanding global market in traceability and sustainability of palm oil products.

We provide platform that connects the supply chain stakeholders within the palm oil industry (i.e. Palm Oil Mills, Agents, Smallholders, and Agri Input vendors), creates a digital ecosystem that removes friction points, and essentially boosts the productivity of the smallholders via access to affordable yet high quality agro-inputs, agronomic services, and high quality planting materials.

We envision to be the game-changer that improves smallholders’ living standard, and help our planet to meet the growing global demand for sustainable palm oil.

Responsibilities:
Participate in the complete backend services development life cycle.
Develop backend services according to API specifications.
Integrate external / third party services.
Perform system analysis, design, testing, and documentation whenever necessary.
Write testing for unit and system integration.
Maintain code quality, unit testing, and automation
Provide technical support on on-call rotations.

Qualifications:
At least a Bachelor's Degree, or Master's Degree, in Computer Science / IT, Engineering (Computer/Telecommunication), or equivalent.
Proficiency in Golang as primary language and other languages such as Java.
Proficiency in Git
Proficiency in PostgreSQL
At least 4 years working experience in backend services using Golang and Postgres database.
Knowledge of RESTful APIs and microservices, experience designing & consuming them
Experience in designing OpenAPI-based API.
Experience in working in cross-functional teams.
Have discipline in writing unit tests and integration tests.
Familiarity with development on cloud services such as GCP and/or AWS.
Familiarity with continuous integration and continuous deployment.
Familiarity with the Scrum development process.
Willing to work on-site."
3765189243,Mulesoft Developer,htthttps://www.linkedin.com/jobs/view/3765189243,VISEO,https://www.linkedin.com/company/viseo/life," ",1 week ago,64,,Remote,,"1,001-5,000 employees · IT Services and IT Consulting","As a Mulesoft Developer you will:

Provide good understanding of architecture design of the project and be part of the development team to execute it properly.
Collaborate with Architect to build and maintain integrations for multiple on premises and/or cloud systems and must be capable of understanding business requirements, working with end users and developing and deploying the integrations.
Provide technical expertise in large, complex environments and must have a track record of successful and reference-able customer projects. This position requires knowledge and experience with J2EE, MuleSoft product suite as well as experience in detailed requirements analysis, software design, development, testing, and deployment.
Work with the Engagement Manager, customers, architects and partners to implement MuleSoft's AnyPoint platform in order to solve mission-critical business challenges.

Profile

Bachelor’s Degree or equivalent experience required
6+ years of Working knowledge of MuleSoft SaaS technology, and business integrations and maintenance within complex international organizations.
Background in the Software development and familiar with End of End Development.
Experienced in Back End Technology such as Node JS, Java API Architecture.
Identify, analyze and develop interfaces and integration flows using Mule ESB Any platform including Mule Runtime, Connectors, Design Center and API Management.
Deep understanding of Synchronous / Asynchronous communication patterns and problem-solving abilities with respect to Message Sequencing, Correlation and Queuing.
Experienced in Mule administration, Configuration and tuning.
Seeks and engages in continued learning of Agile practices and principles, ensuring that development technologies and best practices methodologies are adopted and applied by all team members.
Demonstrate an understanding of software patterns, software modelling, secure programming principles, test-driven development or another unit testing methodology, and code standards compliance.
Adept at producing fully responsive applications within a multitude of environments using modern up-to-date techniques, whilst still being able to support legacy systems and platforms.
Working knowledge of MuleSoft, SaaS technology, and SaaS business integrations and maintenance within complex international organizations.
Knowledge in on-Premise Platform integration (e.g. Informatica, Talend , TIBCO)

Good to Have:
   MuleSoft Certified Developer – Level 1 (Mule 4)
MuleSoft Certified Developer – Integration and API Associate (Mule 3) MuleSoft Certified Platform Architect – Level 1
MuleSoft Certified Developer – Level 1 (Mule 4) DELTA
MuleSoft Certified Developer- API Design Associate (RAML 1.0)"
3762071054,Web Back-end Developer,htthttps://www.linkedin.com/jobs/view/3762071054,Turing,https://www.linkedin.com/company/turingcom/life," ",3 weeks ago,4,,Remote,,"1,001-5,000 employees · IT Services and IT Consulting","A fast-scaling startup, revolutionizing the tech industry through the utilization of cutting-edge generative technology, is seeking a skilled Web Back-End Developer. The primary responsibilities of this role include debugging, testing, and troubleshooting various applications. With a wide range of innovative products and services, this Silicon Valley-based company has gained significant attention and is poised to shape future advancements in technology. This presents an exceptional opportunity for individuals who thrive on experimentation, iteration, and the creation of state-of-the-art solutions.

Job Responsibilities

Analyze code and propose modifications to enhance code quality
Collaborate with talented designers and engineers to develop user-friendly, cutting-edge UIs
Stay abreast of market trends and employ innovative problem-solving strategies through thorough research
Optimize app efficiency, speed, and scalability

Minimum Requirements

Bachelor's/Master's degree in Computer Science (or equivalent experience)
6+ years of experience as a Web Back-End Developer
At least 1+ years of experience with JUnit and Java
Proven track record in developing and maintaining robust back-end systems
Strong understanding of the software development life cycle (SDLC) and agile methodologies
Excellent problem-solving skills with keen attention to detail
Fluent in English with excellent communication skills"
3677044106,SE - Software Developer,htthttps://www.linkedin.com/jobs/view/3677044106,Prudential Indonesia (PT Prudential Life Assurance),https://www.linkedin.com/company/prudential-indonesia-pt-prudential-life-assurance-/life," "," ",3,,On-site,,"1,001-5,000 employees · Insurance","Prudential's purpose is to help people get the most out of life. We will deliver our purpose by creating a culture in which diversity is celebrated and inclusion assured, for our colleagues, customers, and partners. We provide a platform for our people to do their best work and make an impact to the business, and in exchange, we support our people's career ambitions. We pledge to make Prudential a place where you can Connect, Grow and Succeed.

Prudential is an equal opportunity employer. We provide equality of opportunity of benefits for all who apply and who perform work for our organisation irrespective of sex, race, age, ethnic origin, educational, social and cultural background, marital status, pregnancy and maternity, religion or belief, disability or part-time / fixed-term work, or any other status protected by applicable law. We encourage the same standards from our recruitment and third-party suppliers taking into account the context of grade, job and location. We also allow for reasonable adjustments to support people with special requirements."
3769084827,Backend Developer (Java),htthttps://www.linkedin.com/jobs/view/3769084827,Ringan (PT Ringan Teknologi Indonesia),https://www.linkedin.com/company/pt-ringan-teknologi-indonesia/life," ",4 days ago,35,,On-site,,51-200 employees · Financial Services,"Ringan is an innovative and fast-growing non-bank lending company, dedicated to provide financial services to micro and small business owners. As part of our expansion, we are seeking an experienced Backend-Java Developer to join our IT team. The ideal candidate should have a strong background and exposure in using various open source frameworks. As the Java Developer, you will be responsible in writing system architecture design-related and design document, to test-optimize and maintain the project to ensure its stability and reliability.

Key Responsibilities:
Responsible for backend or API development;
Ensure good code quality and it functionality performance approval system requirements and optimization;
Work closely with the Mobile Engineer team and Frontend Engineer team to ensure the smooth progress of the project;
Eager to learn new technologies and tools to improve tech team capabilities;
Test, optimize and maintain the project to ensure its stability and reliability.
Receive the handover and participate in the transition for API or Backend development from HQ


Qualifications:
1. 3 years minimum experience in software development;
2. Diploma Degree and above in computer related major, Indonesian;
3. Proficient in Java, Spring, SQL Databases (MySQL & Postgres) and have understanding about Cache, and Queue, and Load Balancing;
4. Familiar with the Backend CI/CD, API Management, and Design Patterns"
3773621079,Salesforce Developer,htthttps://www.linkedin.com/jobs/view/3773621079,Rukita,https://www.linkedin.com/company/rukita/life," ",1 week ago,42,,On-site,,"501-1,000 employees · Real Estate","About Rukita

Rukita is a property technology (proptech) company that provides long-stay rental housing solutions with end-to-end and hassle-free services in Indonesia. The company builds a holistic ecosystem of housing solutions for both tenants & landlords. It provides quality, accessible housing for the young generation while assisting landlords in transforming their assets into high-yield rental properties.

In this role, you’ll get to:
Manage stakeholders across multiple teams to design business requirements, translate the requirements into detailed technical specifications that result in effective, scalable, and reliable solutions.
Communicate how solutions map optimally to original business requirements and provide product demonstration of developed solutions.
Performing code reviews, providing positive useful feedback and ideas on technical workflow.
Design and create reports and dashboard that will give recommendations to business users to make decisions strategically.

Requirements:
At least 3 years of experience developing custom solutions on the Salesforce platform using Apex Classes, Apex Triggers, Visualforce Pages, and Lightning Components.
Experience with Salesforce page layouts, profiles, permissions, workflows, and approval processes.
Knowledgeable of all levels of the SDLC and all testing phases.
Experience working with and writing intermediate to advanced queries in relational databases (SOQL, SQL, etc.)
Experience working with Salesforce APIs and Web Services (REST, SOAP)
Experience with data migration and system integration techniques
Experienced in service cloud and field service will be a plus point"
3768784226,Cloud Devops Engineer,htthttps://www.linkedin.com/jobs/view/3768784226,Searce Inc,https://www.linkedin.com/company/searceinc/life," ",5 days ago,103,,Hybrid,,"1,001-5,000 employees · Business Consulting and Services","About Searce
Searce is a modern tech consulting firm that empowers clients to futurify their businesses, leveraging Cloud, AI & Analytics.
We are a category-defining niche’ cloud-native technology consulting company, specializing in modernizing (improve, automate & transforming) the full-scope of infra, app, process & work.
We partner with clients in their ‘beyond x’ journey to drive intelligent, impactful & futuristic business outcomes.
We are the most preferred tech partner of choice when it comes to ‘solving for better’ for the new-age tech startups & digital enterprises, leading disruption in their industries.
Our Service Offerings: We offer Advanced Cloud, Data & App Modernization, Cloud Consulting, Management & Improvement (DevOps, SysOps & Cloud Managed Services), Applied AI & Analytics services.
As one of the top 5 niche’ full scope global partners for Google Cloud & a preferred partner for AWS, we are the most preferred ‘engineering-led’ tech company of choice when it comes to solving complex business problems.

Website: www.searce.com

Location: Jakarta

Job Responsibilities
Selecting appropriate Cloud services to design and deploy an application based on given requirements.
Migrating complex, multi-tier applications on Cloud Platforms. Designing and deploying enterprise-wide scalable operations on Cloud Platforms.
Relevant years of experience in Cloud Infrastructure and Operations domains
Experience with Linux systems and / OR Windows servers
Specialize in one or two cloud deployment platforms: AWS, GCP.
Hands-on experience with AWS services (EKS, ECS, EC2, VPC, RDS, Lambda, GKE, Compute Engine).
Experience with one or more programming languages (Python, JavaScript, Ruby, Java,.Net)
Skills for developing, deploying & debugging cloud applications.
Logging and Monitoring tools (ELK, Stackdriver, CloudWatch) effectively.
Skilled in DevOps Technologies.
Knowledge of Configuration Management tools such as Ansible, Terraform, Puppet, Chef.
Experience working with deployment and orchestration technologies (such as Docker, Kubernetes, and Mesos)

Qualification
Passion to tech-awesome, an insatiable desire to learn the latest of the new-age cloud tech, highly analytical aptitude, and a strong ‘desire to deliver’ outlives those fancy degrees!
Relevant years of experience with hands-on experience in Cloud Computing (AWS/GCP) and IT operational experience in a global enterprise environment.
Good analytical, communication, problem-solving, and learning skills."
3766916516,Java Developer,htthttps://www.linkedin.com/jobs/view/3766916516,Lancesoft Indonesia,https://www.linkedin.com/company/lancesoft-indonesia/life," ",1 week ago,66,,On-site,,"1,001-5,000 employees · Staffing and Recruiting","Hi Tech Talent!

Currently we're looking for Backend Java Developer.

Job Details:
- Mastering the Java Programming Language
- Mastering the Java Spring MVC Framework
- Understand the concept and be able to implement Java Server Page (JSP)
- Understand the concept and be able to implement web service / API
- Able to use SQL Server Database, MySQL Database, MongoDB and Redis cache
- Having knowledge in SAP Hybris is a plus
- Able to use collaboration tools such as Github and TFS
- Able to understand the concept of security in programming"
3762062842,Web Backend Developer,htthttps://www.linkedin.com/jobs/view/3762062842,Turing,https://www.linkedin.com/company/turingcom/life," ",3 weeks ago,3,,Remote,,"1,001-5,000 employees · IT Services and IT Consulting","Job Description

A leading U.S.-based company, renowned for its innovative approach and dynamic work environment, is currently in search of an accomplished Web Backend Developer. This company, listed on the NYSE, is consistently at the forefront of technological advancements, pushing boundaries and setting new industry standards. The successful candidate will play a pivotal role in the development and maintenance of various applications, contributing to the ongoing success and growth of this prestigious organization.

As a Web Backend Developer, your role will involve:

Developing and maintaining robust backend systems using GraphQL, React, and Spring Boot.
Collaborating with a team of highly skilled developers to design, build, and implement scalable applications.
Debugging, testing, and troubleshooting applications to ensure optimal performance and an exceptional user experience.
Staying updated on the latest industry trends and technologies to ensure the organization's applications remain current and competitive.
Contributing to the overall success of the team through active participation in team meetings and collaborative projects.
Continuously improving code quality through the development of unit tests, automation, and conducting code reviews.

Job Requirements:

Bachelor's/Master's degree in Engineering, Computer Science, or equivalent experience.
A minimum of 6-7 years of experience in the field of Web Backend Development.
At least 1+ years of experience with GraphQL and React, and 1+ years of experience with Spring Boot.
Proven experience in developing and maintaining robust backend systems.
Strong understanding of the software development life cycle (SDLC) and agile methodologies.
Excellent problem-solving skills and meticulous attention to detail.
Fluency in English and strong communication skills."
3769042022,Data Engineer,htthttps://www.linkedin.com/jobs/view/3769042022,BitHealth,https://www.linkedin.com/company/bithealth/life," ",5 days ago,133,,Hybrid,,51-200 employees · Information Technology & Services,"BitHealth is a growing digital health professional services company with leading capabilities in digital health application, analytics, and process automation. We embrace the power of digital health to create value and change the face of healthcare for our clients and people. As being our Data Engineer, your responsibilities will include, but not limited to:

Maintain existing Data Warehouse in cloud and do exploration, design, and implement new solutions if necessary.
Build API
Create ETL scripts, improve existing ETL scripts, and handle all server administration related to Data Engineering.
Maintain and add new services related to Data Engineering in several projects within Google Cloud Platform.
Perform complete project documentation.
Monitoring current data pipeline and develop some kind of notification (other than Slack) if necessary.
Work and collaborate with the data team (Data Analyst, Data Engineer, Data Scientist) and another team (Project Manager) to successfully deliver the project.

Requirements:

Bachelor's degree in Computer Science, Information Technology, or a related field.
Min. 3+ years of experience
understand and have experience with data migration
Experience with both consuming and designing RESTful APIs
Integration of multiple data sources and databases into one system.
Proficient understanding of code versioning tools, such as Git
Knowledge of Cloud Server such as GCP/AWS/Azure"
