id,title,job_url,company,company_link,location,published_at,number_of_applicants_applied,employment_duration,work_location_type,work_experience_level,company_type,about_the_job
3762063623,Web Back-End Developer,htthttps://www.linkedin.com/jobs/view/3762063623,Turing,https://www.linkedin.com/company/turingcom/life," ",3 weeks ago,0,,Remote,,"1,001-5,000 employees · IT Services and IT Consulting","Join a NASDAQ-listed technology company celebrated for its innovative mindset and unwavering dedication to delivering cutting-edge solutions. They're in pursuit of a Web Back-End Developer to become an integral part of our U.S.-based enterprise. As a pioneering force in the tech industry, they consistently push boundaries and set new standards. In this role, you will play a pivotal part in developing and maintaining various applications, significantly contributing to our company's ongoing success and growth.

The Web Back-End Developer will be responsible for crafting and implementing efficient server-side logic to ensure high performance and responsiveness. Collaboration with front-end developers is key to seamlessly integrating user-facing elements into the application, making a strong understanding of front-end technologies essential.

Job Responsibilities:

Create and implement efficient server-side logic to ensure high performance and responsiveness.
Collaborate closely with front-end developers to seamlessly integrate user-facing elements.
Continuously optimize the application for maximum speed and scalability.
Implement stringent security measures and data protection.
Design and manage advanced data storage solutions.
Stay updated on industry trends and emerging technologies to maintain cutting-edge applications.

Job Requirements:

Bachelor’s/Master’s degree in Engineering, Computer Science, or equivalent experience.
A minimum of 11 years of overall web development experience.
Minimum 1+ years of experience with GraphQL, React, and Spring Boot.
Strong understanding of Git and version control tools.
Familiarity with continuous integration practices.
Exceptional problem-solving skills and meticulous attention to detail.
Proficiency in English with strong communication skills."
3744636003,Web Back-End Developer,htthttps://www.linkedin.com/jobs/view/3744636003,Turing,https://www.linkedin.com/company/turingcom/life," ",1 month ago,10,,Remote,,"1,001-5,000 employees · IT Services and IT Consulting","A well-established company that is currently on a mission to revitalize the tech industry by harnessing the power of generative, modern technology is looking for a Web Back-End Developer. The developer will be tasked with debugging, testing, and troubleshooting multiple applications. The company’s range of innovative products and services has put them in the limelight and is expected to change the course of next-generation technology advancements. This is an exciting opportunity for candidates who are eager to experiment, iterate, and build cutting-edge solutions from scratch.

Job Responsibilities:

Conduct code analysis and suggest modifications to raise the quality of the code
Develop cutting-edge, user-friendly UIs by working with talented designers and engineers
Identify market trends as well as innovative problem-solving strategies through research
Boost the efficiency, speed, and scalability of apps

Job Requirements:

Bachelor’s/Master’s degree in Engineering, Computer Science (or equivalent experience)
3+ years of experience working as a Web Back-End Developer
Minimum of 2+ years of experience working with JUnit and 4+ years of experience with Java
Proven experience in developing and maintaining robust back-end systems
Strong understanding of software development life cycle (SDLC) and agile methodologies
Excellent problem-solving skills and attention to detail
Must be fluent in English and possess strong communication skills"
3756446352,Web Back-End Developer,htthttps://www.linkedin.com/jobs/view/3756446352,Turing,https://www.linkedin.com/company/turingcom/life," ",1 month ago,2,,Remote,,"1,001-5,000 employees · IT Services and IT Consulting","A Silicon Valley-based company, renowned for its innovative digital solutions, is seeking a Web Back-End Developer to facilitate the seamless exchange of data between the server and users. This role is vital in delivering inventive solutions to complex challenges and contributing to the company's growth in the digital landscape. Join a dynamic team and thrive in a fast-paced, rewarding environment.

Key Responsibilities

Develop and maintain server-side logic, ensuring high performance and responsiveness to front-end requests
Collaborate closely with front-end developers to harmonize user-facing elements with server-side logic
Implement robust security and data protection measures to safeguard user information
Design and implement data storage solutions, optimizing data handling
Work closely with the team to identify and resolve performance and scalability issues
Stay updated with emerging technologies and apply relevant updates into the existing platform

Qualifications

Bachelor’s/Master’s degree in Engineering, Computer Science, or equivalent experience
A minimum of 3-5 years of overall web development experience
At least 2+ years of hands-on experience in Go programming language
Profound understanding of the web development cycle and a wide range of programming techniques and tools
Proficiency in code versioning tools, with a strong grasp of Git
Exceptional problem-solving skills and the ability to tackle complex development tasks
Excellent English communication skills and the capacity to excel in a team environment"
3758297964,Web Back-End Developer,htthttps://www.linkedin.com/jobs/view/3758297964,Turing,https://www.linkedin.com/company/turingcom/life," ",4 weeks ago,0,,Remote,,"1,001-5,000 employees · IT Services and IT Consulting","An NYSE-listed company, lauded for its innovative spirit and unwavering commitment to providing cutting-edge solutions, is actively seeking a Web Back-End Developer. This dynamic organization is at the vanguard of technological advancements, consistently pushing boundaries and raising the industry's standards. This role presents an exciting opportunity for an enterprising individual to contribute to the development and maintenance of various applications.

Job Responsibilities:

Pioneer, debug, test, and troubleshoot multiple applications to ensure peak performance
Collaborate seamlessly with our team of adept designers and engineers to create user-friendly interfaces
Engage in in-depth code analysis and recommend adjustments to enhance code quality
Harness Git, JUnit, and Java to craft and maintain robust back-end systems
Keep a vigilant eye on market trends and employ innovative problem-solving strategies rooted in research
Elevate application efficiency, speed, and scalability to outpace industry norms

Job Requirements:

Possess a Bachelor's or Master's degree in Engineering, Computer Science, or an equivalent field
Accumulate a minimum of 6-7 years of extensive experience in the industry
Demonstrate at least 1+ year/s of hands-on expertise with Git, JUnit, and Java
Exhibit a proven history of crafting and maintaining robust back-end systems
Boast a profound grasp of the software development life cycle (SDLC) and agile methodologies
Showcase exceptional problem-solving prowess and an unwavering commitment to precision
Display fluency in English, accompanied by strong communication skills"
3762068671,Web Backend Developer,htthttps://www.linkedin.com/jobs/view/3762068671,Turing,https://www.linkedin.com/company/turingcom/life," ",3 weeks ago,0,,Remote,,"1,001-5,000 employees · IT Services and IT Consulting","Job Description

An esteemed U.S.-based company, recognized for its inventive approach and steadfast dedication to delivering state-of-the-art solutions, is currently seeking a skilled Web Backend Developer. This company stands at the forefront of technological advancements, consistently pushing boundaries and establishing new benchmarks within the industry. The role being offered presents an exciting opportunity for a dynamic and driven professional to make a significant contribution to the ongoing success and expansion of the company.

As a Web Backend Developer, you will be responsible for the development and maintenance of robust backend systems, leveraging your expertise in GraphQL, React, and Spring Boot. Your key responsibilities will include debugging, testing, and troubleshooting multiple applications to ensure optimal efficiency, speed, and scalability.

Job Responsibilities

Develop and maintain robust backend systems using GraphQL, React, and Spring Boot.
Conduct debugging, testing, and troubleshooting of multiple applications to ensure optimal efficiency, speed, and scalability.
Collaborate with a team of talented designers and engineers to create user-friendly UIs.
Perform code analysis and recommend modifications to enhance code quality.
Stay updated with market trends and innovative problem-solving strategies through thorough research.
Contribute to the continuous improvement of the company's products and services.

Job Requirements

Bachelor's/Master's degree in Engineering, Computer Science, or equivalent experience.
Minimum of 8-10 years of overall experience in the field.
At least 1+ years of experience with GraphQL and React, and 1+ years of experience with Spring Boot.
Proven track record in developing and maintaining robust backend systems.
Strong understanding of the software development life cycle (SDLC) and agile methodologies.
Exceptional problem-solving skills and meticulous attention to detail.
Fluent in English with excellent communication skills."
3762069469,Web Back-End Developer,htthttps://www.linkedin.com/jobs/view/3762069469,Turing,https://www.linkedin.com/company/turingcom/life," ",3 weeks ago,0,,Remote,,"1,001-5,000 employees · IT Services and IT Consulting","Join a NASDAQ-listed technology company, known for its innovative approach and steadfast commitment to delivering cutting-edge solutions. Headquartered in Silicon Valley, the company consistently lead the way in technological advancements, pushing boundaries and setting new industry standards. They are currently seeking a Web Back-End Developer, offering an exciting opportunity for dynamic and ambitious professionals to contribute to their ongoing success and growth.

As a Web Back-End Developer, your role involves developing and maintaining robust back-end systems, utilizing your skills in GraphQL, React, and Spring Boot. You will be responsible for diagnosing, testing, and resolving issues in multiple applications to optimize efficiency, speed, and scalability.

Job Responsibilities:

Develop and maintain robust back-end systems using GraphQL, React, and Spring Boot
Diagnose, test, and resolve issues in multiple applications to optimize efficiency, speed, and scalability
Collaborate closely with a team of talented designers and engineers to create user-friendly UIs
Perform comprehensive code analysis and recommend enhancements to improve code quality
Stay updated with industry trends and innovative problem-solving strategies through continuous research
Contribute to the ongoing improvement of the company's products and services

Job Requirements:

Bachelor’s or Master’s degree in Engineering, Computer Science, or equivalent experience
A minimum of 8-10 years of overall experience in the field
At least 1+ year/s of hands-on experience with GraphQL, React, and Spring Boot
Proven track record in developing and maintaining robust back-end systems
Strong understanding of the software development life cycle (SDLC) and agile methodologies
Exceptional problem-solving skills and meticulous attention to detail
Proficiency in English and effective communication skills"
