id,title,job_url,company,company_link,location,published_at,number_of_applicants_applied,employment_duration,work_location_type,work_experience_level,company_type,company_logo,company_description,about_the_job
3633367937,Lead/Staff Software Engineer – Front End (Bangkok based – Relocation provided),https://www.linkedin.com/jobs/view/3633367937,Agoda,https://www.linkedin.com/company/agoda/life," "," ",209,,Full-time,,"5,001-10,000 employees · Software Development",https://media.licdn.com/dms/image/C4D0BAQGBa_7QNZNwpw/company-logo_100_100/0/1656643826660/agoda_logo?e=1712188800&v=beta&t=Uch6o32VIVJnqd5pOyN6ISz8TvEijuYR_vC1w3EK8HQ,"Agoda is transforming travel for millions of customers across the globe.

Headquartered in Asia, Agoda is one of the world’s largest online travel platforms. Founded in 2005 and now part of Booking Holdings (Nasdaq:BKNG), Agoda has a network of over 2,900,000 properties worldwide. Our web and mobile products provide a first-rate reservation service in 38 languages that uniquely combines local knowledge and local connections to provide the best deals for business and leisure travelers.

Agoda employs over 7,000 professionals from 90 nationalities in locations around the globe. In every department – from engineering to customer experience – we provide an environment rich with creativity, collaboration, and experimentation, and the tools to work faster and smarter.

At Agoda, we believe our people are our strength. We work hard and have fun, and we choose people who are dedicated to making things great.

For properties seeking partnership with Agoda, visit https://connect.agoda.com
…
show more","About Agoda

Agoda is an online travel booking platform for accommodations, flights, and more. We build and deploy cutting-edge technology that connects travelers with more than 3.6 million accommodations globally. Based in Asia and part of Booking Holdings, our 6,000+ employees representing 90+ nationalities foster a work environment rich in diversity, creativity, and collaboration. We innovate through a culture of experimentation and ownership, enhancing the ability for our customers to experience the world.

Get to Know our Team

Agoda ha s several teams in front-end focusing on different aspects of our products including accommodations, flights, payments, marketing, post-booking services, and more. Agoda’s marketplace is the world. We build localized and optimized user experiences at scale on every major internet platform . These include our mobile websites, native apps, and desktop sites. We hire people from around the world who have a passion for using technology to create and implement the best user experiences. Our front-end teams work on building user interfaces and integrating them with our back – end services to provide a seamless user experience. Our products are always evolving and under experimentation ; w e accomplish this by having a modularized approach, a utomating everything we can and optimizing our continuous delivery processes . By embracing data-driven practices and measuring our results, we foster a culture of innovation and constant improvement in our work.

We are looking for technical leaders like you who are passionate about their craft, thrive in a collaborative environment, and are driven to deliver high-quality solutions with a strong sense of ownership to push the boundaries of technology. Join our team and be part of a company that values innovation, encourages professional growth, and fosters a supportive and inclusive work culture.

The Opportunity

Lead / Staff engineer is the key role in our technology organization working together with individual contributors and senior leadership. Our lead engineers are heavily involved in the hiring and mentoring process and are the go-to people who design and implement new systems and components. We are looking for people who are passionate to take on more responsibility and driving major architectural changes in Agoda. It’s expected from you in this role as Lead / Staff engineer to push Agoda forward technically by adopting new technologies and setting higher standards.

In this Role, you’ll get to:

 Maintain ownership and responsibility of mission critical systems. 
 Be hands on – build high volume platforms using cutting-edge technologies like React , C# and Kotlin 
 Mentor and coach other software engineers 
 Be a major contributor to our agile and scrum practices and perform code reviews on the systems your teams own 
 Design and lead crucial technical projects and initiatives cross teams and departments 
Stay on the leading edge of technical know-how , industry trends and drive technical 

 What you’ll Need to Succeed: 

 Ove rall 5+ years of experience in front-end development. At least 3 + years of experience in developing web applications in client-side frameworks such as React, Angular, VueJS, etc. 
 B.S. in Computer Science or quantitative field; M.S. optional 
 Working experience with agile, analytics, A/B testing, GIT Flow 
 Excellent HTML/CSS skills – you understand not only how to build the data, but how to make it look great too 
 3 + years’ experience developing performance-critical applications that run in a production environment using one of the backend languages/frameworks such as .NET, Java, Scala, Kotlin, Rust, NodeJS, Go or Python 
 Excellent understanding of the JavaScript language and ecosystem including front-end build tools (Webpack, Babel) and package managers (npm, Yarn) 
 Experience in all aspects of client-side performance optimization 
Ability to guide the team on best frontend practices 
 Experience mentoring junior engineers to help them unleash their full potential 
 Great communication and coordination skills 
Excellent analytical thinking and problem-solving skills
You have a good command of the English language

It’s Great if you have:

 Knowledge in physical architecture at scale, building resilient, no single point of failures, highly available solutions 
 Strong experience in all aspects of client-side performance optimization 
 Proficiency in modern coding and design practices. For example, Clean Code, SOLID principals, and TDD 
 Working Experience with Containers and Dockerization , also K8S is a plus 
 Experience working on an app or internet company that is at scale with large numbers of users and transactions per second 
 E xperience working in a data driven company with experience analyzing and working with Big Data 
 Experience leading teams and greenfield projects solving large system problems 
 Experience working on global projects serving world markets with distributed data centers and localization of the front end and data 

This position is based in Bangkok, Thailand (Relocation Provided)

#sanfrancisco #sanjose #losangeles #sandiego #oakland #denver #miami #orlando #atlanta #chicago #boston #detroit #newyork #portland #philadelphia #dallas #houston #austin #seattle #sydney #melbourne #perth #toronto #vancouver #montreal #shanghai #beijing #shenzhen #prague #Brno #Ostrava #cairo #alexandria #giza #estonia #paris #berlin #munich #hamburg #stuttgart #cologne #frankfurt #hongkong #budapest #jakarta #bali #dublin #telaviv #milan #rome #tokyo #osaka #kualalumpur #amsterdam #oslo #manila #warsaw #krakow #bucharest #moscow #saintpetersburg #capetown #johannesburg #seoul #barcelona #madrid #stockholm #zurich #taipei #bangkok #Phuket #istanbul #london #manchester #edinburgh #kiev #hcmc #hanoi #wroclaw #poznan #katowice #rio #salvador #IT #ENG #4

Equal Opportunity Employer 

At Agoda, we pride ourselves on being a company represented by people of all different backgrounds and orientations. We prioritize attracting diverse talent and cultivating an inclusive environment that encourages collaboration and innovation. Employment at Agoda is based solely on a person’s merit and qualifications. We are committed to providing equal employment opportunity regardless of sex, age, race, color, national origin, religion, marital status, pregnancy, sexual orientation, gender identity, disability, citizenship, veteran or military status, and other legally protected characteristics.

We will keep your application on file so that we can consider you for future vacancies and you can always ask to have your details removed from the file. For more details please read our privacy policy .

To all recruitment agencies: Agoda does not accept third party resumes. Please do not send resumes to our jobs alias, Agoda employees or any other organization location. Agoda is not responsible for any fees related to unsolicited resumes."
3759247352,Quality Assurance Automation Engineer,https://www.linkedin.com/jobs/view/3759247352,VLink Inc,https://www.linkedin.com/company/vlink-inc/life," ",2 weeks ago,175,,On-site,,201-500 employees · IT Services and IT Consulting,https://media.licdn.com/dms/image/C4E0BAQHAMUYx5jqZ1w/company-logo_100_100-alternative/0/1630643463375/vlink_inc_logo?e=1712188800&v=beta&t=WLhr_Wt5-dRVCiaFHGC92H_YO4qHYUhlR2dv1b-osN0,"VLink Inc. is a global software engineering and IT staffing partner, delivering innovative solutions with the most highly vetted expert software development teams. We leverage the latest technologies and the best IT talent to drive business growth for Fortune-500, Large and SMB clients by delivering a customized, personal approach, to ensure their unique technology needs are met.
Founded in 2006, VLink takes pride in our highly revered workforce whose productivity, tech agility, and expertise produce transformative customer success stories year-after-year.

Why Choose VLink?
- 98% Customer Satisfaction
- 5+ Delivery Locations with Onshore/Offshore/Nearshore IT Talent
- 17+ Years of Software Engineering Excellence
- 500+ Software Engineers & Consultants
- 150+ Global Fortune-500, Large & SMB Clients Served
- 2 days TAT for Presenting Candidates on New Hiring Requests


Our core competencies and global service offerings include:
*DIGITAL TRANSFORMATION & CONSULTING*
(Data & Analytics| DevOps & Automation| Blockchain, AI/ML, IoT| Re-engineering Legacy Apps | Enterprise Portal Upgrades & Migrations)

*CUSTOM SOFTWARE DEVELOPMENT & MAINTENANCE*
(Web & Mobile Apps| Product Engineering| Maintenance & Support| QA & Testing)

*DEDICATED TEAMS & IT STAFF AUGMENTATION*
(Delivery Centers Onshore, Offshore & Nearshore| Short & Long-term Assignments| 24x7 Time Zone Alignment| Attrition Management| Speedy delivery)


**AWARD-WINNING WORKFORCE**
- Inc Magazine 500/5000 Fastest Growing Privately Owned Companies
- Connecticut’s 40 Fastest-Growing Tech Companies by Connecticut Technology Council’s Marcum TT 40
- Consistent Top Five Winner of Hartford Business Journal’s Best Places to Work in CT (2023)
- Great Place to Work® Certified™ 2023
- 2023 Best Software Development Companies in Hartford CT, by Expertise.com

***OUR INTELLECTUAL PROPERTIES***
- SimplyEDI
- VLinkCare
…
show more","Job Description
Designing and developing test automation scripts.
Using test automation guidelines.
Researching issues in software through testing.
Collaborating with QA Analysts and Software Developers to develop solutions.
Keeping updated with the latest industry developments
Prepare data and configure automation testing tool according to test scenario
Minimum Qualifications
Bachelor's degree in computer science, software development, or a related field.
Previous experience as a test automation engineer (Selenium, Appium, Katalon Studio), webdriver.io
Performance Testing using tools e.g : Jmeter,
Proficiency in programming languages such as C# and Java.
Excellent mathematical and problem-solving skills.
Highly accurate and detail-oriented.
Strong analytical and planning skills;
Good communication and presentation skills;
Excellent problem-solving skills;"
3763122844,"Systems Engineer - Commercial, Indonesia",https://www.linkedin.com/jobs/view/3763122844,Palo Alto Networks,https://www.linkedin.com/company/palo-alto-networks/life," "," ",157,,On-site,,"10,001+ employees · Computer and Network Security",https://media.licdn.com/dms/image/C560BAQFZg72Sfni4SA/company-logo_100_100/0/1657225156841/palo_alto_networks_logo?e=1712188800&v=beta&t=v58xlvr1E1lc_6YrGkG2oof3TRX0m1C5RMJ4HEAYZdc,"Palo Alto Networks, the global cybersecurity leader, is shaping the cloud-centric future with technology that is transforming the way people and organizations operate. Our mission is to be the cybersecurity partner of choice, protecting our digital way of life. We help address the world's greatest security challenges with continuous innovation that seizes the latest breakthroughs in artificial intelligence, analytics, automation, and orchestration. By delivering an integrated platform and empowering a growing ecosystem of partners, we are at the forefront of protecting tens of thousands of organizations across clouds, networks, and mobile devices. Our vision is a world where each day is safer and more secure than the one before. For more information, visit www.paloaltonetworks.com.
…
show more","Company Description

Our Mission

At Palo Alto Networks® everything starts and ends with our mission:

Being the cybersecurity partner of choice, protecting our digital way of life.

Our vision is a world where each day is safer and more secure than the one before. We are a company built on the foundation of challenging and disrupting the way things are done, and we’re looking for innovators who are as committed to shaping the future of cybersecurity as we are.

Our Approach to Work

We lead with flexibility and choice in all of our people programs. We have disrupted the traditional view that all employees have the same needs and wants. We offer personalization and offer our employees the opportunity to choose what works best for them as often as possible - from your wellbeing support to your growth and development, and beyond!

Job Description

Your Career

As a Pre-Sales Systems Engineer, you are an important member of our technical sales team, identifying complex security challenges in your customers’ networks and driving solutions with our market-leading security products and services.

You are the technical sales representative of the company and focus on customer satisfaction with all that you do. You and your sales partner own the customer relationship and your goal is to help them detect and prevent advanced cyberattacks and breaches while safely enabling applications by deploying the full Palo Alto Networks platform so that they can confidently pursue network, cloud, and mobile technology initiatives.

Your Impact

Understand and effectively present our security platform and solutions
Work closely with Commercial customers & partners in Indonesia
Create and deliver compelling demonstrations of Palo Alto Networks products and solutions
Educate customers and partners on the modern network security landscape
Identify and qualify new opportunities and support technical pre-sales activities to opportunity closure
Expand the Palo Alto Networks install base within existing accounts
Enable and leverage channel partners and work successfully in a channel-driven sales model
Create evaluation test plans with customers and lead the evaluation process to a successful conclusion
Differentiate from industry technologies and solution
Assist customers through the support escalation process
Continuous self-improvement and learning to maintain current technical knowledge and participate in technical communities of interest
Identify problems in customer environments - effectively engages customers at the technical field and technical management levels
Effective in customer-facing engagement, in writing, presentation, and creative problem-solving skills

Qualifications

Your Experience

BSCS or equivalent or equivalent military experience required and 6+ years of experience as a Pre-Sales Systems Engineer or Solution Consultant or Sales Engineer or Systems Integrator
Pre-sales experience handling Commercial customers & partners in Indonesia
Demonstrable experience with systems installation, configuration, and administration of routers/switches, UNIX/Linux and Windows-based systems (prior Active Directory/LDAP experience desirable)
Experience emphasizing L2-L4 Networking (L2 Switching architectures including Spanning Tree, IP routing including OSPF and BGP, L4 Load-balancing)
Industry knowledge of security and network product and technology trends
Experience selling, demonstrating, installing and/or solving network infrastructure security products
Extensive domestic travel within the territory is often required, and international travel may be required as necessary
Experience selling network infrastructure based security appliances including, but not limited to - Firewalls, SSL/IPSec VPNs, Security Proxies and Caches
Practical experience working with routing and switching products that will be installed adjacent to our appliances
Strong communication and presentation skills, both written and verbal
Strong analytical skills, ability to analyze complex multivariate problems and use a systematic approach to gain quick resolution

Additional Information

The Team

As part of our Systems Engineering team, you’ll support the sales team with technical expertise and guidance when establishing trust with key clients. You won’t find someone at Palo Alto Networks that isn’t committed to your success – with everyone pitching in to assist when it comes to solutions selling, learning, and development. As a member of our systems engineering team, you are motivated by a solutions-focused sales environment and find fulfillment in working with clients to resolve incredible complex cyberthreats.

Our Commitment

We’re trailblazers that dream big, take risks, and challenge cybersecurity’s status quo. It’s simple: we can’t accomplish our mission without diverse teams innovating, together.

We are committed to providing reasonable accommodations for all qualified individuals with a disability. If you require assistance or accommodation due to a disability or special need, please contact us at accommodations@paloaltonetworks.com.

Palo Alto Networks is an equal opportunity employer. We celebrate diversity in our workplace, and all qualified applicants will receive consideration for employment without regard to age, ancestry, color, family or medical care leave, gender identity or expression, genetic information, marital status, medical condition, national origin, physical or mental disability, political affiliation, protected veteran status, race, religion, sex (including pregnancy), sexual orientation, or other legally protected characteristics.

All your information will be kept confidential according to EEO guidelines."
3785276921,"Senior Software Engineer, Fullstack",https://www.linkedin.com/jobs/view/3785276921,Grab,https://www.linkedin.com/company/grabapp/life," ",2 weeks ago,52,,On-site,,"5,001-10,000 employees · Software Development",https://media.licdn.com/dms/image/C510BAQGDlPEJILPXbw/company-logo_100_100/0/1630575649647/grabapp_logo?e=1712188800&v=beta&t=LiVprA_nhthcshlCZ9nefFuRlvv-7yPlWzXhmwynrW0,"Grab is Southeast Asia’s leading superapp, offering a suite of services consisting of deliveries, mobility, financial services, enterprise and others. Grabbers come from all over the world, and we are united by a common mission: to drive Southeast Asia forward by creating economic empowerment for everyone.

At Grab, every Grabber is guided by The Grab Way, which explains our mission and the operating principles on how we can achieve it together. We call these principles the 4Hs:

Heart
We work together as OneGrab to serve communities in Southeast Asia

Hunger
We work to understand ground truths and drive improvements, big and small

Honour
We keep our word and steward our resources wisely to build and sustain trust

Humility
We are a constant work-in-progress, and we never stop learning to get better
…
show more","Company Description

Life at Grab

At Grab, every Grabber is guided by The Grab Way, which spells out our mission, how we believe we can achieve it, and our operating principles - the 4Hs: Heart, Hunger, Honour and Humility. These principles guide and help us make decisions as we work to create economic empowerment for the people of Southeast Asia.

Job Description

Get to know the Team

The Nexus team is part of the Automation and Platform Excellence (APEX) family and works on building services to improve developer productivity. The team is currently working on building a platform to enable a unified user experience for tools and documentation utilized by engineers to develop and operate the software ecosystem within Grab.

Get to know the Role

Our work has a direct impact on the productivity and the culture of our company. You will have visibility into every other engineering team and their systems, and you will engage in helping them.

The Day-to-Day Activities

Lead project development as engineering owner, working closely with product managers to understand the requirements, propose solutions and coordinate dependencies
Design and write with NodeJS, Typescript, Golang, Python and other languages to write code that build on the unified platform for internal tools.
Build and deploy performant cloud based backend services.
Engage in service capacity and demand planning, software performance analysis, tuning and optimization
Collaborate with designer and stakeholders to finalize feature specifications, build prototypes
Participate in code and design reviews to maintain our high development standards
Join on-call rotations to debug production issues and improve system stability.
Write high quality, bug-free, reusable, maintainable code both in frontend and backend
End-to-end development of your team’s products including ownership of the team’s infrastructure using Terraform, building and scaling back-end services, building intuitive and performant web applications as well as performing root cause analysis investigations.

Qualifications

The Must-Haves

Working experience on backend development for 5+ years
Strong computer science fundamentals in algorithms and data structures
Familiarity with both backend and frontend programming
Hands-on familiarity with databases and at least one data query language like MySQL or Presto
Strong understanding of system performance and ability to do profiling to find system bottlenecks
Strong understanding of testing frameworks for unit testing
Hands-on familiarity with CI/CD pipelines for system development and deployment
Familiarity with containerization (Kubernetes and Dockerfile)
You can be a good coder in any language (C++, C, Java, Scala, Rust, Haskell, OCaml, Erlang, Python, Ruby, PHP, Node.JS, C#, etc.), but willing to work on Golang and NodeJs, Typescript
Fluent in spoken and written English
Good communication skills, and a proactive mindset
Able to think critically of the current system in terms of growth and stability

The Nice-to-Haves

Hands-on experience with React/Redux
Hands-on experience with Go programming language
Hands-on experience with AWS/Azure

Additional Information

Our Commitment

We recognize that with these individual attributes come different workplace challenges, and we will work with Grabbers to address them in our journey towards creating inclusion at Grab for all Grabbers"
