id,title,job_url,company,company_link,location,published_at,number_of_applicants_applied,employment_duration,work_location_type,work_experience_level,company_type,company_logo,company_description,about_the_job
3791742682,Software Engineer (Web) (Ukirama),https://www.linkedin.com/jobs/view/3791742682,Dealls – Jobs & Mentoring (YC W22),https://www.linkedin.com/company/dealls/life," ",,6,,On-site,,201-500 employees,https://media.licdn.com/dms/image/D560BAQHWQbrRd1zJSw/company-logo_100_100/0/1681113001266/deall_logo?e=1712188800&v=beta&t=bfIKi87gyFPKPX92SaBJW0H7Ea7HN7QOKK8G-t9IZ9s,"Dealls – Jobs & Mentoring (YC W22) is the fastest way for professionals to get job offers from top companies. Simply drop your CV, sit back, and wait for offers from 450+ companies to come to you. Experience the new way of job-seeking with 3 unique features from Dealls:
• #cvAnalyzer. Know your CV ranking compared to other candidates
• #jobAssistant. Dealls' automatic service finds you relevant jobs, best suited to your experience & career preferences
• #antiGhosting. You are guaranteed to receive a response to your job application within max. 14 days

Bukalapak, TikTok, Kapal Api Group, Telkom, Bank BTPN Jenius, IDN Media, and 450+ others have already started using us to hire. We are Indonesia's #1 Best App of Google 2021.
…
show more","🙌🏻 About Us
UKIRAMA is a company with a bunch of passionate and humble professionals who are continuously striving to provide the best business solution utilizing state-of-the-art software to solve real world business problems. We provide Enterprise Resource Planning (ERP) for companies. 

💰Salary
Very competitive

👑 Job Role
Develop end-to-end features and functionality for the company's B2B SaaS platform
Collaborate with business analysts, UI UX designers, and CTO to translate user requirements into technical specifications
Build and maintain scalable databases and optimize queries for performance
Implement front-end interfaces using JavaScript, HTML, CSS, and relevant frameworks
Write efficient and modular code that adheres to best practices and coding standards
Conduct thorough testing and debugging to ensure high-quality software delivery
Ensure seamless deployment and ongoing maintenance of the application
Stay updated with emerging technologies and industry trends, suggesting improvements and enhancements to the platform
Participate in software development processes, including task planning and retrospectives

⛩️ Requirements
Bachelor's degree in Computer Science, Engineering, Information System, or a related field
Have 3-5 years of experience as a Software Engineer / Ruby on Rails Developer or equivalent work experience
Strong proficiency in Ruby on Rails development, including experience with Ruby language and Rails framework
Solid understanding of front-end technologies, such as JavaScript, HTML, CSS, and relevant frameworks (e.g., Angular, Vue.js)
Familiarity with database systems like PostgreSQL or MySQL and experience with query optimization and performance tuning
Knowledge of version control systems, such as Git
Experience with test-driven development (TDD) and writing automated tests
Strong problem-solving and analytical skills
Excellent communication and collaboration abilities

🎁 Perks
THR / Bonus system
Period Leave
Casual Dress Code
Competitive Salary
Medical Insurance
Free Food / Snacks
Team Building Activity
Company Outings"
3792496178,System Engineer,https://www.linkedin.com/jobs/view/3792496178,Tech Data APAC,https://www.linkedin.com/company/techdata-apac/life," ",1 week ago,61,,On-site,,"10,001+ employees · IT Services and IT Consulting",https://media.licdn.com/dms/image/D560BAQEjJjN96Had0A/company-logo_100_100/0/1666642604340/innovixdistribution_logo?e=1712188800&v=beta&t=MfZ_rSiOpGJQunjwICQ9CDi7GLmDQhu2JrTwHjaL6uA,"We’re Tech Data, A TD SYNNEX Company, a leading distributor and solutions aggregator for the IT ecosystem.
We are part of 22,000 of the IT industry’s best and brightest, who share an unwavering passion for bringing compelling technology products, services and solutions to the world. We’re an innovative partner that helps our customers maximize the value of IT investments, demonstrate business outcomes and unlock growth opportunities.
At our core, we’re a company that cares. We care about our partners, our co-workers, our investors and the world around us. And we’re committed to being a diverse, inclusive employer of choice and a good corporate citizen.
…
show more","Responsibilities:

 Determine the scope based on requirements, including stating the scope of work, calculating the resources required in delivering the service and advising the senior system engineer preparing the quotation
 Install and configure services as per the approved implementation plan
 Carry out technology, professional and maintenance support services as per scope within the stipulated duration/ timeline
 Provide level 1 support (basic hardware break-fix & troubleshooting of hardware and software issues ) for installed services
 Provide technical deliverables such as high level design document, user acceptance test (UAT) doc and as-built documentation
 Provide outstanding quality of service and meet predefined customer service level agreement (SLAs)
 Undergo technical trainings and obtain technical certifications that are required to meet suppliers’ mandatory technical requirements
 Conduct knowledge transfer training (where required)

Knowledge, Skills and Experience:

 Minimum 3 years of relevant experience
 Certified in at least one of the technology domain (Infrastructure hardware and software, hyperconvergence, network, security, cloud and/or end user computing)
 Strong technical knowledge on the assigned solution domain/product
 Knowledge of product portfolio in other technology domain is desirable
 Expertise in enterprise products implementation, migration and support.
 Strong interpersonal skills with a customer-centric attitude
 Strong oral and written communication skills
 Strong attention to technical details, priority management and planning skills
 Ability to work independently with little to no supervision
 Results-oriented
 Strong documentation skills

What’s In It For You?

Elective Benefits: Our programs are tailored to your country to best accommodate your lifestyle.
Grow Your Career: Accelerate your path to success (and keep up with the future) with formal programs on leadership and professional development, and many more on-demand courses.
Elevate Your Personal Well-Being: Boost your financial, physical, and mental well-being through seminars, events, and our global Life Empowerment Assistance Program.
Diversity, Equity & Inclusion: It’s not just a phrase to us; valuing every voice is how we succeed. Join us in celebrating our global diversity through inclusive education, meaningful peer-to-peer conversations, and equitable growth and development opportunities.
Make the Most of our Global Organization: Network with other new co-workers within your first 30 days through our onboarding program.
Connect with Your Community: Participate in internal, peer-led inclusive communities and activities, including business resource groups, local volunteering events, and more environmental and social initiatives.

Don’t meet every single requirement? Apply anyway. 

At Tech Data, a TD SYNNEX Company, we’re proud to be recognized as a great place to work and a leader in the promotion and practice of diversity, equity and inclusion. If you’re excited about working for our company and believe you’re a good fit for this role, we encourage you to apply. You may be exactly the person we’re looking for!"
3777876893,Senior Site Reliability Engineer,https://www.linkedin.com/jobs/view/3777876893,DKATALIS,https://www.linkedin.com/company/dkatalis/life," ",3 weeks ago,50,,Remote,,201-500 employees · IT Services and IT Consulting,https://media.licdn.com/dms/image/C4E0BAQEQPE6kBmqrzA/company-logo_100_100/0/1630627927496/dkatalis_logo?e=1712188800&v=beta&t=KiMK5dldtc5f2TmwzCeVEw2RrHLUW1qYX7yx2XLVTMI,"DKatalis is a technology company aiming to co-create scalable digital solutions with customers and ecosystem partners. Founded in 2019, DKatalis is collaborating from all around the world, with hubs operating in Jakarta, Singapore and India.

We have created the Jago App to solve financial literacy, AMAAN App to empower women entrepreneurs, and People Xperience App to empower organizations to adapt with rapid changes.
…
show more","About DKatalis

DKatalis is a financial technology company with multiple offices in the APAC region. In our quest to build a better financial world, one of our key goals is to create an ecosystem linked financial services business.

DKatalis is built and backed by experienced and successful entrepreneurs, bankers, and investors in Singapore and Indonesia who have more than 30 years of financial domain experience and are from top-tier schools like Stanford, Cambridge London Business School, JNU with more than 30 years of building financial services/banking experience from Bank BTPN, Danamon, Citibank, McKinsey & Co, Northstar, Farallon Capital, and HSBC.


About the role
The SRE Team at DKatalis is a 24/7 operation in charge of maintaining the digital platform that serves Bank Jago’s system and services. You'll experience a mix of activities from optimizing Kubernetes to maintaining systems uptime, to debugging production issues and running runbooks to mitigate potential production issues. One of the key objectives of the SRE teams is to constantly improve and uphold the reliability of our digital platform, our software release such as deployment processes and automation of recurring tasks. You should have a strong software engineering background and have the opportunity to collaborate with various software squads in building up a reliable digital platform.

Technologies We Use:
Cloudflare, Google Cloud - GKE, Kubernetes, Tyk API Gateway
Gitlab, Terraform
NodeJS, Java, Redis, Mongo, Kafka, Kotlin
Dynatrace, Pagerduty

Role and Responsibilities:
Participate in SRE software engineering, writing code for the continuing reduction of human intervention in operational tasks and automation of processes.
Ability to balance doing things right with fixing things quickly. Flexible and pragmatic, while working towards improving the long-term health of the system.
You have a strong systems experience with good coding practice.
You have an analytical approach to identifying problem components based on data points. Reliability of systems & applications is your core passion.
The team will be responsible for analyzing systems based on data points to identify workloads that are critical to the business.
Comfortable working cross-functionally to ensure success of the system’s operation. You will be closely collaborating with other engineering and product teams to ensure that expected system behavior is understood and monitoring exists to detect anomalies.
Lead in-depth technical and data analysis to gauge service trends and drive improvements.
You are comfortable with on-call responsibility and are able to manage a crisis working with the broader team, communicating progress and challenges during the crisis.
Participate in continuous improvement and execution of quality and timely major incident root cause analysis and blameless post-mortem activities to ensure we take action to avoid similar problems in the future.
Contribute to prioritization of reliability features and contribute to the design, development and delivery of effective tooling, alerts, and automated responses to identify and address reliability risks.
Contribute to proactive technical communication of reliability, stability and efficiency results (based on Service Level Objectives), service health (via dashboards) key reliability risks and issues to senior business and technology stakeholders – to prioritize activity (based on trend analysis) and direct investment and action.

Requirements:
You are either a Software Engineer with real interest, and ideally some experience in Linux systems, networking, monitoring and automation; or an experienced sysadmin or systems engineer with professional skills in Linux, preferably on distributed systems at scale, and a demonstrable interest and experience in using software engineering to solve operational problems.
Comfortable writing software to automate API-driven tasks at scale. Cloud Tooling engineers primarily use NodeJS and /or Java and Go are also key languages in our environment.
Experience automating the build and deployment of software products, and understand the related challenges in distributed systems.
Excellent communication (both verbal and written). The ability to communicate confidently and clearly on conference calls, in meetings, via email, etc. at all levels of the organization is essential.
Ability to quickly and clearly communicate incident status via email in business friendly language
8+ years experience in software development and/or SRE functions with at least 3 years in a senior/lead capacity
Degree in Computer Science, Engineering, or equivalent experience.
Experience and advanced understanding of Observability, CI/CD and release management.
Well-rounded broad knowledge of OS platforms (Linux/UNIX), Networking, Web Systems and Dev Ops
Experience working with large-scale distributed systems with understanding of microservices architecture concepts
Strong organizational skills and the ability to effectively manage multiple tasks simultaneously
Capable of working in a complex, fast paced environment and ability to maintain calm during stressful situations"
3786182985,Senior Site Reliability Engineer,https://www.linkedin.com/jobs/view/3786182985,DKATALIS,https://www.linkedin.com/company/dkatalis/life," ",3 weeks ago,50,,Remote,,201-500 employees · IT Services and IT Consulting,https://media.licdn.com/dms/image/C4E0BAQEQPE6kBmqrzA/company-logo_100_100/0/1630627927496/dkatalis_logo?e=1712188800&v=beta&t=KiMK5dldtc5f2TmwzCeVEw2RrHLUW1qYX7yx2XLVTMI,"DKatalis is a technology company aiming to co-create scalable digital solutions with customers and ecosystem partners. Founded in 2019, DKatalis is collaborating from all around the world, with hubs operating in Jakarta, Singapore and India.

We have created the Jago App to solve financial literacy, AMAAN App to empower women entrepreneurs, and People Xperience App to empower organizations to adapt with rapid changes.
…
show more","About DKatalis

DKatalis is a financial technology company with multiple offices in the APAC region. In our quest to build a better financial world, one of our key goals is to create an ecosystem linked financial services business.

DKatalis is built and backed by experienced and successful entrepreneurs, bankers, and investors in Singapore and Indonesia who have more than 30 years of financial domain experience and are from top-tier schools like Stanford, Cambridge London Business School, JNU with more than 30 years of building financial services/banking experience from Bank BTPN, Danamon, Citibank, McKinsey & Co, Northstar, Farallon Capital, and HSBC.


About the role
The SRE Team at DKatalis is a 24/7 operation in charge of maintaining the digital platform that serves Bank Jago’s system and services. You'll experience a mix of activities from optimizing Kubernetes to maintaining systems uptime, to debugging production issues and running runbooks to mitigate potential production issues. One of the key objectives of the SRE teams is to constantly improve and uphold the reliability of our digital platform, our software release such as deployment processes and automation of recurring tasks. You should have a strong software engineering background and have the opportunity to collaborate with various software squads in building up a reliable digital platform.

Technologies We Use:
Cloudflare, Google Cloud - GKE, Kubernetes, Tyk API Gateway
Gitlab, Terraform
NodeJS, Java, Redis, Mongo, Kafka, Kotlin
Dynatrace, Pagerduty

Role and Responsibilities:
Participate in SRE software engineering, writing code for the continuing reduction of human intervention in operational tasks and automation of processes.
Ability to balance doing things right with fixing things quickly. Flexible and pragmatic, while working towards improving the long-term health of the system.
You have a strong systems experience with good coding practice.
You have an analytical approach to identifying problem components based on data points. Reliability of systems & applications is your core passion.
The team will be responsible for analyzing systems based on data points to identify workloads that are critical to the business.
Comfortable working cross-functionally to ensure success of the system’s operation. You will be closely collaborating with other engineering and product teams to ensure that expected system behavior is understood and monitoring exists to detect anomalies.
Lead in-depth technical and data analysis to gauge service trends and drive improvements.
You are comfortable with on-call responsibility and are able to manage a crisis working with the broader team, communicating progress and challenges during the crisis.
Participate in continuous improvement and execution of quality and timely major incident root cause analysis and blameless post-mortem activities to ensure we take action to avoid similar problems in the future.
Contribute to prioritization of reliability features and contribute to the design, development and delivery of effective tooling, alerts, and automated responses to identify and address reliability risks.
Contribute to proactive technical communication of reliability, stability and efficiency results (based on Service Level Objectives), service health (via dashboards) key reliability risks and issues to senior business and technology stakeholders – to prioritize activity (based on trend analysis) and direct investment and action.

Requirements:
You are either a Software Engineer with real interest, and ideally some experience in Linux systems, networking, monitoring and automation; or an experienced sysadmin or systems engineer with professional skills in Linux, preferably on distributed systems at scale, and a demonstrable interest and experience in using software engineering to solve operational problems.
Comfortable writing software to automate API-driven tasks at scale. Cloud Tooling engineers primarily use NodeJS and /or Java and Go are also key languages in our environment.
Experience automating the build and deployment of software products, and understand the related challenges in distributed systems.
Excellent communication (both verbal and written). The ability to communicate confidently and clearly on conference calls, in meetings, via email, etc. at all levels of the organization is essential.
Ability to quickly and clearly communicate incident status via email in business friendly language
8+ years experience in software development and/or SRE functions with at least 3 years in a senior/lead capacity
Degree in Computer Science, Engineering, or equivalent experience.
Experience and advanced understanding of Observability, CI/CD and release management.
Well-rounded broad knowledge of OS platforms (Linux/UNIX), Networking, Web Systems and Dev Ops
Experience working with large-scale distributed systems with understanding of microservices architecture concepts
Strong organizational skills and the ability to effectively manage multiple tasks simultaneously
Capable of working in a complex, fast paced environment and ability to maintain calm during stressful situations"
3710124081,Senior Site Reliability Engineer,https://www.linkedin.com/jobs/view/3710124081,DKATALIS,https://www.linkedin.com/company/dkatalis/life," ",3 weeks ago,50,,Remote,,201-500 employees · IT Services and IT Consulting,https://media.licdn.com/dms/image/C4E0BAQEQPE6kBmqrzA/company-logo_100_100/0/1630627927496/dkatalis_logo?e=1712188800&v=beta&t=KiMK5dldtc5f2TmwzCeVEw2RrHLUW1qYX7yx2XLVTMI,"DKatalis is a technology company aiming to co-create scalable digital solutions with customers and ecosystem partners. Founded in 2019, DKatalis is collaborating from all around the world, with hubs operating in Jakarta, Singapore and India.

We have created the Jago App to solve financial literacy, AMAAN App to empower women entrepreneurs, and People Xperience App to empower organizations to adapt with rapid changes.
…
show more","About DKatalis

DKatalis is a financial technology company with multiple offices in the APAC region. In our quest to build a better financial world, one of our key goals is to create an ecosystem linked financial services business.

DKatalis is built and backed by experienced and successful entrepreneurs, bankers, and investors in Singapore and Indonesia who have more than 30 years of financial domain experience and are from top-tier schools like Stanford, Cambridge London Business School, JNU with more than 30 years of building financial services/banking experience from Bank BTPN, Danamon, Citibank, McKinsey & Co, Northstar, Farallon Capital, and HSBC.


About the role
The SRE Team at DKatalis is a 24/7 operation in charge of maintaining the digital platform that serves Bank Jago’s system and services. You'll experience a mix of activities from optimizing Kubernetes to maintaining systems uptime, to debugging production issues and running runbooks to mitigate potential production issues. One of the key objectives of the SRE teams is to constantly improve and uphold the reliability of our digital platform, our software release such as deployment processes and automation of recurring tasks. You should have a strong software engineering background and have the opportunity to collaborate with various software squads in building up a reliable digital platform.

Technologies We Use:
Cloudflare, Google Cloud - GKE, Kubernetes, Tyk API Gateway
Gitlab, Terraform
NodeJS, Java, Redis, Mongo, Kafka, Kotlin
Dynatrace, Pagerduty

Role and Responsibilities:
Participate in SRE software engineering, writing code for the continuing reduction of human intervention in operational tasks and automation of processes.
Ability to balance doing things right with fixing things quickly. Flexible and pragmatic, while working towards improving the long-term health of the system.
You have a strong systems experience with good coding practice.
You have an analytical approach to identifying problem components based on data points. Reliability of systems & applications is your core passion.
The team will be responsible for analyzing systems based on data points to identify workloads that are critical to the business.
Comfortable working cross-functionally to ensure success of the system’s operation. You will be closely collaborating with other engineering and product teams to ensure that expected system behavior is understood and monitoring exists to detect anomalies.
Lead in-depth technical and data analysis to gauge service trends and drive improvements.
You are comfortable with on-call responsibility and are able to manage a crisis working with the broader team, communicating progress and challenges during the crisis.
Participate in continuous improvement and execution of quality and timely major incident root cause analysis and blameless post-mortem activities to ensure we take action to avoid similar problems in the future.
Contribute to prioritization of reliability features and contribute to the design, development and delivery of effective tooling, alerts, and automated responses to identify and address reliability risks.
Contribute to proactive technical communication of reliability, stability and efficiency results (based on Service Level Objectives), service health (via dashboards) key reliability risks and issues to senior business and technology stakeholders – to prioritize activity (based on trend analysis) and direct investment and action.

Requirements:
You are either a Software Engineer with real interest, and ideally some experience in Linux systems, networking, monitoring and automation; or an experienced sysadmin or systems engineer with professional skills in Linux, preferably on distributed systems at scale, and a demonstrable interest and experience in using software engineering to solve operational problems.
Comfortable writing software to automate API-driven tasks at scale. Cloud Tooling engineers primarily use NodeJS and /or Java and Go are also key languages in our environment.
Experience automating the build and deployment of software products, and understand the related challenges in distributed systems.
Excellent communication (both verbal and written). The ability to communicate confidently and clearly on conference calls, in meetings, via email, etc. at all levels of the organization is essential.
Ability to quickly and clearly communicate incident status via email in business friendly language
8+ years experience in software development and/or SRE functions with at least 3 years in a senior/lead capacity
Degree in Computer Science, Engineering, or equivalent experience.
Experience and advanced understanding of Observability, CI/CD and release management.
Well-rounded broad knowledge of OS platforms (Linux/UNIX), Networking, Web Systems and Dev Ops
Experience working with large-scale distributed systems with understanding of microservices architecture concepts
Strong organizational skills and the ability to effectively manage multiple tasks simultaneously
Capable of working in a complex, fast paced environment and ability to maintain calm during stressful situations"
