id,title,job_url,company,company_link,location,published_at,number_of_applicants_applied,employment_duration,work_location_type,work_experience_level,company_type,company_logo,company_description,about_the_job
3736670007,"Lead Data Scientist (Bangkok based, relocation provided)",https://www.linkedin.com/jobs/view/3736670007,Agoda,https://www.linkedin.com/company/agoda/life," "," ",41,,Hybrid,,"5,001-10,000 employees · Software Development",https://media.licdn.com/dms/image/C4D0BAQGBa_7QNZNwpw/company-logo_100_100/0/1656643826660/agoda_logo?e=1712188800&v=beta&t=Uch6o32VIVJnqd5pOyN6ISz8TvEijuYR_vC1w3EK8HQ,"Agoda is transforming travel for millions of customers across the globe.

Headquartered in Asia, Agoda is one of the world’s largest online travel platforms. Founded in 2005 and now part of Booking Holdings (Nasdaq:BKNG), Agoda has a network of over 2,900,000 properties worldwide. Our web and mobile products provide a first-rate reservation service in 38 languages that uniquely combines local knowledge and local connections to provide the best deals for business and leisure travelers.

Agoda employs over 7,000 professionals from 90 nationalities in locations around the globe. In every department – from engineering to customer experience – we provide an environment rich with creativity, collaboration, and experimentation, and the tools to work faster and smarter.

At Agoda, we believe our people are our strength. We work hard and have fun, and we choose people who are dedicated to making things great.

For properties seeking partnership with Agoda, visit https://connect.agoda.com","About Agoda

Agoda is an online travel booking platform for accommodations, flights, and more. We build and deploy cutting-edge technology that connects travelers with more than 3.6 million accommodations globally. Based in Asia and part of Booking Holdings, our 6,000+ employees representing 90+ nationalities foster a work environment rich in diversity, creativity, and collaboration. We innovate through a culture of experimentation and ownership, enhancing the ability for our customers to experience the world.

Get to Know Our Team

The Data department , based in Bangkok , oversees all of Agoda’s data-related requirements. Our ultimate goal is to enable and increase the use of data in the company through creative approaches and the implementation of powerful resources such as operational and analytical databases, queue systems, BI tools, and data science technology. We hire the brightest minds from around the world to take on this challenge and equip them with the knowledge and tools that contribute to their personal growth and success while supporting our company’s culture of diversity and experimentation. The role the Data team plays at Agoda is critical as business users, product managers, engineers, and many others rely on us to empower their decision making. We are equally dedicated to our customers by improving their search experience with faster results and protecting them from any fraudulent activities. Data is interesting only when you have enough of it, and we have plenty. This is what drives up the challenge as part of the Data department, but also the reward.

The Opportunity

Please note -The role will be based in Bangkok. 

We are looking for ambitious and agile data scientists that would like to seize the opportunity to work on some of the most challenging productive machine learning and big data platforms worldwide, processing some 600B events every day and making some 5B predictions.

As part of the Data Science and Machine Learning (AI/ML) team you will be exposed to real-world challenges such as: dynamic pricing, predicting customer intents in real time, ranking search results to maximize lifetime value, classifying and deep learning content and personalization signals from unstructured data such as images and text, making personalized recommendations, innovating algorithm-supported promotions and products for supply partners, discovering insights from big data, and innovating the user experience. To tackle these challenges, you will have the opportunity to work on one of the world’s largest ML infrastructure employing dozens of GPUs working in parallel, 30K+ CPU cores and 150TB of memory.

In This Role, You’ll Get to

Design, code, experiment and implement models and algorithms to maximize customer experience, supply side value, business outcomes, and infrastructure readiness
Mine a big data of hundreds of millions of customers and more than 600M daily user generated events, supplier and pricing data, and discover actionable insights to drive improvements and innovation
Work with developers and a variety of business owners to deliver daily results with the best quality
Research discover and harness new ideas that can make a difference

What You’ll Need To Succeed

4+ years hands-on data science experience
Excellent understanding of AI/ML/DL and Statistics, as well as coding proficiency using related open source libraries and frameworks
Significant proficiency in SQL and languages like Python, PySpark and/or Scala
Can lead, work independently as well as play a key role in a team
Good communication and interpersonal skills for working in a multicultural work environment

It’s Great if You Have

PhD or MSc in Computer Science / Operations Research / Statistics or other quantitative fields
Experience in NLP, image processing and/or recommendation systems
Hands on experience in data engineering, working with big data framework like Spark/Hadoop
Experience in data science for e-commerce and/or OTA

We welcome both local and international applications for this role. Full visa sponsorship and relocation assistance available for eligible candidates.

#sanfrancisco #sanjose #losangeles #sandiego #oakland #denver #miami #orlando #atlanta #chicago #boston #detroit #newyork #portland #philadelphia #dallas #houston #austin #seattle #sydney #melbourne #perth #toronto #vancouver #montreal #shanghai #beijing #shenzhen #prague #Brno #Ostrava #cairo #alexandria #giza #estonia #paris #berlin #munich #hamburg #stuttgart #cologne #frankfurt #hongkong #budapest #jakarta #bali #dublin #telaviv #milan #rome #venice #florence #naples #turin #palermo #bologna #tokyo #osaka #kualalumpur #malta #amsterdam #oslo #manila #warsaw #krakow #doha #alrayyan #riyadh #jeddah #mecca #medina #singapore #seoul #barcelona #madrid #stockholm #zurich #taipei #tainan #taichung #kaohsiung #bangkok #Phuket #istanbul #london #manchester #edinburgh #hcmc #hanoi #lodz #wroclaw #poznan #katowice #rio #salvador #newdelhi #bangalore #bandung #yokohama #nagoya #okinawa #fukuoka #jerusalem #IT #4

Equal Opportunity Employer 

At Agoda, we pride ourselves on being a company represented by people of all different backgrounds and orientations. We prioritize attracting diverse talent and cultivating an inclusive environment that encourages collaboration and innovation. Employment at Agoda is based solely on a person’s merit and qualifications. We are committed to providing equal employment opportunity regardless of sex, age, race, color, national origin, religion, marital status, pregnancy, sexual orientation, gender identity, disability, citizenship, veteran or military status, and other legally protected characteristics.

We will keep your application on file so that we can consider you for future vacancies and you can always ask to have your details removed from the file. For more details please read our privacy policy .

To all recruitment agencies: Agoda does not accept third party resumes. Please do not send resumes to our jobs alias, Agoda employees or any other organization location. Agoda is not responsible for any fees related to unsolicited resumes."
3782117491,Program Manager,https://www.linkedin.com/jobs/view/3782117491,Volex,https://www.linkedin.com/company/volex/life," ",3 weeks ago,145,,On-site,,"10,001+ employees · Appliances, Electrical, and Electronics Manufacturing",,,"Business overview
Volex is a leading integrated manufacturing specialist for performance critical applications and supplier of power products serving a diverse range of markets and customers, with particular expertise in cable assemblies, higher-level assemblies, data centre products, electric vehicles and consumer electronics.
We employ over 7000 employees across 22 countries and operate 19 manufacturing locations. In our most recent FY we had revenue of $614.6m spread broadly across the four regions (Americas, Europe, APAC and China).

Job Overview
The Program Manager plays a major role in developing and shaping programs, managing and building long-term client relationships and understanding the “big picture” in business. The Program Manager is the “chief operating officer” of the team and makes sure the team member know what they need to do and when and how much time they have to do the work.
To successfully manage programs from start to completion; 
is responsible for partnering with the internal team (sales, engineering, operations, new business and finance) to ensure that work is delivered on strategy, on time and on budget.
Jointly responsible for the P&L for the program with the Account Manager with primary responsibility for development costs.

Essential Job Functions
The Program Manager is the main point of contact to the delivery team and a key client contact during the life of a project; the sales lead and leads the internal team to scope and set up the engagement correctly, to deliver multiple projects on time, on margin and to the appropriate quality and is responsible for the tactical deliverables of each work stream in the implementation phase, including: 
Develop and manage of scope of work and program timelines with GM. Work closely with the GM to ensure that all the appropriate resources and plans are in place to deliver all projects. 
Conduct kick-off meeting and regular review meetings to ensure programs are on track and meeting CRD or VCD
Propose projects based on feasibility study and justification 
Working closely with Sales, Program manage customer onboarding and new business across engineering, operations (including the RFQ process), new business development and finance
Develop & implement project governance including key project performance metrics and may work outside normal office hour and indicators to ensure project management improvements are highly visible via weekly and monthly reports
Follow up with respective project owners when there is deviation from schedule, and may work outside normal office hours
Support GM in achieving revenue goals by reducing conversion time from project won to purchase order (PO)
Participate in new business calls as appropriate to help develop the value proposition
 Key Qualifications and desirable experience
Holds a recognised Degree
Fast response time to Sales or Customer enquiries
Strong written and oral communication skills
Three (3) years experience in program management roles in manufacturing environment
Proficient in Microsoft office suite
Relationship builder 
Strategic, big picture thinker
Multi-tasker 
Pro-active, enthusiastic and diplomatic 
Detail-oriented 
Leader, coach and mentor 
Ability to work with all levels of an organization
Willing to work outside normal office hour"
3785640172,Partnership Manager,https://www.linkedin.com/jobs/view/3785640172,SHOPLINE,https://www.linkedin.com/company/shopline/life," ",2 weeks ago,530,,On-site,,"1,001-5,000 employees · Software Development",,,"About the role:
You will be part of the core launch team in ID building and overseeing the relationships with local partners.

What you will own and support:
Build and maintain the local partner ecosystem in ID. Identify, assess and commercialise new partnership opportunities for growth
Maintaining relationships with existing partners to drive commercial revenue targets or set KPIs with our partners. Increase the productivity of the existing partners through structured partnership program
Present the platform to existing and potential partners on how the solution can help to drive revenues, improve efficiencies
Represent Shopline at industry events and conferences to drive potential partner engagements
Support the creation and execution of the partnership strategy and pipeline targets
Support marketing in creation of marketing collaterals and lead generation activities

What Will You Need :
At least 3+ years experience in Partnership and Sales 
Ability to respond to different partners expectations, needs and communication styles and be quick to respond to feedback
Strong project management skills – ability to identify critical paths, engage, motivate key stakeholders, teams and hold everyone accountable for commitment
Process oriented mindset, very organised, and strong attention to detail
Experience working with cross-functional and cross-culture teams/stakeholders
Comfortable working in a fast-paced, multi-tasked, high-energy working environment
Ecommerce, Social Commerce and/or Retail experience strongly preferred
Plus: Sales, Business Development, Start Up experience will be an added advantage"
3693017931,Vertical Sales Specialist,https://www.linkedin.com/jobs/view/3693017931,Siemens,https://www.linkedin.com/company/siemens/life," "," ",466,,On-site,,"10,001+ employees · Automation Machinery Manufacturing",https://media.licdn.com/dms/image/D4E0BAQHYr4M_PHhGdg/company-logo_100_100/0/1688363990393/siemens_logo?e=1712188800&v=beta&t=54OFq1AK_xsInjQj5G-xDLa99QnoQ5B52ifVpkgW2cY,"Siemens is a technology company focused on industry, infrastructure, transport, and healthcare. From more resource-efficient factories, resilient supply chains, and smarter buildings and grids, to cleaner and more comfortable transportation as well as advanced healthcare, the company creates technology with purpose adding real value for customers. By combining the real and the digital worlds, Siemens empowers its customers to transform their industries and markets, helping them to transform the everyday for billions of people. Siemens also owns a majority stake in the publicly listed company Siemens Healthineers, a globally leading medical technology provider shaping the future of healthcare. In addition, Siemens holds a minority stake in Siemens Energy, a global leader in the transmission and generation of electrical power.
In fiscal 2022, which ended on September 30, 2022, the Siemens Group generated revenue of €72.0 billion and net income of €4.4 billion. As of September 30, 2022, the company had around 311,000 employees worldwide. Further information is available at www.siemens.com.
…
show more","We know that a business only thrives if our people are thriving. That’s why we always put our people first. Our global and diverse team would be happy to support you and challenge you to grow in many ways. Who knows where our joint journey will take you?

As a Vertical Sales Specialist, you will work together with Sales Manager to create the Customer Development Plan (CDP), execute and Report Sales Activities including the monthly Sales Forecast, value Selling in F&B, Pharma, Chemical, Oil&Gas and Mining Industry.

You’ll create impact by:

Be a Key Account Manager for assigned 20 End Users. 
Execute/Implement the Customer Development Planning. 
Customer Transparency by managing the quality of CRM tools. 
Assist the Sales Acquisition teams to increase the hit rate of opportunity. 
Able to explain the project risk and how to mitigate.

Use Your Skills To Move The World Forward.

You are the right candidate for this position if the following description fits you:

Experience in Engineering and Sales role
Experience in execute and selling Automation, Electrification and Digitalization portfolio.
Experience as account manager for Multi-National and National Company in F&B, Chemical and Oil&Gas
Experience in selling Solutions or Project Business via EPC
Possess a Bachelor Degree in Industrial Engineering, Electrical Engineering, Engineering
Physics from reputable University
Knowledge in DCS, PLC, SCADA, IIoT Training
Experience in Project Management and Sales Training
Require intensive travelling inside the country
Low profile but confidence
Challengers
Strategic Thinking
Language skills: High proficiency in English and Native language Bahasa Indonesia

In return, we offer:

an attractive remuneration package
benefits to opt for an insurance plan, and health that suit your individual need
development opportunities for personal and professional growth
colleagues that are as thoughtful, encouraging, hardworking, and driven as you
an outstanding open-minded culture with an ecosystem of a large company like Siemens

Create a better #TomorrowWithUs!

We value your unique identity and perspective and are fully committed to providing equitable opportunities and building a workplace that reflects the diversity of society. Come bring your authentic self and create a better tomorrow with us."
3796565153,"Lead Data Engineer (Fintech team) (Bangkok based, relocation provided)",https://www.linkedin.com/jobs/view/3796565153,Agoda,https://www.linkedin.com/company/agoda/life," ",1 day ago,3,,Full-time,,"5,001-10,000 employees · Software Development",https://media.licdn.com/dms/image/C4D0BAQGBa_7QNZNwpw/company-logo_100_100/0/1656643826660/agoda_logo?e=1712188800&v=beta&t=Uch6o32VIVJnqd5pOyN6ISz8TvEijuYR_vC1w3EK8HQ,"Agoda is transforming travel for millions of customers across the globe.

Headquartered in Asia, Agoda is one of the world’s largest online travel platforms. Founded in 2005 and now part of Booking Holdings (Nasdaq:BKNG), Agoda has a network of over 2,900,000 properties worldwide. Our web and mobile products provide a first-rate reservation service in 38 languages that uniquely combines local knowledge and local connections to provide the best deals for business and leisure travelers.

Agoda employs over 7,000 professionals from 90 nationalities in locations around the globe. In every department – from engineering to customer experience – we provide an environment rich with creativity, collaboration, and experimentation, and the tools to work faster and smarter.

At Agoda, we believe our people are our strength. We work hard and have fun, and we choose people who are dedicated to making things great.

For properties seeking partnership with Agoda, visit https://connect.agoda.com","About Agoda 

Agoda is an online travel booking platform for accommodations, flights, and more. We build and deploy cutting-edge technology that connects travelers with more than 3.6 million accommodations globally. Based in Asia and part of Booking Holdings, our 6,000+ employees representing 90+ nationalities foster a work environment rich in diversity, creativity, and collaboration. We innovate through a culture of experimentation and ownership, enhancing the ability for our customers to experience the world.

About Agoda

Agoda is an online travel booking platform for accommodation, flights, and more. We build and deploy cutting edge technology that connects travelers with more than 2.5 million accommodations globally. Based in Asia and part of Booking Holdings, our 4,000+ talents coming from 90+ different nationalities foster a work environment rich in diversity, creativity, and collaboration. We innovate through a culture of experimentation and ownership, enabling our customers to experience the world

 Get to Know Our Team 

Fintech is one of the fastest growing areas in Agoda and we are rapidly expanding our tech team. We work closely with the finance business team and our Fintech product owners to reduce risk, drive efficiencies and move on new market opportunities in this exciting field. We have a wide range of projects from traditional finance or cutting-edge customer fintech. For example, reconciliation using Big Data technologies, growing and optimizing customer payments options, tax calculations in milli-second response times and a mesh of supplier payment options like vertical credit cards. Its a hot field and the perfect mix of data engineering and backend engineering.

 The Opportunity 

We are looking for engineers with experience in the fintech area. This can be a year or two at a fintech startup right through to an expert in this domain. You might have a background as ‘ back end ’ or ‘data’ engineer , either way we are looking for smart engineers who can be super agile, move fast and have an eye for detail. We’d love to hear from you if you are skilled in any of the technologies we work with and excited at building new fintech technology.

In this Role, you will get to

Lead the team technically in improving scalability, stability, accuracy, speed and efficiency of our existing Data systems
Build, administer and scale data processing pipelines
Be comfortable navigating the following technology stack: Scala, Spark, java, Golang, Python3, scripting (Bash/Python), Hadoop, SQL, S3 etc
Improve scalability, stability, accuracy, speed and efficiency of our existing data systems
Design, build, test and deploy new libraries, frameworks or full systems for our core systems while keeping to the highest standards of testing and code quality
Work with experienced engineers and product owners to identify and build tools to automate many large-scale data management / analysis tasks 

What You’ll Need To Succeed

Bachelor’s degree in Computer Science /Information Systems/Engineering/related field
5+ years of experience in Data engineering
Good experience in Apache Spark
Expert level understanding of JVM and either Java or Scala
Experience debugging and reasoning about production issues is desirable
A good understanding of data architecture principles preferred
Any other experience with Big Data technologies / tools
SQL experience
Analytical problem-solving capabilities & experience
Systems administration skills in Linux

It’s great if you have

Good understanding of Hadoop ecosystems
Experience working with Open-source products
Python/Shell scripting skills
Working in an agile environment using test driven methodologies

#telaviv #jerusalem #IT #ENG #4 #sanfrancisco #sanjose #losangeles #sandiego #oakland #denver #miami #orlando #atlanta #chicago #boston #detroit #newyork #portland #philadelphia #dallas #houston #austin #seattle #sydney #melbourne #perth #toronto #vancouver #montreal #shanghai #beijing #shenzhen #prague #Brno #Ostrava #cairo #alexandria #giza #estonia #paris #berlin #munich #hamburg #stuttgart #cologne #frankfurt #hongkong #budapest #jakarta #bali #dublin #telaviv #milan #rome #venice #florence #naples #turin #palermo #bologna #tokyo #osaka #kualalumpur #malta #amsterdam #oslo #manila #warsaw #krakow #doha #alrayyan #riyadh #jeddah #mecca #medina #singapore #seoul #barcelona #madrid #stockholm #zurich #taipei #tainan #taichung #kaohsiung #bangkok #Phuket #istanbul #london #manchester #edinburgh #hcmc #hanoi #lodz #wroclaw #poznan #katowice #rio #salvador #newdelhi #bangalore #bandung #yokohama #nagoya #okinawa #fukuoka #jerusalem #IT #4

Equal Opportunity Employer 

At Agoda, we pride ourselves on being a company represented by people of all different backgrounds and orientations. We prioritize attracting diverse talent and cultivating an inclusive environment that encourages collaboration and innovation. Employment at Agoda is based solely on a person’s merit and qualifications. We are committed to providing equal employment opportunity regardless of sex, age, race, color, national origin, religion, marital status, pregnancy, sexual orientation, gender identity, disability, citizenship, veteran or military status, and other legally protected characteristics.

We will keep your application on file so that we can consider you for future vacancies and you can always ask to have your details removed from the file. For more details please read our privacy policy .

To all recruitment agencies: Agoda does not accept third party resumes. Please do not send resumes to our jobs alias, Agoda employees or any other organization location. Agoda is not responsible for any fees related to unsolicited resumes."
