id,title,job_url,company,company_link,location,published_at,number_of_applicants_applied,employment_duration,work_location_type,work_experience_level,company_type,company_logo,company_description,about_the_job
3774471701,MS Senior Engineer - Middleware,https://www.linkedin.com/jobs/view/3774471701,NTT Ltd.,https://www.linkedin.com/company/global-ntt/life," "," ",15,,Hybrid,,"10,001+ employees · IT Services and IT Consulting",https://media.licdn.com/dms/image/D4D0BAQF0fjPAQRj4uA/company-logo_100_100/0/1698830112594/global_ntt_logo?e=1712188800&v=beta&t=Y27LLHDeNFUNrgLAQFFNQ6FNKYU4YfoZJYhx7cMJJfI,"NTT Ltd. is becoming NTT DATA. As a global IT services powerhouse, we offer an unmatched range of business and technology solutions.","Want to be a part of our team?

Provides technical support to field engineers, technicians, and product support personnel who are diagnosing, troubleshooting, repairing, and debugging complex electro/mechanical equipment, computer systems, complex software, or networked and/or wireless systems.

Responds to situations where first-line product support has failed to isolate or fix problems in malfunctioning equipment or software. Reports design, reliability, and maintenance problems or bugs to design engineering/software engineering. May be involved in customer installation and training.

Provides support to customers/users where the product is highly technical or sophisticated in nature.

Working at NTT

The MS Engineer is responsible for providing a service to clients by proactively identifying and resolving technical incidents and problems. Through preemptive service incident and resolution activities, as well as product reviews, operational improvements, operational practices, and quality assurance this role will maintain a high level of service to clients. Their primary objective is to ensure zero missed service level agreement (SLA) conditions .The MS Engineer s responsible for managing tickets of low to high complexity.

Key Roles and Responsibilities:

Ensure that assigned infrastructure at the client site is configured, installed, tested, and operational
Perform necessary checks, apply monitoring tools and respond to alerts
Identify problems and errors prior to or when it occurs and log all such incidents in a timely manner with the required level of detail
Assist in analyzing, assigning, and escalating support calls
Investigate third line support calls assigned and identify the root cause of incidents and problems
Report and escalate issues to 3rd party vendors if necessary
Provide onsite technical support to clients and provide field engineering services to clients
Conduct a monthly random review of incidents and service requests, analyze and recommend improvement in quality
Provide continuous feedback to clients and affected parties and update all systems and/or portals as prescribed by NTT
Proactively identify opportunities for work optimization including opportunities for automation of work

Knowledge, Skills, and Attributes:

Ability to communicate and work across different cultures and social groups
Ability to plan activities and projects well in advance, and takes into account possible changing circumstances
Ability to maintain a positive outlook at work
Ability to work well in a pressurized environment
Ability to work hard and put in longer hours when it is necessary
Ability to apply active listening techniques such as paraphrasing the message to confirm understanding, probing for further relevant information, and refraining from interrupting
Ability to adapt to changing circumstances
Ability to place clients at the forefront of all interactions, understanding their requirements, and creating a positive client experience throughout the total client journey

Academic Qualifications

Advanced diploma, degree, or relevant qualification in IT/Computing (or demonstrated equivalent work experience)

Required Experience:

Demonstrated work experience
Demonstrated experience required in Engineering function within a medium to large ICT organization
Demonstrated experience of Managed Services
Demonstrated working knowledge of ITIL processes
Demonstrated experience working with vendors and/or 3rd parties

What will make you a good fit for the role?

Equal Opportunity Employer

NTT is proud to be an Equal Opportunity Employer with a global culture that embraces diversity. We are committed to providing an environment free of unfair discrimination and harassment. We do not discriminate based on age, race, color, sex, religion, national origin, disability, pregnancy, marital status, sexual orientation, gender reassignment, veteran status, or other protected category"
3781813894,SKALA - GEDSI PFM Advisor,https://www.linkedin.com/jobs/view/3781813894,DT Global,https://www.linkedin.com/company/dt-global/life," ",3 weeks ago,19,,On-site,,"1,001-5,000 employees · International Trade and Development",https://media.licdn.com/dms/image/C4E0BAQERA9e-DHTZww/company-logo_100_100/0/1630600713339/dt_global_logo?e=1712188800&v=beta&t=Tdg2PVlCgvThfiUvGWtBXvHopx9Z0hecnU5mS3NBEtw,"DT Global works in partnership with communities, governments, and the private sector to deliver innovative solutions that transform lives. DT Global—launched in 2019—is built on legacy companies AECOM International Development’s Services Sector, Development Transformations, IMC Worldwide, and Cardno International Development. To fulfill its profit-for- purpose mission, DT Global is a key donor to the DT Institute, an independent not-for-profit organization, in support of DTI’s efforts to test new ideas or expand on donor partner priorities with the aim to improve as many lives as possible.
Our global team of 2,500 staff and experts work in over 90 countries. We bring over 60 years of experience, relationships,
and technical excellence to improve lives on behalf of our partners, clients, and stakeholders. We aim to maximize sustainable development impact across a wide range of practice areas, including Conflict Prevention, Stabilization & Transition; Economic Growth; Environment & Infrastructure; Governance; and Human Development. Together, we aim to positively impact 500 million lives by 2045.","Location: Jakarta, Indonesia


Program Background

The SKALA Program is a significant Australian investment designed to help Indonesia address regional disparities in development. SKALA will contribute to this objective by strengthening selected elements of Indonesia’s large and complex decentralized government system responsible for the delivery of basic services (Layanan Dasar). The SKALA Program’s core approach is to facilitate better collaboration (Kolaborasi) between Indonesian government stakeholders, at national and subnational levels, to help realize synergies (Sinergi) that will trigger improved service delivery. Moreover, SKALA will build on, and take to scale, the successes and learning from Australia’s previous 17 years of support to Indonesia’s decentralized government system. The SKALA Program is to be implemented through the following three pillars:
  Pillar 1: Stronger national level enabling environment for sub-national service delivery
Pillar 2: Better sub-national governance for service delivery
Pillar 3: Greater participation, representation and influence for women, people with disabilities and vulnerable groups
 
About DT Global

DT Global is shaping a future where sustainable development and innovation empower individuals, communities, and nations. We work in partnership with local stakeholders to foster inclusive prosperity, social equity, and environmental stewardship. Our global team of 2,500 staff and experts work in over 90 countries to solve complex problems in the peacebuilding, governance, economic development, environment, and human development sectors. With a track record of technical excellence and more than 60 years of international development experience and relationships, we deliver innovative solutions that transform lives.
 
For more information, please see www.dt-global.com


The Role

The GEDSI-PFM Advisor will support the team to operationalize the GEDSI Strategy through technical oversight and support to mainstream GEDSI in various SKALA’s interventions. This position will work with the team to provide GEDSI technical support as required, particularly on the area expertise of public finance management.
 Within the GEDSI team, the advisor will work closely with GEDSI managers based on direction and supervision of the GEDSI Lead to ensure technical support provided timely and adequately, across various implementation team.
 
Click on the link or copy paste it to access the full Terms of Reference for this position: https://bit.ly/3Nj4aBo
 
About You
Specific Responsibilities
Support ongoing activities against the targets set out as outlined in the SKALA's work plan. Work closely with the GEDSI Managers on delivery, reporting, and monitoring of the overall implementation of GEDSI activities as directed by the GEDSI Lead.
Provide support on the strengthening GEDSI mainstreaming through government mechanisms embedded in SKALA's key ministries partners: Ministry of Home Affairs; Ministry of Finance and Ministry of National Planning.
Identify and provide technical support in the development of potential GEDSI responsive-public finance management research themes.
Provide technical input and support to the development of research concepts and implementation of public expenditure and revenue analysis (PERA).
Working collaboratively with the research team in data collection, analysis, writing reports and presenting results of studies.
Work collaboratively with the team to develop policy briefs and other relevant publications to promote and advocate research recommendations for policy improvement on GEDSI responsive planning and budgeting.
Provide technical support and capacity building of SKALA team members and relevant stakeholders.

 Selection Criteria
Minimum postgraduate qualifications (Masters or PHD) in relevant discipline.
Relevant mid and expert level technical and operational experience in the field of expertise.
Experience in providing advisory services in expertise.
Minimum 12 years of total working experience in the area of expertise (having experience working in less developed region more preferable).
Minimum 5 years of experience working with/for GOI ministries on relevant area.
Minimum 5 years of experience working with DFAT and/or other donor funded projects.
Has practical and technical understanding of gender equality, disability, and social inclusion, demonstrated by experience implementing activities with gender, disability, and social inclusion considerations in Indonesia.
Demonstrated strong analytical and writing skills and experience preparing high-level communication products for stakeholders, clients, and officials.
Strong engagement skills with a wide range of government, non-government, and donor organizations; and a demonstrated ability to effectively communicate in a cross-cultural context.
Women and persons with disability strongly encouraged to apply.

 Why join SKALA
By joining the SKALA, you will be part of an environment where you can collaborate with leading experts from diverse backgrounds, access development programs to achieve your career goals, and be challenged to take a global outlook.
 
HOW TO APPLY
Click the 'Apply Now' button.

 Please submit
1) Your CV
2) A cover letter addressing the essential selection criteria (maximum 2 pages)


APPLICATIONS CLOSE – 23rd December 2023, 5 PM Jakarta time.
  
Should this role be of interest, we encourage you to apply as soon as possible. Kindly note only shortlisted applicants will be contacted.
 
DT Global is committed to child protection and safeguarding the welfare of children in the delivery of our international development programs. We are committed to Safety and the Prevention of Sexual Abuse and Harassment (PSEAH), and bribery prevention. DT Global is an equal opportunity employer and we encourage women, men, people with diverse backgrounds and people living with disabilities to apply. This program is funded by the Australian Government and Managed by DT Global."
3785657365,IT Manager - The Luxury Collection Lombok Resort & Spa,https://www.linkedin.com/jobs/view/3785657365,The Luxury Collection,https://www.linkedin.com/company/the-luxury-collection-ltd/life," ",2 weeks ago,73,,Full-time,,"10,001+ employees · Hospitality",https://media.licdn.com/dms/image/C4E0BAQEq6foRuGJAoA/company-logo_100_100/0/1660573855493/the_luxury_collection_ltd_logo?e=1712188800&v=beta&t=3K2cUFdWCSIOQyPBGgzFahwcUqxBndl-ckaByPCtWt4,The Luxury Collection offers a gateway to the world’s most exciting and desirable destinations – each inspiring a thousand stories tied to the transformative experiences that make each locale unforgettable. Explore more than 120 unique hotels in The Luxury Collection in over 35 countries.,"Job Number 23213323

Job Category Information Technology

Location The Luxury Collection Lombok, One Marriott Drive, Lombok, West Nusa Tenggara, Indonesia VIEW ON MAP

Schedule Full-Time

Located Remotely? N

Relocation? N

Position Type Management

Hotel Description

The 60-key Luxury Collection Lombok Resort & Spa will be a standalone rebranding project from The Legian Sire Lombok , slated to open in Q1, 2024. The resort is located on the northwestern shore of Lombok along the serene Sire Beach. It is bordered by the acclaimed 18-hole championship course Sire Beach Golf Club to the east and a vacant land lot to the south. The resort is approximately a 2-hour drive from Lombok International Airport and a short boat ride from the Gili Islands, a group of three idyllic islands located off the northwestern coast of Lombok, renowned for their natural beauty and vibrant night life. Occupying a land area of approximately 4.5 HA, the resort features 14 one-to-two-bedroom private pool villas and 46 suites housed in west-facing guestroom blocks, offering unobstructed sunset views over the Lombok Strait. Sire Beach is characterized by its pristine white sand and crystal clear, calm waters, suitable for snorkeling and kayaking. The resort offers an all day dining, specialty restaurant and three bars. Facilities also include a function room at 140 square meters, fitness centre, spa, kid’s club and recreation center.

Job Summary

As a member of the property management staff, contributes advanced knowledge and skill in technology and general hospitality business knowledge to support the property and technology Information Resources objectives. Position is responsible to the property for all technology planning, decision-making, implementation, and maintenance. May interfaces with vendors, owners, Executive Committee and property staff.

CANDIDATE PROFILE 

Education And Experience

 BS/BA or equivalent work experience. Additionally, 2-4 years experience in like position. 
 Previous experience in IR Global Field Services or Marriott Systems Support desirable. 
 System-related professional certifications desired. 

CORE WORK ACTIVITIES

Ensuring Client Technology Needs are Met

 Uses computers and computer systems (including hardware and software) to program, write software, set up functions, enter data, or process information. 
 Monitors, ensures and manages the acquisition and maintenance of property based systems. 
 Analyzes information, identifies current and potential problems and proposes solutions. 
 Maintains, inspects and repairs equipment. 
 Inspects and ensures the maintenance of the equipment or the environment. 
 Ensures that computer and network operations are monitored at the property, backup/recovery functions are performed on scheduled basis and administration functions for hardware, operating and application systems are maintained and completed on consistent basis. 
 Manages IR activities to ensure the property infrastructure and applications systems are functional at all times. 
 Ensures solutions are consistent with the client's needs and brand specific IR environment. 
 Administers and maintains mail and email. 
 Maintains inventories and manages IT hardware/software. 
 Provides Internet support and maintenance (if applicable)
 Provides cable management support. 
 Generates systems communications for property users to introduce new applications, provide user tips, alert users of system problems and inform staff of progress or status. 
 Consults on specific application issues or hardware/software problems. 
 Provides feedback to Lodging IR on application functional performance and system performance. 

Managing Projects and Policies 

 Uses relevant information and individual judgment to determine whether events or processes comply with laws, regulations, or standards. 
 Monitors processes and evaluates information according to SOP and LSOP requirements. 
 Enforces IR policies and standards protecting company hardware, software and other resources at the property. 
 Directs maintenance of equipment and installed software applications inventory for property ensuring compliance with licensing regulations. 

Maintaining Information Systems and Technology Goals

 Develops specific goals and plans to prioritize, organize, and accomplish your work. 
 Performs an assessment of needs, ensuring compliance with brand specific standards, budget and capital requirements. 
 Determines priorities, schedules, plans and necessary resources to ensure completion of any property projects on schedule and according to specification. 
 Ensures problems are correctly reported, routed, tracked and solved, with the system user being informed of situation at all times. 
 Ensures proper asset management. 
 Performs on-site monitoring of all projects. 
 Ensures that regular on-going communication is happening in all areas of responsibility to create awareness of business objectives and communicates expectations, recognizes performance and produces desired business results. 

Demonstrating and Applying Information Resources Knowledge 

 Keeps up-to-date technically and applies new knowledge to your job. 
 Demonstrates knowledge of job-relevant issues, products, systems, and processes. 
 Provides technical expertise and support. 

Additional Responsibilities

 Provides information to supervisors, co-workers, and subordinates by telephone, in written form, e-mail, or in person. 
 Informs and/or updates the executives, the peers and the subordinates on relevant information in a timely manner. 
 Analyzes information and evaluates results to choose the best solution and solve problems. 
 Coordinates property efforts, prioritizes needs and communicates those needs to IR Shared Services and other systems staff. 
 Manages vendors for property IT requirements functioning as escalation point for problem resolution. 

Marriott International is an equal opportunity employer. We believe in hiring a diverse workforce and sustaining an inclusive, people-first culture. We are committed to non-discrimination on any protected basis, such as disability and veteran status, or any other basis covered under applicable law.

The Luxury Collection Hotels & Resorts, with over 120 properties in more than 35 countries, offers the promise of authentic experiences that evoke lasting, treasured memories. Our more than 100 years of experience, beginning in 1906 under the Italian CIGA brand – a collection of Europe's most celebrated and iconic properties – serves as a solid foundation as we continuously evolve to exceed the desires of the luxury traveler.

From legendary palaces and remote retreats to timeless modern classics, each luxury hotel and resort is a unique and cherished expression of its locale – a portal to the destination’s cultural charms and treasures. If you are someone with an appreciation for evocative storytelling, a keen interest and passion for this destination's heritage, and a desire to deliver genuine, personalized, and anticipatory hospitality, then we invite you on our journey. In joining The Luxury Collection, you join a portfolio of brands with Marriott International. Be where you can do your best work, begin your purpose, belong to an amazing global team, and become the best version of you."
