id,title,job_url,company,company_link,location,published_at,number_of_applicants_applied,employment_duration,work_location_type,work_experience_level,company_type,company_logo,company_description,about_the_job
3781777491,Bancassurance Life Consultant - JATENG,https://www.linkedin.com/jobs/view/3781777491,AIA Indonesia,https://www.linkedin.com/company/aia_indonesia/life," ",2 weeks ago,54,,On-site,,"1,001-5,000 employees · Insurance",https://media.licdn.com/dms/image/C510BAQEmWvQmZ2PsMQ/company-logo_100_100/0/1631411580594/aia_indonesia_logo?e=1712188800&v=beta&t=7DBg3X0dCSAqQI3v3EoFHkGPaO7ZscFhMc3oRRarMeY,"PT AIA FINANCIAL (“AIA”) is one of the leading life insurance companies in Indonesia that registered and supervised by the Indonesian Financial Services Authority. AIA in Indonesia is a subsidiary of the AIA Group. AIA offers various products ranging from life insurance, health insurance, personal accident insurance, and unit linked products, including Sharia based insurance, as well as employee benefits services, severance and pension fund (DPLK). These products are marketed by our 6.600+ experienced professional sales force through multi distribution channels including Agency, Bancassurance, Corporate Solutions (Pension & Employee Benefits), and Direct Marketing/ Telemarketing.

AIA prides itself on playing a leadership role in Indonesia’s life insurance industry, which has led to recognition by numerous third party awards givers in recent years.","Wujudkan Ambisi Besarmu, Raih Impian Besarmu! Jadilah Mitra AIA sebagai Bancassurance Life Consultant, dan maksimalkan potensi Anda untuk memperoleh penghasilan yang tidak terbatas. The only limitation is you! AIA adalah salah satu perusahaan asuransi terbesar di Asia dan juga merupakan salah satu perusahaan asuransi terkemuka di Indonesia dalam bidang Bancassurance. Dengan bergabung menjadi AIA Bancassurance Life Consultant (BLC) berarti Anda akan memperoleh pengalaman bekerja di bidang asuransi sekaligus di bidang perbankan.

Selain itu, AIA bermitra dengan institusi-institusi perbankan terbesar dan terdepan di Indonesia sehingga menyediakan Anda sebuah kesempatan untuk mengembangkan network Anda di brand-brand tersebut secara maksimal. Sebagai BLC, Anda akan ditempatkan pada salah satu cabang bank yang berafiliasi dengan AIA, di mana Anda dapat memberikan solusi proteksi dan investasi yang sesuai dengan kebutuhan para nasabah.

Tugas & Tanggung Jawab:
Melakukan penjualan produk asuransi AIA di BANK partner yang bekerjasama dengan AIA Financial
Menjalin komunikasi & kerjasama yang baik dengan seluruh staff BANK
Membuat laporan produktivitas penjualan bulanan secara berkala

Persyaratan :
Pendidikan S1 (Wajib memiliki pengalaman Sales / Marketing / Front Office / Frontliner)
Kemampuan komunikasi dan interpersonal yang baik
Dapat bekerja secara tim ataupun individu
Memiliki motivasi kerja yang tinggi dan siap dengan tekanan target
Money oriented, disiplin, bertanggung jawab & integritas yang baik
Bersedia ditempatkan pada semua cabang Bank Partner

Terbuka untuk penempatan: Solo, Tegal, Ambarawa, Magelang, Semarang, Salatiga, Kudus, Pekalongan, Purwodadi, Purwokerto, Cilacap"
3746556668,QA Customer Interface Manager,https://www.linkedin.com/jobs/view/3746556668,Lonza,https://www.linkedin.com/company/lonza/life," "," ",270,,On-site,,"10,001+ employees · Pharmaceutical Manufacturing",https://media.licdn.com/dms/image/C4E0BAQEhdJGKwif6yg/company-logo_100_100/0/1631314433528?e=1712188800&v=beta&t=6ZC5qGgSOvyrEls6VzbAlt6EliV1QRguxHY4lvAyJuU,"At Lonza, we enable A Healthier World by supporting our healthcare customers on the path to commercialization. Our community of 16,000 talented employees work across a global network of more than 30 sites to deliver for our customers across the pharma, biotech and nutrition markets.

By combining technological insight with world-class manufacturing, scientific expertise and process excellence, we help our customers to deliver new and innovative medicines that help treat a wide range of diseases.

While we work in science, there’s no magic formula to how we do it. Our greatest scientific solution is talented people working together, devising commitment and ideas that help our customers to help people.

In exchange, we let our people own their careers. Their ideas, big and small, genuinely improve the world. And that’s the kind of work we want to be part of.

Our work makes A Meaningful Difference.","Indonesia, Jakarta

Today, Lonza is a global leader in life sciences operating across three continents. While we work in science, there’s no magic formula to how we do it. Our greatest scientific solution is talented people working together, devising ideas that help businesses to help people. In exchange, we let our people own their careers. Their ideas, big and small, genuinely improve the world. And that’s the kind of work we want to be part of.

Key Responsibilities

Monitor, evaluate and manage the activities performance of compliance customer management function in order to ensure all customer & consumer issues/complaint being handled according to corporate standard quality and procedure.
Control and ensure that complaint handling is properly investigate and response timely in coordination with Head of Quality. Checking and approve reply letter to the customer regarding the results of an investigation of customer complaints, ensuring that the analytical data is accurate and delivered on time, in order to achieve customer satisfaction in coordination with Head of Quality.
Initiate CAPA related to complaint (for justified & for complaint which needed CAPA) & issued to QA Compliance CAPA Team.
Handling customer audit and provide customers with statement letters.
Proactively visit to customers both domestic and export in coordination with Technical Service Engineer/Territory Sales Manager/Sales Manager to handle customer focus on complaint investigation & resolve complaint purposes.
Manage return product (capsule product return by customer).
Manage mock recall & recall product (capsule product recall by regulatory).
Manage Customer Quality Agreement aligned with Global procedure and per customer’s requirements.
Coordinate implementation & approve special requirement system to ensure its build into products.
Coordinate with operation team for complaint investigation and improvement plan of complaint.
Provide prompt feedback to Sales Team & Technical Service, with related to quality capsule issue which not yet submit as complaint but may lead to complaint or feedback to clarify whether it is not appropriate to be complaint.

Key Requirements

Bachelor’s Degree or higher in Chemistry, Microbiology, or Life Sciences, Pharmaceutical, or equivalent scientific discipline.
Minimum 6 years of experience in quality or regulatory compliance within the pharmaceuticals, biologics, or other related industry.
Proven track record in customer quality & engagement, complaint management and partnering with internal departments.
Good Manufacturing Practice experience, or experience in a highly regulated industry.
Experience with supporting product inspections from local Regulatory Authorities.
Effectively represent Quality Assurance, both internally and externally.
Good communication skills (Both English and Local Language).
This role will be onsite at manufacturing unit of Lonza.

Every day, Lonza’s products and services have a positive impact on millions of people. For us, this is not only a great privilege, but also a great responsibility. How we achieve our business results is just as important as the achievements themselves. At Lonza, we respect and protect our people and our environment. Any success we achieve is no success at all if not achieved ethically.

People come to Lonza for the challenge and creativity of solving complex problems and developing new ideas in life sciences. In return, we offer the satisfaction that comes with improving lives all around the world. The satisfaction that comes with making a meaningful difference.

Reference: R56604

Apply"
3787873636,Senior Strategic Partnership Associate for System Integrator/Reseller,https://www.linkedin.com/jobs/view/3787873636,McEasy,https://www.linkedin.com/company/mceasy/life," ",1 week ago,110,,On-site,,"201-500 employees · Technology, Information and Internet",https://media.licdn.com/dms/image/D560BAQFphTG0QTqrvA/company-logo_100_100/0/1681981359578/mceasy_logo?e=1712188800&v=beta&t=Wbcd3p7a5bUGDBcTMs2Qd18nqeGhD32ntdR_jNkt04A,"McEasy adalah perusahaan yang bergerak di bidang inovasi teknologi yang menyajikan solusi digital terintegrasi untuk manajemen transportasi dan supply chain. Sebagai pionir dalam pengembangan platform yang terhubung dengan Internet of Things (IoT) dan telematika, McEasy memberikan efisiensi operasional di berbagai lini bisnis. melalui pengembangan Fleet Transportation Management System (FTMS) McEasy meningkatkan efisiensi, produktivitas, keamanan, dan visibilitas dalam operasional sektor transportasi di Indonesia.

Bermitra dengan tenang
Secara konsisten mengutamakan keamanan data pelanggan dan telah meraih sertifikasi ISO 27001 pada september 2023.

#McEasy #KendaliPenuh","McEasy, Indonesia's leading web and mobile logistic system, is looking for a Senior Partnership Associate to join our ever growing team.

If you are a keen learner, self-driven, and looking to be a part of a team that is passionate with helping each other, we want to hear from you.

What will you do?
Research and identify potential partners in target markets
Execute recruitment strategies to onboard new Partners aligned with company goals
Provide comprehensive product and sales training to partners.
Work closely with partners to manage Business pipelines and forecast accurately
Establish key performance indicators (KPIs) for partners
Foster strong relationships through regular communication and collaboration
Regularly assess partner performance and implement improvement strategies as needed

Qualification:
Bachelor's degree in Business, Marketing, or a related field
Minimum 2 years of experience in partnership, business development, or a related field.
Proven track record of successfully managing partnerships with System Integrators and Resellers
Proven experience in partnership management with a focus on reseller relationships.
Strong training and presentation skills to provide comprehensive product and sales training to partners
Excellent interpersonal and communication skills to foster strong relationships through regular communication and collaboration"
3733357457,Sales Engineer,https://www.linkedin.com/jobs/view/3733357457,Johnson Controls,https://www.linkedin.com/company/johnson-controls/life," "," ",104,,On-site,,"10,001+ employees · Industrial Machinery Manufacturing",https://media.licdn.com/dms/image/D560BAQFnrtZYJlJMIA/company-logo_100_100/0/1686861274478/johnson_controls_logo?e=1712188800&v=beta&t=4tfOhNawxT4BUoGwVnwmiGC46pNZWRxSxd29mb_1_QA,"At Johnson Controls (NYSE:JCI) we transform the environments where people live, work, learn and play. As the global leader in smart, healthy and sustainable buildings, our mission is to reimagine the performance of buildings to serve people, places and the planet.

With a history of more than 135 years of innovation, Johnson Controls delivers the blueprint of the future for industries such as healthcare, schools, data centers, airports, stadiums, manufacturing and beyond through its comprehensive digital offering OpenBlue. With a global team of 100,000 experts in more than 150 countries, Johnson Controls offers the world`s largest portfolio of building technology, software as well as service solutions with some of the most trusted names in the industry. For more information, visit www.johnsoncontrols.com or follow us @johnsoncontrols on Twitter.","Who We Are

Johnson Controls-Hitachi Air Conditioning is a Global Air Conditioning Manufacturer, established in October 2015 as a Joint Venture of Johnson Controls International plc and Hitachi Appliances, Inc. (now Hitachi Global Life Solutions, Inc.). Johnson Controls-Hitachi is seeking a Global Head of Public Relations to enhance the organization's positioning in media worldwide. Our 15,000 employees create quality products, services and solutions for residential and commercial buildings throughout the world. We exceed customer expectations with the most diverse range of HVAC products in the world – from ductless solutions to chillers to HVAC room air conditioning systems, fueled by our industry-leading technology and innovation. #CareerwithAir

At Johnson Controls–Hitachi we are transforming our DNA to embrace a high performance, agile and innovative culture. In order to be the #1 Premium Japanese HVAC Technology Provider, we are focused on World Class Product Excellence, Digitally Transforming to be accessible to Customers online 24x7, Easy to do Business with for our Channel Partners & being a Premium Brand at every touchpoint in the Customer Journey.

What You Will Do

As Sales Engineer, you will be responsible to achieve the forecasted sales target and profit margin and ensure timely collection of payment, sell products through channel partners, provide quotation to all customers, and provide customer service to contractors, consultants, and end-users in order to maximize equipment sales and customer satisfactions.

How You Will Do It

To achieve Key Result Area (KRA) set.
To generate and submits accurate quotation, forecast on sales & collection on a regular basis and reports expenses in accordance with Company Policy.
To liaise with the customers on the secured projects to implement and carry out the scope of supply as stated in the purchase order and generate billing/invoice accordingly.
To build and maintain strong relationships with all customers by maintaining regular calls and visits. Make formal presentations to customers and the industries as required.
To maintain the existing customers base and develop new customers base from time to time in order to have a continuous business expansion.
To obtain an effective understanding of Hitachi products and offers, to produce and supply quotations to suit customer requirements.
To maintain constant field intelligence, feeds back pertinent information concerning competitors’ activities, products, prices, promotional programs and results as applied to Hitachi and competitive activities.
To liaise with sales / service administrator and finance department pertaining to the computerized system, timely collection of payments (Credit Officer) from customers, credit issues and maintaining good customer credit profile.
To update all customers on all Hitachi product information and offer.
To ensure establishment of credit facilities for new customer (if necessary) and collection.
To ensure accurate and timely response to all customers at all time.
To maintain close relationship with dealers, consultants, and end users.

What We Look For

Minimum Degree in Mechanical / Electrical / Electronic Engineering or equivalent.
At least 3 - 5 years of experience as Senior Sales in HVAC, pump, cooling tower, contractor, or medical devices (MRI/CT Scan).
Experience in selling product to contractor, consultant, or company’s owner, and in handling project.
Knowledge of Building HVAC, Fire Protection, Controls would be preferred.
Experience in Building industry would be preferred.
Basic understanding on SAP operations will be advantageous.
Personal qualities of the candidate: ambitious, good understanding in project, and good relationship with contractor, consultant, or company’s owner."
3768750388,O&M Specialist I,https://www.linkedin.com/jobs/view/3768750388,Fluor Corporation,https://www.linkedin.com/company/fluor/life," "," ",112,,On-site,,"10,001+ employees · Construction",https://media.licdn.com/dms/image/C560BAQG88t_bagf8Pg/company-logo_100_100/0/1654091580634/fluor_logo?e=1712188800&v=beta&t=FwSZO2J-5cxXXc-8LeMLrWhJQn-ikZ5wIAZqGy_Kzkg,"Fluor Corporation is a global engineering, procurement and construction company. We work with leaders in the energy, infrastructure, life sciences, advanced technologies, mining and metals industries, as well as government agencies, to build a better world.

Since our founding in 1912, we have been building a legacy of innovation. Our 40,000 employees provide professional and technical solutions to deliver safe, well-executed, capital-efficient projects for our global clients.

At Fluor, we believe in open communication and value the conversations that are fostered through our social media communities. To learn more about our community standards, please visit: https://bit.ly/3PB32Yk

Fluor has been notified of fraudulent employment offers being made via email, WhatsApp and other channels to prospective candidates. Learn more: http://bit.ly/3LfkBwx","Diversity Statement 
At Fluor, we are proud to design and build projects and careers. This requires teams that are as unique as the projects we execute. We are committed to fostering a work environment that embraces Diversity, Equity, and Inclusion (DE&I) for all so our employees and stakeholders benefit from the creative solutions derived as a result of embracing differences.

Job Description: 

This position performs assignments to develop professional work knowledge and ability and may act as a project team leader when assigned.

• Perform maintenance engineering work by applying standard maintenance engineering techniques, procedures, and criteria in support of the plant operating environment
• Correct plant operations equipment and maintenance problems by applying experienced proven systems and procedures
• Prepare project reports and contributes to project estimates by identifying activities, reporting project status, and performance
• Maintain technical knowledge by keeping current on available systems and equipment for plant maintenance, repair, operations (MRO) management and best practices management
• Develop and monitor scheduling activities by implementing and planning preventative, corrective, scheduled outage maintenance work orders and plans and schedule small capital work
• As directed by Operations & Maintenance (O&M) manager, fulfill contract and Operating System Requirements (OSR)/Operating System Implementation Plan (OSIP) requirements by ensuring that the duties and responsibilities of the project contract are clearly defined, documented, and followed by the Fluor team
• Maintain safe and healthy work environment by following established project procedures relating to safety, work permitting and work order systems; adhering to legal requirements
• Analyze and make independent recommendations regarding solutions to problems with varying complexity in accordance with organization and/or project objectives and guidelines
• Organize and prioritize a variety of projects and multiple tasks in an effective and timely manner, set priorities, and meet deadlines
• Plan and organize own work assignments, as well as carry out tasks from management staff
• Maintain compliance with all applicable policies, procedures, and global standards
• Adhere to and support Fluor's Health, Safety & Environmental and Sustainability Policies
• Effectively develop and apply the Core Skills to the job
• May need to travel to attend to business related matters
• Meet expectations on attendance and punctuality
• Other duties as assigned
Basic Job Requirements :
• Accredited four (4) year degree or global equivalent in applicable field of study and no required years of work-related experience or a combination of education and directly related experience equal to four (4) years* if non-degreed
• Certification(s) in Predictive Maintenance Technology types and applications, such as Vibration Analysis, Ultrasonic Testing, Thermography, and/or Motor Circuit analysis
• Plant Operations & Maintenance experience and/or other relevant work experience
• Ability to communicate effectively with audiences that include but are not limited to management, coworkers, clients, vendors, contractors, and visitors
• Job related technical knowledge necessary to complete the job
• Ability to learn and apply knowledge of applicable local, state/province, and federal/national statutes and guidelines
• Ability to attend to detail and work in a time-conscious and time-effective manner

Requisition Number
140054BR

 Diverse Workforce 
We are an equal opportunity employer that recognizes the value of a diverse workforce. All qualified individuals will receive consideration for employment without regard to race, color, age, sex, sexual orientation, gender identity, religion, national origin, disability, veteran status, genetic information, or any other criteria protected by governing law."
3780364696,Engineer DEV Wet Process,https://www.linkedin.com/jobs/view/3780364696,Infineon Technologies,https://www.linkedin.com/company/infineon-technologies/life," "," ",166,,On-site,,"10,001+ employees · Semiconductor Manufacturing",https://media.licdn.com/dms/image/C4E0BAQG0dfCs_tMDUQ/company-logo_100_100/0/1631307630627?e=1712188800&v=beta&t=CIaFrKQI93Jn9J8OJ0pTiJYd9plrjhM1TLlhHB4h624,"Semiconductors are crucial to solve the energy challenges of our time and shape the digital transformation. This is why Infineon is committed to actively driving decarbonization and digitalization. As a global semiconductor leader in power systems and IoT, we enable game-changing solutions for green and efficient energy, clean and safe mobility, as well as smart and secure IoT. We make life easier, safer, and greener. Together with our customers and partners. For a better tomorrow.

With a unique team, employees from more than 90 countries make Infineon a successful international company – with their skills, their enthusiasm and the courage to challenge the status quo and open up new horizons. Since the semiconductor was invented, we have helped shape the future – every single day.","As DEV Engineer, you will be responsible for developing new processes and ensuring design to cost & design to manufacturing, actively challenging current processes and looking for improvement, efficiencies, and value engineering. In your new role, you will:

Establish and set up new assembly process capabilities for adhesion and plating processes.
Identify problems or deviations and recommend and implement corrective actions.
Support new package development, ramp-up, platform extensions, and innovations.
Perform data gathering according to Process Development Handbook requirements and record into the Statistical Process Control database.

You are best equipped for this task if you have:

Education qualification required/desired: Master / Bachelor's Degree in chemical/materials/process engineering.
Previous experience required: Minimum 1 Year in IC/semiconductor assembly industry.
Freshers are welcome.
Have technical or functional competencies:
Possess knowledge of the Plating process, equipment, materials, and their interactions.
Independent with good communication and coordination skills.
Demonstrates an ability to lead a team in problem-solving.

Driving decarbonization and digitalization. Together.

Infineon designs, develops, manufactures, and markets a broad range of semiconductors and semiconductor-based solutions, focusing on key markets in the automotive, industrial, and consumer sectors. Its products range from standard components to special components for digital, analog, and mixed-signal applications to customer-specific solutions together with the appropriate software.

We are on a journey to create the best Infineon for everyone.

This means we embrace diversity and inclusion and welcome everyone for who they are. At Infineon, we offer a working environment characterized by trust, openness, respect and tolerance and are committed to give all applicants and employees equal opportunities. We base our recruiting decisions on the applicant´s experience and skills.

Please let your recruiter know if they need to pay special attention to something in order to enable your participation in the interview process.

Click here for more information about Diversity & Inclusion at Infineon."
