id,title,job_url,company,company_link,location,published_at,number_of_applicants_applied,employment_duration,work_location_type,work_experience_level,company_type,company_logo,company_description,about_the_job
3780689968,"Data Center Engineering Operation, DC Communities",https://www.linkedin.com/jobs/view/3780689968,Amazon Web Services (AWS),https://www.linkedin.com/company/amazon-web-services/life," ",,166,,Full-time,,"10,001+ employees · IT Services and IT Consulting",https://media.licdn.com/dms/image/C560BAQER_QnUTXrPJw/company-logo_100_100/0/1670264051233/amazon_web_services_logo?e=1712188800&v=beta&t=PX9JZ5Nmv89uZe7Xu2OFujY42wUrDPtIYm4ON122q9I,"Launched in 2006, Amazon Web Services (AWS) began exposing key infrastructure services to businesses in the form of web services -- now widely known as cloud computing. The ultimate benefit of cloud computing, and AWS, is the ability to leverage a new business model and turn capital infrastructure expenses into variable costs. Businesses no longer need to plan and procure servers and other IT resources weeks or months in advance. Using AWS, businesses can take advantage of Amazon's expertise and economies of scale to access resources when their business needs them, delivering results faster and at a lower cost.

Today, Amazon Web Services provides a highly reliable, scalable, low-cost infrastructure platform in the cloud that powers hundreds of thousands of businesses in 190 countries around the world. With data center locations in the U.S., Europe, Singapore, and Japan, customers across all industries are taking advantage of our low cost, elastic, open and flexible, secure platform.","Description

Amazon is looking for an energetic, detail-oriented individual to join our Data Center Engineering Operations Team. This committed group works to maintain the critical physical infrastructure that supports Amazon Web Services. Specifically, this team works to ensure that the data center's MEP operates at 100% availability while maintaining first-class customer service to the teams and groups within the data centers

The Data Center Engineering Operation engineer is responsible for ensuring that all electrical, mechanical, and fire/life safety equipment within the data center is operating within contract parameters within third party Colocation facilities. Often this will be including risk management and mitigation, corrective and preventative maintenance of critical infrastructure, vendor management and metric reporting.

Responsibilities

 Establish performance benchmarks, conduct analysis, and prepare reports on all aspects of the critical facility operations and maintenance
 Responsible for the on-site management of sub contractors and vendors, ensuring that all work performed is in accordance with established practices and procedures.
 Manage relationship with third party Colocation providers and their facility staff
 Responsible for the operation of and management of both routine and emergency services on a variety of critical systems such as: switchgear, generators, UPS systems, power distribution equipment, chillers, cooling towers, computer room air handlers, building monitoring systems, etc.
 Data Center capacity planning and reporting
 May assist in the design and build out of new facilities
 May assist in projects to increase current Facility efficiency
 Work with IT managers and other business leaders to coordinate projects, manage capacity, and optimize plant safety, performance, reliability and efficiency
 Deliver quality service and ensure all customer demands are met
 Procurement for DCEO related expenditure
 Responsible for asset and inventory management
 Assist in recruiting efforts

We are open to hiring candidates to work out of one of the following locations:

Jakarta, IDN

Basic Qualifications

 Demonstrate skills, competencies, and capabilities in leading and managing operation of critical facilities which require in-depth knowledge in electrical, mechanical, and control system
 In depth knowledge of Data Center Facilities such as generators, chillers, cooling towers, air handling units, UPS and DRUPS, electrical sub distribution systems, fire detection and suppression systems, cable reticulation systems
 Fundamental knowledge of network design and layout (copper / fiber) as well as low / high voltage (copper/ fiber) cabling, BMS Systems, Monitoring and alarming systems
 Knowledge of Data Center capacity planning and reporting
 Knowledge in leading and managing emergency situation
 In-dept knowledge in operation management (safety, security, availability, and efficiency)
 Experiences and knowledge in people management (talent acquisition and people development)
 Understanding of written and spoken English
 Strong leadership and organizational skills
 Strong attention to detail
 Ability to prioritize in complex, fast-paced environment
 Work for periods of longer than eight hours in duration where required
 Respond to out of hours emergency calls – second level escalation point for Data Center facilities related issues/failures
 Bachelor’s Degree in Electrical Engineering, Mechanical Engineering or relevant discipline

Preferred Qualifications

 Advanced electrical or mechanical certifications (Bachelor's degree or higher in a relevant engineering discipline is also acceptable).

OR

 5+ years of Data Center Engineering Experience
 good understanding of written and spoken English.


Company - PT Amazon Data Srvcs Indonesia

Job ID: A2511694"
3770374597,Logistics Officer I,https://www.linkedin.com/jobs/view/3770374597,Thales,https://www.linkedin.com/company/thales/life," "," ",1247,,On-site,,"10,001+ employees · IT Services and IT Consulting",https://media.licdn.com/dms/image/C4D0BAQEmnUAXTuLkJQ/company-logo_100_100/0/1631366051478/thales_logo?e=1712188800&v=beta&t=fR-_1rdLK9NpE5iwkT9ZOI6KiJ_jDpDcGOv0zDXm-48,"Thales is a global technology leader with more than 77,000 employees on five continents. The Group is investing in digital and “deep tech” innovations – Big Data, artificial intelligence, connectivity, cybersecurity and quantum technology – to build a future we can all trust. Trust is essential for societies to flourish, with humans playing a central role in every critical decision.
Thales's high-tech solutions, services and products help companies, organisations and governments to achieve their goals and ambitions. And in each of our five vertical markets — digital identity and security, defence and security, aerospace, space, and transport — our customers play a vital role in society.","Location: Jakarta, Indonesia

Thales people architect identity management and data protection solutions at the heart of digital security. Business and governments rely on us to bring trust to the billons of digital interactions they have with people. Our technologies and services help banks exchange funds, people cross borders, energy become smarter and much more. More than 30,000 organizations already rely on us to verify the identities of people and things, grant access to digital services, analyze vast quantities of information and encrypt data to make the connected world more secure.

Thales has been established in Indonesia for close to 40 years. Today Thales Indonesia employs 25 people and has successfully provided numerous solutions to Indonesia in both civil and defense sectors. The Group’s main business in Indonesia has historically been the defense domain, where Thales is a long-term provider of defense systems for the Indonesian Army and Navy. In these areas Thales has demonstrated a strong commitment to working collaboratively with the Indonesian government and partners with local stakeholders. In recent years there has been an increased interest in the Thales civil solutions especially in the field of transportation and air traffic control. With the growing attention to infrastructure development by the Indonesian government, Thales will have opportunities in the transportation and security domain.

Job Responsibilities:

 You will liaise and coordinate with Planner and Production for Finished Goods delivery to end customers on time.
 You will assist in the primary functions of receiving, storage, picking, issuing and shipping of materials,
 PR creation for the monthly volume generated by Outsourcing Company that provide personalization process,
 You will work with Purchasing and Operation Supervisor to creating PO immediately after raising PR.
 You will work with CS (Customer Service) for supporting in ERP system for monthly invoicing process.
 You will be responsible for stock inventory in warehouse to cards; ensure accuracy and reconciliation in the system.
 To assist in tracking and process improvement related to Perso processes around pulls, card destruction etc.
 To track/monitor vault transactions and item inventories to ensure physical and system numbers reconcile.
 To be responsible in keeping all files related in an order, and to archive it according to local procedures.
 You will be required to undertake in any other special projects as specified, as and when.
 You shall at all times during the employment with the company, respect and comply with the Thales Quality, Health, Safety, Environmental & Security requirements during the performance of his/her duties.


Requirements:

 Independent/Autonomous in managing his/her team
 Strong interpersonal, communication and influencing skills
 Possess initiative to handle improvement & upgrading activities
 Able to work well in fast paced/pressurizing environment
 English & computer literacy .
 Customer oriented and has a good sense of urgency
 Good analysis and resourceful (in identifying operator shortfall, and improving operation efficiency and productivity)
 Able to handle 1st level work grievances & disciplinary cases (when necessary)
 Receptive to changes of policy & procedures
 Adaptive to continual learning in a fast-changing environment & work towards achieving manufacturing excellence (system, process, job methods, operations)
 Accept assigned roles by Supervisor Operation from time to time


At Thales we provide CAREERS and not only jobs. With Thales employing 80,000 employees in 68 countries our mobility policy enables thousands of employees each year to develop their careers at home and abroad, in their existing areas of expertise or by branching out into new fields. Together we believe that embracing flexibility is a smarter way of working. Great journeys start here, apply now!"
3772630953,Enterprise Support Engineer,https://www.linkedin.com/jobs/view/3772630953,,,,,0,,Full-time,,See how you compare to 3 applicants. Try Premium for IDR0,,,"Qualification

A Support Engineer solves problems submitted by Clients well and maintains the process of solving them smoothly and thoroughly; Provide remote and on-site support for all clients and projects; Ensuring proper recording and reporting of all issues; and Provide prompt and accurate feedback to clients."
3786187655,Database Administrator,https://www.linkedin.com/jobs/view/3786187655,Privy,https://www.linkedin.com/company/privy-id/life," ",1 week ago,405,,On-site,,201-500 employees · IT Services and IT Consulting,https://media.licdn.com/dms/image/D560BAQF4wC2_rkTOng/company-logo_100_100/0/1687255620299?e=1712188800&v=beta&t=TBea_kCQg1b0MZd5OY_PPHEAdCBKyrHlCYn9psJM9Kw,"Privy, formerly PrivyID, is revolutionizing the way people are identified in cyberspace and the way the online transaction is carried out. We believe that Trusted Identity and Digital Signature are the foundations of a healthy online transaction ecosystem. Led by Marshall Pribadi as the CEO who is listed in Forbes 30 Under 30 Asia and an Endeavor Entrepreneur, Privy is growing so fast by having 40 million users and 2.600 enterprise customers in six years.

Privy is listed as a Certification Authority (CA) under Indonesia's Ministry of Communication and Information Technology to issue electronic certificates with the highest level of verification (level 4). Privy has a Cooperation Agreement with the Directorate General of Population & Civil Registration to support identity verification services in issuing and using electronic certificates and is listed in OJK as Digital Financial Services Innovation, e-KYC cluster.

Privy obtained ISO 27001:2013 certification in Information Security Management Systems and has gained numerous accolades such as Forbes Asia 100 to watch 2021, part of Google for Startup Accelerator: Indonesia 2021 cohort, The Most Promising Fintech 2017 by Danamon Bank, and the winner of fintech category at 2017 Echelon Asia Summit Singapore.

Privy has raised US$ 48 million from Series C financing round led by a leading global investment firm KKR & Co. Inc. and our other notable investors are Singtel Innov8, MDI Ventures, GGV Capital, Telkomsel Mitra Indonesia (TMI), Bank Mandiri, Gunung Sewu Group, Mahanusa Capital. We have a very energetic and healthy working cultures with surprising and fun working place. We have our private badminton court, basketball court, mini theatre, coffee bar with trained baristas, and super cool 84-inch Surface Hub. We provide an exceptional supports and rewards to your innovation in which sky is not even the limit.","About Privy
Privy is Indonesia's market leader in Digital Signature and Digital Identity, with more than 40 million verified users and more than 2.600 enterprise clients. Our Digital Signature is acknowledged by the Ministry of Communication and Informatics. We have just closed our Series C funding led by KKR in November 2022. We are growing more rapidly than ever and would love to have talented and enthusiastic individuals onboard.

Job Descriptions
- Ensure security and data availability in the Privy’s PKI (Public Key Infrastructure) entity database system
- Actively involved in audit activities for the HSM Admin Role
- General understanding of Public Key Infrastructure
- Create and maintain database structures, including tables, indexes, and appearance
- Optimize and clean up data, manage access control and security perimeter of privy’s PKI DB
- Collaboration with L2 Certification Authority (CA) regarding evidence in the CA environment
- Monitor database performance and perform tuning to improve performance
- Create and operate backup and recovery procedures to ensure data availability in emergency situations
- Provide technical support to the operational team in terms of using the database system
- Collaborate with technical/ operational teams in the CA Privy environment

Qualifications
- Minimum 1 year DBA experience
- Mastering DB Cluster Concepts is a plus
- Mastering Google SQL and MariaDB is a plus
- Mastering Proxy DB and High Availability DB
- Mastering DB performance optimization and tuning techniques
- Proactive and disciplined
- Good communication skills in explaining DB technicalities
- High enthusiasm for the IT Security field"
3780610454,Business Analyst,https://www.linkedin.com/jobs/view/3780610454,Generali Indonesia,https://www.linkedin.com/company/generali-indonesia/life," ",3 weeks ago,928,,On-site,,201-500 employees · Insurance,https://media.licdn.com/dms/image/C560BAQFzr-5lNlK8VQ/company-logo_100_100/0/1631368663614?e=1712188800&v=beta&t=fhknrGh3tZoGlnCHutsherhgPpgrmDwDyUS3yWbxWs0,"PT Asuransi Jiwa Generali Indonesia (Generali Indonesia) operates in Indonesia since year 2009. We are a subsidiary of the Generali Group; the Group was established in 1831, Trieste, Italy as one of Europe’s largest insurance providers and the European biggest life insurer.

Generali is taking the Indonesian life insurance industry by storm. With a clear business strategy and over 11,000 agents and agency offices nationwide, we're focused on providing innovative products and value-added services that meet the needs of our customers.
We manage multiple distribution channels, form balanced long-term partnerships with financial institutions and general distribution, and leverage digital technology to stay ahead of the curve.
Our customer-centric approach means that we provide customized products and leading services that earn the trust of our customers every step of the way. We're committed to continuously developing ourselves in the life insurance and financial planning industry in Indonesia to maintain our position as a major force in the market.

At Generali, we're all about delivering the best possible outcomes for our customers, and we're not afraid to push the boundaries to make it happen.","Responsibilities
Responsible to provide information and report for business updates. 
Develop sales dashboards for monitoring sales productivity closely and provide accurate and timely information of drivers and reporting that are required for supporting stakeholders’ business update. 
Develop sales strategies with sales leadership focused on sales process standardization.
Review and monitor the most effective and productive marketing support tools to speed up the process. 

Qualifications
Min. bachelor’s degree in Mathematics or Statistic Major.
Min. 1 years of experience in the related field. 
Capable at decision making, negotiating, and basic market research knowledge.
Able to speak and write in basic English (minimum score of 350 in TOEFL).
Intermediate Interpersonal Skill 
Basic Market Research Knowledge
Intermediate Priority Management (include Time Management)
Basic Leadership Skills (People Management)
Intermediate Communication Skill
Basic Presentation Skill (Story Telling & Teaching)
Intermediate Excel"
