id,title,job_url,company,company_link,location,published_at,number_of_applicants_applied,employment_duration,work_location_type,work_experience_level,company_type,company_logo,company_description,about_the_job
3777895492,Network Engineer,https://www.linkedin.com/jobs/view/3777895492,Packet Systems Indonesia ,https://www.linkedin.com/company/packet-systems-indonesia/life," ",3 weeks ago,215,,Hybrid,,201-500 employees · IT Services and IT Consulting,https://media.licdn.com/dms/image/D560BAQEQsAok1DKdjg/company-logo_100_100/0/1703351063449/packet_systems_indonesia_logo?e=1712188800&v=beta&t=YcrFvFoFTh-d3QyCFQQvh8qPv-b490uzpojDfhqhE5U,"Packet Systems Indonesia (PSI), which commenced operations in 2004, is a leading ICT systems integrator and service company in Indonesia focusing in the area of Data Center/Virtualization, Collaboration, Service Provider & Enterprise Network Infrastructure, Information Security, and Software Solution. Its spectrum of advanced services include assessment; technical advisory; planning & design; project management, deployment, integration; and maintenance.

PSI has partnerships with some of the most advanced technology companies in the world, such as Cisco Systems where it is certified as a Gold Partner. PSI is headquartered in Jakarta and has presence in Surabaya.

In September 2017, PSI has become a Logicalis-Metrodata company.

Logicalis (www.logicalis.com) is an international multi-skilled solution provider providing digital enablement services to help customers harness digital technology and innovative services to deliver powerful business outcomes. Its customers span industries and geographical regions; and our focus is to engage in the dynamics of our customers’ vertical markets; including financial services, TMT (telecommunications, media and technology), education, healthcare, retail, government, manufacturing and professional services, and apply the skills of our 4,000 employees in modernising key digital pillars; data centre and cloud services, security and network infrastructure, workspace communications and collaboration, data and information strategies, and IT operation modernisation.

P.T. Metrodata Electronics, Tbk (“Metrodata”; www. metrodata.co.id)— is a public company listed at PT. Bursa Efek Indonesia since 1990 (IDX: MTDL) and is one of the leading Information Communications Technology (ICT) companies in Indonesia. It has built strategic alliances with world-class information technology companies. Metrodata has four main business lines, operating through its subsidiaries: Distribution Business Unit handles distribution to dealer partners, warranty, and ICT solution company; Solution Business Unit provides Information and Communication Technology total solutions from design, implementation, IT managed services, consultation and training; Consulting Business Unit which offers innovative business solutions from conceptualizing, defining, commissioning and implementation, and supporting for business transformation; and E-Commerce Business Unit covering modern IT Retail E-Commerce.
…
show more","Job Specification:
Requirement: 
Hold a bachelor's degree (S-1 degree) in Information Technology Computer Engineering or Telecommunication from a reputable university with a minimum IPK of 3.0 
Holding CCNP Enterprise.
Minimum 5 years experience in Networking.
Deep knowledge of Cisco Routing Switching Technologies, Data Center Technologies.
Deep knowledge in Wireless Technologies, NAC, SDA, SDWAN.
Deep Knowledge in TCP/IP & Routing (OSPF, EIGRP, BGP) 
Having experience in Cisco SDN Technology (SD-Access or Cisco ACI) 
Excellent interpersonal & communication skills. 
Fluent in English, good communication skills.
Competent with Microsoft Office applications i.e. Microsoft Visio, Word, Excel, and PowerPoint. 
Ability to perform under pressure and tight time constraints; be able to work under limited guidance in line with a broad plan, or strategy. 
Leadership, teamwork, commitment, and service excellence are personal qualities. 

Job Description: 
Report to: Team Leader 

Role shall cover: 
For Project based: 
Support for a new installation, integration into the existing system, migration, and monitoring. 
Including all documentation related to the project (Site Survey, MoP, UAT, as build documentation). 

For Maintenance based: 
Support for troubleshooting problems in all PSI customers. 
Also, support for change requests in the customer network. 
Including reporting, documentation, and standby monitoring."
3782377624,[ODS] Associate Software Engg - Data Engineering Team,https://www.linkedin.com/jobs/view/3782377624,Gojek,https://www.linkedin.com/company/gojek/life," "," ",215,,On-site,,"1,001-5,000 employees · Technology, Information and Internet",https://media.licdn.com/dms/image/C4D0BAQHCmfKRtPXKDg/company-logo_100_100/0/1658813682786/gojek_logo?e=1712188800&v=beta&t=yQB9vj7jakbwBeSRhOKn8GWhuk_iW5If25yWvnke33A,"Gojek is Southeast Asia’s leading on-demand platform and a pioneer of the multi-service ecosystem model, providing access to a wide range of services including transportation, food delivery, logistics and more. Gojek is founded on the principle of leveraging technology to remove life's daily frictions by connecting consumers to the best providers of goods and services in the market.

The company was first established in 2010 focusing on courier and motorcycle ride-hailing services, before launching its app in January 2015 in Indonesia. Since then, Gojek has grown to become the leading on-demand platform in Indonesia, with additional operations in Vietnam and Singapore. The Gojek platform now comprises over 2.5 million driver partners across the region. Gojek is part of the GoTo Group, the largest digital ecosystem in Indonesia, consisting of Gojek, Tokopedia and GoTo Financial.

Gojek is dedicated to solving the daily challenges faced by consumers, while improving the quality of life for millions of people across Southeast Asia, especially those in the informal sector and micro, small and medium enterprises (MSMEs).

The Gojek application is available for download via iOS and Android.
.........

*IMPORTANT*
Gojek is affiliated to the GoTo Group companies, and all authentic jobs/open positions listed by Gojek can ONLY be accessed via our official channels -- Gojek on LinkedIn, Gojek Tech on LinkedIn, Gojek on Glassdoor, and https://www.gojek.io/careers. In case you are contacted by our Talent Acquisition team, please ensure that the communication is coming from a valid Gojek domain - *****@gojek.com. If you are contacted by any third party outside of the authenticated channels highlighted above, please write to us at ethics@gotocompany.com to validate the job/open position. This is to avoid any potential instances of fraud, and to ensure your safety and security during the job application process.","About The Role

This role is for the Platform Engineering team under the Data Engineering vertical of Gojek. You’ll have the responsibilities to build, ship and grow Platform products that are core pillars of Data engineering. The roles comprise of responsibilities towards products in like Authentication/Authorization, Infrastructure, Observability, orchestration and more.

What You Will Do

Develop, test, and maintain scalable frontend apps with API integrations to support continuing increases in the adoption of the products within Gojek
Pair with team members on functional and nonfunctional requirements and spread design philosophy and goals across the team
Coordinate with cross-functional teams (Backend, Mobile, DevOps, Data, UX, QA, etc.) on planning and execution
Work closely with all Data Platform and other engineering teams to develop and roll out high-quality products

What You Will Need

0-1 Years of full stack development experience in high scale Product Companies
Expertise in at least one OO programming language & tech stack to write maintainable, scalable, unit-tested codeHave at least a basic understanding of Docker, Kubernetes, Git, Jenkins
Solid understanding of OOPS
Excellent understanding of interactive application development paradigm, memory management, performance/resource optimizations, database interactions, network programming, concurrency and multithreading, fault tolerance, monitoring, security, and operability of systems
Willingness to learn new languages and methodologies and innate desire to deliver and a strong sense of accountability for your work
You must know the basic concepts of Javascript to design optimized and modular components that need to be used across our platform
You should have experience working on the UI workflow layer in terms of Development, Testing, Building, and Deployment

About The Team

We are a team of developers, designers and product managers with diverse academic, professional and personal backgrounds but united by the passion to enrich Data Platform & Analytics at Gojek through sound methods and ease of use. Working alongside the Product Managers, BI Analytics and Product Engineers, we are predominantly concerned with utilizing and translating data into critical information that can be used to make sound business decisions.

This includes gathering any new data points, and working closely with various business teams to capture, connect, and convert any data changes into useful knowledge in guiding our next steps to create a meaningful business impact.

Combating remote work has brought us even closer, with frequent catch-ups over tea and sharing ways we have been keeping ourselves sane. Along with our desire to utilize smart technology and innovative engineering strategies to make people’s lives easier, our team also bonds over our shared love for reading, gaming, and drinking lots of coffee. We work hard and play hard, and believe it or not, we actually enjoy each other’s company!

About GoTo Group

GoTo Group is the largest digital ecosystem in Indonesia with its mission to “Empower Progress’ by offering technological infrastructure and solutions for everyone to access and thrive in the digital economy. The GoTo ecosystem consists of on-demand transportation services, e-commerce, food and grocery delivery, logistics and fulfillment, as well as financial and payment services through the Gojek, Tokopedia and GoTo Financial platforms.It is the first platform in Southeast Asia that hosts these crucial cases in a single ecosystem, capturing the majority of Indonesia’s vast consumer household.

About Gojek

Gojek is Southeast Asia’s leading on-demand platform and pioneer of the multi-service ecosystem with over 2.5 million driver partners across the regions offering a wide range of services such as transportation, food delivery, logistics and more. With its mission to create impact at scale, Gojek is committed to resolving consumer problems and raising standards of living by connecting consumers to the best providers of goods and services in the market.

About GoTo Financial

GoTo Financial accelerates financial inclusion through its leading financial services and merchants solutions. Its consumer services include GoPay and GoPayLater and serve businesses of all sizes through Midtrans, Moka, GoBiz Plus, GoBiz, and Selly. With its trusted and inclusive ecosystem of products, GoTo Financial is open to new growth opportunities and aims to empower everyone to Make It Happen, Make It Together, Make It Last.

About Tokopedia

Tokopedia is an Indonesian technology company with a mission to democratize commerce through technology. It has been a driving force behind Indonesia's digital development since its foundation in 2009, with more than 99% of districts and empowered around 12 million merchants listed nationwide. With Nakama ranging all across Indonesia, Tokopedia aims to simplify the lives of many to #FindYourPurpose together.

GoTo and its business units, including Gojek, Tokopedia, GoToFinancial and GoToLogistics (""GoTo"") only post job opportunities on our official channels on our respective company websites and on LinkedIn. GoTo is not liable for any job postings or job offers that did not originate from us. You should conduct your own due diligence to prevent being victims of any fake job scams, if they did not originate from GoTo's official recruitment channels."
3781657907,IT Application Support,https://www.linkedin.com/jobs/view/3781657907,PT Adicipta Inovasi Teknologi,https://www.linkedin.com/company/pt-adicipta-inovasi-teknologi/life," ",1 month ago,35,,On-site,,201-500 employees · Information Technology & Services,https://media.licdn.com/dms/image/C510BAQGO-hgrnVQ2bw/company-logo_100_100/0/1631349604665?e=1712188800&v=beta&t=kPUMQQGgXsedAX4hbGXWapi-zLwI4FsK9Pa7NzBwWLU,"Advance Innovations (AdIns) is a dynamic, thriving organization with the mission to deliver business solutions through innovative integration of proven technologies with creativity.

Our friendly staff consists of highly skilled and well trained professionals. Our experience has helped us to understand each characteristics of the business process, so we can deliver innovative solutions with the highest quality services, meeting deadline at the most reasonable price. This is a challenge that requires innovations, creativity and smartness, without conventional approach to problem solving.

AdIns was established in April 2000 with a sound vision and commitment to deliver the suitable and innovative solutions to increase the customer competitive advantage. Within the last few years, AdIns has became trusted and respected IT Company providing products and services that notably have the most functional features in its category.","To understand the system design and problem investigation, problem identification, root analysis, solution definition for the second level of support
Attend customer support requests for questions or problems on App Support
Diagnose problems in several areas including operating system, application server, network, database and security
Diagnose, solve problems, and identify solutions to solve problems
Ensure smooth workflow processes and achievement of service level commitments
Communicating with customers for application deployment and support
Communicate and work closely with the Product Team about reported issues or required improvements to the software
Create application performance and status reports
Ticket resolve according to SLA

Minimum Qualifications

Bachelor's Degree in Computer Science/Information Technology.
Have a minimum of 1-year working experience in the related field
Understand the basics of Linux Server is a must
Have analytical skills including the ability to identify problems and solve problems
Understand database concepts & SQL Language, and also have JSP, ASP, MSSQL, Web Server skills
Understand operating system, Network, troubleshooting and firewall technology
Understand the OSI layer & SFTP server – client
Have knowledge in IT operations and the role of sysadmins to form strategies in the entire integration and deployment process
Have experience configuring web and application servers
Have good communication skills both orally and in writing because he will work with various teams
Have own initiative, able to work independently, collaboratively with people at various levels
Able to work individually and in team
Able to work under pressure"
3788868722,Automation Engineer - SPX Express (Sunter),https://www.linkedin.com/jobs/view/3788868722,Shopee,https://www.linkedin.com/company/shopee/life," "," ",189,,On-site,,"5,001-10,000 employees · Technology, Information and Internet",https://media.licdn.com/dms/image/C560BAQE0iX_dgdH7nA/company-logo_100_100/0/1672279162763/shopee_logo?e=1712188800&v=beta&t=YOOfP8buLRx8UmTaRks5zte1XLjE_Srdn7i45b-zmOU,"Shopee is the leading e-commerce platform in Southeast Asia and Taiwan. It is a platform tailored for the region, providing customers with an easy, secure and fast online shopping experience through strong payment and logistical support.

Shopee aims to continually enhance its platform and become the region’s e-commerce destination of choice via ongoing product optimisation and localised user-centered strategies.

Shopee, a Sea company, was first launched in Singapore in 2015, and has since expanded its reach to Malaysia, Thailand, Taiwan, Indonesia, Vietnam and the Philippines. Sea is a leader in digital entertainment, e-commerce and digital financial services across Greater Southeast Asia. Sea's mission is to better the lives of consumers and small businesses with technology, and is listed on the NYSE under the symbol SE.

The Shopee team is rapidly expanding across the region and we are constantly on the lookout for talents who have the passion and drive to become part of a fast-moving and dynamic team. Do check out our career website http://careers.shopee.sg/ for our available positions!","Job Description

Build high-quality, cost-effective solutions for our Sorting centres and Distribution Hubs
Work on multiple projects simultaneously, from detail engineering all the way through Commissioning. 
Transition the project to our Operation and Maintenance team. 
Support the team to ensure that the system you’ve built is operating at peak performance.
The projects may include green-fields, brown-fields, and retrofits, including highly automated sorting centers, cross-dock facilities, and Distribution Hubs. Your projects will be a variety of template-based and designed-from-scratch.
Work with a team of highly skilled and highly engaged engineers in a fast-paced environment.

Requirements

Bachelor’s degree in engineering (any discipline) or a related field
Total min. 3+ years of working experience in the industrial automation industry. Preferably have 1+ years of working for Top Automation companies
Experience with Inverters, PLC, SCADA, Fieldbuses and Rest API."
3788223066,Security Engineer Blue Team,https://www.linkedin.com/jobs/view/3788223066,DANA Indonesia,https://www.linkedin.com/company/dana-indonesia/life," ",1 week ago,116,,On-site,,"501-1,000 employees · IT Services and IT Consulting",https://media.licdn.com/dms/image/C560BAQFf-Q5syHcOSA/company-logo_100_100-alternative/0/1630647441555?e=1712188800&v=beta&t=xy8hcfMd9D0LBe8X9uPQW1JSNb7Gg1vIdXe3hTwBWbk,"#BukanDompetBiasa

DANA is a TechFin company that aims to bring in inclusive financial services to empower people for a better living. We aim to be one of the Pillar of Digital Economy in Indonesia by enabling the society to transact seamlessly. As a highly secured and scalable payment service platform to connect everyone based on world class technology, our goal is to provide Indonesia with a trustworthy and convenient mobile payment system to cater the needs of our customers, and sustainable profitable business for our stakeholders.

Join us and together we build Indonesia cashless society.","We are looking for Security Engineer, who enjoys security work and possesses both deep and wide expertise in the security space.

You will make things more secure by protecting system boundaries, keeping computer systems and network devices hardened against attacks and securing highly sensitive data. You will working closely with IT security team, to improve the internal process in security and improve the visibility of security detection coverage, optimization of configuration and accuracy if detection. 
Qualified candidates will have a background in Security or Infrastructure/Systems Engineering.

What days look like as Security Engineer?

Responsible for building relationships with teams across the company to understand current and future security threats and vulnerabilities.
Steer work on the design and operation of current and future toolsets that will support the SOC development, as per current understanding of future scenarios; namely alerting, monitoring and reporting
Accountable for the development of long and short technical capabilities, including software and hardware requirements; gathering business requirements; developing initial findings and working to agree a priorities list of technical capabilities and projects with the assistance of the SOC Analyst
Responsible for ensuring that SOC delivery for Information Security is aligned with ISGC policies, related standards and guidelines
Routine review the security standard applied for plan, request for change, implementation process, roll out plan, check the whole process
Deliver Information Security related consultancy across a wide range of technology issues to technology and business leaders and their teams across various departments within the business.
Responsible for ensuring all relevant technical standards and policy documentation is reviewed and maintained thought-out each if the SOC technical capabilities
Fine tuning Robot Detection System (RDS), WAF, Anti DDoS
Server hardening (Unix custom OS, Windows)
Infrastructure security (Database, Web, DNS, firewall)
Access control review
Strong log analysis to do digital forensic

You are welcome to apply, if:

BSc degree Computer Science/Cyber Security (or related field).
Have minimum 2 years working experience of security engineer or relevant experience.
Experience in engineering and software development. Including; information systems security and life cycle management documentation
Strong problem solving and troubleshooting skills with experience exercising mature judgement
Problem solving skills and ability to work under pressure
Strong written and verbal communication skill in English and Bahasa Indonesia"
3784060190,Apprenticeship - Application Support,https://www.linkedin.com/jobs/view/3784060190,Prudential Indonesia (PT Prudential Life Assurance),https://www.linkedin.com/company/prudential-indonesia-pt-prudential-life-assurance-/life," ",2 weeks ago,302,,Hybrid,,"1,001-5,000 employees · Insurance",https://media.licdn.com/dms/image/C510BAQHlHbrkp6AbPg/company-logo_100_100/0/1630608436677/prudential_indonesia_pt_prudential_life_assurance__logo?e=1712188800&v=beta&t=ysRkgOZVmxHTtT2JbZYmKP3SntFZdXl07hnCtk7C9vo,"Listening. Understanding. Delivering.

At Prudential Indonesia we deliver excellence by consistently innovating, creating new opportunities and growing our business to cater all of our customers' needs.

With a vision of becoming truly world class, Prudential Indonesia provides quality services and proven track record of market leadership in the country.

Working at Prudential Indonesia gives you many opportunities to develop yourself and explore what you’re really capable of, as well as the perfect environment to collaborate, listen and care for others.

Ask around. The more you find out about us, the more you’ll learn that we’re an insurance company that understands you.

We are here to listen.","Prudential’s purpose is to be partners for every life and protectors for every future. Our purpose encourages everything we do by creating a culture in which diversity is celebrated and inclusion assured, for our people, customers, and partners. We provide a platform for our people to do their best work and make an impact to the business, and we support our people’s career ambitions. We pledge to make Prudential a place where you can Connect, Grow, and Succeed.

Responsibilities:
Support monitoring and maintain application
Diagnosis and Investigation any issue occurs 
Communicate incident to stakeholders
Resolution and recovery any issue occurs
 Requirements:
Undergraduate student (3rd or 4th year) / fresh graduate with major in computer science / informatics/ information system
Good analytical skills
Familiar with Operating System Linux or Windows
Familiar with software testing (e.g postman, jmeter)
Familiar with Database (e.g postqresql, SQL Server)
Creative and Innovative
Willing to follow hybrid regulation – WFO (3x) & WFH (2x) in South Jakarta

Prudential is an equal opportunity employer. We provide equality of opportunity of benefits for all who apply and who perform work for our organisation irrespective of sex, race, age, ethnic origin, educational, social and cultural background, marital status, pregnancy and maternity, religion or belief, disability or part-time / fixed-term work, or any other status protected by applicable law. We encourage the same standards from our recruitment and third-party suppliers taking into account the context of grade, job and location. We also allow for reasonable adjustments to support people with individual physical or mental health requirements."
