id,title,job_url,company,company_link,location,published_at,number_of_applicants_applied,employment_duration,work_location_type,work_experience_level,company_type,company_logo,company_description,about_the_job
3797611539,Data Science Consultant,https://www.linkedin.com/jobs/view/3797611539,Accenture Southeast Asia,https://www.linkedin.com/company/accenture-sea/life," ",1 day ago,28,,On-site,,"10,001+ employees · Business Consulting and Services",https://media.licdn.com/dms/image/D560BAQGeynb8FBRdxA/company-logo_100_100/0/1692237311041/accenture_sea_logo?e=1712188800&v=beta&t=IlB943IerOUVMMjPqYytYZ8BwZxIgK12CYuWyf6Crkc,"Accenture is a leading global professional services company that helps the world’s leading businesses, governments and other organizations build their digital core, optimize their operations, accelerate revenue growth and enhance citizen services—creating tangible value at speed and scale. We are a talent- and innovation-led company with 732,000 people serving clients in more than 120 countries. Technology is at the core of change today, and we are one of the world’s leaders in helping drive that change, with strong ecosystem relationships. We combine our strength in technology with unmatched industry experience, functional expertise and global delivery capability. We are uniquely able to deliver tangible outcomes because of our broad range of services, solutions and assets across Strategy & Consulting, Technology, Operations, Industry X and Accenture Song. These capabilities, together with our culture of shared success and commitment to creating 360° value, enable us to help our clients succeed and build trusted, lasting relationships. We measure our success by the 360° value we create for our clients, each other, our shareholders, partners, and communities. Visit us at www.accenture.com.","Description

Accenture is a leading global professional services company, providing a broad range of services in strategy and consulting, interactive, technology and operations, with digital capabilities across all of these services. We combine unmatched experience and specialized capabilities across more than 40 industries – powered by the world’s largest network of Advanced Technology and Intelligent Operations centers. With 505,000 people serving clients in more than 120 countries, Accenture brings continuous innovation to help clients improve their performance and create lasting value across their enterprises. Visit us at www.accenture.com.

Job Description Your client’s eyes probably glaze over when you discuss in detail logistic regression, cluster analysis, neural nets and other segmentation models, but they certainly appreciate your uncanny ability to utilize those to lower their marketing costs and improve marketing effectiveness. Or perhaps they rely on you to provide analytics that stimulate sales, strengthen customer loyalty and generate purchases. If you’ve earned a reputation for your analytics expertise, Accenture may be the perfect place to take the next step in your career journey. Your Role Data Scientist As a Data Science professional, the individual will help drive sales and solutioning of data science/analytics engagements, manage and/or supervise project delivery, mentor teams, build new capabilities, support/contribute to thought leadership and building new skills. The candidate should be able to seamlessly work with Client teams in positioning data science/analytical capabilities and with help of them drive an deliver data science/analytics engagement. The successful candidate should have strong consultative, business and communication skills in addition to quantitative ability. As well as be exposed to the challenges of using statistics in a business setting, such as incomplete data, biased data, large data sets, low signal-to-noise ratios, high variance and multiple objective functions. Requires being creative and resourceful and will utilize traditional statistical methodologies as well as newer techniques from computational statistics and data mining and big data capabilities.

YOUR EXPERIENCE:


Degree in a relevant field like statistics, computer science or applied maths, physics or relevant subjects or 3+ years of experience in computer science, applied mathematics, or other quantitative/computational discipline.

Strong background in statistical concepts and calculations

3+ years of experience with real data

Innovative and strong analytical and algorithmic problem solvers

3+ years of experience with scripting languages (e.g., Python, Ruby, Perl, Bash) for orchestration and data manipulation

3+ years of experience with statistical computing tools like R, SAS, and SPSS

Data engineering experience, including SQL and experience manipulating structured and unstructured data sources for analysis.


Qualifications

External Qualifications


Experience in one or more statistical software packages such as R, SAS, SPSS, etc

Experience in one or more programming languages such as Python, R, etc

Experience in one or more machine learning solutions such as TensorFlow, IBM Watson, etc

Experience in one or more tools for visualization such as Tableau, Qlik, D3, etc

Good understanding of statistical modelling and machine learning

Good understanding of machine learning techniques such as Neural Networks, Random Forest, etc

Ability to meet travel requirements, when applicable

Have a minimum of 3-5 years in relevant experience

Have a minimum of Bachelor degree


Professional Skill Requirements


Proven success in contributing to a team-oriented environment

Proven ability to work creatively and analytically in a problem-solving environment

Desire to work in an information systems environment

Excellent leadership, communication (written and oral) and interpersonal skills


Entry or junior level positions are also available for candidates with less experience.

You will also have opportunities to hone your functional skills and expertise in an area of specialization. We offer a variety of formal and informal training programs at every level to help you acquire and build specialized skills faster. Learning takes place both on the job and through formal training conducted online, in the classroom, or in collaboration with teammates. The sheer variety of work we do, and the experience it offers, provide an unbeatable platform from which to build a career.

Accenture is an equal opportunities employer and welcomes applications from all sections of society and does not discriminate on grounds of race, religion or belief, ethnic or national origin, disability, age, citizenship, marital, domestic or civil partnership status, sexual orientation, gender identity, or any other basis as protected by applicable law."
3792015028,"Computer Vision – Staff Engineer (Bangkok based, relocation provided)",https://www.linkedin.com/jobs/view/3792015028,Agoda,https://www.linkedin.com/company/agoda/life," ",1 week ago,16,,Full-time,,"5,001-10,000 employees · Software Development",https://media.licdn.com/dms/image/C4D0BAQGBa_7QNZNwpw/company-logo_100_100/0/1656643826660/agoda_logo?e=1712188800&v=beta&t=Uch6o32VIVJnqd5pOyN6ISz8TvEijuYR_vC1w3EK8HQ,"Agoda is transforming travel for millions of customers across the globe.

Headquartered in Asia, Agoda is one of the world’s largest online travel platforms. Founded in 2005 and now part of Booking Holdings (Nasdaq:BKNG), Agoda has a network of over 2,900,000 properties worldwide. Our web and mobile products provide a first-rate reservation service in 38 languages that uniquely combines local knowledge and local connections to provide the best deals for business and leisure travelers.

Agoda employs over 7,000 professionals from 90 nationalities in locations around the globe. In every department – from engineering to customer experience – we provide an environment rich with creativity, collaboration, and experimentation, and the tools to work faster and smarter.

At Agoda, we believe our people are our strength. We work hard and have fun, and we choose people who are dedicated to making things great.

For properties seeking partnership with Agoda, visit https://connect.agoda.com","About Agoda

Agoda is an online travel booking platform for accommodations, flights, and more. We build and deploy cutting-edge technology that connects travelers with more than 3.6 million accommodations globally. Based in Asia and part of Booking Holdings, our 6,000+ employees representing 90+ nationalities foster a work environment rich in diversity, creativity, and collaboration. We innovate through a culture of experimentation and ownership, enhancing the ability for our customers to experience the world.

Agoda is an online travel booking platform for accommodation, flights, and more. We build and deploy cutting edge technology that connects travelers with more than 2.5 million accommodations globally. Based in Asia and part of Booking Holdings, our 4,000+ talents coming from 90+ different nationalities foster a work environment rich in diversity, creativity, and collaboration. We innovate through a culture of experimentation and ownership, enabling our customers to experience the world.

Get to Know Our Team

The Engineering department oversees all Agoda’s ML and software related requirements. Our goal is to enable and increase Agoda’s business through creative approaches and the implementation of powerful resources such as operational and analytical databases, ML driven solutions, queue systems and data monitoring tools. We hire the brightest minds from around the world to take on this challenge and equip them with the knowledge and tools that contribute to their personal growth and success while supporting our company’s culture of diversity and experimentation. The role the engineering team plays at Agoda is critical as business users, product managers, and many others rely on us to empower their decision making. We are equally dedicated to our customers by improving their search experience with faster results and protecting them from any fraudulent activities. Data is interesting only when you have enough of it, and we have plenty. This is what drives up the challenge as part of the ML engineering squad, but also the reward. We work across structured and non-structured data at scale. For example, our current ML models process millions of images every day to try and enhance the experience that our users get from our app.

Why Agoda Engineering Team (ML role)?

Our engineering teams are at the intersection of business analytics, ml engineering, data warehousing and software engineering. Our job involves dealing with distributed systems, stream processing, ml modeling and computation at tens of PB Scale. We focus on software engineering related to data replication, storage, centralized computation, and Data API’s. By providing our users with ML products/tools, shared frameworks, and ML services, we enable our company to validate strategic decisions, make smarter choices, and react to the fast-changing world. We are a small but passionate team with people from different nationalities working together on a single goal.

In this Role, you will get to:

 Lead the team technically in improving scalability, stability, accuracy, speed and efficiency of our existing ML systems and processes.
 Build, administer and scale ML processing pipelines.
 Be comfortable navigating the following technology stack: Python3, Pyspark, scripting (Bash/Python), Hadoop, SQL, S3 etc.
 Should be able to understand internals of ML models such as Random Forest, CNN, Regression models, etc
 Design, build, test and deploy new libraries, frameworks or full systems for our core systems while keeping to the highest standards of testing and code quality.
 Work with experienced engineers and product owners to identify and build tools to automate many large-scale data management / analysis tasks.
 We believe in end-to-end ownership; this role will involve taking ML models to production at a scale.

What You’ll need to Succeed:

 Bachelor’s degree in computer science /information systems/engineering/related field
 8+ years of experience in software engineering with a minimum of 4+ years in ML
 Good experience in Pyspark
 Expert level understanding of Python with design patterns and object-oriented programming.
 Experience debugging and reasoning about production issues is desirable.
 A good understanding of data architecture principles preferred.
 Any other experience with Big Data technologies / tools
 SQL experience
 Analytical problem-solving capabilities & experience.
 Systems administration skills in Linux
 A strong engineering driven mindset will be required to succeed in this role.

It’s great if you have:

 Good understanding of Hadoop ecosystems
 Experience working with Open-source products
 Experience with Scala development
 Working in an agile environment using test driven methodologies

#telaviv #jerusalem #IT #ENG #4 #sanfrancisco #sanjose #losangeles #sandiego #oakland #denver #miami #orlando #atlanta #chicago #boston #detroit #newyork #portland #philadelphia #dallas #houston #austin #seattle #sydney #melbourne #perth #toronto #vancouver #montreal #shanghai #beijing #shenzhen #prague #Brno #Ostrava #cairo #alexandria #giza #estonia #paris #berlin #munich #hamburg #stuttgart #cologne #frankfurt #hongkong #budapest #jakarta #bali #dublin #telaviv #milan #rome #venice #florence #naples #turin #palermo #bologna #tokyo #osaka #kualalumpur #malta #amsterdam #oslo #manila #warsaw #krakow #doha #alrayyan #riyadh #jeddah #mecca #medina #singapore #seoul #barcelona #madrid #stockholm #zurich #taipei #tainan #taichung #kaohsiung #bangkok #Phuket #istanbul #london #manchester #edinburgh #hcmc #hanoi #lodz #wroclaw #poznan #katowice #rio #salvador #newdelhi #bangalore #bandung #yokohama #nagoya #okinawa #fukuoka #jerusalem #IT #4

Equal Opportunity Employer 

At Agoda, we pride ourselves on being a company represented by people of all different backgrounds and orientations. We prioritize attracting diverse talent and cultivating an inclusive environment that encourages collaboration and innovation. Employment at Agoda is based solely on a person’s merit and qualifications. We are committed to providing equal employment opportunity regardless of sex, age, race, color, national origin, religion, marital status, pregnancy, sexual orientation, gender identity, disability, citizenship, veteran or military status, and other legally protected characteristics.

We will keep your application on file so that we can consider you for future vacancies and you can always ask to have your details removed from the file. For more details please read our privacy policy .

To all recruitment agencies: Agoda does not accept third party resumes. Please do not send resumes to our jobs alias, Agoda employees or any other organization location. Agoda is not responsible for any fees related to unsolicited resumes."
3784074656,Organization Development & Performance Management,https://www.linkedin.com/jobs/view/3784074656,Praktis,https://www.linkedin.com/company/prakasa-triputra-solusi/life," ",2 weeks ago,698,,On-site,,"201-500 employees · Transportation, Logistics, Supply Chain and Storage",https://media.licdn.com/dms/image/C560BAQHGjOyVFTtQLA/company-logo_100_100/0/1640168321713/prakasa_triputra_solusi_logo?e=1712188800&v=beta&t=yCTOC7ZIo6BujDtPF3T-K7Aj5RZoI3JMEuD8DlbhRqc,"Praktis is an end to end supply chain startup that helps brands focus on their core competencies with reliable technology and a data powered platform for seamless business operation.

Our mission is to help Indonesian micro, small, and medium enterprises (MSMEs) to become a national and even international player, by giving three main services:
1. Sourcing & Production
2. Fulfillment & Logistic
3. Order Management

In order to achieve our mission we need “Praktisi” people who have Collaborative Growth, Openness & Trustworthy, and Excellence as our core values to give the most seamless experience to our customer.

Currently Praktis has more than +-1000 Manufactures and Supplier nationwide, 50.000 Package delivered daily, 200 Product Categories, and 15.000 sqm Warehouse Capacity (Depok, Tangerang, Surabaya, Bogor, Bandung, and Cimanggis). Join our team and become one of our “Praktisi” because we provide room to growth, to exploring and living your potential and for a higher mission.","Responsibilities
Design and implementation of Organization Development Strategy. Include planning and developing Career Development Plan, Succession Planning, Competency Mapping, Performance Management System to supports organization goals.
Collaborate with superiors to designing organization structure based on company goals and targets:
Deep understanding about organization changes, goals and reason of change.
Draw & maintain all organization structure documentation (historical and revised documents).
Develop, update and maintain Job Description for all positions in the organization according to the new and/or updated Organization Structure.
Responsible for the implementation and monitoring of the effectiveness and efficiency of the new employee orientation program
Monitor the internal movement process within the company.
Implement and manage performance appraisal tool, process and programs including evaluate and analyze performance appraisal results.

Qualifications
Bachelor's degree in Human Resource Management or Psychology
3+ years of working experience in performance management or organizational development
Experienced in structuring a Performance Management System
Solid data analytics skills
Strong business acumen, decision-making and problem-solving skills"
3790515418,"Technical Service Representative, Consumer Solution (P&P)",https://www.linkedin.com/jobs/view/3790515418,Solenis,https://www.linkedin.com/company/solenis/life," ",2 weeks ago,131,,On-site,,"10,001+ employees · Chemical Manufacturing",https://media.licdn.com/dms/image/C4E0BAQHq1Z5Q9VIngA/company-logo_100_100/0/1631356401779?e=1712188800&v=beta&t=I7nIK92_ciGTdxhq6QrvDvUnovVXyXVEXGIrSEnsSas,"Solenis is a leading global producer of specialty chemicals focused on delivering sustainable solutions for water-intensive industries, including consumer, industrial, institutional, food and beverage, and pool and spa water markets. Owned by Platinum Equity, the company’s product portfolio includes a broad array of water treatment chemistries, process aids, functional additives, and cleaners and disinfectants, as well as state-of-the-art monitoring and control systems. These technologies are used by customers to improve operational efficiencies, enhance product quality, protect plant assets, minimize environmental impact, and create cleaner and safer environments. Headquartered in Wilmington, Delaware, the company has 71 manufacturing facilities strategically located around the globe and employs a team of over 15,400 professionals in 130 countries across six continents. Solenis is a 2023 US Best Managed Company.

For additional information about Solenis, please visit www.solenis.com or follow us on social media.

COVID-19 from Solenis
As COVID-19 continues to affect everyone around the world with varying degrees of impact, Solenis remains focused on the safety and well-being of our employees, customers and communities. Our products are defined, in many countries, as essential to critical infrastructure and we are continuing to manage our operations in a manner intended to ensure the safety of everyone as well as maintain business continuity. In all instances, Solenis follows the guidance issued by the CDC, the World Health Organization and local government authorities. If you have any COVID-19 related questions, please do not hesitate to contact your Solenis representative or alternatively send an email to soleniscommunications@solenis.com.","Job Description :

To technically support the day-to-day operation of the account by intensive communication with account manager and other stake holders for all Solenis chemicals application in the account.
Working together with account manager and other team to explore and probe all opportunities to enrich the sales pipelines by deep technical analysis and observations, help the team to technically convert it to sales realization.
Help the team to establish a high technical service level for customer with value added selling as the basic approach.
Ensure the preparation and submission of the approved daily/weekly/ monthly report to customer. Also, able to present it to customers.
Technically lead the trouble shooting program to show Solenis high standard service level.
Build a good relationship with customer especially with user, technical team, and managerial level.


Requirements:

Bachelor’s Degree in engineering or paper technology education background
Having working experience in the related field, with minimum 5 years in papermaking industry and Paper Coating related experience
Excellent verbal and written communication in English
Strong presentation skills
Proactively identifies and anticipates customer requirements, expectations, and needs
Demonstrates a strong desire to help customers make their business successful
Understands the customers business and helps them deliver on their goals and objectives
Strong interpersonal skill, teamwork, problem solving, initiative and leadership skills"
3740832064,Land Development/Infrastructure Engineer,https://www.linkedin.com/jobs/view/3740832064,Arup,https://www.linkedin.com/company/arup/life," "," ",456,,Hybrid,,"10,001+ employees · Design Services",https://media.licdn.com/dms/image/D4E0BAQGJio-1N-Cssg/company-logo_100_100/0/1686582688780/arup_logo?e=1712188800&v=beta&t=e7ODYmmLdNVhJOgrmbqvf-D3gyXv_CR8n2J1pF5Crdk,"Dedicated to sustainable development, Arup is a collective of designers, consultants and experts working across 140 countries. Founded to be both humane and excellent, we collaborate with our clients and partners using imagination, technology and rigour to shape a better world.","Do you want to make a positive impact on the world? Sustainable development is at the heart of everything we do.

Seventy-five years ago, we created a home for creative thinkers seeking to solve the world’s biggest challenges. Today, a collective of 16,000+ Arupians gather across the globe from 140 different countries to build a sustainable future.

We strive to create an inclusive environment and give everyone a voice. Diversity drives innovation in our projects and offers empathy to the communities we serve. We welcome and encourage applications from people living with disability and provide workplace adjustments.

At Arup, you’ll do more than work — you’ll shape a better world.

About This Role

As Senior Site Development Engineer, you are responsible for delivering infrastructure planning advice to a wide range of urban planning and masterplanning projects, building and infrastructure projects, including precinct or city wide analysis of infrastructure (water, waste water, solid waste, energy, ICT) and developing recommendation to shape precinct/ city plans, engagement with relevant government counterparts and report-writing. This role will report to Indonesia Cities, Planning and Design Team Leader and project managers or directors, for assigned projects primarily in the Indonesia market, but also for regional projects in ASEAN, as needed.

What will I do?


Undertake strategic infrastructure planning projects, including feasibility analysis, impact assessments, modelling, and developing recommendations for clients across public and private sectors. Infrastructure includes water, waste water, solid waste, energy, ICT.
Provide scheme and detailed design work across a broad range of projects within civil engineering, planning, water, energy and waste related areas.
Input to the technical / design development on such projects, and lead within discipline specialism ensuring work quality is maintained at the expected standard.
Engagement with key government counterparts at national, province or city level.
Project coordination and management, relationship management and related business development activities with new and existing clients.
Coordination and project management on infrastructure and masterplan related projects and bids


What will I bring?


Bachelors’ Degree in Civil Engineering. A Masters’ degree / Post graduate studies in Civil Engineering or relevant Master’s degree.
Minimum eight years of relevant experience in civil engineer and master planning work.
Familiar with Indonesian Codes and Practices, contract administration and submission procedures.
Knowledge of consulting and technical infrastructure, development and related areas in the consulting engineering environment, including the ability to advise clients on cost-effective, sustainable solutions..
Ability to independently undertake project and technical analyses, and report on results.
Experience in managing key projects, including the coordination of multi-disciplinary project teams..
Proficiency in both written and spoken English and Bahasa Indonesia


Our firm 

Dedicated to sustainable development, the firm is a collective of 16,000 designers, advisors and experts working across 140 countries. Founded to be both humane and excellent, we collaborate with our clients and partners using imagination, technology, and rigour to shape a better world.

We create spaces where everyone feels safe, seen and included and able to perform at their best. We take an approach to flexible working that supports the diversity and well-being of our members.

Are you ready to shape a better world?

Our open roles are waiting for you on the Arup careers page. If you like what you see here, apply today.

Arup does not accept unsolicited resumes from recruiters or employment agencies."
