id,title,job_url,company,company_link,location,published_at,number_of_applicants_applied,employment_duration,work_location_type,work_experience_level,company_type,company_logo,company_description,about_the_job
3780821875,"Expert, IT PMO",https://www.linkedin.com/jobs/view/3780821875,Asia Pulp & Paper,https://www.linkedin.com/company/asiapulppaper/life," ",4 weeks ago,624,,On-site,,"10,001+ employees · Paper and Forest Product Manufacturing",https://media.licdn.com/dms/image/D560BAQGErFgMw4Vs3Q/company-logo_100_100/0/1698113094507/asiapulppaper_logo?e=1712188800&v=beta&t=09bEWkb8TemHyqT8daSle82gBAGAO3cm65G6dA-aCwc,"PT APP Purinusa Ekapersada (APP) and its group companies manage several pulp and paper manufacturing and forestry operation that deliver quality products to meet the growing global demand for paper, packaging and tissue.

Following the growing industry and market dynamic, APP will continue growing further to be the global player and global brand, to acquire new customers across markets. APP's products are marketed in more than 150 countries across six continents.

As a sustainable and responsible business, we create products and operate with care for our employees, society and the environment. We do this by leveraging technology and innovation, partnering the community and adhering to international business and operating standards across our production and supply chain.

We subscribe to the Environmental, Social, and Governance (ESG) principles and our Sustainability Roadmap Vision 2030 guides us in fulfilling our commitment to protect forests, support communities, conserve biodiversity and as we work towards achieving carbon neutrality across our operations.
…
show more","Job Description:
Analyzing & Managing project delivery, resource, risk, schedule, cost and conflict
Managing communication with all project stakeholders
Manage, measure, maintain high level of Business satisfaction
Assist in the development and ensure the implementation of IT policies and procedures.

Job Requirements:
Degree in Computer Science is preferred
Have a minimum of 8 years of working experience in related position, familiar with SAP Projects
Good communication skills, analytical skill and team work
Working arrangement: Onsite in Serpong, Area"
3629534299,Technology Consulting Junior Consultant,https://www.linkedin.com/jobs/view/3629534299,EY,https://www.linkedin.com/company/ernstandyoung/life," "," ",2734,,On-site,,"10,001+ employees · Professional Services",https://media.licdn.com/dms/image/C510BAQGpRhkpxp5A9A/company-logo_100_100/0/1630570672166/ernstandyoung_logo?e=1712188800&v=beta&t=G4v6K3k9tCzqqdIiZupT4w1rzEOifyLkDifehFIZEQc,"EY exists to build a better working world, helping create long-term value for clients, people and society and build trust in the capital markets.

Enabled by data and technology, diverse EY teams in over 150 countries provide trust through assurance and help clients grow, transform and operate.

Working across assurance, consulting, law, strategy, tax and transactions, EY teams ask better questions to find new answers for the complex issues facing our world today.

Find out more about the EY global network http://ey.com/en_gl/legal-statement","Technology Consulting

What if your career could have a lasting impact on you, and on the world?

Here at EY, you’ll have the chance to build a truly exceptional experience. We’ll empower you with the latest technology, surround you with high-performing teams, and provide the global scale and diverse and inclusive culture you need to discover your full potential. Through our coaching and training programs, you’ll develop the skillsets you need to stay relevant today and in the future – all while building a network of colleagues, mentors, and leaders who will be on the journey with you at EY and beyond.

The Exceptional EY Experience. It's Yours To Build.

The opportunities: your next adventure awaits

EY Consulting is global practice with more than 70,000 people around the globe. We are building a better working world by transforming businesses through the power of people, technology and innovation. Our client-centric approach focuses on driving long-term value for our clients by solving their most strategic problems, and our consulting services are recognized by the global analyst community and our 25+ alliance partners. EY Consulting is made up of three sub-service lines: Business Consulting, Technology Consulting and People Advisory Services.

Whole industries have been disrupted and transformed in recent years by digital technology. As a Technology Consultant, you’ll help businesses realize the value they can gain from their IT investments — supporting strategy and being a key growth driver. As part of a high-performing team, you’ll deliver exceptional client service — implementing technology solution, providing advice on how technology enablement, digital transformation and enterprise intelligence contribute to performance improvement, as well as how IT can act as multiplying effect during major program transformations.

As organizations look to leverage the advantage IT offers, we’ll work with you to develop the consultancy and analytical skills that you’ll need in today’s environment. Working on projects that cross borders and sectors, the experiences you gain here will be more valuable than anywhere else. So whenever you join, however long you stay, the exceptional EY experience lasts a lifetime.

We have multiple opportunities available for rising Junior Consultant. We are currently recruiting for:

Cyber Security Associate.
Digital & Emerging Technology Associate
Technology Solution Delivery Associate

Some of the key responsibilities would include:

Client Delivery Responsibilities

Contribute to engagement team to integrate client’s strategy, process, people, and technology
Participate as a fieldwork team member in Consulting engagements 
Work effectively as a team member, sharing responsibility, providing support, maintaining communication, and updating senior team members on progress
Leverage data and technology to assist senior team members in providing innovative solutions to client’s challenges
Assist in preparing high quality work products for clients and other related parties in timely manner
Anticipate and identify risks within engagements and raise any issues with senior members of the team
Develop and maintain productive working relationships with client personnel

People Responsibilities

Understand and follow workplace policies and procedures
Build strong internal relationships within EY Consulting and with other services across the organization
Maintain an educational program to continually develop personal skills of staff
Contribute to people-related initiatives including recruiting and retaining consulting professionals

What We Look For

You have an agile, growth-oriented mindset. What you know matters. But the right mindset is just as important in determining success. We’re looking for people who are innovative, can work in an agile way and keep pace with a rapidly changing world.
You are curious and purpose driven. We’re looking for people who see opportunities instead of challenges, who ask better questions to seek better answers that build a better working world.
You are inclusive. We’re looking for people who seek out and embrace diverse perspectives, who value differences, and team inclusively to build safety and trust.

Main Qualifications

Have a bachelor’s degree in the areas of Information Technology, Computer Science, Mathematics, Statistics, Engineering, Business, Finance, Economics, or other related major from reputable university with excellent academic record. Master’s degree will be an advantage.
Fresh graduate or has limited working experience
Min GPA 3.00 out of 4.00 from reputable university
Excellent skills in both written and verbal Bahasa Indonesia and English
Strong leadership, analytical thinking, problem solving skills, presentation and communication skills
Excellent analytical skills for both business and technology solutions to enable the development of business process and/or technical solutions, including documentation of business problems in a clear concise manner

Additional Qualifications (good To Have)

Experience in applying computer-aided statistical modelling to solve business problems
Experience in machine learning, data mining and information retrieval.
Experience in extracting information from a wide variety of sources including quantitative, qualitative and big data sources
At least one of the following modelling software packages: MATLAB, R, SAS, SPSS.
At least one of the following scripting languages: C++, Java, Python.
Data visualization experience – Tableau / Qlikview / D3.js / Power BI and SAS VA as one of the tool aside from Tableau/QlikView.
Exposure to artificial intelligence, deep learning and advanced predictive modelling
Exposure to any of the following area; Solution architecture, technology sourcing for transformation, system delivery support and device, IT service management, ERP Implementation, SAP, Oracle, Peoplesoft, Hyperion, Siebel, Pega, MDM, ETL, Big Data.
Exposure to any of the following area; Enterprise Application (SAP, Oracle, Microsoft), Solution Architecture, Software Development, System Delivery and Implementation, IT Service Management
Knowledge in Cyber Security, Security Risk on Business, Networks and Operating Systems
Knowledge and experience in following domain Technology Strategy, NextGen Technology Operations, Infrastructure and Service Resiliency, and Enterprise Architecture, certification relates to the domain will be considered an asset
Trainings/Certificates for any of the following SAP modules would be advantageous; FICO, MM, HR, SD, PM, PP, or ABAP

What’s In It For You

Accelerate your technical capabilities and transformative leadership skills with future-focused courses and development programs.
Broaden your horizons by working on highly integrated teams across the globe and collaborate with people of diverse backgrounds — both professionally and culturally.
Bring out the best in yourself with continuous investment in your personal well-being and career development.
Develop your own personal purpose and help us create a positive ripple effect on our teams, our business, clients and society – building a better working world, together.
We prioritize your wellbeing by providing a competitive medical benefit.

What You Can Expect

Due to the volume of applications, only shortlisted candidates will be contacted.
Shortlisted candidates can expect to perform a preliminary assessment as it is a required step of the recruitment process.

About EY

EY | Building a better working world

EY exists to build a better working world, helping to create long-term value for clients, people and society and build trust in the capital markets. Enabled by data and technology, diverse EY teams in over 150 countries provide trust through assurance and help clients grow, transform and operate.

Working across assurance, consulting, law, strategy, tax and transactions, EY teams ask better questions to find new answers for the complex issues facing our world today.

If you can confidently demonstrate that you meet the criteria above, please contact us as soon as possible.

Make your mark. Apply now."
3783585957,IT & Design Staff,https://www.linkedin.com/jobs/view/3783585957,,,,,0,,Hybrid,,See how you compare to 10 applicants. Try Premium for IDR0,,,"PERSOLKELLY Indonesia is currently assisting one of our clients, Japanese Education and Learning Center in Bali, to find the best talent for IT & Design Staff.

Key Responsibility Areas

 Administer and maintain the company's IT infrastructure, including hardware, software, networks, and servers. 
 Monitor system performance and security, ensuring optimal functionality. 
 Create visually appealing and user-friendly designs for digital and print materials. 
 Develop and maintain the company's website, ensuring a modern and responsive design. 
 Stay informed about the latest trends and advancements in both IT and design fields. 
 Make recommendations for the adoption of new technologies and design tools. 

Requirements

 Bachelor's degree in Information Technology, Computer Science, Design, or a related field.
 Interested in design, image editing, video editing (Photoshop, Adobe Illustrator, Premiere Pro), photography, and understanding of networks. 
 Experience with graphic design tools (Adobe Creative Suite, Sketch, etc). 
 Willing to work in Denpasar, Bali"
3789758615,Web Developer,https://www.linkedin.com/jobs/view/3789758615,PHINCON,https://www.linkedin.com/company/phintraco-consulting/life," ",2 weeks ago,316,,On-site,,51-200 employees · IT Services and IT Consulting,https://media.licdn.com/dms/image/C560BAQGlo4pZo6rcaQ/company-logo_100_100/0/1631379820861?e=1712188800&v=beta&t=f9eIcYC7O7BTj4QTMqCMUHr0TcJgii-7yAUH6Y2XK_I,"Phincon (Phintraco Consulting), a company member of Phintraco Group, is an Information Technology (IT) consulting and services company.

Established in 2008, we are focusing on providing customers with all spectrums of Customer Relationship Management (CRM), Middleware, HR, Big Data, RPA, and ERP solutions.","Responsibilities
Web developer is responsible for implementing visual and interactive elements that users engage with through their web browser when using a web application.
Develop functional and appealing web- and mobile-based applications based on usability
Provide website maintenance and enhancements
Create quality mockups and prototypes on tight timelines
Maintain graphic standards and branding throughout the product’s interface

Qualifications
Bachelor's degree or equivalent experience in Computer Science
Web Programming : Understanding Java framework such as Angular, Reactjs, Node.JS, Golang
Understanding AJAX and JSON message format
Has experience in telco project
Familiar with designer tools such as : Adobe Photoshop, Corel Draw,etc
Candidate must possess at least Bachelor's Degree in Computer Science/Information Technology or equivalent.
At least 3 Year(s) of working experience in the related field is required for this position.
Preferably Supervisor/Coordinator specialized in IT/Computer - Software or equivalent"
3787659908,IT Project Manager (Project Based),https://www.linkedin.com/jobs/view/3787659908,Lintasarta,https://www.linkedin.com/company/lintasarta/life," ",2 weeks ago,600,,On-site,,"501-1,000 employees · IT Services and IT Consulting",https://media.licdn.com/dms/image/C4D0BAQF3SGsOQnRjVg/company-logo_100_100/0/1630536135163/pt_aplikanusa_lintasarta_logo?e=1712188800&v=beta&t=CixsErnlZ0NdrxRFIJEc7Pyb95WrbKu0yDLa-vfV8aE,"Lintasarta is an Information and Communication Technology (ICT) total solutions company founded in 1988. We have enabled companies to grow beyond their capabilities regarding digital transformation. For over three decades, we have become a pioneer in many services for all industry segments, including finance, resources, government, manufacturing, services, trading/distribution, etc.

We are proud to serve more than 2.400 corporate clients and we will continue evolving to keep delivering services and solutions in each industry. We are supported by certified experts and local support that encourage our growth to enhance businesses and government performance in accelerating digital transformation.

The challenge upon us is unforeseeable, but our commitment to bring connectivity and empower people and the nation remains steady. Lintasarta #EmpoweringYourFuture","JOB DESCRIPTION:
Collaborating with the research team in conducting market research as well as competitor analysis to identify trends and customer needs.
Partnership Management: forming strategic alliances and collaboration with external partners.
Managing user feedback to improve system information features so they can reach a wider range of customers.
Developing a business model, product positioning, and pricing strategy .
Ensuring that system are successfully implemented to clients/vendors.
Supporting the operational team and guarantee that the system information are able to operate properly and meet the service-level agreement (SLA).


JOB QUALIFICATION:
Minimum education: Bachelor Computer Science/Information Technology (IT).
At least 2 years of work experience in B2B product management (have experience in telco/banking industries is a plus)
Strong Product Management skill to maintain product lifecycle.
Having good knowledge on application development framework, database, and infrastructure architecture.
Having good presentation and communication skills.
Familiarity with containerized application architecture for automating deployment and scaling.

Penempatan: klien Lintasarta lokasi Jakarta"
3462671823,Digital Partnership Ecosystem - SME Head,https://www.linkedin.com/jobs/view/3462671823,UOB,https://www.linkedin.com/company/uob/life," "," ",1608,,Hybrid,,"10,001+ employees · Banking",https://media.licdn.com/dms/image/C4E0BAQE7TULSMjVkbA/company-logo_100_100/0/1663196867873/uob_logo?e=1712188800&v=beta&t=RkuP5TAXDe26Xu6fd7fv66YLRSNtgn4pb5l2qqIoPSE,"We’re here to do Right By You.

At UOB, we aspire to build a better future for the people and businesses in the region.

Through our extensive network and suite of capabilities, we offer financial solutions to the people and businesses within, and connecting with ASEAN.

We create solutions tailored to your unique needs through data and relationship-led insights.

Our comprehensive regional network and one-bank approach connects your business to new opportunities in ASEAN.

We help businesses to advance responsibly and guide personal wealth to grow sustainably. We foster inclusiveness and environmental well-being for stronger societies.

This is how we stay committed to forging a sustainable future for generations to come.



Note: For the terms of use of our LinkedIn channel, please visit: https://go.uob.com/socialmedia","About UOB

United Overseas Bank Limited (UOB) is a leading bank in Asia with a global network of more than 500 branches and offices in 19 countries and territories in Asia Pacific, Europe and North America. In Asia, we operate through our head office in Singapore and banking subsidiaries in China, Indonesia, Malaysia and Thailand, as well as branches and offices.

Our history spans more than 80 years. Over this time, we have been guided by our values — Honorable, Enterprising, United and Committed. This means we always strive to do what is right, build for the future, work as one team and pursue long-term success. It is how we work, consistently, be it towards the company, our colleagues or our customers.

About The Department

Business Banking

We develop integrated products and services targeted at helping small and medium-sized enterprises across the region progress through different stages of growth. These include innovative solutions and initiatives in areas of working capital loans, operational efficiency and currency exposure.

About UOB Digital Partnership-SME

Digital partnership seeks to partner (Fintechs, Digital Platforms) with large scale digital platforms working with SMEs and who will allow us to cross-sell banking products (lending and non-lending) to the SMEs who are working with such platforms. Examples of such partners are e-commerce, mPOS, Accounting and payment etc.

For selected strategic partners, the Bank is integrated with them through API. Data sharing occurs (for consented customers) between the Bank and the partners to enhance customer experience and enable deeper cross-sell. Besides linking the Bank’s digital assets to partners, we are also actively building embedded finance solutions with strategic digital partners along with BizSmart.

BizSmart maintains a curated set of digital solution providers that collaborate closely with us to help customers digitalize their businesses. Examples of partner solutions are in areas of accounting, enterprise resource planning (ERP), HR, e-commerce, e-marketing and point-of-sales (POS).

Job Responsibilities

To lead the Bank’s effort to deliver all of the above objectives, the Digital Partnership-SME must be:

 Highly in-tune with market trends in digital solutions for SMEs 
 Able to properly manage the following 3 areas of responsibilities: 

A – Partner Origination. To originate, assess, negotiate and onboard new partners. Complete coverage of all necessary partner onboarding due diligence including getting approval from compliance, legal and other approval committees. If new credit programs are required, to collaborate with Credit, Analytics and Product to deliver a working model. If technical integrations are involved, to collaborate with Customer Journey, Technology and Operations teams to map out the full process.

B – Commercialization. To lead a team of digital advisors to formulate and execute marketing initiatives and go-to-market sales activities for B&E in general, or for specific partners or programs. Engage partners and our front liners to drive new customer onboarding and active utilization of partner solutions, with the ultimate objective to improve revenue per customer. To drive regular tracking cadence with team and provide monthly B&E portfolio updates to management.

C – Customer Journey. To build end-to-end customer journey and data flow process with partners that involve technical integrations. Lead in formulating business requirements and work with various technology, operations and transaction banking departments to perform all necessary process negotiations, testings and maintenance.

Job Requirements

 Proven experience in partner management and project management 
 Proven experience to lead teams to build new or execute on-going businesses 
 Strong knowledge of embedded finance capabilities 
 Highly in-tune with digital solution trends, industry players and ecosystems tie-ups in the market 
 Excellent communication and interpersonal skills, confident and professional 

Be a part of UOB Family

UOB is an equal opportunity employer. UOB does not discriminate on the basis of a candidate's age, race, gender, color, religion, sexual orientation, physical or mental disability, or other non-merit factors. All employment decisions at UOB are based on business needs, job requirements and qualifications. If you require any assistance or accommodations to be made for the recruitment process, please inform us when you submit your online application.

Apply now and make a difference."
