id,title,job_url,company,company_link,location,published_at,number_of_applicants_applied,employment_duration,work_location_type,work_experience_level,company_type,company_logo,company_description,about_the_job
3814798715,Campaign Specialist,https://www.linkedin.com/jobs/view/3814798715,Manna Indo Lakta,https://www.linkedin.com/company/manna-indo-lakta/life,"Surabaya, East Java, Indonesia",3 days ago,63,,On-site,,51-200 employees,,,"Company Description
Manna Indo Lakta (MIL) is a trusted breast milk booster company in Indonesia under the brand MamaBear. Since 2016, we have helped more than 3,000,000 breastfeeding mothers through 500 resellers spread across Indonesia and Philippines. MamaBear has 5 flagship products, including Breast Milk Booster Tea, Almond Oat Cookies, Powder Drink: Zoya Mix, Powder Drink: Almon Mix, and Breast Milk Storage Bags. Joining us is an opportunity for you to contribute to building the next generation.

Duties and Responsibilities: 
Lead and oversee end-to-end execution of major marketing campaigns.
Develop and implement campaign strategies to achieve objectives.
Provide guidance and support to ensure the team's success.
Collaborate with cross-functional teams to ensure seamless execution.
Monitor and analyze campaign performance metrics.
Provide insights and recommendations for optimization.
Utilize strong project management skills to oversee the end-to-end execution of campaigns, including timelines, budgets, and deliverables.
Manage campaign budgets effectively to maximize ROI
Work closely with creative, content, and digital teams to align campaign elements.

Requirements:
Bachelor's degree in Marketing, Business, or a related field.
Proven experience in campaign management, with a focus on strategic planning.
Strong leadership skills with the ability to motivate and guide a team.
Excellent project management skills, with the ability to multitask and meet tight deadlines.
Familiarity with relevant tools and platforms for campaign execution.
Analytical mindset with proficiency in performance tracking tools.
Excellent communication and collaboration skills.
Demonstrated success in managing budgets and achieving campaign goals."
3821689653,Creative Director,https://www.linkedin.com/jobs/view/3821689653,PT. Teman CEO Indonesia,https://www.linkedin.com/company/pt-teman-ceo-indonesia/life,"West Jakarta, Jakarta, Indonesia",,48,,On-site,,11-50 employees · Software Development,,,"The last 4 years have been very interesting for us. We have supported many companies to grow through digital transformation. Our integrated business software have helped companies to run their business process more efficiently, while our digital marketing team have increased the growth of their brands and most importantly, their revenue.

And now, we wanted to focus on doing it on a bigger scale. Helping many more companies to grow faster. Therefore, we are currently looking for a highly motivated, result oriented, persistent and passionate professional to join our team to fill the below position: 

Creative Director
(Jakarta)

Responsibilities:
Conceptualize and execute high-impact social media campaigns aligned with marketing objectives
Develop compelling storylines and visual identities that resonate with our target audience.
Lead and inspire a team of creatives (videographers, photographers, graphic designers) to deliver exceptional content.
Integrate emerging social media trends into a data-driven content strategy for maximum reach and engagement.
Analyze social media performance data and utilize insights to optimize content and campaign strategies.
Manage multiple projects simultaneously and meet deadlines efficiently.

Qualifications :
A visual storyteller with a Bachelor's degree and/or 2-3 years of professional experience in related field.
An eye for design, headlines, and creativity.
Independent, strong leadership, self-motivated, able to work well under pressure, team builder, fast learner.
Ability to multitask and meet deadlines while maintaining attention to detail.
Strong communication ability (oral and written).
Excellent interpersonal communication skills.
Must attach your Portfolio to your CV"
