id,title,job_url,company,company_link,location,published_at,number_of_applicants_applied,employment_duration,work_location_type,work_experience_level,company_type,company_logo,company_description,about_the_job
3778358682,Full-Stack Cloud Developer,https://www.linkedin.com/jobs/view/3778358682,Turing,https://www.linkedin.com/company/turingcom/life," ",1 month ago,1,,Remote,,"1,001-5,000 employees · IT Services and IT Consulting",https://media.licdn.com/dms/image/D4D0BAQHB79AE71th8A/company-logo_100_100/0/1688472201595/turingcom_logo?e=1712188800&v=beta&t=uetswaiWdovNMJP7hgdfWDYzXjbSme1NRN0fa3n0zxI,"Traditional recruiting wasn’t designed for today’s software-first world. The old model is simply too slow, doesn’t allow for deep vetting and takes the control and ownership out of your hands. This is why we built Turing, the world’s most deeply vetted developers and teams, matched by AI. Turing connects world-class engineers with companies to help them achieve their respective career and business goals.

Traditional recruiting is over. Welcome to the Talent Cloud.

Turing enables:
> companies to get matched to vetted remote talent at the touch of a button
> developers to achieve their elite dream career from anywhere in the world

900+ top companies, including Pepsi, Bumble, and Dell, have trusted Turing’s Talent Cloud for their engineering needs.

Recruit Developers/Engineers:
Turing combines AI and a global reach to deliver your ideal engineers tailored to your business needs. Our Talent Cloud matches you to rigorously vetted, quality remote developers.

Try Turing.com for 2 weeks risk-free at turing.com

Turing Careers:
Turing helps you get excellent remote opportunities to build a high-growth career faster.

Find high-quality remote U.S. software jobs across 15 roles and 100+ technologies.

Apply today: turing.com/jobs

—----------------------
Co-founded by @Jonathan Siddarth and @Vijay Krishnan, Turing is an AI-powered technology company disrupting the traditional recruiting model for companies seeking to engage the most deeply vetted developers and teams.

Having raised $140 million from investors, including WestBridge Capital, Foundation Capital, Stanford StartX, and execs from Google, Meta, Microsoft, and Amazon, Turing's last round was on a $4 billion valuation cap.
…
show more","A fast-growing company that aims to create a top-tier AI venture investing engine that can be personalized to meet the client's needs, is looking for a Full-Stack Cloud Developer. The developer will be working with a diverse and cross-functional team to develop a multi-user chatbot. The company discloses investment insights and related businesses while offering an extensive investment portfolio at a look. This is an amazing opportunity for candidates who are passionate about working with cutting-edge technologies while developing innovative solutions.

Job Responsibilities:

Be willing to redevelop utilizing a different tech stack if necessary
Finish the working MVP to help the organization present it to venture capitalists and get investment
Promote the last phase of the innovative platform
Assist in resolving the present bugs and enhancing the underperforming chatbot 
Examine the product's architecture and, if required, redesign it
Easily combine GCP and Azure cloud services
Use Pinecone for tasks involving vector databases
Use OpenAI APIs to access AI features

Job Requirements:

Bachelor’s/Master’s degree in Engineering, Computer Science (or equivalent experience)
At least 6+ years of relevant experience working on client-facing products
Prolific experience working with Python, Fast API and Langchain
Ability to build simple frontends following the design/specifications
Demonstrable experience working with Azure and OpenAI API
Must possess an aptitude for root-cause investigation in many tech stacks
Some prior knowledge of GitHub Actions and Linux-based VM administration is desirable 
Proficiency in debugging is preferred
Familiarity with Google Cloud Platform (GCP) and TypeScript is desirable
Excellent spoken and written English communication skills"
3781590502,Software Engineer,https://www.linkedin.com/jobs/view/3781590502,,,,,0,,IDR1/yr - IDR2/yr,,See how you compare to 3 applicants. Upgrade my plan,,,"Job Requirements

Candidate must possess at least Bachelor's Degree in IT (Information Technology) or related major
At least 3 Year(s) of working experience as Software Developer/Programmer
Excellence skills in React JS, .Net, SQL Server, JSON, Flowchart, MVC, UML

Job Responsibilities

Create new Software application
Analyze and develop current software"
3792864304,Software Engineer,https://www.linkedin.com/jobs/view/3792864304,,,,,0,,IDR1/yr - IDR2/yr,,See how you compare to 3 applicants. Upgrade my plan,,,"Job Requirements

Candidate must possess at least Bachelor's Degree in IT (Information Technology) or related major
At least 3 Year(s) of working experience as Software Developer/Programmer
Excellence skills in React JS, .Net, SQL Server, JSON, Flowchart, MVC, UML

Job Responsibilities

Create new Software application
Analyze and develop current software"
3782769510,DevOps Engineer,https://www.linkedin.com/jobs/view/3782769510,Turing,https://www.linkedin.com/company/turingcom/life," ",1 month ago,12,,Remote,,"1,001-5,000 employees · IT Services and IT Consulting",https://media.licdn.com/dms/image/D4D0BAQHB79AE71th8A/company-logo_100_100/0/1688472201595/turingcom_logo?e=1712188800&v=beta&t=uetswaiWdovNMJP7hgdfWDYzXjbSme1NRN0fa3n0zxI,"Traditional recruiting wasn’t designed for today’s software-first world. The old model is simply too slow, doesn’t allow for deep vetting and takes the control and ownership out of your hands. This is why we built Turing, the world’s most deeply vetted developers and teams, matched by AI. Turing connects world-class engineers with companies to help them achieve their respective career and business goals.

Traditional recruiting is over. Welcome to the Talent Cloud.

Turing enables:
> companies to get matched to vetted remote talent at the touch of a button
> developers to achieve their elite dream career from anywhere in the world

900+ top companies, including Pepsi, Bumble, and Dell, have trusted Turing’s Talent Cloud for their engineering needs.

Recruit Developers/Engineers:
Turing combines AI and a global reach to deliver your ideal engineers tailored to your business needs. Our Talent Cloud matches you to rigorously vetted, quality remote developers.

Try Turing.com for 2 weeks risk-free at turing.com

Turing Careers:
Turing helps you get excellent remote opportunities to build a high-growth career faster.

Find high-quality remote U.S. software jobs across 15 roles and 100+ technologies.

Apply today: turing.com/jobs

—----------------------
Co-founded by @Jonathan Siddarth and @Vijay Krishnan, Turing is an AI-powered technology company disrupting the traditional recruiting model for companies seeking to engage the most deeply vetted developers and teams.

Having raised $140 million from investors, including WestBridge Capital, Foundation Capital, Stanford StartX, and execs from Google, Meta, Microsoft, and Amazon, Turing's last round was on a $4 billion valuation cap.
…
show more","A US-based AI-powered communications platform that is revolutionizing the industry with some farsighted solutions is looking for a DevOps Engineer. The selected candidate will be responsible for the DevOps infrastructure, including running the current tools and setting the stage for long term architecture decisions. The company's advanced technology ensures conversational compliance by redacting text from transcripts and audio files in real-time. This is a nice opportunity for candidates to contribute their talent and build innovative products and features.

Job Responsibilities:

Collaborate with different teams to ensure high productivity, reliability, and scalability of built solutions
Build metrics and KPIs to judge product quality and engineering efficiency
Design and develop CI/CD pipelines and take responsibility for source code control management.
Look into architectural/code review & validation, code deployment, etc. in phased releases
Provide inputs for potential projects that can bring impactful results

Job Requirements:

Bachelor’s/Master’s degree in Engineering, Computer Science (or equivalent experience)
At least 3+ years of relevant experience as a DevOps engineer
Expertise in working with programming languages like Python, Java, Go, Perl, C#, .NET Core
Thorough knowledge of using CI tools such as Jenkins, Travis, Azure, DevOps, etc.
Understanding Node.js ecosystem (API development, Typescript, large libraries, etc.)
Ability to work with Kubernetes, Docker, or other containerization technologies
Well-versed with database technologies, release management, REST, SRE, etc.
Past experience working with Cloud platforms like AWS, Google Cloud Platform, Azure
Attention to detail, abstract thinking, and problem-solving skills
Ability to communicate efficiently with engineering managers at top software companies"
