id,title,job_url,company,company_link,location,published_at,number_of_applicants_applied,employment_duration,work_location_type,work_experience_level,company_type,company_logo,company_description,about_the_job
3778356419,Full-Stack Front-End-Heavy Developer,https://www.linkedin.com/jobs/view/3778356419,Turing,https://www.linkedin.com/company/turingcom/life," ",4 weeks ago,6,,Remote,,"1,001-5,000 employees · IT Services and IT Consulting",https://media.licdn.com/dms/image/D4D0BAQHB79AE71th8A/company-logo_100_100/0/1688472201595/turingcom_logo?e=1712188800&v=beta&t=uetswaiWdovNMJP7hgdfWDYzXjbSme1NRN0fa3n0zxI,"Traditional recruiting wasn’t designed for today’s software-first world. The old model is simply too slow, doesn’t allow for deep vetting and takes the control and ownership out of your hands. This is why we built Turing, the world’s most deeply vetted developers and teams, matched by AI. Turing connects world-class engineers with companies to help them achieve their respective career and business goals.

Traditional recruiting is over. Welcome to the Talent Cloud.

Turing enables:
> companies to get matched to vetted remote talent at the touch of a button
> developers to achieve their elite dream career from anywhere in the world

900+ top companies, including Pepsi, Bumble, and Dell, have trusted Turing’s Talent Cloud for their engineering needs.

Recruit Developers/Engineers:
Turing combines AI and a global reach to deliver your ideal engineers tailored to your business needs. Our Talent Cloud matches you to rigorously vetted, quality remote developers.

Try Turing.com for 2 weeks risk-free at turing.com

Turing Careers:
Turing helps you get excellent remote opportunities to build a high-growth career faster.

Find high-quality remote U.S. software jobs across 15 roles and 100+ technologies.

Apply today: turing.com/jobs

—----------------------
Co-founded by @Jonathan Siddarth and @Vijay Krishnan, Turing is an AI-powered technology company disrupting the traditional recruiting model for companies seeking to engage the most deeply vetted developers and teams.

Having raised $140 million from investors, including WestBridge Capital, Foundation Capital, Stanford StartX, and execs from Google, Meta, Microsoft, and Amazon, Turing's last round was on a $4 billion valuation cap.
…
show more","A rapidly-expanding company that offers geospatial data analysis services to the oil and gas development sectors is looking for a Full-Stack Front-End-Heavy Developer. The developer will be tasked with creating, implementing, and managing superior software solutions. In order to help clients make better business decisions, the company makes sure that datasets are appropriate for their needs. This is a great opportunity for candidates to showcase their talent and work in a dynamic environment.

Job Responsibilities:

Build software development solutions for the energy, gas, and oil industries 
Assist with a few major initiatives to move current desktop applications to the Cloud or Azure 
Collaborate on the product roadmap rather than just receiving instructions
Work with cross-functional teams to comprehend needs, provide technological fixes, and guarantee that they are in line with the objectives of the product

Job Requirements:

Bachelor’s/Master’s degree in Engineering, Computer Science (or equivalent experience)
At least 5+ years of relevant experience as a full-stack or front-end developer
Extensive experience working with C#/.NET/ASP.NET, Angular (9+), and TypeScript
In-depth knowledge of OpenID Connect, Mapbox, MS SQL Server, and Azure Cosmos DB is preferred
Be independent and work autonomously
Excellent spoken and written English communication skills"
3791741470,EPM Applications Developer,https://www.linkedin.com/jobs/view/3791741470,Binar Academy,https://www.linkedin.com/company/binar-academy/life," ",,1,,On-site,,201-500 employees,https://media.licdn.com/dms/image/C560BAQEBEZeoowry3A/company-logo_100_100/0/1657875033201/binar_academy_logo?e=1712188800&v=beta&t=79RrolW64elCqgu2dKcvzRMR2LqJn9ud8WNl1jCkjeY,"BINAR was born in 2017 to advance Indonesia’s technology ecosystem. Our mission is to solve digital talent gap by upskilling and job matching.

We support people to build a career in digital industry or upskilling into digital related roles with the knowledge and skills needed to thrive through a structured learning journey and multiple learning styles to ensure each learner can reach mastery through their own preferred way.

Our upskilling programs are designed to provide learners with first-hand exposure to the real world and prepare them with skills critically needed by the industries in this fast-changing digital era.

Also, we help students and companies to connect and build great teams.
Fueled by industry change, BINAR for Business helps companies achieve critical business outcomes and stay competitive by offering relevant and personalized learning experiences.

Advance your career, show off your skills, grow your business and get ready to #SelangkahDiDepan with BINAR.

Learn more about us:
Website: www.binaracademy.com
Instagram: @academybinar
Youtube: https://www.youtube.com/binaracademy

BINAR Apps is available on the Google Play store and iOS. Download BINAR app on:
- Apple Store: https://bit.ly/BinarAppsAppStore
- Google Play Store: https://bit.ly/BinarAppsPlayStore
…
show more","Binar Academy aims to unlock and channel human potential so we can help the world turn into a better place. One of the ways we strive to do that is to channel potential talents to impactful opportunities using our very own job connector, Binar Job Connect.

Binar Job Connect is currently looking for EPM Applications Developer for our hiring partner. This opportunity will allow you to be hired and work for Indonesia's state-owned bank (BUMN), Financial Company, Insurance Company, and Fintech Company.

Role Description
This is a contract, on-site role located in Jakarta, Indonesia for an EPM Applications Developer. The EPM Applications Developer will be responsible for developing applications (New Applications, Change Requests, and Bug Fixing) EPM IBM Cognos TM1 Planning Analytics for users at Astra International Head Office in accordance with predetermined assignments and schedules. The EPM Applications Developer will collaborate with cross-functional teams to identify business requirements and provide customized solutions.

Qualifications
Bachelor's degree or higher in Computer Science, Information Systems, or a related field
2+ years of experience in Oracle Hyperion Enterprise Performance Management (EPM) software development, including Hyperion Planning, Hyperion Financial Management (HFM), Hyperion Essbase, and Oracle Business Intelligence (OBIEE)
Preferred to have minimum 1 year using IBM Cognos TM1 Planning Analytics / SAP BPC / SAP BCS / Oracle Hyperion / Anaplan or any related financial planning and consolidation application.
IBM Cognos TM1 Planning Analytics / SAP BPC / SAP BCS / Oracle Hyperion / Anaplan or any related financial planning and consolidation application, business knowledge related to corporate planning, budgeting and/or treasury, Microsoft Office Excel VB Macro
Experience with Essbase Load Rules and Calc Scripts, MaxL, Web forms, SmartView, and Financial Reporting
Experience with Java, JavaScript, PL/SQL, and HTML
Experience with web services, SOAP, REST APIs, and XML
Knowledge of software development lifecycle (SDLC), agile methodologies, and software engineering best practices
Strong analytical, problem-solving, and communication skills with high attention to detail and accuracy
Ability to work well independently and collaboratively with cross-functional teams.
Excellent written and spoken English communication skills.
Experience with internationalization and localization is a plus.

Benefit:
Salary (include BPJS, transport & communication allowance)
Annual leave
Laptop loan
People Development

If this application can no longer be applied, you can fill out form or see other #vacancies here: https://bit.ly/JobConnectRegist."
3782773106,Senior Full-Stack Cloud Native Engineer,https://www.linkedin.com/jobs/view/3782773106,Turing,https://www.linkedin.com/company/turingcom/life," ",1 month ago,0,,Remote,,"1,001-5,000 employees · IT Services and IT Consulting",https://media.licdn.com/dms/image/D4D0BAQHB79AE71th8A/company-logo_100_100/0/1688472201595/turingcom_logo?e=1712188800&v=beta&t=uetswaiWdovNMJP7hgdfWDYzXjbSme1NRN0fa3n0zxI,"Traditional recruiting wasn’t designed for today’s software-first world. The old model is simply too slow, doesn’t allow for deep vetting and takes the control and ownership out of your hands. This is why we built Turing, the world’s most deeply vetted developers and teams, matched by AI. Turing connects world-class engineers with companies to help them achieve their respective career and business goals.

Traditional recruiting is over. Welcome to the Talent Cloud.

Turing enables:
> companies to get matched to vetted remote talent at the touch of a button
> developers to achieve their elite dream career from anywhere in the world

900+ top companies, including Pepsi, Bumble, and Dell, have trusted Turing’s Talent Cloud for their engineering needs.

Recruit Developers/Engineers:
Turing combines AI and a global reach to deliver your ideal engineers tailored to your business needs. Our Talent Cloud matches you to rigorously vetted, quality remote developers.

Try Turing.com for 2 weeks risk-free at turing.com

Turing Careers:
Turing helps you get excellent remote opportunities to build a high-growth career faster.

Find high-quality remote U.S. software jobs across 15 roles and 100+ technologies.

Apply today: turing.com/jobs

—----------------------
Co-founded by @Jonathan Siddarth and @Vijay Krishnan, Turing is an AI-powered technology company disrupting the traditional recruiting model for companies seeking to engage the most deeply vetted developers and teams.

Having raised $140 million from investors, including WestBridge Capital, Foundation Capital, Stanford StartX, and execs from Google, Meta, Microsoft, and Amazon, Turing's last round was on a $4 billion valuation cap.
…
show more","A U.S.-based company that is committed to revolutionizing the way computers enhance users' lives through their top-notch operating systems, is looking for a Senior Full-Stack Cloud Native Engineer. The engineer will be responsible for creating, implementing, verifying, maintaining, and improving extensive software systems. The company is developing an operating system with a customized natural language user interface. During their Seed round of funding, the company managed to securely raise more than $18mn in funding.

Job Responsibilities:

Note: This is an AI-related job. It is primarily focused on training and evaluating large language models and foundation models, rather than building features.
Lead technical teams on projects with a significant impact
Motivate and mentor a remote engineering team
Promote team consensus and understanding around objectives, results, and deadlines
Control the deliverables, deadlines, and priorities of projects

Job Requirements:

Bachelor’s/Master’s degree in Engineering, Computer Science (or equivalent experience)
At least 4+ years of relevant experience as a full-stack engineer
2+ years' worth of experience managing an engineering team as a tech lead
Extensive experience working with TypeScript, React, Node.js, and Next.js
Prolific experience with Kubernetes, Docker, and Cloud technologies like AWS, GCP, or Azure
Demonstrable experience with Kubernetes, Docker, and NoSQL Databases
Some understanding of Web Scrapping technologies like Plawright, Selenium, or Puppeteer
Familiarity with WebRTC, VNC, and Monitoring
Some development experience of Cloud Native apps
In-depth knowledge of web scraping technologies.
Prior design documentation authoring experience
Consideration to those with prior experience finding, vetting, and interviewing job candidates
Nice to have previous management expertise, such as performing performance reviews
Some prior experience as an engineer at a major, 100-person IT organization
Preferably, worked for a startup in its early stages with fewer than ten engineers
Excellent English communication skills, both written and spoken"
3782771269,Systems Engineer,https://www.linkedin.com/jobs/view/3782771269,Turing,https://www.linkedin.com/company/turingcom/life," ",1 month ago,9,,Remote,,"1,001-5,000 employees · IT Services and IT Consulting",https://media.licdn.com/dms/image/D4D0BAQHB79AE71th8A/company-logo_100_100/0/1688472201595/turingcom_logo?e=1712188800&v=beta&t=uetswaiWdovNMJP7hgdfWDYzXjbSme1NRN0fa3n0zxI,"Traditional recruiting wasn’t designed for today’s software-first world. The old model is simply too slow, doesn’t allow for deep vetting and takes the control and ownership out of your hands. This is why we built Turing, the world’s most deeply vetted developers and teams, matched by AI. Turing connects world-class engineers with companies to help them achieve their respective career and business goals.

Traditional recruiting is over. Welcome to the Talent Cloud.

Turing enables:
> companies to get matched to vetted remote talent at the touch of a button
> developers to achieve their elite dream career from anywhere in the world

900+ top companies, including Pepsi, Bumble, and Dell, have trusted Turing’s Talent Cloud for their engineering needs.

Recruit Developers/Engineers:
Turing combines AI and a global reach to deliver your ideal engineers tailored to your business needs. Our Talent Cloud matches you to rigorously vetted, quality remote developers.

Try Turing.com for 2 weeks risk-free at turing.com

Turing Careers:
Turing helps you get excellent remote opportunities to build a high-growth career faster.

Find high-quality remote U.S. software jobs across 15 roles and 100+ technologies.

Apply today: turing.com/jobs

—----------------------
Co-founded by @Jonathan Siddarth and @Vijay Krishnan, Turing is an AI-powered technology company disrupting the traditional recruiting model for companies seeking to engage the most deeply vetted developers and teams.

Having raised $140 million from investors, including WestBridge Capital, Foundation Capital, Stanford StartX, and execs from Google, Meta, Microsoft, and Amazon, Turing's last round was on a $4 billion valuation cap.
…
show more","A U.S.-based company that offers consolidated, enterprise-level technologies to make it simple for companies to manage their carriers, business regulations, and shipments, is looking for a Systems Engineer. The engineer will be responsible for creating and implementing code for integration projects, independently and in collaboration with others. The company offers comprehensive, integrated, and automated shipping solutions that simplify and cut unnecessary costs. This is an amazing opportunity for candidates who are eager to work with a professional team while testing their mettle.

Job Responsibilities:

Update, maintain, and enhance current software products
Determine and evaluate the effects of changes to current projects
Test, debug, and resolve problems throughout the whole technology stack
Work together with coworkers in the organization for product development
Aid in enhancing technical tools and infrastructure 
Performing daily duties largely independently
Interact with clients and non-technical personnel with ease
Assume responsibility for deliverables individually or as a team and support the project migration to GitHub
Assist with creating a strategy for utilizing GitHub with upcoming advancements (policy, procedures, and training)

Job Requirements:

Bachelor’s/Master’s degree in Engineering, Computer Science (or equivalent experience)
At least 3+ years of relevant experience as a Systems Engineer
Demonstrable experience working with .NET, .NET Core, C#, and SQL Server databases
Prolific experience working with ASP.Net, MVC, and SOAP XML web services 
Solid understanding of Unit and Regression testing
Prior experience with SQL Server development and maintenance 
In-depth knowledge of jQuery, JavaScript, and GitHub
Demonstrable experience of production-quality work is nice to have
Possesses a strong understanding of the creation and deployment of both back-end and front-end systems 
Demonstrable experience using REST API patterns 
Solid understanding of the principles of continuous integration and deployment
Excellent English communication skills, both spoken and written"
3778358929,Full-Stack Front-End-Heavy Developer,https://www.linkedin.com/jobs/view/3778358929,Turing,https://www.linkedin.com/company/turingcom/life," ",4 weeks ago,5,,Remote,,"1,001-5,000 employees · IT Services and IT Consulting",https://media.licdn.com/dms/image/D4D0BAQHB79AE71th8A/company-logo_100_100/0/1688472201595/turingcom_logo?e=1712188800&v=beta&t=uetswaiWdovNMJP7hgdfWDYzXjbSme1NRN0fa3n0zxI,"Traditional recruiting wasn’t designed for today’s software-first world. The old model is simply too slow, doesn’t allow for deep vetting and takes the control and ownership out of your hands. This is why we built Turing, the world’s most deeply vetted developers and teams, matched by AI. Turing connects world-class engineers with companies to help them achieve their respective career and business goals.

Traditional recruiting is over. Welcome to the Talent Cloud.

Turing enables:
> companies to get matched to vetted remote talent at the touch of a button
> developers to achieve their elite dream career from anywhere in the world

900+ top companies, including Pepsi, Bumble, and Dell, have trusted Turing’s Talent Cloud for their engineering needs.

Recruit Developers/Engineers:
Turing combines AI and a global reach to deliver your ideal engineers tailored to your business needs. Our Talent Cloud matches you to rigorously vetted, quality remote developers.

Try Turing.com for 2 weeks risk-free at turing.com

Turing Careers:
Turing helps you get excellent remote opportunities to build a high-growth career faster.

Find high-quality remote U.S. software jobs across 15 roles and 100+ technologies.

Apply today: turing.com/jobs

—----------------------
Co-founded by @Jonathan Siddarth and @Vijay Krishnan, Turing is an AI-powered technology company disrupting the traditional recruiting model for companies seeking to engage the most deeply vetted developers and teams.

Having raised $140 million from investors, including WestBridge Capital, Foundation Capital, Stanford StartX, and execs from Google, Meta, Microsoft, and Amazon, Turing's last round was on a $4 billion valuation cap.
…
show more","A rapidly-expanding company that offers geospatial data analysis services to the oil and gas development sectors is looking for a Full-Stack Front-End-Heavy Developer. The developer will be tasked with creating, implementing, and managing superior software solutions. In order to help clients make better business decisions, the company makes sure that datasets are appropriate for their needs. This is a great opportunity for candidates to showcase their talent and work in a dynamic environment.

Job Responsibilities:

Build software development solutions for the energy, gas, and oil industries 
Assist with a few major initiatives to move current desktop applications to the Cloud or Azure 
Collaborate on the product roadmap rather than just receiving instructions
Work with cross-functional teams to comprehend needs, provide technological fixes, and guarantee that they are in line with the objectives of the product

Job Requirements:

Bachelor’s/Master’s degree in Engineering, Computer Science (or equivalent experience)
At least 5+ years of relevant experience as a full-stack or front-end developer
Extensive experience working with C#/.NET/ASP.NET, Angular (9+), and TypeScript
In-depth knowledge of OpenID Connect, Mapbox, MS SQL Server, and Azure Cosmos DB is preferred
Be independent and work autonomously
Excellent spoken and written English communication skills"
3645738040,Senior Oracle Engineer,https://www.linkedin.com/jobs/view/3645738040,Traveloka,https://www.linkedin.com/company/traveloka/life," ",7 months ago,57,,On-site,,"1,001-5,000 employees · Software Development",https://media.licdn.com/dms/image/D560BAQGe_izwxvj_SQ/company-logo_100_100/0/1700635813325/traveloka_logo?e=1712188800&v=beta&t=VKJUx8BZomGFW6QdHfexYEryZ1npU3aI597TfFvWhNo,"We don’t innovate for the sake of innovation, we utilize technology to simplify people’s lives so they can enjoy their lives better. That belief is what brought Traveloka to be the leading travel platform in Southeast Asia. Traveloka serves 20+ products that include comprehensive travel services. From transportations to accommodations, discovering nearby attractions, and insurance products to financial services, including the groundbreaking ‘Buy Now Pay Later’.

With 100+ millions downloads in six countries across the SEA region, we aim to keep exploring for better innovations — all to fulfill our users’ travel aspirations so they can enjoy their lives, their way.
…
show more","It's fun to work in a company where people truly BELIEVE in what they're doing!

Job Description

As an Oracle EBS Engineer, you will be responsible for building customizations, extensions, modifications, localizations or integrations to the existing product and also develop reports using the developer tools to cater to business specific reporting needs. Technical consultants are expected to work on development activities and managing custom application development projects, customization and extension of Oracle Applications.

Oracle EBS Engineer is expected to work closely with Functional consultants to understand the requirements and then undertake technical design and produce software component designs and specifications as per the functional design. Once the software components are developed then he needs to test the components viz. reports, workflow, interfaces, customizations, data migration scripts etc. He is also required to carry out audits and participate in technical walk through. The successful candidate will encounter challenges related to Oracle information systems, business process and technology.

Requirements

Bachelor's degree in Computer Science or equivalent from a reputable university with good academic results.
At least 5 years of strong Oracle engineering skills with PLSQL, Java, Shell Scripting knowledge.
Extensive experience in Oracle RDBMS with backend development, performance tuning, Table Architecture and Normalization.
Experience in EBS developer suites such as Forms & Report Builder, BI Publisher, SQL Developer, Workflow Builder and JDeveloper.
Experience working with Finance and Procurement modules with minimum 3 implementation project experience.
Experience in creating interfaces through standard API’s, Interface tables and data loading.
Experience in implementing MD70 and MD120 Documentation for all internal initiatives.
Strong object-oriented analysis and design skills.
Experience in version control tools and familiarity with development collaboration tools such as Github.
Passion in software engineering, application development, or systems development.
Good business acumen, excellent problem skills and broad understanding of software and system design.
Curiosity to explore creative solutions and try new things to solve challenging problems to pull it all together into a user accepted solution.
Participation in multiple end-to-end implementations of system integration, data migration, internal business applications, or configuring vendor-provided solutions.
Excellent interpersonal, communication, and influence skills and personal maturity.

Good to Have

Experience in maintaining infrastructure in cloud such as AWS/GCP/Azure 
Knowledge/Experience in creating interfaces using UTL_HTTP or Integrated SOA Gateway 
Knowledge of EBS administration to effectively work with internal DBA
Understanding of Oracle Licensing

If you like wild growth and working with happy, enthusiastic over-achievers, you'll enjoy your career with us!"
