id,title,job_url,company,company_link,location,published_at,number_of_applicants_applied,employment_duration,work_location_type,work_experience_level,company_type,company_logo,company_description,about_the_job
3784366249,Full Stack Developer (Media Fakta Global (Fakta.com)),https://www.linkedin.com/jobs/view/3784366249,Dealls,https://www.linkedin.com/company/dealls/life," ",3 weeks ago,5,,On-site,,See how you compare to 5 applicants. Try Premium for IDR0,,,"🙌🏻 About Us

FaktaCom merupakan media massa konvergen pertama di Indonesia, di mana informasi, data, berita, analisis, hingga opini dari masyarakat akan disajikan dalam format integrasi (integrated media), dengan lebih dulu dilakukan filtrasi (gate keeping) melalui sidang redaksi dan fitur teknologi informasi berbentuk kecerdasaan buatan (artificial intelligence). Upaya filtrasi FaktaCom dilakukan demi menjaga aspek validitas, kebergunaan, hingga tingkat eksposur informasi atau data yang dimunculkan. Ayo dukung jurnalisme yang sehat demi demokrasi Indonesia yang kuat!

💰Salary

Very competitive

👑 Job Role

Merancang dan mengembangkan UI/UX pengguna yang responsif dan menarik
Membangun dan mengelola server, database, dan aplikasi server-side
Menyusun API yang efisien untuk mendukung interaksi antara front-end dan back-end
Desain dan mengelola struktur database
Mengidentifikasi dan mengatasi potensi kerentanan keamanan
Melakukan pembaruan keamanan dan pemantauan secara berkala
Melakukan optimasi performa untuk meningkatkan kecepatan dan efisiensi

⛩️ Requirements

Pengalaman yang solid sebagai Full Stack Developer atau peran pengembangan serupa
Keterampilan mendalam dalam pengembangan front-end menggunakan HTML, CSS, dan JavaScript
Penguasaan setidaknya satu framework front-end (contoh: React, Angular, atau Vue)
Kemampuan dalam pengembangan back-end menggunakan bahasa seperti Node.js, Python, atau Java
Pengalaman dalam pengelolaan database, baik SQL maupun NoSQL
Pengetahuan tentang keamanan aplikasi dan praktik terbaik
Kemampuan bekerja sama dalam tim dan berkomunikasi dengan jelas
Lulusan dengan gelar sarjana (S1) dalam bidang Ilmu Komputer atau bidang terkait
Portofolio proyek-proyek pengembangan yang berhasil akan dihargai

🎁 Perks

Competitive Salary
THR / Bonus system
Medical Insurance"
3785528660,Python Developer,https://www.linkedin.com/jobs/view/3785528660,AVOMIND,https://www.linkedin.com/company/avomind/life," ",3 weeks ago,29,,On-site,,11-50 employees · Staffing and Recruiting,https://media.licdn.com/dms/image/D4E0BAQG2H9y2EhPDxw/company-logo_100_100/0/1704357936451/avomind_logo?e=1712188800&v=beta&t=QILBi8RJbO_wF9dBGKbKopZWWbZKPf3chbwEF3gD0p8,"Avomind is a go to firm to hire commercial, strategy and analytics & insights talent globally.

Our global network - serviced from Berlin, London, Barcelona, Miami, Jakarta and Singapore is built up of partnerships with >200 leading academic institutions; 25 leading MBA programs and 45 tech institutions

We provide our clients with unlimited access to our network and offer custom recruitment; embedded hiring and talent branding services.

Speed is our care value - do expect a first project input within 24 hours. 75% of the hired candidates are part of the 1st week’s batch, that we would deliver on a project.","Job Description:

Translation of the UI/UX design wireframes to actual code that will produce visual elements of the application using Angular 2 framework.
Architect efficient and reusable front-end systems that drive complex we applications
Unit-test code for robustness, including edge cases, usability, and general reliability.
Design and develop Rest Apis as backend services using python frameworks for Cloud platforms.
Hands on knowledge of Django and REST API concepts
Work in agile environment with product management team to understand and develop product features in the defined technology stack


Requirements:

Bachelor’s degree in Computer Science, Information Technology, or a related field.
Strong communication and collaboration skills within a team environment.
Have a good communication in English is a must
Proficiency in Linux OS
Proficient in Programming languages: Python framework (Flask, Django), TypeScript (Angular)
Familiarity with RDBMS (PostgreSQL, MySQL, SQL Server), NoSQL databases (Redis, MongoDB),
Experience writing REST API.
Proficient use of Git version control system
Experience in designing front-end interfaces using Angular(2) UI framework.
Knowledge and practical experience in cloud development, particularly Azure or Google cloud.
Understanding and experience in CI/CD ( Continuous Integration / Continuous Deployment) development processes.


Work hour: Hybrid

Salary: Rp 20.000.000 - Rp 30.000.000

Benefit: Learning & Network Opportunities, Professional Development, BPJS TK and Kesehatan, Insurance (Sinarmas), Laptop, THR, Annual leave (14 days)"
3769417643,"Senior/Staff Software Engineer, Codashop",https://www.linkedin.com/jobs/view/3769417643,Coda Payments,https://www.linkedin.com/company/coda-payments/life," ",2 months ago,10,,Hybrid,,"501-1,000 employees · Internet Publishing",https://media.licdn.com/dms/image/C560BAQGPvgUuumAyZw/company-logo_100_100/0/1630672427695/coda_payments_logo?e=1712188800&v=beta&t=TfAjQr4dhQj9GcjGVSV5lyXyG4Zbg_hoaMX-LoUjqCk,"We take life’s digital experiences over the top by enabling users to bring more creativity and self-expression to their play - no matter who or where they are.

Founded in 2011, Coda Payments (“Coda”) is the leading provider of secure, cross-border monetisation solutions for digital products and services in more than 60 markets. Through our three services: Codashop, xShop, and Codapay, we help a range of top digital content publishers worldwide, such as Activision Blizzard (Call of Duty: Mobile, Diablo Immortal), Riot Games (VALORANT, League of Legends: Wild Rift), Moonton (Mobile Legends: Bang Bang), Garena (Free Fire), Tencent (PUBG Mobile), beIN, Bigo Live, Tinder, and Viu to monetise their content and unlock new revenue streams.

Today, Coda has more than 500 people in 35+ countries who are working towards the same mission: to offer our customers the best value, experience and entertainment every day, without fail.

If you want to make an impact in taking life’s digital experiences over the top, join us!

- We are backed by Smash Capital, Insight Partners, GIC, Apis Partners and GMO Global Payment Fund (affiliated with Japan’s largest online payment gateway).
- In 2022, we are named the 5th fastest growing fintech company in the APAC by the Financial Times, the 13th fastest growing company in Singapore by the Straits Times, and a Technology Pioneer by the World Economic Forum.
- Our headquarters are in Singapore, with 11+ offices worldwide and 35+ remote locations, including South Korea, Egypt and France.

We are an equal opportunity employer that is committed to cultivating an inclusive environment for all employees, and we welcome the diversity that you will bring!","What we do

At Coda, we break down barriers between publishers and their audiences by thinking outside of the app. Coda is trusted by 300+ top digital content publishers – including industry giants Activision Blizzard, Bigo, Electronic Arts, Riot Games, and Zynga – to grow revenue, profit margins, and customer engagement in 60+ markets with ease. For publishers, this means less lift, more players and more payers. For players, Coda’s solutions allow them to pay for play their way.

Our winning formula? A laser-focused, pragmatic attitude coupled with an unwavering commitment to excellence. We are customer-centric, creative, and solution-oriented, always delivering to our users the top-tier entertainment content they want at competitive prices.

If you’re ambitious, bold and ready to take your career to the next level, get in touch!

Engineering - Technology at Coda

At Coda, our goal is to make our mark in the high-volume payments and e-commerce industry – and we are levelling up fast. To stay in stride with the dynamic environment, we focus on building robust, distributed systems that can effortlessly handle traffic spikes. Moreover, our ambitious roadmap necessitates innovative tools to streamline the development lifecycle and sustain our swift momentum.

We place great value on balancing teamwork with individual autonomy, allowing our teams to make the most of modern cloud infrastructure. Our tech stack is solidly based on AWS cloud, with a keen interest in infrastructure-as-code and the creation of new microservices via the Quarkus framework. Our toolbox includes JSON and GRPC, multiple data storage integrations, queues, OpenTelemetry, and more.

But what truly defines us? It's our incredible team. We hire top talent and give them the freedom to push Coda's technology and products to exciting new levels. We believe that genius can strike anywhere, so we promote ownership and cultivate a servant leadership culture that lets engineers take the reins on features.

About The Role

We are looking for a proactive, driven engineer who is hungry to contribute using their deep and fundamental knowledge in software development and automation. You will be responsible for the architecture, development, and evolution of key products and features at Coda.

About The Codashop Team

The Codashop Team owns our B2C e-commerce marketplace for in-app purchases. Codashop.com allows tens of millions of users each month to benefit from our direct relationships with publishers and payment channels. We currently operate in over 50 countries and growing. Our aim is to always provide the best value, delightful user experiences, and a highly secure platform for accessing the best digital content globally. We need engineers who want to collaborate on complex problems in an exciting and growing space.

Responsibilities

Design and develop highly scalable, reliable, secure, and fault-tolerant systems end to end using state of the art technology
Work directly with Product and Technology team members to define and implement complex features
Collaborate with other team members to learn and share best practices
Understand and constantly optimize our products, identifying and fixing problems, improving stability and user experience
Take operational responsibility for the services that are owned by your team
Debug production issues across services
Participate in on-call rotations as needed (we support a healthy work/life balance, so we invest in minimizing out-of-office interruptions and we use rotations to minimize on-call days)


Requirements

At least 2 years of experience in software development
A bachelor’s degree in computer science, engineering, mathematics, or a related field (or equivalent experience)
Strong knowledge of one or more programming languages (Java, Scala, Kotlin, Groovy, Go, C/C++, Rust, Python, C#, etc.) and the ability to learn new programming languages quickly
Strong understanding of software architecture
Understanding of data systems and how to query/interact with them (RDBMS, NoSQL, Queues, etc.)
A desire to build automation into everything you do, including implementing state of the art CI/CD practices and test automation
Understanding of agile methodologies (e.g. Scrum)
Good command of the English language and the ability to communicate effectively


Bonus if you have

Experience building high scale APIs
Knowledge of AWS and cloud technologies such as lambdas and containerization
Experience in FinTech or related fields requiring strong security discipline


Working at Coda

Joining the Coda team means diving into a fast-paced, challenging, and exciting world. With Codans spread across over 30 countries around the world, our highly collaborative environment breaks down time zones and cultural barriers, empowering you to chase innovative ideas, contribute to Coda’s growth, and make a lasting impact.

If you have a passion for pushing boundaries, and thrive on continuous improvement through experimentation, we'd love to hear from you!

Our Perks*

WFH / Hybrid Support: Get a monthly allowance to cover your work-from-home expenses and keep you connected.

Wellness Boost: Stay healthy with resources for physical and mental well-being with our flexible benefits and Employee Assistance Program - because you matter!

Customized Benefits: Tailor your benefits with our flexible plan.

Growth Opportunities: Unlock your potential through clear progression paths.

Skill Development: Access training resources to fuel your personal and professional growth.

Volunteer Time Off: Enjoy paid time off to make a difference in the world through volunteering.

Family Care: Take advantage of paid Family Care Leave to bond with your family, while our selected Flexible Benefits also cater to your family's needs.

Benefits are reviewed and updated on a yearly basis


We are proud to be an equal opportunity employer, embracing the unique qualities of every individual, regardless of gender, race, age, religion, disability, or other local protected classes. Our goal is to foster an inclusive environment where everyone feels welcome and valued.

Due to the large number of exceptional applications we receive, we can only reach out to shortlisted candidates. If you don't hear from us, rest assured there may be another opportunity at Coda that aligns better with your unique abilities. Remember to check our Careers Page for more exciting job openings!"
3620766054,Lead Software Engineer (Bangkok based – Relocation provided),https://www.linkedin.com/jobs/view/3620766054,Agoda,https://www.linkedin.com/company/agoda/life," "," ",154,,Hybrid,,"5,001-10,000 employees · Software Development",https://media.licdn.com/dms/image/C4D0BAQGBa_7QNZNwpw/company-logo_100_100/0/1656643826660/agoda_logo?e=1712188800&v=beta&t=Uch6o32VIVJnqd5pOyN6ISz8TvEijuYR_vC1w3EK8HQ,"Agoda is transforming travel for millions of customers across the globe.

Headquartered in Asia, Agoda is one of the world’s largest online travel platforms. Founded in 2005 and now part of Booking Holdings (Nasdaq:BKNG), Agoda has a network of over 2,900,000 properties worldwide. Our web and mobile products provide a first-rate reservation service in 38 languages that uniquely combines local knowledge and local connections to provide the best deals for business and leisure travelers.

Agoda employs over 7,000 professionals from 90 nationalities in locations around the globe. In every department – from engineering to customer experience – we provide an environment rich with creativity, collaboration, and experimentation, and the tools to work faster and smarter.

At Agoda, we believe our people are our strength. We work hard and have fun, and we choose people who are dedicated to making things great.

For properties seeking partnership with Agoda, visit https://connect.agoda.com","About Agoda

Agoda is an online travel booking platform for accommodations, flights, and more. We build and deploy cutting-edge technology that connects travelers with more than 3.6 million accommodations globally. Based in Asia and part of Booking Holdings, our 6,000+ employees representing 90+ nationalities foster a work environment rich in diversity, creativity, and collaboration. We innovate through a culture of experimentation and ownership, enhancing the ability for our customers to experience the world.

Get to Know our Team:

In Agoda’s Back End Engineering department, we build the scalable, fault-tolerant systems and APIs that host our core business logic. Our systems cover all major areas of our business: inventory and pricing, product information, customer data, communications, partner data, booking systems, payments, and more. These mission-critical systems change frequently with dozens of releases per day, so we must employ state-of-the-art CI/CD and testing techniques in order to make sure everything works without any downtime. We also ensure that our systems are self-healing, responding gracefully to extreme loads or unexpected input. In order to accomplish this, we use state-of-the-art languages like Scala and Go, data technologies like Kafka and Aerospike, and agile development practices. Most importantly though, we hire great people from all around the world and empower them to be successful. Whether it’s building new projects like Flights and Packages or reimagining our existing business, you’ll make a big impact as part of the Back End Engineering team.

The Opportunity:

Agoda Platform team is looking for developers to work on mission critical systems that deals with the designing and development of a system that serves millions of users a day.

What you’ll Need to Succeed:

8+ years’ experience under your belt developing performance-critical applications that run in a production environment using Scala and Java
A minimum of one year of experience with Scala
You have RDBMS knowledge (SQL Server, Oracle, MySql or other)
You have a Good command of the English language
You are passionate about the craft of software development and constantly work to improve your knowledge and skills

It’s Great if you have:

Knowledge in one or more of the following: NoSQL (especially, but not only Cassandra), Queueing system experience (Kafka, RabbitMQ, ActiveMQ, MSMQ), Play framework, Akka library 

#sanfrancisco #sanjose #losangeles #sandiego #oakland #denver #miami #orlando #atlanta #chicago #boston #detroit #newyork #portland #philadelphia #dallas #houston #austin #seattle #sydney #melbourne #perth #toronto #vancouver #montreal #shanghai #beijing #shenzhen #prague #Brno #Ostrava #cairo #alexandria #giza #estonia #paris #berlin #munich #hamburg #stuttgart #cologne #frankfurt #hongkong #budapest #jakarta #bali #dublin #telaviv #milan #rome #tokyo #osaka #kualalumpur #amsterdam #oslo #manila #warsaw #krakow #bucharest #moscow #saintpetersburg #capetown #johannesburg #seoul #barcelona #madrid #stockholm #zurich #taipei #bangkok #Phuket #istanbul #london #manchester #edinburgh #kiev #hcmc #hanoi #wroclaw #poznan #katowice #rio #salvador #IT #4 #5

Equal Opportunity Employer 

At Agoda, we pride ourselves on being a company represented by people of all different backgrounds and orientations. We prioritize attracting diverse talent and cultivating an inclusive environment that encourages collaboration and innovation. Employment at Agoda is based solely on a person’s merit and qualifications. We are committed to providing equal employment opportunity regardless of sex, age, race, color, national origin, religion, marital status, pregnancy, sexual orientation, gender identity, disability, citizenship, veteran or military status, and other legally protected characteristics.

We will keep your application on file so that we can consider you for future vacancies and you can always ask to have your details removed from the file. For more details please read our privacy policy .

To all recruitment agencies: Agoda does not accept third party resumes. Please do not send resumes to our jobs alias, Agoda employees or any other organization location. Agoda is not responsible for any fees related to unsolicited resumes."
3607477867,Lead Software Engineer,https://www.linkedin.com/jobs/view/3607477867,Mekari,https://www.linkedin.com/company/mekari/life," ",8 months ago,107,,Full-time,,"1,001-5,000 employees · Software Development",https://media.licdn.com/dms/image/D560BAQEy-QSiDSQhLQ/company-logo_100_100/0/1689148487268/mekari_logo?e=1712188800&v=beta&t=ASFmiiQJqaGA4D_OR_etEQJRg5pK5i62fYgGOoK9i1o,"Mekari is the #1 Software-as-a-Service (SaaS) company in Indonesia, aiming to empower the progress of businesses and professionals across various industries.

Our innovative cloud-based technology solution in HR (Mekari Talenta), Accounting (Mekari Jurnal), Sales (Mekari Qontak), Tax (Mekari Klikpajak), Electronic Signature (Mekari Sign), and Benefits (Mekari Flex) have been used by tens thousands of businesses in Indonesia.

To reach millions, we need more people like you —those eager to innovate, lead, and win with us.
…
show more","Mekari is Indonesia's no. 1 Software-as-a-Service (SaaS) company. Our mission is to empower businesses and professionals to progress effortlessly. Our products (Mekari Talenta, Mekari Jurnal, Mekari KlikPajak, & Mekari Qontak) have been used by tens of thousands of businesses in Indonesia.

To reach millions, we need more people like you: entrepreneurs, builders, owners inside the company who are eager to grow at scale. Join us to empower more businesses with technology.

Job Descriptions

Lead a squad of 3-4 passionate engineers
Work closely with Product Manager and other business stakeholders to design solutions that delight our customers
Architect and develop high-quality software solutions
Work with Technical Program Manager to run development lifecycle (concept, design, test, release, support)
Work closely with DevOps to maintain the application in our infrastructure
Mentor junior developers to develop their skills
Manage knowledge within the team in form of written documentation surrounding technical requirements, deployments, and post-mortems.

Requirements/Qualifications

At least 6 months of experience in technically leading a software project. Experience as a people manager is a huge plus.
At least 4 years of experience in developing a medium-scale web and/or backend service as a team.
Solid understanding of modern software engineering practices such as TDD, continuous integration, code review, and microservices design patterns
Familiarity with software development methodologies and frameworks such as Agile, XP, and Scrum
Familiarity with containers and container orchestration
Excellent communication skills, written and verbal, with a focus on collaboration, understanding, and information sharing between team members and stakeholders
Willingness to learn the tech stack being used by the team, primarily Ruby on Rails and VueJs

What You Will Get

 Competitive salary + daily allowance.
 Premium private health insurance (outpatient, inpatient, maternity, dental).
 Early access to salary + flex installment (employee loan) via Mekari Flex.
 Allowance for sports activities and glasses/contact lenses.
 Flexible working hours and remote work culture with free co-working space services.
 Annual and unpaid leaves from day 1 of join date + unlimited sick leave with doctor note.
 Notebook Ownership Program.
 Strategic office location, accessible by MRT.
 Friendly and dynamic work environment.
 Opportunity to take part in growing Indonesia's no. 1 SaaS company

Our team will review your application and will be in touch if your application is shortlisted to the next stage. If you do not hear from us in 30 days, we will keep your resume on file in case a relevant opportunity opens up.

Don't forget to check our Recruitment FAQ at bit.ly/RecruitmentFAQ-Mekari [ENG] or bit.ly/RekrutmenMekari-FAQ [INA] to find the answers to commonly-asked questions regarding our recruitment process.

We wish you the best. Hope to see you around soon!"
