id,title,job_url,company,company_link,location,published_at,number_of_applicants_applied,employment_duration,work_location_type,work_experience_level,company_type,company_logo,company_description,about_the_job
3792012468,Lead Machine Learning Operations Engineer,https://www.linkedin.com/jobs/view/3792012468,Agoda,https://www.linkedin.com/company/agoda/life," ",1 week ago,3,,Full-time,,"5,001-10,000 employees · Software Development",https://media.licdn.com/dms/image/C4D0BAQGBa_7QNZNwpw/company-logo_100_100/0/1656643826660/agoda_logo?e=1712188800&v=beta&t=Uch6o32VIVJnqd5pOyN6ISz8TvEijuYR_vC1w3EK8HQ,"Agoda is transforming travel for millions of customers across the globe.

Headquartered in Asia, Agoda is one of the world’s largest online travel platforms. Founded in 2005 and now part of Booking Holdings (Nasdaq:BKNG), Agoda has a network of over 2,900,000 properties worldwide. Our web and mobile products provide a first-rate reservation service in 38 languages that uniquely combines local knowledge and local connections to provide the best deals for business and leisure travelers.

Agoda employs over 7,000 professionals from 90 nationalities in locations around the globe. In every department – from engineering to customer experience – we provide an environment rich with creativity, collaboration, and experimentation, and the tools to work faster and smarter.

At Agoda, we believe our people are our strength. We work hard and have fun, and we choose people who are dedicated to making things great.

For properties seeking partnership with Agoda, visit https://connect.agoda.com
…
show more","About Agoda

Agoda is an online travel booking platform for accommodations, flights, and more. We build and deploy cutting-edge technology that connects travelers with more than 3.6 million accommodations globally. Based in Asia and part of Booking Holdings, our 6,000+ employees representing 90+ nationalities foster a work environment rich in diversity, creativity, and collaboration. We innovate through a culture of experimentation and ownership, enhancing the ability for our customers to experience the world.

Agoda is an online travel booking platform for accommodation, flights, and more. We build and deploy cutting edge technology that connects travelers with more than 2.5 million accommodations globally. Based in Asia and part of Booking Holdings, our 4,000+ talents coming from 90+ different nationalities foster a work environment rich in diversity, creativity, and collaboration. We innovate through a culture of experimentation and ownership, enabling our customers to experience the world.

Get to Know Our Team

The Engineering department oversees all Agoda’s ML and software related requirements. Our goal is to enable and increase Agoda’s business through creative approaches and the implementation of powerful resources such as operational and analytical databases, ML driven solutions, queue systems and data monitoring tools. We hire the brightest minds from around the world to take on this challenge and equip them with the knowledge and tools that contribute to their personal growth and success while supporting our company’s culture of diversity and experimentation. The role the engineering team plays at Agoda is critical as business users, product managers, and many others rely on us to empower their decision making. We are equally dedicated to our customers by improving their search experience with faster results and protecting them from any fraudulent activities. Data is interesting only when you have enough of it, and we have plenty. This is what drives up the challenge as part of the ML engineering squad, but also the reward. We work across structured and non-structured data at scale. For example, our current ML models process millions of images every day to try and enhance the experience that our users get from our app.

 ML Platform in Agoda 

Agoda ML Platform is built on self-managed Kubernetes and powered by Kubeflow, an open-source solution that enables efficient machine learning workflows.

Our MLOps team combines the best practices of software engineering with data science to help Machine Learning Engineers and Data Scientists work more effectively, meaning we aim to incorporate data/model versioning, collaboration, monitoring etc. in an intuitive way that allows our users to prosper within the field.

 In This Role, You’ll Get to: 

 Lead the design, development, and implementation of on-premises MLOps solutions that support the delivery of machine learning models 
 Collaborate with data scientists and software engineers to build scalable and efficient data pipelines and model training and deployment systems 
 Develop and maintain monitoring and management tools to ensure the reliability and performance of our on-premises MLOps infrastructure 
 Work with stakeholders across the organization to understand their machine learning needs and requirements, and to develop MLOps solutions that meet those needs 
 Stay up-to-date with the latest trends and technologies in MLOps, LLMOps, machine learning, and artificial intelligence, and share your knowledge with the team to help us stay at the forefront of the field 
 Mentor junior members of the team and help them grow their skills and expertise in MLOps 
 Troubleshooting and debugging user issues 

What You’ll Need To Succeed

 5+ years of experience in MLOps, Software engineering, Data engineering, or a related field 
 Strong programming skills in a modern programming language (Java, Scala, Python, Kotlin) 
 Excellent communication and collaboration skills, and the ability to work effectively in a team environment 
 Value code simplicity and performance 

 It’s Great if you have: 

 Understanding of ML Projects lifecycle 
 Experience with MLOps platforms, such as Kubeflow or MLFlow 
 Experience with ML frameworks – like scikit-learn, LGBM, Tensorflow, PyTorch etc. 
 Experience with Big Data tools – Spark, S3, Hadoop 
 Strong knowledge of containerization and container orchestration technologies, such as Docker and Kubernetes 
 Experience with DevOps and CI/CD practices 
 Has experience building and scaling model serving tools, i.e building APIs with tight SLAs 
 Passion for the engineering behind machine learning, and scaling it 
 Experience designing and building MLOps infrastructure, including data pipelines, model training and deployment systems, and monitoring and management tools. 

#telaviv #jerusalem #IT #ENG #4 #sanfrancisco #sanjose #losangeles #sandiego #oakland #denver #miami #orlando #atlanta #chicago #boston #detroit #newyork #portland #philadelphia #dallas #houston #austin #seattle #sydney #melbourne #perth #toronto #vancouver #montreal #prague #Brno #Ostrava #cairo #alexandria #giza #estonia #paris #berlin #munich #hamburg #stuttgart #cologne #frankfurt #budapest #bali #dublin #telaviv #milan #rome #venice #florence #naples #turin #palermo #bologna #osaka #malta #amsterdam #oslo #warsaw #krakow #alrayyan #riyadh #jeddah #mecca #medina #singapore #seoul #barcelona #madrid #stockholm #zurich #taipei #tainan #taichung #kaohsiung #bangkok #Phuket #istanbul #london #manchester #edinburgh #hcmc #hanoi #lodz #wroclaw #poznan #katowice #rio #salvador #newdelhi #bangalore #bandung #yokohama #nagoya #okinawa #fukuoka #jerusalem #IT #4 #bangalore #delhi #hyderabad #pune #singapore #beijing #shanghai #shenzhen #tokyo #seoul #hongkong #taipei #kualalumpur #jakarta #hochiminh #hochiminhcity #manila #instanbul #makati #dubai #riyadh #gurgaon #noida

Equal Opportunity Employer 

At Agoda, we pride ourselves on being a company represented by people of all different backgrounds and orientations. We prioritize attracting diverse talent and cultivating an inclusive environment that encourages collaboration and innovation. Employment at Agoda is based solely on a person’s merit and qualifications. We are committed to providing equal employment opportunity regardless of sex, age, race, color, national origin, religion, marital status, pregnancy, sexual orientation, gender identity, disability, citizenship, veteran or military status, and other legally protected characteristics.

We will keep your application on file so that we can consider you for future vacancies and you can always ask to have your details removed from the file. For more details please read our privacy policy .

To all recruitment agencies: Agoda does not accept third party resumes. Please do not send resumes to our jobs alias, Agoda employees or any other organization location. Agoda is not responsible for any fees related to unsolicited resumes."
3774471701,MS Senior Engineer - Middleware,https://www.linkedin.com/jobs/view/3774471701,NTT Ltd.,https://www.linkedin.com/company/global-ntt/life," "," ",15,,Hybrid,,"10,001+ employees · IT Services and IT Consulting",https://media.licdn.com/dms/image/D4D0BAQF0fjPAQRj4uA/company-logo_100_100/0/1698830112594/global_ntt_logo?e=1712188800&v=beta&t=Y27LLHDeNFUNrgLAQFFNQ6FNKYU4YfoZJYhx7cMJJfI,"NTT Ltd. is becoming NTT DATA. As a global IT services powerhouse, we offer an unmatched range of business and technology solutions.","Want to be a part of our team?

Provides technical support to field engineers, technicians, and product support personnel who are diagnosing, troubleshooting, repairing, and debugging complex electro/mechanical equipment, computer systems, complex software, or networked and/or wireless systems.

Responds to situations where first-line product support has failed to isolate or fix problems in malfunctioning equipment or software. Reports design, reliability, and maintenance problems or bugs to design engineering/software engineering. May be involved in customer installation and training.

Provides support to customers/users where the product is highly technical or sophisticated in nature.

Working at NTT

The MS Engineer is responsible for providing a service to clients by proactively identifying and resolving technical incidents and problems. Through preemptive service incident and resolution activities, as well as product reviews, operational improvements, operational practices, and quality assurance this role will maintain a high level of service to clients. Their primary objective is to ensure zero missed service level agreement (SLA) conditions .The MS Engineer s responsible for managing tickets of low to high complexity.

Key Roles and Responsibilities:

Ensure that assigned infrastructure at the client site is configured, installed, tested, and operational
Perform necessary checks, apply monitoring tools and respond to alerts
Identify problems and errors prior to or when it occurs and log all such incidents in a timely manner with the required level of detail
Assist in analyzing, assigning, and escalating support calls
Investigate third line support calls assigned and identify the root cause of incidents and problems
Report and escalate issues to 3rd party vendors if necessary
Provide onsite technical support to clients and provide field engineering services to clients
Conduct a monthly random review of incidents and service requests, analyze and recommend improvement in quality
Provide continuous feedback to clients and affected parties and update all systems and/or portals as prescribed by NTT
Proactively identify opportunities for work optimization including opportunities for automation of work

Knowledge, Skills, and Attributes:

Ability to communicate and work across different cultures and social groups
Ability to plan activities and projects well in advance, and takes into account possible changing circumstances
Ability to maintain a positive outlook at work
Ability to work well in a pressurized environment
Ability to work hard and put in longer hours when it is necessary
Ability to apply active listening techniques such as paraphrasing the message to confirm understanding, probing for further relevant information, and refraining from interrupting
Ability to adapt to changing circumstances
Ability to place clients at the forefront of all interactions, understanding their requirements, and creating a positive client experience throughout the total client journey

Academic Qualifications

Advanced diploma, degree, or relevant qualification in IT/Computing (or demonstrated equivalent work experience)

Required Experience:

Demonstrated work experience
Demonstrated experience required in Engineering function within a medium to large ICT organization
Demonstrated experience of Managed Services
Demonstrated working knowledge of ITIL processes
Demonstrated experience working with vendors and/or 3rd parties

What will make you a good fit for the role?

Equal Opportunity Employer

NTT is proud to be an Equal Opportunity Employer with a global culture that embraces diversity. We are committed to providing an environment free of unfair discrimination and harassment. We do not discriminate based on age, race, color, sex, religion, national origin, disability, pregnancy, marital status, sexual orientation, gender reassignment, veteran status, or other protected category"
3777877106,Java Spring Boot Developer,https://www.linkedin.com/jobs/view/3777877106,Lancesoft Indonesia,https://www.linkedin.com/company/lancesoft-indonesia/life," ",3 weeks ago,113,,On-site,,"1,001-5,000 employees · Staffing and Recruiting",https://media.licdn.com/dms/image/C560BAQGLOAFB358F-g/company-logo_100_100/0/1632155027401/lancesoft_indonesia_logo?e=1712188800&v=beta&t=Wy6FnLN00ydYHCIAQYBoI-JRf0MRBpnSC6hyBMgb00U,"Established in 2000, LanceSoft is a Certified MBE and Woman-Owned organization, and a pioneer in providing premium end-to-end Global Workforce Solutions and IT Services to diverse clients across various domains.

LanceSoft’s mission is to establish global cross-culture human connections that further the careers of our employees and strengthen the businesses of our clients. We are driven to use the power of our global network to connect businesses with the right people, and people with the right businesses without bias. We provide Global Workforce Solutions with a human touch.

LanceSoft provides Global Workforce Solutions with a human touch and a comprehensive recruiting organization, addressing the complex workforce challenges your company faces today, from contingent and permanent staffing to talent management, outsourcing, and talent development.

With currently over 3,800+ staff serving over 110+ enterprise clients worldwide including “Fortune” companies, LanceSoft serves a wide array of industries including Banking & Financial Services, Semiconductor/VLSI, Technology, Healthcare & Life Sciences, Government, Telecom & Media, Retail & Distribution, Oil & Gas and Energy & Utilities.

LanceSoft is headquartered in Herndon, VA with 27 regional offices across the U.S. and 21 offices around the globe.
Other Offices - India, Indonesia, Hongkong, Malaysia, Thailand, Philippines, Australia, Japan & Bangladesh, etc..

Office in Indonesia -
Gedung Wisma Metropolitan I, Level 3A, Jl Jend Sudirman Kav 29-31, RT. 008 RW. 003, Karet, Setiabudi, Jakarta Selatan, Indonesia, D07 P4AX
Indonesia
…
show more","Banking/Financial Industry
WFO in Jakarta
A laptop will be provide by the company after completing the 3-months probation period
Max Budget - 15 Mio 
Max Budget - 22 Mio Gross (Team Lead Experience)

Requirements -
Java + Spring Frameworks"
3791738247,Senior Java Developer,https://www.linkedin.com/jobs/view/3791738247,Staffing Ninja,https://www.linkedin.com/company/staffing-ninja/life," ",2 days ago,31,,Remote,,1-10 employees · Staffing and Recruiting,https://media.licdn.com/dms/image/D4D0BAQH6VtK5Mqw5Wg/company-logo_100_100/0/1692353299796?e=1712188800&v=beta&t=Hu1qo7dcoZNNw7ZZOZc5WMMlmeuLiP_kj47p8ThKw48,"Staffing Ninja is a leading recruitment agency specializing in connecting top talent with innovative companies worldwide for recruiting.

At Staffing Ninja, we are committed to building long-term relationships with our clients and candidates. Our goal, among other industry experts, is to help our clients achieve their business objectives by providing them with the best talent available through our headhunting service and to help our candidates take their careers to the next level with the best AI jobs.

Find your next career opportunity in the AI space, contact us today!","Job Responsibilities:
Develop, design, and implement Java-based integration solutions facilitating communication across various systems and applications.
Collaborate with cross-functional teams to gather integration requirements and translate them into technical designs.
Create and maintain APIs and connectors to enable seamless data exchange and interoperability.
Employ integration tools and platforms to craft scalable and resilient integration solutions.
Conduct code reviews and ensure adherence to coding standards and best practices.
Identify and troubleshoot integration issues, implementing effective solutions and addressing root causes.
Participate in the entire software development lifecycle, including requirements analysis, design, coding, testing, deployment, and maintenance.
Document integration processes, APIs, and technical specifications for future reference.
Collaborate with stakeholders to comprehend business needs and align integration solutions with organizational goals.

Job Qualifications:
Hold a Bachelor's degree in Computer Science, Software Engineering, or a related field (or possess equivalent practical experience).
Demonstrate proven experience as a Java Developer, with additional experience in integration projects being advantageous.
Possess a strong proficiency in the Java programming language and related frameworks (Spring, Apache Camel, etc.).
Familiarity with integration patterns, API design, and RESTful web services.
Experience with integration tools such as Apache Kafka, RabbitMQ, or MuleSoft is considered a plus.
Knowledge of data formats such as JSON and XML, coupled with experience in data transformation.
Understanding of authentication, authorization, and security principles in integration.
Showcase excellent problem-solving skills with the ability to analyze and resolve complex integration challenges.
Possess strong communication skills for effective collaboration with both technical and non-technical teams.
Ability to work independently and collaboratively within a fast-paced environment.
Experience with version control systems (e.g., Git) and continuous integration practices is advantageous."
3798028794,AI Backend Developer (Python),https://www.linkedin.com/jobs/view/3798028794,Turing,https://www.linkedin.com/company/turingcom/life," ",4 days ago,0,,Remote,,"1,001-5,000 employees · IT Services and IT Consulting",https://media.licdn.com/dms/image/D4D0BAQHB79AE71th8A/company-logo_100_100/0/1688472201595/turingcom_logo?e=1712188800&v=beta&t=uetswaiWdovNMJP7hgdfWDYzXjbSme1NRN0fa3n0zxI,"Traditional recruiting wasn’t designed for today’s software-first world. The old model is simply too slow, doesn’t allow for deep vetting and takes the control and ownership out of your hands. This is why we built Turing, the world’s most deeply vetted developers and teams, matched by AI. Turing connects world-class engineers with companies to help them achieve their respective career and business goals.

Traditional recruiting is over. Welcome to the Talent Cloud.

Turing enables:
> companies to get matched to vetted remote talent at the touch of a button
> developers to achieve their elite dream career from anywhere in the world

900+ top companies, including Pepsi, Bumble, and Dell, have trusted Turing’s Talent Cloud for their engineering needs.

Recruit Developers/Engineers:
Turing combines AI and a global reach to deliver your ideal engineers tailored to your business needs. Our Talent Cloud matches you to rigorously vetted, quality remote developers.

Try Turing.com for 2 weeks risk-free at turing.com

Turing Careers:
Turing helps you get excellent remote opportunities to build a high-growth career faster.

Find high-quality remote U.S. software jobs across 15 roles and 100+ technologies.

Apply today: turing.com/jobs

—----------------------
Co-founded by @Jonathan Siddarth and @Vijay Krishnan, Turing is an AI-powered technology company disrupting the traditional recruiting model for companies seeking to engage the most deeply vetted developers and teams.

Having raised $140 million from investors, including WestBridge Capital, Foundation Capital, Stanford StartX, and execs from Google, Meta, Microsoft, and Amazon, Turing's last round was on a $4 billion valuation cap.","Python Tech Lead: Shaping AI Discourse

Are you enthralled by the idea of AI effortlessly interweaving into everyday conversations? Our company is defining the space with next-gen chatbots that are indistinguishable from human counterparts. We are on the prowl for a Python Tech Lead—a curious and dynamic individual ready to sculpt the future of intelligent interactions.

Your Endeavor:

Design and maintain watertight Python frameworks, the core of our AI systems. 
Conduct stringent code testing, ensuring our AI chat solutions meet stringent quality criteria. 
Apply your deep-seated Python skills to tackle and demystify complex technical challenges, churning out ingenious solutions. 
Foster code that is as insightful as it is operational, honed for scalability and simplicity. 

Your Credentials:

Possess a Bachelor's degree in Engineering, Computer Science, or a comparable professional pedigree. 
Proven track record with 3+ years of software development, with a preference for Python excellence. 
Strong command over Python, especially its application in data science, machine learning; acquainted with SQL and dedicated to QA protocols. 
Algorithmic flair and experience in data engineering or app development will gain extra merit.
Proficient and eloquent in English communication. 

Advantages for Our Team Members:

Connect with a cadre of exceptional developers and thought leaders around the globe. 
Luxuriate in the liberty of remote work—efficiency untethered from a fixed locale. 
Receive remuneration that is not only internationally competitive but also delivered with unwavering consistency in USD. 

Throw yourself into pioneering projects that break molds and value your ingenuity, positioning your career trajectory at the edge of tech innovation."
