id,title,job_url,company,company_link,location,published_at,number_of_applicants_applied,employment_duration,work_location_type,work_experience_level,company_type,company_logo,company_description,about_the_job
3792828368,Junior Full-Stack Developer,https://www.linkedin.com/jobs/view/3792828368,Bali Jobs Recruitment,https://www.linkedin.com/company/balijobsrecruitment/life," ",5 days ago,55,,On-site,,1-10 employees · Human Resources Services,https://media.licdn.com/dms/image/D560BAQH3Jsd-rnRsUw/company-logo_100_100/0/1685438030899/balijobsrecruitment_logo?e=1712188800&v=beta&t=MXLRxoTxvtsYKaoB_yW-Nrcs6nzQHxWWFC4Z_2C16aI,"Bali Jobs Recruitment is a leading professional recruitment agency specializing in the HR services (Recruitment, Training, HR Solution) on behalf of start-ups, independent brands, hospitality businesses and other small companies.","Our client is an online coding boot camp provider who is currently seeking a Coding Teacher Assistant to join their team.

If you are passionate about web development, have a keen interest in e-commerce, and want to make a meaningful contribution to a growing company, we'd love to hear from you!

Open to Juniors: Junior developers are encouraged to apply - we provide guidance throughout the course.


Requirements:

Minimum of one year developing full-stack applications
Proficiency in coding full-stack web applications.
Strong understanding of front-end and back-end development principles.
A degree in Computer Science is preferred, but talented self-taught individuals are also welcome.
Fluent in English.
Enthusiasm for Teaching: A genuine interest in explaining basic computer science concepts.
Knowledge of Node.js and React is advantageous but not a must.
Eagerness to learn and adapt to new technologies and tools.
Excellent problem-solving and communication skills.


Responsibilities:

Student Guidance: Assist students, many of whom are beginners with little to no programming experience, through hands-on learning. Help them grasp fundamental web development concepts.
Problem Solving: Address and resolve students' queries and technical issues.
Course Support: Work closely with the course director to enhance the learning experience.
Collaborative work within the team to fulfil project requirements.
Regular participation in project meetings for progress updates and collaborative problem-solving.


Job perks:

Work-Life Balance: Flexible working hours in a vibrant location (30 hours a week of work, Monday to Friday for 6-hrs a day from 12 - 6 pm)
Holiday Package: Generous vacation policy.
Compensation will be aligned with industry standards and your experience, details of which will be discussed during the interview process."
3769417643,"Senior/Staff Software Engineer, Codashop",https://www.linkedin.com/jobs/view/3769417643,Coda Payments,https://www.linkedin.com/company/coda-payments/life," ",2 months ago,9,,Hybrid,,"501-1,000 employees · Internet Publishing",https://media.licdn.com/dms/image/C560BAQGPvgUuumAyZw/company-logo_100_100/0/1630672427695/coda_payments_logo?e=1712188800&v=beta&t=TfAjQr4dhQj9GcjGVSV5lyXyG4Zbg_hoaMX-LoUjqCk,"We take life’s digital experiences over the top by enabling users to bring more creativity and self-expression to their play - no matter who or where they are.

Founded in 2011, Coda Payments (“Coda”) is the leading provider of secure, cross-border monetisation solutions for digital products and services in more than 60 markets. Through our three services: Codashop, xShop, and Codapay, we help a range of top digital content publishers worldwide, such as Activision Blizzard (Call of Duty: Mobile, Diablo Immortal), Riot Games (VALORANT, League of Legends: Wild Rift), Moonton (Mobile Legends: Bang Bang), Garena (Free Fire), Tencent (PUBG Mobile), beIN, Bigo Live, Tinder, and Viu to monetise their content and unlock new revenue streams.

Today, Coda has more than 500 people in 35+ countries who are working towards the same mission: to offer our customers the best value, experience and entertainment every day, without fail.

If you want to make an impact in taking life’s digital experiences over the top, join us!

- We are backed by Smash Capital, Insight Partners, GIC, Apis Partners and GMO Global Payment Fund (affiliated with Japan’s largest online payment gateway).
- In 2022, we are named the 5th fastest growing fintech company in the APAC by the Financial Times, the 13th fastest growing company in Singapore by the Straits Times, and a Technology Pioneer by the World Economic Forum.
- Our headquarters are in Singapore, with 11+ offices worldwide and 35+ remote locations, including South Korea, Egypt and France.

We are an equal opportunity employer that is committed to cultivating an inclusive environment for all employees, and we welcome the diversity that you will bring!
…
show more","What we do

At Coda, we break down barriers between publishers and their audiences by thinking outside of the app. Coda is trusted by 300+ top digital content publishers – including industry giants Activision Blizzard, Bigo, Electronic Arts, Riot Games, and Zynga – to grow revenue, profit margins, and customer engagement in 60+ markets with ease. For publishers, this means less lift, more players and more payers. For players, Coda’s solutions allow them to pay for play their way.

Our winning formula? A laser-focused, pragmatic attitude coupled with an unwavering commitment to excellence. We are customer-centric, creative, and solution-oriented, always delivering to our users the top-tier entertainment content they want at competitive prices.

If you’re ambitious, bold and ready to take your career to the next level, get in touch!

Engineering - Technology at Coda

At Coda, our goal is to make our mark in the high-volume payments and e-commerce industry – and we are levelling up fast. To stay in stride with the dynamic environment, we focus on building robust, distributed systems that can effortlessly handle traffic spikes. Moreover, our ambitious roadmap necessitates innovative tools to streamline the development lifecycle and sustain our swift momentum.

We place great value on balancing teamwork with individual autonomy, allowing our teams to make the most of modern cloud infrastructure. Our tech stack is solidly based on AWS cloud, with a keen interest in infrastructure-as-code and the creation of new microservices via the Quarkus framework. Our toolbox includes JSON and GRPC, multiple data storage integrations, queues, OpenTelemetry, and more.

But what truly defines us? It's our incredible team. We hire top talent and give them the freedom to push Coda's technology and products to exciting new levels. We believe that genius can strike anywhere, so we promote ownership and cultivate a servant leadership culture that lets engineers take the reins on features.

About The Role

We are looking for a proactive, driven engineer who is hungry to contribute using their deep and fundamental knowledge in software development and automation. You will be responsible for the architecture, development, and evolution of key products and features at Coda.

About The Codashop Team

The Codashop Team owns our B2C e-commerce marketplace for in-app purchases. Codashop.com allows tens of millions of users each month to benefit from our direct relationships with publishers and payment channels. We currently operate in over 50 countries and growing. Our aim is to always provide the best value, delightful user experiences, and a highly secure platform for accessing the best digital content globally. We need engineers who want to collaborate on complex problems in an exciting and growing space.

Responsibilities

Design and develop highly scalable, reliable, secure, and fault-tolerant systems end to end using state of the art technology
Work directly with Product and Technology team members to define and implement complex features
Collaborate with other team members to learn and share best practices
Understand and constantly optimize our products, identifying and fixing problems, improving stability and user experience
Take operational responsibility for the services that are owned by your team
Debug production issues across services
Participate in on-call rotations as needed (we support a healthy work/life balance, so we invest in minimizing out-of-office interruptions and we use rotations to minimize on-call days)


Requirements

At least 2 years of experience in software development
A bachelor’s degree in computer science, engineering, mathematics, or a related field (or equivalent experience)
Strong knowledge of one or more programming languages (Java, Scala, Kotlin, Groovy, Go, C/C++, Rust, Python, C#, etc.) and the ability to learn new programming languages quickly
Strong understanding of software architecture
Understanding of data systems and how to query/interact with them (RDBMS, NoSQL, Queues, etc.)
A desire to build automation into everything you do, including implementing state of the art CI/CD practices and test automation
Understanding of agile methodologies (e.g. Scrum)
Good command of the English language and the ability to communicate effectively


Bonus if you have

Experience building high scale APIs
Knowledge of AWS and cloud technologies such as lambdas and containerization
Experience in FinTech or related fields requiring strong security discipline


Working at Coda

Joining the Coda team means diving into a fast-paced, challenging, and exciting world. With Codans spread across over 30 countries around the world, our highly collaborative environment breaks down time zones and cultural barriers, empowering you to chase innovative ideas, contribute to Coda’s growth, and make a lasting impact.

If you have a passion for pushing boundaries, and thrive on continuous improvement through experimentation, we'd love to hear from you!

Our Perks*

WFH / Hybrid Support: Get a monthly allowance to cover your work-from-home expenses and keep you connected.

Wellness Boost: Stay healthy with resources for physical and mental well-being with our flexible benefits and Employee Assistance Program - because you matter!

Customized Benefits: Tailor your benefits with our flexible plan.

Growth Opportunities: Unlock your potential through clear progression paths.

Skill Development: Access training resources to fuel your personal and professional growth.

Volunteer Time Off: Enjoy paid time off to make a difference in the world through volunteering.

Family Care: Take advantage of paid Family Care Leave to bond with your family, while our selected Flexible Benefits also cater to your family's needs.

Benefits are reviewed and updated on a yearly basis


We are proud to be an equal opportunity employer, embracing the unique qualities of every individual, regardless of gender, race, age, religion, disability, or other local protected classes. Our goal is to foster an inclusive environment where everyone feels welcome and valued.

Due to the large number of exceptional applications we receive, we can only reach out to shortlisted candidates. If you don't hear from us, rest assured there may be another opportunity at Coda that aligns better with your unique abilities. Remember to check our Careers Page for more exciting job openings!"
3767476298,Global Software Engineer (C++),https://www.linkedin.com/jobs/view/3767476298,Michael Page,https://www.linkedin.com/company/michael-page/life," ",1 month ago,4,,On-site,,"5,001-10,000 employees · Staffing and Recruiting",https://media.licdn.com/dms/image/D4E0BAQHpnANIG_FYpg/company-logo_100_100/0/1688136319954/michael_page_logo?e=1712188800&v=beta&t=4O0RVODg6V1xPGl7glPl0Jyw3rA8n2fNoMuyr4Ro2do,"Welcome to the Michael Page global company profile.

Michael Page has five decades of expertise in professional services recruitment. We were established in London in 1976, and over this period we've grown organically to become one of the best-known and most respected consultancies, with an office network spanning six continents.

While size has its advantages, it doesn't define us - the nature of our organic growth means that each new office is integrated into the region that it serves. It also means that as an employer looking to hire, or as a candidate aiming to grow your career you have the best of both worlds; a team that understands the market and geography you operate in, plus the resources and expertise of an international network at your disposal.

Our teams are broken down to focus on industry, assignment type, salary level and location, so your hiring requirements or job search will all be handled by a specialist who knows your sector inside-out. We are confident that our expertise can add value to your recruitment or job search process – get in touch to find out more.
…
show more","Working at one of the biggest technology company globally|Worked on interesting product


About Our Client

Global technology company with distribution all over the world

Job Description

Design and implement scalable and reliable software
Collaborate with Product and Engineering teams to identify and prioritize requirements and features
Write high-quality, maintainable, and efficient code
Optimize application performance and scalability
Write and maintain automated tests to ensure code quality
Participate in code reviews and provide feedback to other team members
Troubleshoot and debug issues in production environments
Continuously learn and improve your technical skills


The Successful Applicant

Experiences on software construction and unit test.
Using C++ programming languages and AWS Cloud Environment.
Strong understanding on mobile and web technologies.
Strong understanding logic, algorithm and data structure concepts. 
Excellent understanding on big data computation model and analytical algorithms.

Excellent communication abilities in English and Bahasa Indonesia

What's On Offer

Working in an interesting industry with opportunity to progress career.

Contact: Hashegi Hanjaya

Quote job ref: JN-112023-6250370"
3782481674,Senior Backend Engineer,https://www.linkedin.com/jobs/view/3782481674,Hyppies.com,https://www.linkedin.com/company/hyppies/life," ",3 weeks ago,33,,Hybrid,,11-50 employees · Staffing and Recruiting,https://media.licdn.com/dms/image/C560BAQHE8iZCHUEBNg/company-logo_100_100/0/1630644050657/hyppies_logo?e=1712188800&v=beta&t=i9ZL-sR98kd7eTbAMu0iF0OKmRHuc4lAYZRnoToxEGs,"At Hyppies, we're more than just a recruitment company; we're a movement. Inspired by the ethos of hypergrowth and high potential, we're dedicated to matching the most talented individuals with the most ambitious tech companies.
Our name, Hyppies, is a nod to the revolutionary spirit of the hippie movement, reflecting our commitment to challenging the conventional approach to tech recruitment.

Our Vision
We envision a world where the right talent meets the right opportunity, creating a synergy that fuels innovation and growth in the tech sector. We believe in the power of people and their potential to transform industries, and we're here to make those connections happen.

Our Services
Recruitment : We specialize in identifying high-potential talent for roles that demand innovation and expertise. Our extensive network across the tech industry enables us to find the perfect match for both companies and candidates.

Contracting: Recognizing the need for flexibility in the fast-paced tech world, we offer staffing solutions for short-term and project-based needs.

Large-Scale Recruitment Projects: Hyppies offers streamlined, high-quality recruitment solutions for companies facing rapid expansion and large-scale hiring needs.

Offshoring: We specialize in establishing efficient offshore teams, connecting you with a global talent pool to enhance diversity and optimize costs.

Market Insights: With our finger on the pulse of Asia's tech scene, we offer valuable insights into market trends, helping companies and professionals stay ahead of the curve.

Our Presence
Headquartered in Singapore, Hyppies operates across Asia with additional offices in Malaysia and Indonesia. This strategic presence allows us to tap into diverse talent pools and offer region-specific market expertise.

Our Culture
We're proud to embody the spirit of non-conformity and freedom that marked the hippie movement. At Hyppies, creativity and out-of-the-box thinking are at the core of what we do.
…
show more","A leading health-tech company is on the lookout for a passionate individual eager to contribute as a Senior Backend Engineer. As a pivotal part of the team, you'll collaborate closely with cross-functional teams, spearheading the creation and delivery of top-tier products and features.

As a Senior Backend Engineer, your responsibilities will involves designing, implementing, and rigorously testing solutions, ensuring seamless integration with the development and product teams to uphold peak performance. Crafting product requirements and overseeing tech projects within the platform, safeguarding system security and propelling the CI/CD processes forward.

Requirements

A Bachelor's degree in Computer Science or equivalent field experience
Proficiency in Rest API development
A minimun of 3 years senior-level experience
Hands-on knowledge of Cloud System (AWS/GCP)
Expertise in Server Side languages like Golang & NodeJS
Experience in source code management and CI/CD processes

This role offers an exceptional opportunity for growth and the chance to showcase your skills in crafting world-class digital products. If you're ready to make a mark in a fast-paced, collaborative environment, we'd love to hear from you!

Apply now or drop your cv at kholis.arifin@hyppies.com"
3792368995,Odoo Developer,https://www.linkedin.com/jobs/view/3792368995,"PT. Akasha Wira International, Tbk.",https://www.linkedin.com/company/akashainternational/life," ",6 days ago,4,,On-site,,"1,001-5,000 employees · Manufacturing",https://media.licdn.com/dms/image/C4E0BAQEO3ymv3W4Q2Q/company-logo_100_100/0/1631334364526?e=1712188800&v=beta&t=5IM2_0A_ObC2tCgDQvz_iMjV3kSxzTz-zGJFWr25S8c,"PT. Akasha Wira International Tbk was founded on 6th March 1985 in Jakarta, Indonesia. Our reason for being is to bring the world’s best consumer solutions to the world’s masses

At the moment PT Akasha Wira International Tbk is engaging in two business segments :

a) BEVERAGE: Akasha International currently produces and distributes Nestlé® Pure Life® in Indonesia under the license and supervision of Nestlé Water SA. In October 2011, as an answer to consumers' needs, Akasha International started to produce mineral drinking water using its trademark, Vica Royal.

b) BEAUTY CARE: In 2010 Akasha International expanded our business scope to the cosmetics business by acquiring a company engaged in the production of hair care products under the brand Makarizo. In 2012, the Company signed an agreement with Procter & Gamble to import, distribute, and sell Procter & Gamble products in the premium professional segment (the products distributed through hairstylists) under the brands Wella Professional, System Professional, and Clairol Professional. This action is expected to increase the company's overall performance in the future in the middle of tight business competition for cosmetic products in Indonesia.

Akasha International believes that People, Systems, Technology, and Capital can craft our vision. As those four we call an operational excellent platform. Each platform attempts to achieve world-class capabilities led by committed and obsessed leaders supported by state-of-the-art yet practical technology and purposed-built processes. Akasha International is investing quite heavily relative to our size today and needs scalable core capability platforms to support future acquisition and growth opportunities.

In the past five years, Akasha International has made one acquisition a year and intends to keep this acquisition pace going forward. Currently, the Company employs +2,000 employees across Indonesia.
…
show more","Responsibilities

Migrate module odoo CE v11 to odoo CE v14
Experienced in handling HR odoo module

Requirements

Candidate must possess at least Bachelor’s Degree Computer Science/Information Technology or equivalent.
Minimum 1 years of experience in odoo Technical (Odoo version 11/12/14)
Good knowledge of PostgreSQL
Experience using GIT or Versioning Control"
3784367285,Fullstack Engineer,https://www.linkedin.com/jobs/view/3784367285,,,,,0,,"IDR6,500,000/yr - IDR9,000,000/yr",,See how you compare to 5 applicants. Upgrade my plan,,,"We are looking for a skilled Fullstack Engineer to join our team. The ideal candidate will have experience in developing web applications using Golang and React as the primary programming languages. We welcome middle-level developers with a passion for building scalable and efficient software. A Bachelor's degree in computer engineering or a related field is a plus.

Responsibilities

Developing and maintaining web applications using Golang and React
Collaborating with cross-functional teams to design, develop, and deploy high-quality software solutions
Building reusable code and libraries for future use
Participating in code reviews to maintain code quality standards
Debugging and resolving technical issues as they arise
Staying up-to-date with emerging trends and technologies in software development

Requirements

Strong proficiency in Golang and React
Experience with front-end technologies such as HTML, CSS, and JavaScript
Experience with back-end technologies such as RESTful APIs, databases, and web servers
Familiarity with software development tools such as Git, JIRA, and Agile methodologies
Strong problem-solving skills and attention to detail
Excellent communication and collaboration skills

Education

Bachelor's degree in computer engineering or a related field is a plus

If you meet the above requirements and are passionate about software development, we encourage you to apply for this exciting opportunity."
3765729784,Fullstack Engineer,https://www.linkedin.com/jobs/view/3765729784,,,,,0,,"IDR6,500,000/yr - IDR9,000,000/yr",,See how you compare to 5 applicants. Upgrade my plan,,,"We are looking for a skilled Fullstack Engineer to join our team. The ideal candidate will have experience in developing web applications using Golang and React as the primary programming languages. We welcome middle-level developers with a passion for building scalable and efficient software. A Bachelor's degree in computer engineering or a related field is a plus.

Responsibilities

Developing and maintaining web applications using Golang and React
Collaborating with cross-functional teams to design, develop, and deploy high-quality software solutions
Building reusable code and libraries for future use
Participating in code reviews to maintain code quality standards
Debugging and resolving technical issues as they arise
Staying up-to-date with emerging trends and technologies in software development

Requirements

Strong proficiency in Golang and React
Experience with front-end technologies such as HTML, CSS, and JavaScript
Experience with back-end technologies such as RESTful APIs, databases, and web servers
Familiarity with software development tools such as Git, JIRA, and Agile methodologies
Strong problem-solving skills and attention to detail
Excellent communication and collaboration skills

Education

Bachelor's degree in computer engineering or a related field is a plus

If you meet the above requirements and are passionate about software development, we encourage you to apply for this exciting opportunity."
