id,title,job_url,company,company_link,location,published_at,number_of_applicants_applied,employment_duration,work_location_type,work_experience_level,company_type,company_logo,company_description,about_the_job
3500666744,"Lead / Staff Full Stack Software Engineer (Bangkok based, relocation provided)",https://www.linkedin.com/jobs/view/3500666744,Agoda,https://www.linkedin.com/company/agoda/life," "," ",203,,Full-time,,"5,001-10,000 employees · Software Development",https://media.licdn.com/dms/image/C4D0BAQGBa_7QNZNwpw/company-logo_100_100/0/1656643826660/agoda_logo?e=1712188800&v=beta&t=Uch6o32VIVJnqd5pOyN6ISz8TvEijuYR_vC1w3EK8HQ,"Agoda is transforming travel for millions of customers across the globe.

Headquartered in Asia, Agoda is one of the world’s largest online travel platforms. Founded in 2005 and now part of Booking Holdings (Nasdaq:BKNG), Agoda has a network of over 2,900,000 properties worldwide. Our web and mobile products provide a first-rate reservation service in 38 languages that uniquely combines local knowledge and local connections to provide the best deals for business and leisure travelers.

Agoda employs over 7,000 professionals from 90 nationalities in locations around the globe. In every department – from engineering to customer experience – we provide an environment rich with creativity, collaboration, and experimentation, and the tools to work faster and smarter.

At Agoda, we believe our people are our strength. We work hard and have fun, and we choose people who are dedicated to making things great.

For properties seeking partnership with Agoda, visit https://connect.agoda.com
…
show more","About Agoda

Agoda is an online travel booking platform for accommodations, flights, and more. We build and deploy cutting-edge technology that connects travelers with more than 3.6 million accommodations globally. Based in Asia and part of Booking Holdings, our 6,000+ employees representing 90+ nationalities foster a work environment rich in diversity, creativity, and collaboration. We innovate through a culture of experimentation and ownership, enhancing the ability for our customers to experience the world.

Get to Know our Team:

The Full Stack Engineering Department builds the Agoda web and app products. We have several teams in front-end focusing on different aspects of our products including accommodations, flights, payments, marketing, post-booking services, and more. Agoda’s marketplace is the world. We build localized and optimized user experiences at scale on every major internet platform. These include our mobile websites, native apps, and desktop sites. We hire people from around the world who have a passion for using technology to create and implement the best user experiences. Our teams work on the full stack and build end-to-end systems including user interfaces, APIs, backend systems, and database systems. Our products are always evolving and under experimentation. We accomplish this by having an amazing degree of automation, CI/CD systems, and use a modularized approach. As we are data driven and measure our results, we continually innovate and improve our work. We are looking for the next great talent who strives to learn and grow and has a standard of excellence, strong sense of ownership, and great technical skills.

The Opportunity:

Lead / Staff engineer is the key role in our technology organization working together with individual contributors and senior leadership. Our Lead engineers are heavily involved in the hiring and mentoring process and are the go-to people who design and implement new systems and components. We are looking for people who are passionate to take on more responsibility and driving major architectural changes in Agoda. It’s expected from you in this role as Lead / Staff engineer to push Agoda forward technically by adopting new technologies and setting higher standards.

In this Role, you’ll get to:

Maintain ownership and responsibility of mission critical systems
Be hands on – build high volume platforms using cutting-edge technologies like React and GraphQL
Mentor and coach other software engineers
Be a major contributor to our agile and scrum practices
Design and lead crucial technical projects and initiatives cross teams and departments
Stay on the leading edge of technical know-how, industry trends and drive technical innovations

What you’ll Need to Succeed:

7 years of experience developing web applications in client-side frameworks such as React, Angular, VueJS, etc. 6+ years preferred
B.S. in Computer Science or quantitative field; M.S. preferred
Working experience with agile, analytics, A/B testing and/or feature flags, Continuous Delivery, Trunk-based Development
Excellent HTML/CSS skills – you understand not only how to build the data, but how to make it look great too
Excellent understanding of object-oriented JavaScript, TypeScript
You love new technologies and approaches and want to use the best tools available. We want people who can help us continually evolve our stack
Great communication and coordination skills
Excellent analytical thinking and problem-solving skills
You have a good command of the English language

It’s Great if you have:

Knowledge in physical architecture at scale, building resilient, no single point of failures, highly available solutions
Knowledge in one or more of the following: NoSQL technologies (Cassandra, ScyllaDB, ElasticSearch, Redis, DynamoDB, etc), Queueing system experience (Kafka, RabbitMQ, SQS, Azure Service Bus, etc)
Working Experience with Containers and Dockerization, also K8S is a plus
Knowledge and hands on experience in CI/CD solutions would be a plus
Strong experience in all aspects of client-side performance optimization,
Extremely proficient in modern coding and design practices. For example, Clean Code, SOLID principals, and TDD
Experience in multiple front-end platforms including iOS, Android, Web, and API services
Have worked on an app or internet company that is at scale with large numbers of users and transactions per second
Have experience in a data driven company with experience analyzing and working with Big Data
Lead teams and greenfield projects solving large system problems
Worked on global projects serving world markets with distributed data centers and localization of the front end and data

This position is based in Bangkok, Thailand (Relocation Provided)

#sanfrancisco #sanjose #losangeles #sandiego #oakland #denver #miami #orlando #atlanta #chicago #boston #detroit #newyork #portland #philadelphia #dallas #houston #austin #seattle #sydney #melbourne #perth #toronto #vancouver #montreal #shanghai #beijing #shenzhen #prague #Brno #Ostrava #cairo #alexandria #giza #estonia #paris #berlin #munich #hamburg #stuttgart #cologne #frankfurt #hongkong #budapest #jakarta #bali #dublin #telaviv #milan #rome #tokyo #osaka #kualalumpur #amsterdam #oslo #manila #warsaw #krakow #bucharest #moscow #saintpetersburg #capetown #johannesburg #seoul #barcelona #madrid #stockholm #zurich #taipei #bangkok #Phuket #istanbul #london #manchester #edinburgh #kiev #hcmc #hanoi #wroclaw #poznan #katowice #rio #salvador #IT #ENG #4

Equal Opportunity Employer 

At Agoda, we pride ourselves on being a company represented by people of all different backgrounds and orientations. We prioritize attracting diverse talent and cultivating an inclusive environment that encourages collaboration and innovation. Employment at Agoda is based solely on a person’s merit and qualifications. We are committed to providing equal employment opportunity regardless of sex, age, race, color, national origin, religion, marital status, pregnancy, sexual orientation, gender identity, disability, citizenship, veteran or military status, and other legally protected characteristics.

We will keep your application on file so that we can consider you for future vacancies and you can always ask to have your details removed from the file. For more details please read our privacy policy .

To all recruitment agencies: Agoda does not accept third party resumes. Please do not send resumes to our jobs alias, Agoda employees or any other organization location. Agoda is not responsible for any fees related to unsolicited resumes."
3786182985,Lead Full Stack Developer,https://www.linkedin.com/jobs/view/3786182985,Staffing Ninja,https://www.linkedin.com/company/staffing-ninja/life," ",1 week ago,59,,Remote,,1-10 employees · Staffing and Recruiting,https://media.licdn.com/dms/image/D4D0BAQH6VtK5Mqw5Wg/company-logo_100_100/0/1692353299796?e=1712188800&v=beta&t=Hu1qo7dcoZNNw7ZZOZc5WMMlmeuLiP_kj47p8ThKw48,"Staffing Ninja is a leading recruitment agency specializing in connecting top talent with innovative companies worldwide for recruiting.

At Staffing Ninja, we are committed to building long-term relationships with our clients and candidates. Our goal, among other industry experts, is to help our clients achieve their business objectives by providing them with the best talent available through our headhunting service and to help our candidates take their careers to the next level with the best AI jobs.

Find your next career opportunity in the AI space, contact us today!
…
show more","Roles & Responsibilities:
Creating front-end website architecture.
Crafting user interactions on web pages.
Building back-end website applications.
Establishing servers and databases for functionality.
Ensuring cross-platform optimization for mobile devices.
Guaranteeing the responsiveness of applications.
Collaborating with graphic designers for web design elements.
Overseeing a project from inception to completion.
Designing and developing APIs.
Addressing both technical and consumer requirements.
Keeping up to date with advancements in web applications and programming languages.

Skills & Requirements:
2+ years of experience as a Full Stack Developer.
Bachelor's degree in computer science.
Strong organizational and project management abilities.
Proficiency in core front-end languages like HTML, CSS, and JavaScript.
Knowledge of Web3 technologies is advantageous.
Familiarity with JavaScript frameworks such as AngularJS, React, and Amber.
Proficiency in server-side languages such as Python, Ruby, Java, PHP, and .Net.
Understanding of database technology including MySQL, Oracle, and MongoDB.
Experience in developing CI/CD pipelines and deploying applications using cloud services such as AWS.
Strong problem-solving skills and attention to detail.

Good to have:
Familiarity with Web 3 is advantageous.
Proficiency in English is required.
Basic proficiency in both spoken and written Chinese (Cantonese and Mandarin) or Japanese is beneficial.

Benefits:
It is a Full-Time Remote Opportunity."
3775947107,Java Developer,https://www.linkedin.com/jobs/view/3775947107,Mitrais,https://www.linkedin.com/company/mitrais/life," ",3 weeks ago,133,,Hybrid,,"501-1,000 employees · IT Services and IT Consulting",https://media.licdn.com/dms/image/C510BAQEhZsUjQpb1jg/company-logo_100_100/0/1630620031684/mitrais_logo?e=1712188800&v=beta&t=llazfjJ4SFlmGFtfqGAMC7cGHvWtJEFZTfbOFw9Zbgk,"Mitrais is a Software Company and is a member of CAC Holdings Group with offices in Indonesia and Singapore. We have a full range of software development capabilities including NodeJS, Flutter, ReactJS, Microsoft, Java, mobile, web, PHP, and Low Code, while our product services cover the deployment and support of leading software products targeting the mining and healthcare sectors. These activities are backed by best-in-class human capital management systems and an integrated engagement model. Since 1991, we have helped over 500 clients to achieve their goals.
…
show more","Mitrais, a member of CAC Holdings Group, is an international Information Technology company with offices in Indonesia, Singapore, and Australia. We have two lines of business – Software Development Services and Software Product Services. We provide a full range of Software Development capabilities including Microsoft, Mobile, Web, Java, etc. Our Software Product Services cover the deployment and support of leading Software Products.

Build your Career with Mitrais!

We have clients that urgently looking for Experienced Java Developers to be part of our team for an immediate start.

What will you be doing?
Coding high-quality software using distributed computing, messaging, microservices, performance tuning and memory and resource management techniques
Developing data-driven solutions for a range of clients - frontend as well as backend.
Collaborating within cross-functional and international agile teams.
Testing, debugging, re-testing, and coordinating with QA, validating software as ready for shipping
Reviewing code and acting as a subject matter expert for juniors in the team

What about you? 
You have 2+ years of experience in Java development with Springboot 
You are familiar with RDBMS 
You can speak reasonable English 
You are well versed in best practices in OOP, design patterns, SOLID principles, and data driven design 
You are comfortable using git or TFS in a CI/CD environment 
You enjoy working on lean and agile development projects using Scrum & Kanban 
You love clean and beautiful code, with an eye for simplicity and pragmatism. 
Additional value  
Experience on microservice, Kafka and Redis 
SQL and hands-on experience with ORM frameworks such as Hibernate 
Common Basic Web technologies such as: HTML, JQuery 
Java unit-test frameworks such as: Junit 
Java 8 features such as: Time API, Lambda, Functional Programming Style, Stream API 
You have experience in Java reporting tools such as: Jasper Report, Apache POI 
You have working knowledge and experience with: 
Cloud Computing such as: AWS, Azure, Google Cloud 
You are well versed in best practices in OOP, design patterns and SOLID principles 
What can Mitrais offer you?
A CAREER, not a JOB!
Competitive salary
Excellent working environment, with the possibility to relocate to our regional offices and work remotely
Free English classes, English is our working language
Lots of opportunities to improve your competencies on our technical boot camps, certification programs and soft skills training courses
Hackathons with big prizes!

Learn about life at Mitrais from our current team by searching #mitraislife on your social media.

Please note that all activities included in the recruitment processes are free of charge. Beware of online scams such as persons posing to represent the Mitrais Recruitment Team or other recruiting-related personnel by sending unsolicited text messages and emails asking you to provide personal information, transfer money, or do any other specific activities.

To Apply…
Simply click the apply button, complete the form and upload your latest CV in English! What are you waiting for?"
3795422325,iOS Developer Senior Lead,https://www.linkedin.com/jobs/view/3795422325,JAC Recruitment,https://www.linkedin.com/company/jacrecruitment/life," ",,8,,Hybrid,,"1,001-5,000 employees · Staffing and Recruiting",https://media.licdn.com/dms/image/D560BAQFnU2mQGyqXPA/company-logo_100_100/0/1687844701980/jacgroup_logo?e=1712188800&v=beta&t=tzHCgUOQnbT-dS7a4VoQIT3_94wfL2oG9ayaAXxVoPQ,"JAC Recruitment, listed on the first section of the Tokyo Stock Exchange, is one of the very few recruitment consultancies providing specialised services for medium-to-high-income job positions such as specialists, middle management positions and executives.

The Group has over 45 years of history since its foundation in 1975 in the United Kingdom. Its Japanese subsidiary was opened in 1988 and has been driving the recruitment industry in Japan for over 30 years. We are now operating across 33 offices in 11 countries. have a presence in the U.S., the United Kingdom, Germany and 7 Asian countries (Singapore, Malaysia, Indonesia, Thailand, South Korea, Vietnam, India).

With our global network operating across 11 countries, we are contributing to the growth of our client companies’ global business expansions by providing services for Japanese, foreign capitalized and local company clients. To satisfy the recent increasing demand of talent in the latest technology areas such as DX, IoT, AI and robots, we are strengthening digital-related recruitment services through our brand “JAC Digital” as a company-wide project.

From the end of 2020, we have started to provide two additional recruitment-related services: “Interim Management Solutions (IMS)"" specializing in solving management issues with the aim of responding to the diverse work style needs of high-skilled personnel, and “Recruitment Process Optimisation (RPO)"" to solve corporate recruitment issues.

All of our 1,830 staff around the world continue aiming to gain trust and support by our customers by improving our service quality.
…
show more","About the company:

Our client is a leading multinational conglomerate with diversified interests across various industries, including automotive, financial services, heavy equipment, mining, energy, agribusiness, information technology, and infrastructure. Our commitment to innovation and excellence has positioned us as a prominent player in the business landscape.

Position Overview:

We are seeking a highly skilled and experienced Senior Software Developer Lead to join our dynamic team. The successful candidate will play a crucial role in leading a talented team of 3 to 5 developers, focusing on the design, development, and maintenance of cutting-edge mobile applications for both iOS and Android platforms.

Responsibilities: 

 Lead a team of 3 to 5 developers in the design, development, and maintenance of iOS and Android applications. 
 Collaborate with cross-functional teams, including product managers, designers, and other developers, to deliver exceptional user experiences. 
 Provide technical leadership and mentorship to team members, fostering a collaborative and growth-oriented environment. 
 Architect, design, and implement complex features and functionalities for both iOS and Android platforms. 
 Stay updated with the latest trends and technologies in mobile development to ensure the team is utilizing the best practices. 
 Conduct regular code reviews to ensure code quality, performance, and adherence to coding standards. 
 Troubleshoot, debug and resolve software defects and issues promptly. 
 Work closely with the product team to understand requirements, and contribute to the overall product strategy. 



Qualifications:

 Bachelor's or Master's degree in Computer Science, Software Engineering, or a related field. 
 Proven experience (2+ years) in iOS and Android application development. 
 Strong expertise in Swift, Objective-C, and Java/Kotlin programming languages. 
 Experience in leading and managing development teams, with excellent communication and interpersonal skills. 
 Solid understanding of mobile architecture patterns, design principles, and best practices. 
 Experience with RESTful APIs, third-party libraries, and integration of external services. 
 Strong problem-solving skills and ability to think critically about complex technical challenges. 
 Familiarity with version control systems, continuous integration, and deployment tools. 
 Knowledge of emerging technologies and trends in the mobile development space. 
 A portfolio of past projects showcasing your contributions to successful iOS and Android applications. 
 Lead a team of 3 to 5 developers in the design, development, and maintenance of iOS and Android applications. 
 Collaborate with cross-functional teams, including product managers, designers, and other developers, to deliver exceptional user experiences. 
 Provide technical leadership and mentorship to team members, fostering a collaborative and growth-oriented environment. 
 Architect, design, and implement complex features and functionalities for both iOS and Android platforms. 
 Stay updated with the latest trends and technologies in mobile development to ensure the team is utilizing the best practices. 
 Conduct regular code reviews to ensure code quality, performance, and adherence to coding standards. 
 Troubleshoot, debug and resolve software defects and issues promptly. 
 Work closely with the product team to understand requirements, and contribute to the overall product strategy."
3696159643,Senior/Staff/Principal Software Engineer,https://www.linkedin.com/jobs/view/3696159643,Argus Labs,https://www.linkedin.com/company/arguslabs/life," ",4 months ago,431,,Remote,,1-10 employees · Computer Games,https://media.licdn.com/dms/image/D560BAQFD0aysWfYM8A/company-logo_100_100/0/1682378045885/arguslabs_logo?e=1712188800&v=beta&t=O8-SSRDi5rKjnUogwSaEN7TyCkRMskU654j6FjDBnII,Building the future of online games through applied research in distributed systems and game design.,"At Argus Labs, we are shaping the future of video games through applied research in distributed systems and game design. We believe online game worlds should be open and interconnected, rather than closed siloes controlled by platform giants.

Argus is an MMO game developer and publisher built around a collective of hackers and designers in pursuit of the next great paradigm shift in the video game industry.

As an applied research lab with an integrated game studio/publisher, we are uniquely positioned to lead the way. We build our own games that are native to our infrastructure. This allows us to fully understand and utilize the capabilities of our platform, resulting in novel game designs built around the platform's unique power and quirks.

Backed by the best

We recently raised $10 million in seed funding led by Haun Ventures with participation from angels in tech and gaming such as Elad Gil, Balaji Srinivasan, Kevin Aluwi, Siqi Chen, etc.

Read more about who we are at https://argus.gg

Responsibilities

Design, develop, and maintain the web platform product suite, ensuring its scalability, reliability, and performance. 
Collaborate with product managers, designers, and other engineers to define and implement new features and improvements. 
Write clean, efficient, and maintainable code using modern web technologies and frameworks. 
Ensure code quality through code reviews, testing, and automation. 
Participate in the full software development lifecycle, from requirements gathering to deployment and maintenance. 
Mentor and guide junior engineers, providing technical leadership and sharing best practices. 

Requirements

Bachelor's or Master's degree in Computer Science, Engineering, or a related field. 
At least 4 years of experience in full-stack web development. 
Strong proficiency in modern web frameworks such as Node.js, React, and Next.js. 
Experience with database design and optimization, particularly with SQL and NoSQL databases. 
Strong understanding of web technologies such as HTTP, REST, and WebSocket. 
Strong problem-solving skills and ability to work independently and in a team. 
Fluent in English. 

Nice to have

Experience working in the blockchain and video game industry. 
Knowledge of UX/UI design principles and practices. 

Perks & benefits

For full-time employees

A note for the game industry veterans: no crunch :-)
Flexible PTO (2 weeks required) + holidays
100% employer-covered medical, dental, and vision insurance (US)
401k (US)
Up to $1500 desk set-up stipend
Company retreats

We’re an equal-opportunity employer. All applicants will be considered for employment without attention to race, color, religion, sex, sexual orientation, gender identity, national origin, veteran, or disability status."
3778057408,Odoo Developer & Functional,https://www.linkedin.com/jobs/view/3778057408,SIGMATECH,https://www.linkedin.com/company/sigmatechnology/life," ",1 month ago,12,,"IDR7,500,000/yr - IDR11,500,000/yr",,201-500 employees · IT Services and IT Consulting,https://media.licdn.com/dms/image/C560BAQHagndm4nW8zA/company-logo_100_100/0/1630651289082/sigmatechnology_logo?e=1712188800&v=beta&t=0tvybsVfuBKEAgLB7lz-h5ta1-k5471Zo3FUaRtGpKU,"SIGMATECH is the enterprise technology partner of choice for software development, delivering a broad range of web, mobile, and desktop controls coupled with a service-oriented approach throughout the entire application life cycle.


SIGMATECH consists of highly skilled developers specializing in agile development methodology, focusing on Mobile & Web Solution, IT Services and business enterprise, utilizing modern programming languages as our platform. SigmaTech has established itself as the trusted partner for use in mission-critical applications and service clientele from global insurance company, government agencies and large consumer product manufacturer.
…
show more","Requirements

 Having 2 years experience of Python Odoo ERP would be advantage
 Knowledge of OOP languages (Python, Golang, JS, etc.)
 Experience with SQL & No SQL Database
 Experience with Git/Repository management
 Experience with OS (Win, Linux, Unix)
 Experience with ERP systems (Odoo, SAP, Oracle) is an advantage
 Experience with website/POS/Mobile Dev is an advantage
 Manage Odoo Functional & Programmer (Mandatory)
 Individual Contributor
 xml, node.js dll (related to Odoo)
 Preferred from retail industry"
