id,title,job_url,company,company_link,location,published_at,number_of_applicants_applied,employment_duration,work_location_type,work_experience_level,company_type,company_logo,company_description,about_the_job
3620766054,Lead Software Engineer (Bangkok based – Relocation provided),https://www.linkedin.com/jobs/view/3620766054,Agoda,https://www.linkedin.com/company/agoda/life," "," ",152,,Hybrid,,"5,001-10,000 employees · Software Development",https://media.licdn.com/dms/image/C4D0BAQGBa_7QNZNwpw/company-logo_100_100/0/1656643826660/agoda_logo?e=1712188800&v=beta&t=Uch6o32VIVJnqd5pOyN6ISz8TvEijuYR_vC1w3EK8HQ,"Agoda is transforming travel for millions of customers across the globe.

Headquartered in Asia, Agoda is one of the world’s largest online travel platforms. Founded in 2005 and now part of Booking Holdings (Nasdaq:BKNG), Agoda has a network of over 2,900,000 properties worldwide. Our web and mobile products provide a first-rate reservation service in 38 languages that uniquely combines local knowledge and local connections to provide the best deals for business and leisure travelers.

Agoda employs over 7,000 professionals from 90 nationalities in locations around the globe. In every department – from engineering to customer experience – we provide an environment rich with creativity, collaboration, and experimentation, and the tools to work faster and smarter.

At Agoda, we believe our people are our strength. We work hard and have fun, and we choose people who are dedicated to making things great.

For properties seeking partnership with Agoda, visit https://connect.agoda.com
…
show more","About Agoda

Agoda is an online travel booking platform for accommodations, flights, and more. We build and deploy cutting-edge technology that connects travelers with more than 3.6 million accommodations globally. Based in Asia and part of Booking Holdings, our 6,000+ employees representing 90+ nationalities foster a work environment rich in diversity, creativity, and collaboration. We innovate through a culture of experimentation and ownership, enhancing the ability for our customers to experience the world.

Get to Know our Team:

In Agoda’s Back End Engineering department, we build the scalable, fault-tolerant systems and APIs that host our core business logic. Our systems cover all major areas of our business: inventory and pricing, product information, customer data, communications, partner data, booking systems, payments, and more. These mission-critical systems change frequently with dozens of releases per day, so we must employ state-of-the-art CI/CD and testing techniques in order to make sure everything works without any downtime. We also ensure that our systems are self-healing, responding gracefully to extreme loads or unexpected input. In order to accomplish this, we use state-of-the-art languages like Scala and Go, data technologies like Kafka and Aerospike, and agile development practices. Most importantly though, we hire great people from all around the world and empower them to be successful. Whether it’s building new projects like Flights and Packages or reimagining our existing business, you’ll make a big impact as part of the Back End Engineering team.

The Opportunity:

Agoda Platform team is looking for developers to work on mission critical systems that deals with the designing and development of a system that serves millions of users a day.

What you’ll Need to Succeed:

8+ years’ experience under your belt developing performance-critical applications that run in a production environment using Scala and Java
A minimum of one year of experience with Scala
You have RDBMS knowledge (SQL Server, Oracle, MySql or other)
You have a Good command of the English language
You are passionate about the craft of software development and constantly work to improve your knowledge and skills

It’s Great if you have:

Knowledge in one or more of the following: NoSQL (especially, but not only Cassandra), Queueing system experience (Kafka, RabbitMQ, ActiveMQ, MSMQ), Play framework, Akka library 

#sanfrancisco #sanjose #losangeles #sandiego #oakland #denver #miami #orlando #atlanta #chicago #boston #detroit #newyork #portland #philadelphia #dallas #houston #austin #seattle #sydney #melbourne #perth #toronto #vancouver #montreal #shanghai #beijing #shenzhen #prague #Brno #Ostrava #cairo #alexandria #giza #estonia #paris #berlin #munich #hamburg #stuttgart #cologne #frankfurt #hongkong #budapest #jakarta #bali #dublin #telaviv #milan #rome #tokyo #osaka #kualalumpur #amsterdam #oslo #manila #warsaw #krakow #bucharest #moscow #saintpetersburg #capetown #johannesburg #seoul #barcelona #madrid #stockholm #zurich #taipei #bangkok #Phuket #istanbul #london #manchester #edinburgh #kiev #hcmc #hanoi #wroclaw #poznan #katowice #rio #salvador #IT #4 #5

Equal Opportunity Employer 

At Agoda, we pride ourselves on being a company represented by people of all different backgrounds and orientations. We prioritize attracting diverse talent and cultivating an inclusive environment that encourages collaboration and innovation. Employment at Agoda is based solely on a person’s merit and qualifications. We are committed to providing equal employment opportunity regardless of sex, age, race, color, national origin, religion, marital status, pregnancy, sexual orientation, gender identity, disability, citizenship, veteran or military status, and other legally protected characteristics.

We will keep your application on file so that we can consider you for future vacancies and you can always ask to have your details removed from the file. For more details please read our privacy policy .

To all recruitment agencies: Agoda does not accept third party resumes. Please do not send resumes to our jobs alias, Agoda employees or any other organization location. Agoda is not responsible for any fees related to unsolicited resumes."
3620759677,Lead / Staff Software Engineer Back End (Bangkok based – Relocation provided),https://www.linkedin.com/jobs/view/3620759677,Agoda,https://www.linkedin.com/company/agoda/life," "," ",212,,Hybrid,,"5,001-10,000 employees · Software Development",https://media.licdn.com/dms/image/C4D0BAQGBa_7QNZNwpw/company-logo_100_100/0/1656643826660/agoda_logo?e=1712188800&v=beta&t=Uch6o32VIVJnqd5pOyN6ISz8TvEijuYR_vC1w3EK8HQ,"Agoda is transforming travel for millions of customers across the globe.

Headquartered in Asia, Agoda is one of the world’s largest online travel platforms. Founded in 2005 and now part of Booking Holdings (Nasdaq:BKNG), Agoda has a network of over 2,900,000 properties worldwide. Our web and mobile products provide a first-rate reservation service in 38 languages that uniquely combines local knowledge and local connections to provide the best deals for business and leisure travelers.

Agoda employs over 7,000 professionals from 90 nationalities in locations around the globe. In every department – from engineering to customer experience – we provide an environment rich with creativity, collaboration, and experimentation, and the tools to work faster and smarter.

At Agoda, we believe our people are our strength. We work hard and have fun, and we choose people who are dedicated to making things great.

For properties seeking partnership with Agoda, visit https://connect.agoda.com
…
show more","About Agoda

Agoda is an online travel booking platform for accommodations, flights, and more. We build and deploy cutting-edge technology that connects travelers with more than 3.6 million accommodations globally. Based in Asia and part of Booking Holdings, our 6,000+ employees representing 90+ nationalities foster a work environment rich in diversity, creativity, and collaboration. We innovate through a culture of experimentation and ownership, enhancing the ability for our customers to experience the world.

Get to Know Our Team

In Agoda’s Back End Engineering department, we build the scalable, fault-tolerant systems and APIs that host our core business logic. Our systems cover all major areas of our business: inventory and pricing, product information, customer data, communications, partner data, booking systems, payments, FinTech and more. These mission-critical systems change frequently with dozens of releases per day, so we must employ state-of-the-art CI/CD and testing techniques in order to make sure everything works without any downtime. We also ensure that our systems are self-healing, responding gracefully to extreme loads or unexpected input. In order to accomplish this, we use state-of-the-art languages like Scala and Go, data technologies like Kafka and Spark, and agile development practices. Most importantly though, we hire great people from all around the world and empower them to be successful. Whether it’s building new projects like Flights and Packages or reimagining our existing business, you’ll make a big impact as part of the Back End Engineering team.

The Opportunity

You might call yourself “full stack” or “back end” or you might consider yourself an authority in a certain field, but you have a keen interest in how the different systems work together.

We’d love to hear from you if you are skilled in any of the technologies we work with (note – we are not looking for you to have them all). We are interested in speaking to persons of any level from individuals just starting their IT careers to experts in their field, although this particular position is better suitable to veteran engineers, with expertise in certain technologies, and especially those that had lead projects, initiatives and/or teams.

In This Role, You’ll Get to

Think and own the full life cycle of our products, not just a single piece of code – from business requirements, technology selection, coding standards, agile development, unit and application testing, to CI/CD and proper monitoring
Design, develop and maintain platforms across the back end area
Improve scalability, stability, and efficiency of our existing systems
Write great code and help others write great code
Collaborate with other teams and departments

What You’ll Need To Succeed

7+ years’ experience under your belt developing performance-critical applications that run in a production environment using Scala, Java or C#
Experience in leading projects, initiatives and/or teams, with full ownership of the systems involved
Data platforms like SQL, Cassandra or Hadoop. You understand that different applications have different data requirements
Good understanding of algorithms and data structures
Strong coding ability
You are passionate about the craft of software development and constantly work to improve your knowledge and skills
Excellent verbal and written English communication skills

It’s Great If You Have

Experience with Scrum/Agile development methodologies
Experience building large-scale distributed products
Core engineering infrastructure tools like Git for source control, TeamCity for Continuous Integration and Puppet for deployment
Hands-on experience working with technology like queueing systems (Kafka, RabbitMQ, ActiveMQ, MSMQ), Spark, Hadoop, NoSQL (Cassandra, MongoDB), Play framework, Akka library 

#sanfrancisco #sanjose #losangeles #sandiego #oakland #denver #miami #orlando #atlanta #chicago #boston #detroit #newyork #portland #philadelphia #dallas #houston #austin #seattle #sydney #melbourne #perth #toronto #vancouver #montreal #shanghai #beijing #shenzhen #prague #Brno #Ostrava #cairo #alexandria #giza #estonia #paris #berlin #munich #hamburg #stuttgart #cologne #frankfurt #hongkong #budapest #jakarta #bali #dublin #telaviv #milan #rome #tokyo #osaka #kualalumpur #amsterdam #oslo #manila #warsaw #krakow #bucharest #moscow #saintpetersburg #capetown #johannesburg #seoul #barcelona #madrid #stockholm #zurich #taipei #bangkok #Phuket #istanbul #london #manchester #edinburgh #kiev #hcmc #hanoi #wroclaw #poznan #katowice #rio #salvador #IT #4 #5

Equal Opportunity Employer 

At Agoda, we pride ourselves on being a company represented by people of all different backgrounds and orientations. We prioritize attracting diverse talent and cultivating an inclusive environment that encourages collaboration and innovation. Employment at Agoda is based solely on a person’s merit and qualifications. We are committed to providing equal employment opportunity regardless of sex, age, race, color, national origin, religion, marital status, pregnancy, sexual orientation, gender identity, disability, citizenship, veteran or military status, and other legally protected characteristics.

We will keep your application on file so that we can consider you for future vacancies and you can always ask to have your details removed from the file. For more details please read our privacy policy .

To all recruitment agencies: Agoda does not accept third party resumes. Please do not send resumes to our jobs alias, Agoda employees or any other organization location. Agoda is not responsible for any fees related to unsolicited resumes."
3742049531,Staff/ Lead Software Engineer (FinTech) [Bangkok based – Relocation provided],https://www.linkedin.com/jobs/view/3742049531,Agoda,https://www.linkedin.com/company/agoda/life," "," ",88,,Hybrid,,"5,001-10,000 employees · Software Development",https://media.licdn.com/dms/image/C4D0BAQGBa_7QNZNwpw/company-logo_100_100/0/1656643826660/agoda_logo?e=1712188800&v=beta&t=Uch6o32VIVJnqd5pOyN6ISz8TvEijuYR_vC1w3EK8HQ,"Agoda is transforming travel for millions of customers across the globe.

Headquartered in Asia, Agoda is one of the world’s largest online travel platforms. Founded in 2005 and now part of Booking Holdings (Nasdaq:BKNG), Agoda has a network of over 2,900,000 properties worldwide. Our web and mobile products provide a first-rate reservation service in 38 languages that uniquely combines local knowledge and local connections to provide the best deals for business and leisure travelers.

Agoda employs over 7,000 professionals from 90 nationalities in locations around the globe. In every department – from engineering to customer experience – we provide an environment rich with creativity, collaboration, and experimentation, and the tools to work faster and smarter.

At Agoda, we believe our people are our strength. We work hard and have fun, and we choose people who are dedicated to making things great.

For properties seeking partnership with Agoda, visit https://connect.agoda.com
…
show more","About Agoda

Agoda is an online travel booking platform for accommodations, flights, and more. We build and deploy cutting-edge technology that connects travelers with more than 3.6 million accommodations globally. Based in Asia and part of Booking Holdings, our 6,000+ employees representing 90+ nationalities foster a work environment rich in diversity, creativity, and collaboration. We innovate through a culture of experimentation and ownership, enhancing the ability for our customers to experience the world.

 Get to Know Our Team 

Fintech is one of the fastest growing areas in Agoda and we are rapidly expanding our tech team. We work closely with the finance business team and our Fintech product owners to reduce risk, drive efficiencies and move on new market opportunities in this exciting field. We have a wide range of projects from traditional finance or cutting-edge customer fintech. For example, reconciliation using Big Data technologies, growing and optimising customer payments options, tax calculations in milli-second response times and a mesh of supplier payment options like vertical credit cards. Its a hot field and the perfect mix of data engineering and backend engineering.

 The Opportunity 

We are looking for engineers with experience in the fintech area. This can be a year or two at a fintech startup right through to an expert in this domain. You might have a background as ‘ back end ’ or ‘data’ engineer , either way we are looking for smart engineers who can be super agile, move fast and have an eye for detail. We’d love to hear from you if you are skilled in any of the technologies we work with and excited at building new fintech techonology.

 In This Role, You’ll Get to 

 Think and own the full life cycle of our products, not just a single piece of code – from business requirements, technology selection , coding standards, agile development, unit and application testing , to CI/CD and proper monitoring 
 Design, develop and maintain platforms and data pipelines across fintech 
 Improve scalability, stability, and efficiency of our existing systems 
 Write great code and help others write great code – mentor people in your team and wider 
 Collaborate with other teams and departments 
Help us hire extraordinary talent such as yourself!

What You’ll Need To Succeed

6+ years’ experience under your belt developing performance-critical applications that run in a production environment using Scala, Java or C#
 Data platforms like Hadoop and SQL. Understand that different applications have different data requirements. 
 Good understanding of algorithms and data structure s 
Strong c oding ability 
You are passionate about the craft of software development and constantly work to improve your knowledge and skills 
Experience with Scrum/Agile development methodologies
Excellent verbal and written English communication skills 

 It’s Great If You Have 

 Experience working in a modern FinTech or Payments organization. 
 Domain knowledge in any of these areas: financial reconciliation, financial reporting, tax, payout methods like vertical credit cards or customer payments. 
 Hands -on experience working with technologies like Spark for data processing, ETLs for data pipelines and q ueueing system s (Kafka, RabbitMQ ). 
 Experience building and running transactional/financial systems 
 Core engineering infrastructure tools like Git Lab for source control and Continuous Integration , Kubernetes, and Puppet for deployment 
 Experience in large-scale distributed designs 
 Experience in leading projects, initiatives and/or teams, with full ownership of the systems involved 

#sanfrancisco #sanjose #losangeles #sandiego #oakland #denver #miami #orlando #atlanta #chicago #boston #detroit #newyork #portland #philadelphia #dallas #houston #austin #seattle #sydney #melbourne #perth #toronto #vancouver #montreal #shanghai #beijing #shenzhen #prague #Brno #Ostrava #cairo #alexandria #giza #estonia #paris #berlin #munich #hamburg #stuttgart #cologne #frankfurt #hongkong #budapest #jakarta #bali #dublin #telaviv #milan #rome #tokyo #osaka #kualalumpur #amsterdam #oslo #manila #warsaw #krakow #bucharest #moscow #saintpetersburg #capetown #johannesburg #seoul #barcelona #madrid #stockholm #zurich #taipei #bangkok #Phuket #istanbul #london #manchester #edinburgh #kiev #hcmc #hanoi #wroclaw #poznan #katowice #rio #salvador #IT #4 #5 

Equal Opportunity Employer 

At Agoda, we pride ourselves on being a company represented by people of all different backgrounds and orientations. We prioritize attracting diverse talent and cultivating an inclusive environment that encourages collaboration and innovation. Employment at Agoda is based solely on a person’s merit and qualifications. We are committed to providing equal employment opportunity regardless of sex, age, race, color, national origin, religion, marital status, pregnancy, sexual orientation, gender identity, disability, citizenship, veteran or military status, and other legally protected characteristics.

We will keep your application on file so that we can consider you for future vacancies and you can always ask to have your details removed from the file. For more details please read our privacy policy .

To all recruitment agencies: Agoda does not accept third party resumes. Please do not send resumes to our jobs alias, Agoda employees or any other organization location. Agoda is not responsible for any fees related to unsolicited resumes."
