id,title,job_url,company,company_link,location,published_at,number_of_applicants_applied,employment_duration,work_location_type,work_experience_level,company_type,company_logo,company_description,about_the_job
3500671412,"Lead / Staff Full Stack Software Engineer (Bangkok based, relocation provided)",https://www.linkedin.com/jobs/view/3500671412,Agoda,https://www.linkedin.com/company/agoda/life," "," ",142,,Full-time,,"5,001-10,000 employees · Software Development",https://media.licdn.com/dms/image/C4D0BAQGBa_7QNZNwpw/company-logo_100_100/0/1656643826660/agoda_logo?e=1712188800&v=beta&t=Uch6o32VIVJnqd5pOyN6ISz8TvEijuYR_vC1w3EK8HQ,"Agoda is transforming travel for millions of customers across the globe.

Headquartered in Asia, Agoda is one of the world’s largest online travel platforms. Founded in 2005 and now part of Booking Holdings (Nasdaq:BKNG), Agoda has a network of over 2,900,000 properties worldwide. Our web and mobile products provide a first-rate reservation service in 38 languages that uniquely combines local knowledge and local connections to provide the best deals for business and leisure travelers.

Agoda employs over 7,000 professionals from 90 nationalities in locations around the globe. In every department – from engineering to customer experience – we provide an environment rich with creativity, collaboration, and experimentation, and the tools to work faster and smarter.

At Agoda, we believe our people are our strength. We work hard and have fun, and we choose people who are dedicated to making things great.

For properties seeking partnership with Agoda, visit https://connect.agoda.com
…
show more","About Agoda

Agoda is an online travel booking platform for accommodations, flights, and more. We build and deploy cutting-edge technology that connects travelers with more than 3.6 million accommodations globally. Based in Asia and part of Booking Holdings, our 6,000+ employees representing 90+ nationalities foster a work environment rich in diversity, creativity, and collaboration. We innovate through a culture of experimentation and ownership, enhancing the ability for our customers to experience the world.

Get to Know our Team:

The Full Stack Engineering Department builds the Agoda web and app products. We have several teams in front-end focusing on different aspects of our products including accommodations, flights, payments, marketing, post-booking services, and more. Agoda’s marketplace is the world. We build localized and optimized user experiences at scale on every major internet platform. These include our mobile websites, native apps, and desktop sites. We hire people from around the world who have a passion for using technology to create and implement the best user experiences. Our teams work on the full stack and build end-to-end systems including user interfaces, APIs, backend systems, and database systems. Our products are always evolving and under experimentation. We accomplish this by having an amazing degree of automation, CI/CD systems, and use a modularized approach. As we are data driven and measure our results, we continually innovate and improve our work. We are looking for the next great talent who strives to learn and grow and has a standard of excellence, strong sense of ownership, and great technical skills.

The Opportunity:

Lead / Staff engineer is the key role in our technology organization working together with individual contributors and senior leadership. Our Lead engineers are heavily involved in the hiring and mentoring process and are the go-to people who design and implement new systems and components. We are looking for people who are passionate to take on more responsibility and driving major architectural changes in Agoda. It’s expected from you in this role as Lead / Staff engineer to push Agoda forward technically by adopting new technologies and setting higher standards.

In this Role, you’ll get to:

Maintain ownership and responsibility of mission critical systems
Be hands on – build high volume platforms using cutting-edge technologies like React and GraphQL
Mentor and coach other software engineers
Be a major contributor to our agile and scrum practices
Design and lead crucial technical projects and initiatives cross teams and departments
Stay on the leading edge of technical know-how, industry trends and drive technical innovations

What you’ll Need to Succeed:

7 years of experience developing web applications in client-side frameworks such as React, Angular, VueJS, etc. 6+ years preferred
B.S. in Computer Science or quantitative field; M.S. preferred
Working experience with agile, analytics, A/B testing and/or feature flags, Continuous Delivery, Trunk-based Development
Excellent HTML/CSS skills – you understand not only how to build the data, but how to make it look great too
Excellent understanding of object-oriented JavaScript, TypeScript
You love new technologies and approaches and want to use the best tools available. We want people who can help us continually evolve our stack
Great communication and coordination skills
Excellent analytical thinking and problem-solving skills
You have a good command of the English language

It’s Great if you have:

Knowledge in physical architecture at scale, building resilient, no single point of failures, highly available solutions
Knowledge in one or more of the following: NoSQL technologies (Cassandra, ScyllaDB, ElasticSearch, Redis, DynamoDB, etc), Queueing system experience (Kafka, RabbitMQ, SQS, Azure Service Bus, etc)
Working Experience with Containers and Dockerization, also K8S is a plus
Knowledge and hands on experience in CI/CD solutions would be a plus
Strong experience in all aspects of client-side performance optimization,
Extremely proficient in modern coding and design practices. For example, Clean Code, SOLID principals, and TDD
Experience in multiple front-end platforms including iOS, Android, Web, and API services
Have worked on an app or internet company that is at scale with large numbers of users and transactions per second
Have experience in a data driven company with experience analyzing and working with Big Data
Lead teams and greenfield projects solving large system problems
Worked on global projects serving world markets with distributed data centers and localization of the front end and data

This position is based in Bangkok, Thailand (Relocation Provided)

#sanfrancisco #sanjose #losangeles #sandiego #oakland #denver #miami #orlando #atlanta #chicago #boston #detroit #newyork #portland #philadelphia #dallas #houston #austin #seattle #sydney #melbourne #perth #toronto #vancouver #montreal #shanghai #beijing #shenzhen #prague #Brno #Ostrava #cairo #alexandria #giza #estonia #paris #berlin #munich #hamburg #stuttgart #cologne #frankfurt #hongkong #budapest #jakarta #bali #dublin #telaviv #milan #rome #tokyo #osaka #kualalumpur #amsterdam #oslo #manila #warsaw #krakow #bucharest #moscow #saintpetersburg #capetown #johannesburg #seoul #barcelona #madrid #stockholm #zurich #taipei #bangkok #Phuket #istanbul #london #manchester #edinburgh #kiev #hcmc #hanoi #wroclaw #poznan #katowice #rio #salvador #IT #ENG #4

Equal Opportunity Employer 

At Agoda, we pride ourselves on being a company represented by people of all different backgrounds and orientations. We prioritize attracting diverse talent and cultivating an inclusive environment that encourages collaboration and innovation. Employment at Agoda is based solely on a person’s merit and qualifications. We are committed to providing equal employment opportunity regardless of sex, age, race, color, national origin, religion, marital status, pregnancy, sexual orientation, gender identity, disability, citizenship, veteran or military status, and other legally protected characteristics.

We will keep your application on file so that we can consider you for future vacancies and you can always ask to have your details removed from the file. For more details please read our privacy policy .

To all recruitment agencies: Agoda does not accept third party resumes. Please do not send resumes to our jobs alias, Agoda employees or any other organization location. Agoda is not responsible for any fees related to unsolicited resumes."
3788455589,"Lead Software Engineer, Trilogy (Remote) - $100,000/year USD",https://www.linkedin.com/jobs/view/3788455589,Crossover ,https://www.linkedin.com/company/crossover/life," "," ",27,,Remote,,"5,001-10,000 employees · IT Services and IT Consulting",https://media.licdn.com/dms/image/C4E0BAQG8bdX5sQ24KQ/company-logo_100_100/0/1630619679689/crossover__logo?e=1712188800&v=beta&t=s4G-ZkvEHeTnm-GLxEoEkbWxJ5Zto3Ts13geqBcmduU,"Crossover is the world's largest database of skilled remote talent (7 million users and counting!)

We help amazing professionals all over the world prove that they're just as good as anyone in Silicon Valley—𝘢𝘯𝘥 𝘥𝘦𝘴𝘦𝘳𝘷𝘦 𝘵𝘩𝘦 𝘴𝘢𝘮𝘦 𝘱𝘢𝘺𝘤𝘩𝘦𝘤𝘬.

Like the Olympics, it's hard to qualify... but it's worth it!
Have you got what it takes to join the 5,000+ people from 130+ countries that we've recruited for high-paying full-time remote jobs?

𝐇𝐄𝐋𝐏𝐅𝐔𝐋 𝐋𝐈𝐍𝐊𝐒:
🧑 Reviews from people we've hired: crossover.com/people-at-crossover
💼 Current openings: crossover.com/jobs
💎 Hire someone for your company: crossover.com/hire
♟️ How the process works: crossover.com/selection-process
❓ FAQs: crossover.com/help-and-faqs
~~~
𝑵𝒐𝒕𝒆: Crossover jobs are are fully compliant with LinkedIn's policies, as well as the applicable laws in every country where we advertise.

Allow us to clarify some common misconceptions:
1) The reason we post so many job ads is because LinkedIn organizes all job postings by location. So, the only way to reach candidates all over the world is to post multiple ads in every city you want to hire from. Most recruiters don't bother because it's too time consuming... but we're not most recruiters.
2) We mostly recruit independent contractors, not employees, because labor laws vary so much from one country to another that it's near-impossible to recruit globally otherwise (which is why it's still uncommon even though most jobs can now be done remotely).
3) As is standard for any self-employed person, the stated pay is the entire compensation package. Because they are not employees, each contractor is responsible for handling the things that an employer would take care of e.g. taxes, equipment, vacation time, health insurance. One of the major reasons that Crossover jobs pay so much more than local jobs is to overcompensate for these costs.

It's hard, but it's worth it!
…
show more","Crossover is the world's #1 source of full-time remote jobs. Our clients offer top-tier pay for top-tier talent. We're recruiting this role for our client, Trilogy. Have you got what it takes?

Are you a software engineer that thrives on complex challenges and is eager to make a real impact? Join our team where you'll be contributing to our strategic product line, that’s looking to reshape industries and change the way people work and learn.

Our strategic product line includes:

Crossover: An AI-powered hiring platform that sifts through millions of applicants per year to find the top 1% of global remote talent. We're breaking down geographical barriers and making high-paying jobs accessible to professionals worldwide, regardless of their location.
gt.school: An online education platform that uses advanced data collection, algorithms, and AI-generated content to empower students to learn at their own pace. Our adaptive learning system fills knowledge gaps, accelerates learning, and helps students master a whole grade level on a subject within weeks.
Data-driven Sales: This initiative leverages data and AI algorithms to streamline the sales process across a portfolio of over 100 software products. We're transitioning these products to a unified platform based on Salesforce and NetSuite, all while handling complex data imports, synchronization, modeling divergences and data inconsistencies.

What we offer:

The opportunity to work with cutting-edge technologies, including the latest in AWS serverless and no-code/low-code patterns.
The opportunity to learn and experiment with using generative AI to boost your productivity.
A team of exceptionally talented engineers from around the world as your peers.
The chance to work on products that are reshaping industries and making a difference in people's lives.

We're not just using AI as a buzzword. We're at the start of a thrilling journey with generative AI, experimenting and learning to fully leverage its potential and free our engineers from mundane tasks, allowing them to focus on what truly matters: design, decision-making, and understanding the far-reaching implications of different implementation strategies.

Showcase your skills, not just your resume. Take on our challenges: 15-min Cognitive, 90-min Coding, 120-min Technical Decision-Making. Excel and you'll face a decisive interview with our Hiring Manager. More than half walk away with an offer. Ready to unleash your potential? Apply today!

What You Will Be Doing

Developing cloud-native backends and implementing data processing algorithms using the latest serverless cloud patterns, including AWS.
Review code to ensure adherence to best practices, team standards, and customer requirements.

What You Won’t Be Doing

Spending time on minor bug fixes or features in outdated codebases.
Dealing with tedious infrastructure to keep poorly written products running.
Getting stuck in endless meetings discussing roadmaps and priorities or chasing people around.

Basic Requirements

Lead Software Engineer key responsibilities

At least 4 years of experience writing production code for the server side of web applications.
At least 2 years of experience being the primary technical contributor for a development team OR software product.
At least 1 year of hands-on experience developing using cloud patterns (any cloud vendor).
An openness to learn to use generative AI in your day-to-day development work.

Nice-to-have Requirements

Experience in using generative AI in your day-to-day development work.

About Trilogy

Hundreds of software businesses run on the Trilogy Business Platform. For three decades, Trilogy has been known for 3 things: Relentlessly seeking top talent, Innovating new technology, and incubating new businesses. Our technological innovation is spearheaded by a passion for simple customer-facing designs. Our incubation of new businesses ranges from entirely new moon-shot ideas to rearchitecting existing projects for today's modern cloud-based stack. Trilogy is a place where you can be surrounded with great people, be proud of doing great work, and grow your career by leaps and bounds.

There is so much to cover for this exciting role, and space here is limited. Hit the Apply button if you found this interesting and want to learn more. We look forward to meeting you!

Working with Crossover

This is a full-time (40 hours per week), long-term position. The position is immediately available and requires entering into an independent contractor agreement with Crossover. The compensation level for this role is $50 USD/hour, which equates to $100,000 USD/year assuming 40 hours per week and 50 weeks per year. The payment period is weekly. Consult www.crossover.com/help-and-faqs for more details on this topic.

What to expect next:

You will receive an email with a link to start your self-paced, online job application.
Our hiring platform will guide you through a series of online “screening” assessments to check for basic job fit, job-related skills, and finally a few real-world job-specific assignments.

Important! If you do not receive an email from us:

First, emails may take up to 15 minutes to send, refresh and check again.
Second, check your spam and junk folders for an email from Crossover.com, mark as “Not Spam” since you will receive other emails as well.
Third, we will send to whatever email account you indicated on the Apply form - by default, that is the email address you use as your LinkedIn username and it might be different than the one you have already checked.
If all else fails, just reset your password by visiting https://www.crossover.com/auth/password-recovery if you already applied using LinkedIn EasyApply.

Crossover Job Code: LJ-4358-ID-Surabaya-LeadSoftwareEn.006"
3788458292,"Senior Software Engineer, Trilogy (Remote) - $100,000/year USD",https://www.linkedin.com/jobs/view/3788458292,Crossover ,https://www.linkedin.com/company/crossover/life," "," ",33,,Remote,,"5,001-10,000 employees · IT Services and IT Consulting",https://media.licdn.com/dms/image/C4E0BAQG8bdX5sQ24KQ/company-logo_100_100/0/1630619679689/crossover__logo?e=1712188800&v=beta&t=s4G-ZkvEHeTnm-GLxEoEkbWxJ5Zto3Ts13geqBcmduU,"Crossover is the world's largest database of skilled remote talent (7 million users and counting!)

We help amazing professionals all over the world prove that they're just as good as anyone in Silicon Valley—𝘢𝘯𝘥 𝘥𝘦𝘴𝘦𝘳𝘷𝘦 𝘵𝘩𝘦 𝘴𝘢𝘮𝘦 𝘱𝘢𝘺𝘤𝘩𝘦𝘤𝘬.

Like the Olympics, it's hard to qualify... but it's worth it!
Have you got what it takes to join the 5,000+ people from 130+ countries that we've recruited for high-paying full-time remote jobs?

𝐇𝐄𝐋𝐏𝐅𝐔𝐋 𝐋𝐈𝐍𝐊𝐒:
🧑 Reviews from people we've hired: crossover.com/people-at-crossover
💼 Current openings: crossover.com/jobs
💎 Hire someone for your company: crossover.com/hire
♟️ How the process works: crossover.com/selection-process
❓ FAQs: crossover.com/help-and-faqs
~~~
𝑵𝒐𝒕𝒆: Crossover jobs are are fully compliant with LinkedIn's policies, as well as the applicable laws in every country where we advertise.

Allow us to clarify some common misconceptions:
1) The reason we post so many job ads is because LinkedIn organizes all job postings by location. So, the only way to reach candidates all over the world is to post multiple ads in every city you want to hire from. Most recruiters don't bother because it's too time consuming... but we're not most recruiters.
2) We mostly recruit independent contractors, not employees, because labor laws vary so much from one country to another that it's near-impossible to recruit globally otherwise (which is why it's still uncommon even though most jobs can now be done remotely).
3) As is standard for any self-employed person, the stated pay is the entire compensation package. Because they are not employees, each contractor is responsible for handling the things that an employer would take care of e.g. taxes, equipment, vacation time, health insurance. One of the major reasons that Crossover jobs pay so much more than local jobs is to overcompensate for these costs.

It's hard, but it's worth it!
…
show more","Crossover is the world's #1 source of full-time remote jobs. Our clients offer top-tier pay for top-tier talent. We're recruiting this role for our client, Trilogy. Have you got what it takes?

Are you a full-stack engineer who thrives on complex challenges and is eager to make a real impact? Join our team to contribute to innovative products that deeply leverage AI and that are reshaping industries and changing the way we work and learn.

Our strategic product line includes:

Crossover: An AI-powered hiring platform that sifts through millions of applicants per year to find the top 1% of global remote talent, making high-paying jobs accessible to professionals worldwide, regardless of their location.
gt.school: An online education platform that uses advanced data collection, algorithms, and AI-generated content to empower students learn at their own pace. Our adaptive learning system fills knowledge gaps, accelerates learning, and helps students quickly master a whole grade level on a subject within weeks.
Data-driven Sales: This initiative leverages data and AI algorithms to streamline the sales process across a portfolio of over 100 software products. We're transitioning these products to a unified platform based on Salesforce and NetSuite, all while handling complex data imports, modeling divergences and data synchronization.

What we offer:

The opportunity to work with cutting-edge technologies, including the latest in Angular, AWS serverless and no-code/low-code patterns.
The opportunity to learn and experiment with using generative AI to boost your productivity.
A team of exceptionally talented engineers from around the world as your peers.
The chance to work on products that are making a real difference in people's lives.

We're not just using AI as a buzzword. We're at the start of a thrilling journey with generative AI, experimenting and learning to fully leverage its potential and free our engineers from mundane tasks, allowing them to focus on what truly matters: design, decision-making, and understanding the far-reaching implications of different implementation strategies.

Showcase your skills, not just your resume. Take on our challenges: 15-min Cognitive, 90-min Coding, 180-min Technical Decision-Making. Excel and you'll face a decisive interview with our Hiring Manager. More than half walk away with an offer. Ready to unleash your potential? Apply today!

What You Will Be Doing

Building modern web apps using Angular accompanied by top-notch libraries and tools.
Enhancing cloud-native backends using the latest serverless cloud patterns, including AWS.
Reviewing code to ensure adherence to best practices, team standards, and customer requirements.

What You Won’t Be Doing

Spending time on minor bug fixes or features in outdated codebases.
Dealing with tedious infrastructure to keep poorly written products running.
Getting stuck in endless meetings discussing roadmaps and priorities or chasing people around.

Basic Requirements

Senior Software Engineer key responsibilities

At least 3 years of experience writing frontend code (any framework)
At least 1 year of experience writing frontend code in Angular.
At least 3 years of experience writing backend code (any framework).
An openness to learn to use generative AI in your day-to-day development work.

Nice-to-have Requirements

Experience in using generative AI in your day-to-day development work.

About Trilogy

Hundreds of software businesses run on the Trilogy Business Platform. For three decades, Trilogy has been known for 3 things: Relentlessly seeking top talent, Innovating new technology, and incubating new businesses. Our technological innovation is spearheaded by a passion for simple customer-facing designs. Our incubation of new businesses ranges from entirely new moon-shot ideas to rearchitecting existing projects for today's modern cloud-based stack. Trilogy is a place where you can be surrounded with great people, be proud of doing great work, and grow your career by leaps and bounds.

There is so much to cover for this exciting role, and space here is limited. Hit the Apply button if you found this interesting and want to learn more. We look forward to meeting you!

Working with Crossover

This is a full-time (40 hours per week), long-term position. The position is immediately available and requires entering into an independent contractor agreement with Crossover. The compensation level for this role is $50 USD/hour, which equates to $100,000 USD/year assuming 40 hours per week and 50 weeks per year. The payment period is weekly. Consult www.crossover.com/help-and-faqs for more details on this topic.

What to expect next:

You will receive an email with a link to start your self-paced, online job application.
Our hiring platform will guide you through a series of online “screening” assessments to check for basic job fit, job-related skills, and finally a few real-world job-specific assignments.

Important! If you do not receive an email from us:

First, emails may take up to 15 minutes to send, refresh and check again.
Second, check your spam and junk folders for an email from Crossover.com, mark as “Not Spam” since you will receive other emails as well.
Third, we will send to whatever email account you indicated on the Apply form - by default, that is the email address you use as your LinkedIn username and it might be different than the one you have already checked.
If all else fails, just reset your password by visiting https://www.crossover.com/auth/password-recovery if you already applied using LinkedIn EasyApply.

Crossover Job Code: LJ-4774-ID-Surabaya-SeniorSoftware.001"
