id,title,job_url,company,company_link,location,published_at,number_of_applicants_applied,employment_duration,work_location_type,work_experience_level,company_type,company_logo,company_description,about_the_job
3796783597,"AI-Augmented Software Developer, Trilogy (Remote) - $200,000/year USD",https://www.linkedin.com/jobs/view/3796783597,Crossover ,https://www.linkedin.com/company/crossover/life," ",1 day ago,6,,Remote,,"5,001-10,000 employees · IT Services and IT Consulting",https://media.licdn.com/dms/image/C4E0BAQG8bdX5sQ24KQ/company-logo_100_100/0/1630619679689/crossover__logo?e=1712188800&v=beta&t=s4G-ZkvEHeTnm-GLxEoEkbWxJ5Zto3Ts13geqBcmduU,"Crossover is the world's largest database of skilled remote talent (7 million users and counting!)

We help amazing professionals all over the world prove that they're just as good as anyone in Silicon Valley—𝘢𝘯𝘥 𝘥𝘦𝘴𝘦𝘳𝘷𝘦 𝘵𝘩𝘦 𝘴𝘢𝘮𝘦 𝘱𝘢𝘺𝘤𝘩𝘦𝘤𝘬.

Like the Olympics, it's hard to qualify... but it's worth it!
Have you got what it takes to join the 5,000+ people from 130+ countries that we've recruited for high-paying full-time remote jobs?

𝐇𝐄𝐋𝐏𝐅𝐔𝐋 𝐋𝐈𝐍𝐊𝐒:
🧑 Reviews from people we've hired: crossover.com/people-at-crossover
💼 Current openings: crossover.com/jobs
💎 Hire someone for your company: crossover.com/hire
♟️ How the process works: crossover.com/selection-process
❓ FAQs: crossover.com/help-and-faqs
~~~
𝑵𝒐𝒕𝒆: Crossover jobs are are fully compliant with LinkedIn's policies, as well as the applicable laws in every country where we advertise.

Allow us to clarify some common misconceptions:
1) The reason we post so many job ads is because LinkedIn organizes all job postings by location. So, the only way to reach candidates all over the world is to post multiple ads in every city you want to hire from. Most recruiters don't bother because it's too time consuming... but we're not most recruiters.
2) We mostly recruit independent contractors, not employees, because labor laws vary so much from one country to another that it's near-impossible to recruit globally otherwise (which is why it's still uncommon even though most jobs can now be done remotely).
3) As is standard for any self-employed person, the stated pay is the entire compensation package. Because they are not employees, each contractor is responsible for handling the things that an employer would take care of e.g. taxes, equipment, vacation time, health insurance. One of the major reasons that Crossover jobs pay so much more than local jobs is to overcompensate for these costs.

It's hard, but it's worth it!","Crossover is the world's #1 source of full-time remote jobs. Our clients offer top-tier pay for top-tier talent. We're recruiting this role for our client, Trilogy. Have you got what it takes?

Are you a seasoned software engineer with a deep interest in AI? Trilogy is on the lookout for exceptional engineers to lead the charge in adopting generative AI tools both in our development process and into our products.

Join us to work on our exciting product portfolio:

TeachTap: Bringing historical figures to life using AI, offering an engaging, TikTok-like learning experience to make learning more relevant and fun.
Educational Content Generation: Utilizing the latest in generative AI combined with comprehensive learning materials to create captivating content.
TeachTower: A game-based motivation system inspired by popular games like Roblox and Minecraft, designed to make learning irresistibly fun.
Coachbot: A learning copilot that integrates with existing apps, guiding learning paths, recommending next steps, and rewarding daily progress.
Data-driven Sales: A sales platform that leverages AI to provide real-time guidance to agents during calls, create personalized renewal plans, and quality control sales calls.
Crossover: An AI-powered hiring platform that sifts through millions of applicants annually to find the top 1% of global talent.

Your role will focus on integrating AI into engineering practices, using AI tools to increase efficiency and solve engineering tasks like coding and testing. Based on the obtained results, you will derive recipes and playbooks to be adopted by the broader engineering team. Maintaining high-quality standards in our codebases while ensuring high leverage of AI tools across our engineering teams will be a key part of your work.

You will be an integral part of our existing engineering team, working collaboratively on our suite of products to deeply understand our environment and needs. You will have the freedom to propose and experiment with new tools and then will leverage the insights and experiences obtained to evolve our processes, advocate for new tool adoption, or even spearhead the creation of small tools, bots, and frameworks to enhance our technical setup.

We seek candidates with a strong background in software engineering and a capacity for adapting to new technologies. Moreover, an interest in the latest generative AI developments and a drive for innovation are crucial. While our primary tech stack is AWS Serverless with TypeScript, we're looking for versatile engineers who can excel in a variety of technical environments and challenges.

What You Will Be Doing

Developing fully functional features, using AI tools to expedite delivery and enhance quality.
Performing experiments with AI to enhance engineering processes, including decomposition, solution design, code generation, and troubleshooting.
Documenting best practices and techniques in guides that enable others to harness the power of generative AI effectively.

What You Won’t Be Doing

Building new AI models from scratch; instead, your focus will be on leveraging and fine-tuning existing models to maximize efficiency.
Being confined to outdated technologies; we encourage an environment that thrives on dynamic tech stacks, fostering continuous innovation.

AI-Augmented Software Developer Key Responsibilities

Drive transformative change by establishing a framework that seamlessly integrates generative AI, significantly amplifying engineering productivity.

Basic Requirements

Minimum 5 years of experience in professional software development.
Minimum 3 years either as a lead engineer reviewing the work of other engineers or as an architect making important technical decisions.
Excited to use and explore new generative AI tools for software engineering tasks on a day-to-day basis

About Trilogy

Hundreds of software businesses run on the Trilogy Business Platform. For three decades, Trilogy has been known for 3 things: Relentlessly seeking top talent, Innovating new technology, and incubating new businesses. Our technological innovation is spearheaded by a passion for simple customer-facing designs. Our incubation of new businesses ranges from entirely new moon-shot ideas to rearchitecting existing projects for today's modern cloud-based stack. Trilogy is a place where you can be surrounded with great people, be proud of doing great work, and grow your career by leaps and bounds.

There is so much to cover for this exciting role, and space here is limited. Hit the Apply button if you found this interesting and want to learn more. We look forward to meeting you!

Working with Crossover

This is a full-time (40 hours per week), long-term position. The position is immediately available and requires entering into an independent contractor agreement with Crossover. The compensation level for this role is $100 USD/hour, which equates to $200,000 USD/year assuming 40 hours per week and 50 weeks per year. The payment period is weekly. Consult www.crossover.com/help-and-faqs for more details on this topic.

What to expect next:

You will receive an email with a link to start your self-paced, online job application.
Our hiring platform will guide you through a series of online “screening” assessments to check for basic job fit, job-related skills, and finally a few real-world job-specific assignments.

Important! If you do not receive an email from us:

First, emails may take up to 15 minutes to send, refresh and check again.
Second, check your spam and junk folders for an email from Crossover.com, mark as “Not Spam” since you will receive other emails as well.
Third, we will send to whatever email account you indicated on the Apply form - by default, that is the email address you use as your LinkedIn username and it might be different than the one you have already checked.
If all else fails, just reset your password by visiting https://www.crossover.com/auth/password-recovery if you already applied using LinkedIn EasyApply.

Crossover Job Code: LJ-5106-ID-Surabaya-AIAugmentedSof.009"
3785279691,"Senior Software Engineer, iOS",https://www.linkedin.com/jobs/view/3785279691,Grab,https://www.linkedin.com/company/grabapp/life," ",,41,,Full-time,,"5,001-10,000 employees · Software Development",https://media.licdn.com/dms/image/C510BAQGDlPEJILPXbw/company-logo_100_100/0/1630575649647/grabapp_logo?e=1712188800&v=beta&t=LiVprA_nhthcshlCZ9nefFuRlvv-7yPlWzXhmwynrW0,"Grab is Southeast Asia’s leading superapp, offering a suite of services consisting of deliveries, mobility, financial services, enterprise and others. Grabbers come from all over the world, and we are united by a common mission: to drive Southeast Asia forward by creating economic empowerment for everyone.

At Grab, every Grabber is guided by The Grab Way, which explains our mission and the operating principles on how we can achieve it together. We call these principles the 4Hs:

Heart
We work together as OneGrab to serve communities in Southeast Asia

Hunger
We work to understand ground truths and drive improvements, big and small

Honour
We keep our word and steward our resources wisely to build and sustain trust

Humility
We are a constant work-in-progress, and we never stop learning to get better
…
show more","Company Description

Life at Grab

At Grab, every Grabber is guided by The Grab Way, which spells out our mission, how we believe we can achieve it, and our operating principles - the 4Hs: Heart, Hunger, Honour and Humility. These principles guide and help us make decisions as we work to create economic empowerment for the people of Southeast Asia.

Job Description

Get to know the Team

Come join the Consumer Experience (CX) Engineering team - we work on a diverse set of consumer experience problems for our users spanning across core experiences powering the UX navigation and transaction funnels, content and service discovery, user engagement and the mobile application developer experience. We are on an exciting mission to build the best engagement and discovery experience for our users and win customer loyalty by serving the most important needs of customers’ daily lives with a seamless, personalized and contextual experience that optimize convenience and value for money

Get to know the Role

In this role, you will be responsible to work on continuously improving user retention by reducing friction across all possible user journeys, optimising performance & platformising the solutions. You will be working in a fast paced growth team that continuously iterates on assumed hypothesis and solution . You will be required to quickly adapt solve problems with in entire mobile superapp scope.

The Day-to-Day Activities

Design and write in swiftUI & Objective C
Collaborate with mobile and backend engineers, designers, data scientists and product managers to architect and implement features
Actively participate in code and design reviews to maintain our high development standards
Brainstorm innovative ideas, identify problems, propose and implement solutions geared towards scale and performance
Take full ownership of projects that are built to meet functional and non-functional requirements of our users and business partners.
Design, implement, instrument and deploy highly performant and reusable Android components for operational excellence initiatives
Lead Collaboration with stakeholders across teams and roles, to identify and resolve ambiguous, multi dimensional business, legal, and product needs.
Participate in interview loops to help Grab continue hiring top industry talent
Provide technical guidance, mentorship and knowledge sharing to peers.

The Must-Haves

4+ years of professional software development experience including at least 2 years of iOS development experience
Solid computer science fundamentals in algorithms and data structures
Experience owning an end-to-end feature
Experience running large scale applications and global understanding of systems internals and tools like crash analytics, remote debugging and continuous integration.
Possess excellent communication, sharp analytical abilities with proven design skills, able to think critically of the current system in terms of growth and stability
Deep understanding about the CI/CD implementation
Highly accountable and takes ownership of one’s own work.
Eager to learn, to take more responsibility and create impact on millions of users.

Our Commitment

We recognize that with these individual attributes come different workplace challenges, and we will work with Grabbers to address them in our journey towards creating inclusion at Grab for all Grabbers."
3781596760,Cloud Engineer (Managed Service On-Site),https://www.linkedin.com/jobs/view/3781596760,Logicalis Asia,https://www.linkedin.com/company/logicalis-asia/life," "," ",45,,On-site,,"5,001-10,000 employees · IT Services and IT Consulting",https://media.licdn.com/dms/image/D560BAQHsdumSvmnbGQ/company-logo_100_100/0/1688541605950/logicalis_asia_logo?e=1712188800&v=beta&t=cLU-uBIOd8N5OVEZzRGp-MA-Znlr7-r6IWk-sTIDjVU,"Logicalis is an international solutions provider of digital services currently accelerating the digital transformation of its 10,000 customers around the world.

Through a globally connected network of specialist hubs, sector-leading experts (in education, financial services, government, healthcare, manufacturing, professional services, retail and telecommunications) and strategic partnerships (including Cisco, Microsoft, HPE, IBM, NetApp, Oracle, ServiceNow, and VMware), Logicalis has more than 6,500 employees focused on understanding customer priorities and enhancing their experience.

As Architects of ChangeTM, Logicalis’ focus is to design, support, and execute customers’ digital transformation by bringing together their vision with its technological expertise and industry insights. The company, through its deep knowledge in key IT industry drivers such as Security, Cloud, Data Management and IoT, can address customer priorities such as revenue and business growth, operational efficiency, innovation, risk and compliance, data governance and sustainability.

The Logicalis Group has annualised revenues of $1.7 billion, from operations in Europe, North America, Latin America, Asia Pacific, and Africa. It is a division of Datatec Limited, listed on the Johannesburg Stock Exchange, with revenues of over $4.3 billion.

For more information, please visit www.ap.logicalis.com.
…
show more","Why choose iZeno?

iZeno was founded in 2003 to provide enterprises with custom-built technology solutions they need to keep their business running seamlessly. Logicalis Asia, part of the Logicalis Group, a leading international IT solutions and managed services provider, has acquired a majority stake in iZeno, a company specialising in digital transformation, application modernisation, DevOps, customer experience and hybrid cloud solutions.

With a team of 120+ in-house innovators, we have delivered over 500 Enterprise Solutions, implemented, and optimized to enable smarter insights. Our team draws on industry experiences in accomplishing a portfolio of mission-critical applications, integrating Cloud, CRM, Data Analytics, and other leading technologies with our clients' existing IT frameworks.

With leading presence in the region, headquartered in Singapore and operation in Malaysia, Indonesia, Thailand and Philippines, no project is too complex for us, and our team is always ready for a new challenge. 

About the role:

Perform administrative tasks related to install Linux (RedHat) servers from scratch, configure, patching, and has good troubleshooting skills. 
Performance monitoring for all Linux servers (OS, CPU, Memory, Network, Disk and Process), detect, diagnose, report and resolve Linux server related hardware and OS problems. 
Perform hardening and security configuration of Linux (RedHat) servers. 
Establish and maintain documentation and standards
Works as part a team and provide the support when required

What we are looking for:

Bachelor's degree or Diploma in Computer Science, related technical field, or equivalent practical experience
RedHat certifications is preferred
Knowledge of best practice especially for RedHat OpenShift Container Platform, RedHat OS, and IT operations in an always-up, always-available service. 
Hands-on experience with Linux (RedHat) environment, managing, troubleshooting and configuring servers will be advantageous
Working experience and knowledge with automation/configuration management using ansible. 
Working experience in scripting, Bash, Shell, and basic DevOps. 
Working experience with applications such as web/proxy servers, LDAP, database (Cassandra, PostgreSQL), Kafka, etc. 
Work effectively in a fast-paced implementation environment
Good analytical and problem solving attitude, work independently and as part of a team
Understand and willing to adapt with new technology (cloud computing, container, or configuration and automation management). 
Work on 24/7 rotation shifts based on customer site

What we have to offer:

An exciting job with latest technology
Continuous training& development of soft and hard skills
A competitive salary, in line with your profile
A package of benefits including healthcare insurance
An awesome team of colleagues& regular team building activities. 
The ability to work with the world’s leading companies in technology and innovation. 
An environment where we embrace openness, transparency and grab every opportunity to have fun, while always doing what is right for our customers and partners. 

Posting Code:"
3785638907,Mobile Application Developer,https://www.linkedin.com/jobs/view/3785638907,Binar Academy,https://www.linkedin.com/company/binar-academy/life," ",2 weeks ago,136,,Hybrid,,201-500 employees · IT Services and IT Consulting,https://media.licdn.com/dms/image/C560BAQEBEZeoowry3A/company-logo_100_100/0/1657875033201/binar_academy_logo?e=1712188800&v=beta&t=79RrolW64elCqgu2dKcvzRMR2LqJn9ud8WNl1jCkjeY,"BINAR was born in 2017 to advance Indonesia’s technology ecosystem. Our mission is to solve digital talent gap by upskilling and job matching.

We support people to build a career in digital industry or upskilling into digital related roles with the knowledge and skills needed to thrive through a structured learning journey and multiple learning styles to ensure each learner can reach mastery through their own preferred way.

Our upskilling programs are designed to provide learners with first-hand exposure to the real world and prepare them with skills critically needed by the industries in this fast-changing digital era.

Also, we help students and companies to connect and build great teams.
Fueled by industry change, BINAR for Business helps companies achieve critical business outcomes and stay competitive by offering relevant and personalized learning experiences.

Advance your career, show off your skills, grow your business and get ready to #SelangkahDiDepan with BINAR.

Learn more about us:
Website: www.binaracademy.com
Instagram: @academybinar
Youtube: https://www.youtube.com/binaracademy

BINAR Apps is available on the Google Play store and iOS. Download BINAR app on:
- Apple Store: https://bit.ly/BinarAppsAppStore
- Google Play Store: https://bit.ly/BinarAppsPlayStore","Binar Academy aims to unlock and channel human potential so we can help the world turn into a better place. One of the ways we strive to do that is to channel potential talents to impactful opportunities using our very own job connector, Binar Job Connect.

Binar Job Connect has connected up to 250 talents & candidates; whether it be young & aspirational fresh graduate to tech-savvy team leaders, individuals who decided to start from scratch, and junior engineers to skilled product managers to our experienced hiring partners. Binar Job Connect provides various options of employment, as we intend that everyone processed by us can choose the best career track for them.

Currently Binar Job Connect is looking potential Android Developer for our hiring partner: Bank Mandiri, IFG Life and many more.

What Are We Looking For?
Minimum Associate’s Degree majoring in Information Technology/Computer Science/Software Engineering, or related ITfields.
Min. 3 years of experience in Mobile Developer (iOS Developer, Android Developer)
Experienced using Kotlin, Swift, Jetpack, Develop Android application, React Native.
Knowledge of CI/CD
Understand Object Oriented Programming
Familiar with Modular Architecture, Sonarqube
Experienced with Git, Agile/Jira/Confluence
Experienced in MVVM/VIPER Design Pattern and Reactive Programming
Experienced in Develop Custom view Component"
3791762693,Senior .NET Developer,https://www.linkedin.com/jobs/view/3791762693,The Software Practice Pte Ltd,https://www.linkedin.com/company/the-software-practice-pte-ltd/life," ",2 days ago,31,,On-site,,51-200 employees · Software Development,https://media.licdn.com/dms/image/C510BAQGJCyjTDcjK8Q/company-logo_100_100/0/1631382786414?e=1712188800&v=beta&t=YF0x7Z64ZFN2hZq0szVUz6SnGwlNB7weYtG2A6Eo08A,"The Software Practice is a technology company based in Singapore that builds software for clients and its own business. Our core strength is in architecting and developing large and complex web and mobile applications.

In the past, we’ve built applications that have been used by hundreds of thousands of users. Our expertise lies in being able to architect stable, highly scalable and performant software for the web and mobile platforms. We help startups develop their products by being their external CTO/product team - from ideation to prototype to real-world applications. We also build high profile applications for the private and public sector solving their most critical business problems - we're talking about Government agencies in Singapore, financial institutions including some SE Asia's biggest banks and large enterprises Fortune 500 IT firms and some of Asia's biggest airports.

We work on a range of technologies and tend to hire smart people who can pick up new tech-stacks and get things done quickly. Just in the last year, we've worked on projects in ReactJS, AngularJS, Python, ReactNative, .NET and Solidity.

Our culture is results-driven that values execution and creativity. You'll get a lot of ownership over your deliverables, and we trust you to ship high quality products on time. You will join a high performing cross functional team where you get to witness the direct impact of your work - seeing applications go live with real-world usage.","The Software Practice is a Singapore based technology development firm that builds software for clients and its own business. Our core strength is in developing large and complex web and mobile applications by architecting and implementing robust, scalable and performant software.

We're trying to find exceptionally smart people with strong development skills and an avid interest in web development. You should be able to learn quickly and work independently - we'll help you as best as we can, but you must be tenacious and resourceful enough to figure out things you don't know how to do.

Requirements
Solid programming ability and at least 3 years of experience (preferably over 5 years of experience) in building web applications using .NET, C#.
Designing, documenting, and implementing efficient API endpoints
Implementing security and data-protection best practices
Drive key technical and architectural designs with a close eye on maintainability, performance and security
Conduct code reviews
Clear and precise written communication. A large part of our team works remotely and it's vital that you are able to document ideas, progress and problems with clarity so everyone can work asynchronously.
You must be happy to work independently and be able to structure timelines, take ownership and responsibility and communicate clearly.
Based in or willing to relocate to Bandung.

Any experience in the one or more of the following is a definite plus:
Experience with AWS, Azure, Heroku or any other cloud platforms
Development in Python
Worked on non-trivial Javascript applications (and experience in VueJS)

If you've built something in the past, do let us know. Github and/or StackOverflow profiles are welcome.

You'll get to work in a fast-paced environment, with a great team of full-stack engineers who have a lot of experience in building large software applications from scratch.

We seek your understanding that only shortlisted candidates will be notified."
