id,title,job_url,company,company_link,location,published_at,number_of_applicants_applied,employment_duration,work_location_type,work_experience_level,company_type,company_logo,company_description,about_the_job
3780365389,Principal Software Engineer Back End (Bangkok based – Relocation provided),https://www.linkedin.com/jobs/view/3780365389,Agoda,https://www.linkedin.com/company/agoda/life," "," ",25,,Hybrid,,"5,001-10,000 employees · Software Development",https://media.licdn.com/dms/image/C4D0BAQGBa_7QNZNwpw/company-logo_100_100/0/1656643826660/agoda_logo?e=1712188800&v=beta&t=Uch6o32VIVJnqd5pOyN6ISz8TvEijuYR_vC1w3EK8HQ,"Agoda is transforming travel for millions of customers across the globe.

Headquartered in Asia, Agoda is one of the world’s largest online travel platforms. Founded in 2005 and now part of Booking Holdings (Nasdaq:BKNG), Agoda has a network of over 2,900,000 properties worldwide. Our web and mobile products provide a first-rate reservation service in 38 languages that uniquely combines local knowledge and local connections to provide the best deals for business and leisure travelers.

Agoda employs over 7,000 professionals from 90 nationalities in locations around the globe. In every department – from engineering to customer experience – we provide an environment rich with creativity, collaboration, and experimentation, and the tools to work faster and smarter.

At Agoda, we believe our people are our strength. We work hard and have fun, and we choose people who are dedicated to making things great.

For properties seeking partnership with Agoda, visit https://connect.agoda.com
…
show more","About Agoda

Agoda is an online travel booking platform for accommodations, flights, and more. We build and deploy cutting-edge technology that connects travelers with more than 3.6 million accommodations globally. Based in Asia and part of Booking Holdings, our 6,000+ employees representing 90+ nationalities foster a work environment rich in diversity, creativity, and collaboration. We innovate through a culture of experimentation and ownership, enhancing the ability for our customers to experience the world.

Get to Know Our Team

In Agoda’s Back End Engineering department, we build the scalable, fault-tolerant systems and APIs that host our core business logic. Our systems cover all major areas of our business: inventory and pricing, product information, customer data, communications, partner data, booking systems, payments, FinTech and more. These mission-critical systems change frequently with dozens of releases per day, so we must employ state-of-the-art CI/CD and testing techniques in order to make sure everything works without any downtime. We also ensure that our systems are self-healing, responding gracefully to extreme loads or unexpected input. In order to accomplish this, we use state-of-the-art languages like Scala and Go, data technologies like Kafka and Spark, and agile development practices. Most importantly though, we hire great people from all around the world and empower them to be successful. Whether it’s building new projects like Flights and Packages or reimagining our existing business, you’ll make a big impact as part of the Back End Engineering team.

The Opportunity

You might call yourself “full stack” or “back end” or you might consider yourself an authority in a certain field, but you have a keen interest in how the different systems work together.

We’d love to hear from you if you are skilled in any of the technologies we work with (note – we are not looking for you to have them all). We are interested in speaking to persons of any level from individuals just starting their IT careers to experts in their field, although this particular position is better suitable to veteran engineers, with expertise in certain technologies, and especially those that had lead projects, initiatives and/or teams.

In This Role, You’ll Get to

Think and own the full life cycle of our products, not just a single piece of code – from business requirements, technology selection, coding standards, agile development, unit and application testing, to CI/CD and proper monitoring
Design, develop and maintain platforms across the back end area
Improve scalability, stability, and efficiency of our existing systems
Write great code and help others write great code
Collaborate with other teams and departments

What You’ll Need To Succeed

12+ years’ experience under your belt developing performance-critical applications that run in a production environment using Scala, Java or C#
Experience in leading projects, initiatives and/or teams, with full ownership of the systems involved
Data platforms like SQL, Cassandra or Hadoop. You understand that different applications have different data requirements
Good understanding of algorithms and data structures
Strong coding ability
You are passionate about the craft of software development and constantly work to improve your knowledge and skills
Excellent verbal and written English communication skills

It’s Great If You Have

Experience with Scrum/Agile development methodologies
Experience building large-scale distributed products
Core engineering infrastructure tools like Git for source control, TeamCity for Continuous Integration and Puppet for deployment
Hands-on experience working with technology like queueing systems (Kafka, RabbitMQ, ActiveMQ, MSMQ), Spark, Hadoop, NoSQL (Cassandra, MongoDB), Play framework, Akka library 

#sanfrancisco #sanjose #losangeles #sandiego #oakland #denver #miami #orlando #atlanta #chicago #boston #detroit #newyork #portland #philadelphia #dallas #houston #austin #seattle #sydney #melbourne #perth #toronto #vancouver #montreal #shanghai #beijing #shenzhen #prague #Brno #Ostrava #cairo #alexandria #giza #estonia #paris #berlin #munich #hamburg #stuttgart #cologne #frankfurt #hongkong #budapest #jakarta #bali #dublin #telaviv #milan #rome #tokyo #osaka #kualalumpur #amsterdam #oslo #manila #warsaw #krakow #bucharest #moscow #saintpetersburg #capetown #johannesburg #seoul #barcelona #madrid #stockholm #zurich #taipei #bangkok #Phuket #istanbul #london #manchester #edinburgh #kiev #hcmc #hanoi #wroclaw #poznan #katowice #rio #salvador #IT #4 #5

Equal Opportunity Employer 

At Agoda, we pride ourselves on being a company represented by people of all different backgrounds and orientations. We prioritize attracting diverse talent and cultivating an inclusive environment that encourages collaboration and innovation. Employment at Agoda is based solely on a person’s merit and qualifications. We are committed to providing equal employment opportunity regardless of sex, age, race, color, national origin, religion, marital status, pregnancy, sexual orientation, gender identity, disability, citizenship, veteran or military status, and other legally protected characteristics.

We will keep your application on file so that we can consider you for future vacancies and you can always ask to have your details removed from the file. For more details please read our privacy policy .

To all recruitment agencies: Agoda does not accept third party resumes. Please do not send resumes to our jobs alias, Agoda employees or any other organization location. Agoda is not responsible for any fees related to unsolicited resumes."
3791750168,Senior Frontend Engineer,https://www.linkedin.com/jobs/view/3791750168,Talent Insider,https://www.linkedin.com/company/talentinsider/life," ",,5,,On-site,,"11-50 employees · Technology, Information and Internet",https://media.licdn.com/dms/image/C560BAQE1tUpFj8bT_Q/company-logo_100_100/0/1630662935364/talentinsider_logo?e=1712188800&v=beta&t=Ig8ErskBeJxkTUfD86vkDJYHBAO4d9kmg2AGv8Ea3_w,"Welcome to Talent Insider. We aim to be the world’s largest professional media company, developed in Indonesia for the world.

Vision:
Empower everyone who wishes to dream higher or find their dream hire.

Mission:
Talent Insider will enhance everyone and every company, enriching them through research, insights, and industry-specific news. Our futuristic technology will enable everyone to have an equal opportunity to grow.

Who Are We?
Talent Insider began with our founder, Jacky Bhagchandani, in September 2020 and was officially launched on March 1st, 2021. He has previously worked at LinkedIn and has over 17 years of experience in the HR and Information Technology Industry.

Our values are based on the principles of Communication, Trust, and Respect, recognizing that everyone at Talent Insider and beyond can aspire to dream higher.

At Talent Insider, we believe that the future belongs to those who dare to dream and those who seek their dream careers. We are committed to providing a platform where individuals and businesses can access the latest insights, trends, and news to achieve their aspirations. Our dedicated team, led by Jacky Bhagchandani, brings a wealth of experience from the HR and IT sectors, ensuring that our content and technology are second to none.

Whether you are an aspiring professional or a forward-thinking company, Talent Insider is here to support your journey. We are driven by a vision to empower individuals to reach new heights and help businesses thrive in a dynamic world. Join us in this exciting journey toward a brighter, more inclusive future.
…
show more","Responsibilities
Build High Quality, Fault Tolerant Systems And Products, Owning All Areas Of Implementation, Frontend, CI Pipeline, Automated Test Suites And Operations
Work With Your Product Owner And Business Stakeholders To Define The Product And Tech Roadmaps.
Engage With The Wider Engineering Organisation, Making Sure Your Tech Roadmap Aligns With The Other Teams.

Qualifications
Experienced with frontend frameworks like Next.js and React
Familiar with Server Side Rendering (SSR) and/or Static Site Generation (SSG)
Familiar with Kubernetes and write your applications Docker first.
A team leader, with prior experience mentoring junior engineers and facing off to business stakeholders."
3742048648,Staff/ Lead Software Engineer (FinTech) [Bangkok based – Relocation provided],https://www.linkedin.com/jobs/view/3742048648,Agoda,https://www.linkedin.com/company/agoda/life," "," ",88,,Hybrid,,"5,001-10,000 employees · Software Development",https://media.licdn.com/dms/image/C4D0BAQGBa_7QNZNwpw/company-logo_100_100/0/1656643826660/agoda_logo?e=1712188800&v=beta&t=Uch6o32VIVJnqd5pOyN6ISz8TvEijuYR_vC1w3EK8HQ,"Agoda is transforming travel for millions of customers across the globe.

Headquartered in Asia, Agoda is one of the world’s largest online travel platforms. Founded in 2005 and now part of Booking Holdings (Nasdaq:BKNG), Agoda has a network of over 2,900,000 properties worldwide. Our web and mobile products provide a first-rate reservation service in 38 languages that uniquely combines local knowledge and local connections to provide the best deals for business and leisure travelers.

Agoda employs over 7,000 professionals from 90 nationalities in locations around the globe. In every department – from engineering to customer experience – we provide an environment rich with creativity, collaboration, and experimentation, and the tools to work faster and smarter.

At Agoda, we believe our people are our strength. We work hard and have fun, and we choose people who are dedicated to making things great.

For properties seeking partnership with Agoda, visit https://connect.agoda.com
…
show more","About Agoda

Agoda is an online travel booking platform for accommodations, flights, and more. We build and deploy cutting-edge technology that connects travelers with more than 3.6 million accommodations globally. Based in Asia and part of Booking Holdings, our 6,000+ employees representing 90+ nationalities foster a work environment rich in diversity, creativity, and collaboration. We innovate through a culture of experimentation and ownership, enhancing the ability for our customers to experience the world.

 Get to Know Our Team 

Fintech is one of the fastest growing areas in Agoda and we are rapidly expanding our tech team. We work closely with the finance business team and our Fintech product owners to reduce risk, drive efficiencies and move on new market opportunities in this exciting field. We have a wide range of projects from traditional finance or cutting-edge customer fintech. For example, reconciliation using Big Data technologies, growing and optimising customer payments options, tax calculations in milli-second response times and a mesh of supplier payment options like vertical credit cards. Its a hot field and the perfect mix of data engineering and backend engineering.

 The Opportunity 

We are looking for engineers with experience in the fintech area. This can be a year or two at a fintech startup right through to an expert in this domain. You might have a background as ‘ back end ’ or ‘data’ engineer , either way we are looking for smart engineers who can be super agile, move fast and have an eye for detail. We’d love to hear from you if you are skilled in any of the technologies we work with and excited at building new fintech techonology.

 In This Role, You’ll Get to 

 Think and own the full life cycle of our products, not just a single piece of code – from business requirements, technology selection , coding standards, agile development, unit and application testing , to CI/CD and proper monitoring 
 Design, develop and maintain platforms and data pipelines across fintech 
 Improve scalability, stability, and efficiency of our existing systems 
 Write great code and help others write great code – mentor people in your team and wider 
 Collaborate with other teams and departments 
Help us hire extraordinary talent such as yourself!

What You’ll Need To Succeed

6+ years’ experience under your belt developing performance-critical applications that run in a production environment using Scala, Java or C#
 Data platforms like Hadoop and SQL. Understand that different applications have different data requirements. 
 Good understanding of algorithms and data structure s 
Strong c oding ability 
You are passionate about the craft of software development and constantly work to improve your knowledge and skills 
Experience with Scrum/Agile development methodologies
Excellent verbal and written English communication skills 

 It’s Great If You Have 

 Experience working in a modern FinTech or Payments organization. 
 Domain knowledge in any of these areas: financial reconciliation, financial reporting, tax, payout methods like vertical credit cards or customer payments. 
 Hands -on experience working with technologies like Spark for data processing, ETLs for data pipelines and q ueueing system s (Kafka, RabbitMQ ). 
 Experience building and running transactional/financial systems 
 Core engineering infrastructure tools like Git Lab for source control and Continuous Integration , Kubernetes, and Puppet for deployment 
 Experience in large-scale distributed designs 
 Experience in leading projects, initiatives and/or teams, with full ownership of the systems involved 

#sanfrancisco #sanjose #losangeles #sandiego #oakland #denver #miami #orlando #atlanta #chicago #boston #detroit #newyork #portland #philadelphia #dallas #houston #austin #seattle #sydney #melbourne #perth #toronto #vancouver #montreal #shanghai #beijing #shenzhen #prague #Brno #Ostrava #cairo #alexandria #giza #estonia #paris #berlin #munich #hamburg #stuttgart #cologne #frankfurt #hongkong #budapest #jakarta #bali #dublin #telaviv #milan #rome #tokyo #osaka #kualalumpur #amsterdam #oslo #manila #warsaw #krakow #bucharest #moscow #saintpetersburg #capetown #johannesburg #seoul #barcelona #madrid #stockholm #zurich #taipei #bangkok #Phuket #istanbul #london #manchester #edinburgh #kiev #hcmc #hanoi #wroclaw #poznan #katowice #rio #salvador #IT #4 #5 

Equal Opportunity Employer 

At Agoda, we pride ourselves on being a company represented by people of all different backgrounds and orientations. We prioritize attracting diverse talent and cultivating an inclusive environment that encourages collaboration and innovation. Employment at Agoda is based solely on a person’s merit and qualifications. We are committed to providing equal employment opportunity regardless of sex, age, race, color, national origin, religion, marital status, pregnancy, sexual orientation, gender identity, disability, citizenship, veteran or military status, and other legally protected characteristics.

We will keep your application on file so that we can consider you for future vacancies and you can always ask to have your details removed from the file. For more details please read our privacy policy .

To all recruitment agencies: Agoda does not accept third party resumes. Please do not send resumes to our jobs alias, Agoda employees or any other organization location. Agoda is not responsible for any fees related to unsolicited resumes."
3788461036,"Lead Software Engineer, Trilogy (Remote) - $100,000/year USD",https://www.linkedin.com/jobs/view/3788461036,Crossover ,https://www.linkedin.com/company/crossover/life," "," ",25,,Remote,,"5,001-10,000 employees · IT Services and IT Consulting",https://media.licdn.com/dms/image/C4E0BAQG8bdX5sQ24KQ/company-logo_100_100/0/1630619679689/crossover__logo?e=1712188800&v=beta&t=s4G-ZkvEHeTnm-GLxEoEkbWxJ5Zto3Ts13geqBcmduU,"Crossover is the world's largest database of skilled remote talent (7 million users and counting!)

We help amazing professionals all over the world prove that they're just as good as anyone in Silicon Valley—𝘢𝘯𝘥 𝘥𝘦𝘴𝘦𝘳𝘷𝘦 𝘵𝘩𝘦 𝘴𝘢𝘮𝘦 𝘱𝘢𝘺𝘤𝘩𝘦𝘤𝘬.

Like the Olympics, it's hard to qualify... but it's worth it!
Have you got what it takes to join the 5,000+ people from 130+ countries that we've recruited for high-paying full-time remote jobs?

𝐇𝐄𝐋𝐏𝐅𝐔𝐋 𝐋𝐈𝐍𝐊𝐒:
🧑 Reviews from people we've hired: crossover.com/people-at-crossover
💼 Current openings: crossover.com/jobs
💎 Hire someone for your company: crossover.com/hire
♟️ How the process works: crossover.com/selection-process
❓ FAQs: crossover.com/help-and-faqs
~~~
𝑵𝒐𝒕𝒆: Crossover jobs are are fully compliant with LinkedIn's policies, as well as the applicable laws in every country where we advertise.

Allow us to clarify some common misconceptions:
1) The reason we post so many job ads is because LinkedIn organizes all job postings by location. So, the only way to reach candidates all over the world is to post multiple ads in every city you want to hire from. Most recruiters don't bother because it's too time consuming... but we're not most recruiters.
2) We mostly recruit independent contractors, not employees, because labor laws vary so much from one country to another that it's near-impossible to recruit globally otherwise (which is why it's still uncommon even though most jobs can now be done remotely).
3) As is standard for any self-employed person, the stated pay is the entire compensation package. Because they are not employees, each contractor is responsible for handling the things that an employer would take care of e.g. taxes, equipment, vacation time, health insurance. One of the major reasons that Crossover jobs pay so much more than local jobs is to overcompensate for these costs.

It's hard, but it's worth it!
…
show more","Crossover is the world's #1 source of full-time remote jobs. Our clients offer top-tier pay for top-tier talent. We're recruiting this role for our client, Trilogy. Have you got what it takes?

Are you a full-stack engineer who thrives on complex challenges and is eager to make a real impact? Join our team to contribute to innovative products that deeply leverage AI and that are reshaping industries and changing the way we work and learn.

Our strategic product line includes:

Crossover: An AI-powered hiring platform that sifts through millions of applicants per year to find the top 1% of global remote talent, making high-paying jobs accessible to professionals worldwide, regardless of their location.
gt.school: An online education platform that uses advanced data collection, algorithms, and AI-generated content to empower students learn at their own pace. Our adaptive learning system fills knowledge gaps, accelerates learning, and helps students quickly master a whole grade level on a subject within weeks.
Data-driven Sales: This initiative leverages data and AI algorithms to streamline the sales process across a portfolio of over 100 software products. We're transitioning these products to a unified platform based on Salesforce and NetSuite, all while handling complex data imports, modeling divergences and data synchronization.

What we offer:

The opportunity to work with cutting-edge technologies, including the latest in Angular, AWS serverless and no-code/low-code patterns.
The opportunity to learn and experiment with using generative AI to boost your productivity.
A team of exceptionally talented engineers from around the world as your peers.
The chance to work on products that are making a real difference in people's lives.

We're not just using AI as a buzzword. We're at the start of a thrilling journey with generative AI, experimenting and learning to fully leverage its potential and free our engineers from mundane tasks, allowing them to focus on what truly matters: design, decision-making, and understanding the far-reaching implications of different implementation strategies.

Showcase your skills, not just your resume. Take on our challenges: 15-min Cognitive, 90-min Coding, 180-min Technical Decision-Making. Excel and you'll face a decisive interview with our Hiring Manager. More than half walk away with an offer. Ready to unleash your potential? Apply today!

What You Will Be Doing

Building modern web apps using Angular accompanied by top-notch libraries and tools.
Enhancing cloud-native backends using the latest serverless cloud patterns, including AWS.
Reviewing code to ensure adherence to best practices, team standards, and customer requirements.

What You Won’t Be Doing

Spending time on minor bug fixes or features in outdated codebases.
Dealing with tedious infrastructure to keep poorly written products running.
Getting stuck in endless meetings discussing roadmaps and priorities or chasing people around.

Basic Requirements

Lead Software Engineer key responsibilities

At least 3 years of experience writing frontend code (any framework)
At least 1 year of experience writing frontend code in Angular.
At least 3 years of experience writing backend code (any framework).
An openness to learn to use generative AI in your day-to-day development work.

Nice-to-have Requirements

Experience in using generative AI in your day-to-day development work.

About Trilogy

Hundreds of software businesses run on the Trilogy Business Platform. For three decades, Trilogy has been known for 3 things: Relentlessly seeking top talent, Innovating new technology, and incubating new businesses. Our technological innovation is spearheaded by a passion for simple customer-facing designs. Our incubation of new businesses ranges from entirely new moon-shot ideas to rearchitecting existing projects for today's modern cloud-based stack. Trilogy is a place where you can be surrounded with great people, be proud of doing great work, and grow your career by leaps and bounds.

There is so much to cover for this exciting role, and space here is limited. Hit the Apply button if you found this interesting and want to learn more. We look forward to meeting you!

Working with Crossover

This is a full-time (40 hours per week), long-term position. The position is immediately available and requires entering into an independent contractor agreement with Crossover. The compensation level for this role is $50 USD/hour, which equates to $100,000 USD/year assuming 40 hours per week and 50 weeks per year. The payment period is weekly. Consult www.crossover.com/help-and-faqs for more details on this topic.

What to expect next:

You will receive an email with a link to start your self-paced, online job application.
Our hiring platform will guide you through a series of online “screening” assessments to check for basic job fit, job-related skills, and finally a few real-world job-specific assignments.

Important! If you do not receive an email from us:

First, emails may take up to 15 minutes to send, refresh and check again.
Second, check your spam and junk folders for an email from Crossover.com, mark as “Not Spam” since you will receive other emails as well.
Third, we will send to whatever email account you indicated on the Apply form - by default, that is the email address you use as your LinkedIn username and it might be different than the one you have already checked.
If all else fails, just reset your password by visiting https://www.crossover.com/auth/password-recovery if you already applied using LinkedIn EasyApply.

Crossover Job Code: LJ-4774-ID-Surabaya-LeadSoftwareEn.001"
