id,title,job_url,company,company_link,location,published_at,number_of_applicants_applied,employment_duration,work_location_type,work_experience_level,company_type,company_logo,company_description,about_the_job
3685863219,Java Spring Boot and database engineer,https://www.linkedin.com/jobs/view/3685863219,,,,,0,,On-site,,See how you compare to 7 applicants. Upgrade my plan,,,"Requirements

Role and Responsibilities

 Analyze the existing web core system developed in Java and give recommendation for the system changes
 Explore new available technology related to the existing system
 Developed new modules for the existing system.
 Maintain existing system
 Create a proper documentation for the existing system and new modules to be developed
 Create weekly report progress of duties

Qualifications And Education Requirements

 Candidates must have at least a Diploma in any field
 Preferably have 1 year of experience in the appropriate field for this position

Preferred Skills

 At least 2 years’ experience of Java Programming
 Having knowledge of the following Java technology: Java Server Faces, JBoss, Spring, and other web framework using Java will be an advantage
 Having knowledge of Query Language (SQL)
 Having knowledge of DBMS especially Oracle will be an advantage. Other DBMS will also be considered.
 Having knowledge of code versioning, continuous integration and deployment tools will be an advantage
 Fast Learner and committed to deliver a good result
 Possess a strong analytical thinking and skills
 Can work with minimum supervision and deliver result

Responsibilities

We are looking for developers that are very knowledgeable and efficient to join our growing teams

A brief about us: We have a very fun yet disciplined culture, a friendly environment that helps and pushes you to grow; and policies that make it not just possible but mandatory to learn, push your limits, and do great work that you will be proud of. We help and teach one another."
3673076974,Senior Software Engineer,https://www.linkedin.com/jobs/view/3673076974,DKATALIS,https://www.linkedin.com/company/dkatalis/life," ",6 months ago,302,,Remote,,201-500 employees · IT Services and IT Consulting,https://media.licdn.com/dms/image/C4E0BAQEQPE6kBmqrzA/company-logo_100_100/0/1630627927496/dkatalis_logo?e=1712188800&v=beta&t=KiMK5dldtc5f2TmwzCeVEw2RrHLUW1qYX7yx2XLVTMI,"DKatalis is a technology company aiming to co-create scalable digital solutions with customers and ecosystem partners. Founded in 2019, DKatalis is collaborating from all around the world, with hubs operating in Jakarta, Singapore and India.

We have created the Jago App to solve financial literacy, AMAAN App to empower women entrepreneurs, and People Xperience App to empower organizations to adapt with rapid changes.
…
show more","About DKatalis

DKatalis is a financial technology company with multiple offices in the APAC region. In our quest to build a better financial world, one of our key goals is to create an ecosystem-linked financial services business.

DKatalis is built and backed by experienced and successful entrepreneurs, bankers, and investors in Singapore and Indonesia who have more than 30 years of financial domain experience and are from top-tier schools like Stanford, Cambridge London Business School, JNU with more than 30 years of building financial services/banking experience from Bank BTPN, Danamon, Citibank, McKinsey & Co, Northstar, Farallon Capital, and HSBC.

About The Role

You will be part of cross-functional agile engineering team (squad) responsible to build, deploy and run (support) one or more of our digital products, focusing on full-stack experience to build robust & resilient systems (front-end & back-end).

You will work closely with Engineers, Product, Design, and other stakeholders, collaboratively ensuring quality gets built in the product, get to see your impact in everyday lives of many people, and having great fun while doing it.

You will share your learnings within and beyond your team (squad) and mentor budding engineers for good engineering practices

What Will You Do

Working with engineering+product owners to design, refine and develop the product, from concept to implementation. 
Main contributor in creating best in-class product & experience for our customers by designing, building, scaling, and evolving our platforms, services, and tools
Communicate, collaborate and work effectively across cross functional teams in a multi-cultural environment
Mentor a team of highly talented and motivated engineers
Ensure the performance, security, and responsiveness of applications built
Continuously improve code quality, product execution, automatization and customer delight

What You Need To Have

You have at least 10+ years of professional experience in a similar role developing highly scalable applications
Good written and spoken English
Hands on expertise in Java / Javascript or its derivatives (Typescript, NodeJS, Scala, Kotlin, Springboot, etc)
Have hands on experience on one of this front-end development (Flutter Preferred)
Experience to Lean/XP practices (TDD, Pair Programming, Continuous Integration/Delivery for both Mobile & Back-end)
Experience working in Agile Software development
Communicate, collaborate, and work effectively across distributed teams in a multicultural environment. 
You're excited about delivering end-to-end experiences and care about your software architecture across the front-end, back-end, and the APIs that glue them together
A passion for quality and best practices but with a pragmatism that understands the balance between perfection and delivering value in a timely manner. 
Enjoys mentoring more junior engineers on good engineering practices & share knowledge"
3788219418,Senior Software Engineer - Salatiga,https://www.linkedin.com/jobs/view/3788219418,Formulatrix Indonesia,https://www.linkedin.com/company/formulatrix-indonesia/life," ",6 days ago,3,,On-site,,"501-1,000 employees",https://media.licdn.com/dms/image/C510BAQGwCabTI2ithQ/company-logo_100_100/0/1630629599665/pt_formulatrix_indonesia_logo?e=1712188800&v=beta&t=jbnmJMMM1whtpRTyrQTjL-ix1ln6ZHDacWwbUu3rVjg,"FORMULATRIX® collaborates with researchers to simplify the preparation and analysis of proteins and nucleic acids by designing solutions without boundaries and bringing novel cutting-edge technology to the life science industry.

We are committed to researchers, their labs, and to the scientific discoveries that will improve the lives of generations to come.

In 2006 we opened up our manufacturing facility in Indonesia.
As of now, to meet increased demand, we are quadrupling our manufacturing space from 10,000 to 40,000 square feet.
…
show more","Headquartered in Dubai, UAE, FORMULATRIX is a fast-growing robotic automation equipment manufacturer and software solutions provider to leading pharmaceutical companies and academic research institutions including major Fortune 500 and Fortune 100 companies. The company has aggressively grown because of our industry-recognized patented technology and superior software delivery services.

We are seeking hands-on, top-notch Software Engineers who are experienced in leading a team, can work with Object-Oriented Programming, and has expertise in C# / C++/ Java to implement components of our software products and robotic control systems.

Job Description:
Understanding best coding practices and designing thoughtful coding patterns.
Analyzing problems and proposing an implementation to solve the issues.
Troubleshooting problems in the field.
Collaborating with peers to deliver high-quality products on time.
Leading and mentoring peers or a more junior position.

Requirements:
Candidate must possess at least Bachelor's Degree in Computer Science, Information Technology, Electronic Engineering, or equivalent professional experience in software development.
Have experience with a complete software development life cycle.
Solid experience of at least 4 years in C# / C++/ Java is preferable (the combination of these three is also acceptable).
Demonstrated experience with system architecture review, OOP, and software programming in a team environment.
Good grasp and used best practices in programming.
Committed to writing good quality and high-performance code.
Demonstrated good logical thinking as well as attention to detail.
Proactive, highly motivated, and a strong team player with a good ability to multi-task and re-prioritize as necessary.
Demonstrate leadership, project management, and mentor experience.
Excellent communication skills in English both oral and written.
Applicants must be willing to work (onsite) in Salatiga.

How to apply:
Send your latest CV to forindojob@formulatrix.com with the words SSE (space) Your Name; e.g. ""SSE Adam Fisal"" in the subject line.
You can apply by filling out this form: bit.ly/SSE_BE"
3776894038,Back-End Developer-.Net – Jubior,https://www.linkedin.com/jobs/view/3776894038,PT IKONSULTAN INOVATAMA,https://www.linkedin.com/company/pt-ikonsultan-inovatama/life," ",1 month ago,1,,On-site,,201-500 employees · Information Technology & Services,https://media.licdn.com/dms/image/C560BAQH-OKNci0WBBw/company-logo_100_100/0/1678859878266/pt_ikonsultan_inovatama_logo?e=1712188800&v=beta&t=PMnL9ULnJJjSIvrfOqFQSadXyxyGUF9mXAQUPKSsjss,"For more than two decades, PT Ikonsultan Inovatama (IKON) has been trusted by many local and global leading companies to help them reach their business goals.

Since 2002, IKON has built a strong reputation through its consultants through their experience and knowledge in the financial industry, project management, and information technology. Banks, insurance, and financing companies have become IKON’s clients.

However, due to the rapid development of information technology in Indonesia, IKON is extending the services to other fields like telecommunication, construction, and engineering, oil, and gas, and also retail.

With the vision of empowering people through humanized technology to make better Indonesia, and supported by professional teams, IKON has committed to help clients to achieve their vision and objectives.

IKON offers:
1. Consulting
2. Solution Development
3. Product
4. Managed Services

Partners:
1. Additiv: a leading platform for digitalization of services in the Financial Sector, such as Wealth Management
(http://www.additiv.com/2017-06-12/additiv-asia-ikonsultan-inovatama-ikon-strengthen-ties-serve-indonesian-market/)

2. Appian: leading low-code platform
(https://www.appian.com/)

3. Mega International: leading digital transformation platform (http://www.mega.com/en/event/digit-eyes-are-you-ready-compete-digital-age)

4. Oracle Primavera: leading Enterprise Project Portfolio Management (EPPM)
(https://solutions.oracle.com/scwar/scr/Partner/SCPP-IKONSULTAN.html)

5. Seeburger: leading business integration platform (http://www.seeburger.com/fsi.html)

6. Actico: Digital Business Automation
(https://www.actico.com/)

7. Freshworks: Feature-packed product suite for businesses of all sizes
(www.freshworks.com)

8. neGEntropie : Digital transformation solution
(www.negentropie.com)

9. UiPath : A global software company for robotic process automation (RPA)
(www.uipath.com)



EMPOWERING PEOPLE THROUGH HUMANIZED TECHNOLOGY
…
show more","Develop and implement Information Technology system in the company
 Monitoring and maintaining IT system, software, and also database
 Responsible for giving reports or feedback regarding the system, software, and project latest update”

Qualification

 Bachelor Degree in IT or Computer Science or any other related fields
 1 – 2 years of experience working with advance .Net, C#, WebAPI, GraphQl
 Experience working on enterprise application with .NET core and provisioning cloud-based solutions
 Working experience in web services (REST, jQuery, SOAP, and JSON) Integration
 Working experience in MS SQL Server 2012 and above Database
 Able to write clean code and experience in develop application with clean architecture
 Excellent written/verbal communication skill in Bahasa and English
 Proficient understanding of code versioning tools (Git)
 Have an experience develop application with clean architecture
 Familiar using JIRA or other project tracking software
 A strong understanding of the software development lifecycle and Agile methodologies
 Willing to work in financial industry client (Bank, Insurance or multifinance) support"
3702289048,Senior DevOps Engineer - Game Development,https://www.linkedin.com/jobs/view/3702289048,Michael Page,https://www.linkedin.com/company/michael-page/life," ",4 months ago,10,,On-site,,"5,001-10,000 employees · Staffing and Recruiting",https://media.licdn.com/dms/image/D4E0BAQHpnANIG_FYpg/company-logo_100_100/0/1688136319954/michael_page_logo?e=1712188800&v=beta&t=4O0RVODg6V1xPGl7glPl0Jyw3rA8n2fNoMuyr4Ro2do,"Welcome to the Michael Page global company profile.

Michael Page has five decades of expertise in professional services recruitment. We were established in London in 1976, and over this period we've grown organically to become one of the best-known and most respected consultancies, with an office network spanning six continents.

While size has its advantages, it doesn't define us - the nature of our organic growth means that each new office is integrated into the region that it serves. It also means that as an employer looking to hire, or as a candidate aiming to grow your career you have the best of both worlds; a team that understands the market and geography you operate in, plus the resources and expertise of an international network at your disposal.

Our teams are broken down to focus on industry, assignment type, salary level and location, so your hiring requirements or job search will all be handled by a specialist who knows your sector inside-out. We are confident that our expertise can add value to your recruitment or job search process – get in touch to find out more.
…
show more","Develop & maintain highly scalable platform|Business with presence in multiple countries in SEA


About Our Client

Our client is a software development company with major projects in gaming industry within SEA. Disclaimer: selected regional projects will be involving non-sharia compliant products.

Job Description

A Senior DevOps Engineer will be responsible for:
Manage and maintain the service system and its middlewares 
Build automation for internal agile infrastructure process and support continuous enhancement
Design procedures for system troubleshooting and maintenance
Implement, test and operate advanced software security techniques in compliance with a technical reference architecture
Execute and develop reusable CI/CD components to support multiple platform architectures
Act as an administrator for AWS/GCP cloud platform
The Successful Applicant

A successful candidate will have:
Working experience in AWS and/or GCP cloud environment
Expert in Linux administration and experience in Docker, Kubernetes, CI/CD tools.
The development and operations experience in micro-services ecosystem 
Experience in monitoring and alerting tools like Prometheus, Grafana etc., Log Management like ELK/OpenSearch etc. 
Experienced in script languages like Python, Shell, Perl etc.
Critical Thinking. Good at diagnosis, problem analyzing, resolving and system planning.
Team working. Experience of Collaborate with teams across countries in a multi-cultural environment.
What's on Offer

Competitive salary & benefit

Contact: Dyah Alya Gretiana

Quote job ref: JN-082023-6166698"
3776954098,DevOps Engineer,https://www.linkedin.com/jobs/view/3776954098,MileApp,https://www.linkedin.com/company/mileapp/life," ",1 month ago,17,,On-site,,11-50 employees · Software Development,https://media.licdn.com/dms/image/C560BAQEGzFL0KyBJbQ/company-logo_100_100/0/1630658697025/mileapp_logo?e=1712188800&v=beta&t=Ay6v3etQ77KmfDWG9aqCaQ0mgmxWK9IpRXYZ6xer3Uo,"MileApp will help you optimize your business and make it more efficient. It is a field operations management system that provides: a no-code mobile app builder, route optimization, automated reports, data mapping & visualization, and much more. MileApp can manage field workers like drivers, field sales, canvassers, technicians, and surveyors.
…
show more","Design, implement, and maintain the infrastructure and systems necessary for the development, deployment, and operation of our software applications
Automating and orchestrating workload across multiple public cloud providers
Manage and optimize cloud infrastructure to ensure scalability, cost-effectiveness, and reliability.
Design, implement, and maintain CI/CD pipelines to streamline the software delivery process
Setup alerts and monitoring server
Monitor and ensure the availability, performance, and security of our systems and applications
Collaborate with developers to optimize application performance, scalability, and reliability
Create and maintain comprehensive documentation for infrastructure, processes, and procedures.
Stay up to date with emerging technologies and industry trends related to DevOps practices
Planning projects and being involved in project management decisions 

Minimum Qualifications

Min 2 years previous experience in DevOps
Previous experience with Network, Firewall, and Server infrastructure
Experience with Linux infrastructures, GitLab CI/CD, database MySQL or MongoDB, ELK Stack, and Ansible / Terraform
Experience Deployment for the following languages: JavaScript, PHP, Phyton
Proficient in leveraging CI and CD tools to automate testing and deployment
Good interpersonal skills and communication with all levels of management
Able to multitask, prioritize, and manage time efficiently
It's a WFA (work from anywhere) job; however, we prefer candidates who reside in Jabodetabek area or are willing to relocate to Jakarta. This preference is to facilitate any potential need to our office in case there are server issues that require physical inspection at the data center"
3755743471,DevOps Engineer,https://www.linkedin.com/jobs/view/3755743471,Akseleran,https://www.linkedin.com/company/akseleran/life," ",2 months ago,6,,On-site,,51-200 employees · Financial Services,https://media.licdn.com/dms/image/C560BAQHxvHo3FHH1Vw/company-logo_100_100/0/1675305930211/akseleran_logo?e=1712188800&v=beta&t=8DVAh_P0Mu_OCydbBFK1PPdPMOmbPCiMfu_l4Zu8w4g,"Akseleran is a Peer-to-Peer (P2P) Lending platform with the vision of making financial inclusion a reality in Indonesia. We help SMEs grow their businesses and also open up new investment opportunity for investors. We're also fully licensed and monitored by Financial Services Authority of Indonesia (OJK)
for SMEs - Flexibility. We understand that SMEs need flexibility. We give it to them in the form of:
- Flexibility in collaterals: with or without collaterals, the usage of various type of collaterals
- Flexibility in principal payment: SMEs can pay back the principal in monthly/quarterly/every semester/end of payment terms
- Flexibility of payment terms: ranging from 1 month to 12 months

For Investors - Attractive Return & Safety
- Return: 11.75% - 30% effective p.a.
- Affordable: starts from Rp. 100,000
- Safe: More than 95% loan value has collaterals, fully licensed at & monitored by OJK

…
show more","Monitoring Infrastructure usage
Control & Setup server
Control & Setup Network
Server Administration
Network Administration

Minimum Qualifications

Bachelor's degree in Computer Science or a related subject is required with a GPA minimum of 3.00;
Minimum 3 years experience;
Fast learner and able to implement leading-edge information technologies
Strong analytical and planning skills;
Good communication and presentation skills;
Excellent problem-solving skills;"
3782769613,Systems Engineer,https://www.linkedin.com/jobs/view/3782769613,Turing,https://www.linkedin.com/company/turingcom/life," ",1 month ago,14,,Remote,,"1,001-5,000 employees · IT Services and IT Consulting",https://media.licdn.com/dms/image/D4D0BAQHB79AE71th8A/company-logo_100_100/0/1688472201595/turingcom_logo?e=1712188800&v=beta&t=uetswaiWdovNMJP7hgdfWDYzXjbSme1NRN0fa3n0zxI,"Traditional recruiting wasn’t designed for today’s software-first world. The old model is simply too slow, doesn’t allow for deep vetting and takes the control and ownership out of your hands. This is why we built Turing, the world’s most deeply vetted developers and teams, matched by AI. Turing connects world-class engineers with companies to help them achieve their respective career and business goals.

Traditional recruiting is over. Welcome to the Talent Cloud.

Turing enables:
> companies to get matched to vetted remote talent at the touch of a button
> developers to achieve their elite dream career from anywhere in the world

900+ top companies, including Pepsi, Bumble, and Dell, have trusted Turing’s Talent Cloud for their engineering needs.

Recruit Developers/Engineers:
Turing combines AI and a global reach to deliver your ideal engineers tailored to your business needs. Our Talent Cloud matches you to rigorously vetted, quality remote developers.

Try Turing.com for 2 weeks risk-free at turing.com

Turing Careers:
Turing helps you get excellent remote opportunities to build a high-growth career faster.

Find high-quality remote U.S. software jobs across 15 roles and 100+ technologies.

Apply today: turing.com/jobs

—----------------------
Co-founded by @Jonathan Siddarth and @Vijay Krishnan, Turing is an AI-powered technology company disrupting the traditional recruiting model for companies seeking to engage the most deeply vetted developers and teams.

Having raised $140 million from investors, including WestBridge Capital, Foundation Capital, Stanford StartX, and execs from Google, Meta, Microsoft, and Amazon, Turing's last round was on a $4 billion valuation cap.
…
show more","A U.S.-based company that offers consolidated, enterprise-level technologies to make it simple for companies to manage their carriers, business regulations, and shipments, is looking for a Systems Engineer. The engineer will be responsible for creating and implementing code for integration projects, independently and in collaboration with others. The company offers comprehensive, integrated, and automated shipping solutions that simplify and cut unnecessary costs. This is an amazing opportunity for candidates who are eager to work with a professional team while testing their mettle.

Job Responsibilities:

Update, maintain, and enhance current software products
Determine and evaluate the effects of changes to current projects
Test, debug, and resolve problems throughout the whole technology stack
Work together with coworkers in the organization for product development
Aid in enhancing technical tools and infrastructure 
Performing daily duties largely independently
Interact with clients and non-technical personnel with ease
Assume responsibility for deliverables individually or as a team and support the project migration to GitHub
Assist with creating a strategy for utilizing GitHub with upcoming advancements (policy, procedures, and training)

Job Requirements:

Bachelor’s/Master’s degree in Engineering, Computer Science (or equivalent experience)
At least 3+ years of relevant experience as a Systems Engineer
Demonstrable experience working with .NET, .NET Core, C#, and SQL Server databases
Prolific experience working with ASP.Net, MVC, and SOAP XML web services 
Solid understanding of Unit and Regression testing
Prior experience with SQL Server development and maintenance 
In-depth knowledge of jQuery, JavaScript, and GitHub
Demonstrable experience of production-quality work is nice to have
Possesses a strong understanding of the creation and deployment of both back-end and front-end systems 
Demonstrable experience using REST API patterns 
Solid understanding of the principles of continuous integration and deployment
Excellent English communication skills, both spoken and written"
