id,title,job_url,company,company_link,location,published_at,number_of_applicants_applied,employment_duration,work_location_type,work_experience_level,company_type,company_logo,company_description,about_the_job
3707593845,Backend Software Engineer,https://www.linkedin.com/jobs/view/3707593845,ION Mobility,https://www.linkedin.com/company/ionmobility/life," ",3 months ago,88,,On-site,,11-50 employees · Motor Vehicle Manufacturing,https://media.licdn.com/dms/image/D560BAQFA16Yx1-_rWw/company-logo_100_100/0/1699247663901/ionmobility_logo?e=1712188800&v=beta&t=Wxbfn3JkHFJQH3nGohn-mWNwh4Bivnf41p9jQZhWHls,"ION Mobility’s mission is to create affordable, desirable, and sustainable mobility for everyone. We are committed to creating great products and seamless user experiences for our customers.","We are seeking a talented Backend Engineer with expertise in Manufacturing Execution Systems (MES) to play a pivotal role in designing, developing, and maintaining our MES platform. As a Backend Engineer at Ion Mobility, you will have the opportunity to work on innovative projects that will drive efficiency, quality, and productivity in manufacturing processes.

What You Will Do

Collaborate closely with cross-functional teams, including manufacturing, operations, and IT, to understand system requirements. 
Design, develop, and maintain scalable and efficient backend systems for our MES platform. 
Implement data collection, analysis, and reporting features to improve manufacturing processes. 
Optimize system performance and ensure high availability and reliability. 
Collaborate on database design and optimization for manufacturing data storage and retrieval. 
Troubleshoot and resolve technical issues, ensuring minimal downtime. 
Stay current with industry trends and best practices in MES development. 

Who You Are

Bachelor's degree in Computer Science, Engineering, or a related field (or equivalent work experience). 
Proven experience as a Backend Engineer with a focus on MES or manufacturing systems. 
Strong proficiency in programming languages commonly used in MES development. 
Experience with database technologies (SQL, NoSQL) and data modeling for manufacturing data. 
Familiarity with manufacturing processes and workflows. 
Experience with IoT technologies and sensor integration. 
Previous work on projects involving process optimization and automation in manufacturing. 
Understanding of security best practices in manufacturing system development. 
Knowledge of real-time data processing and integration with shop floor equipment. 
Excellent problem-solving and debugging skills. 
Strong communication and collaboration abilities. 

About ION Mobility

We are pushing the frontiers of what is possible by developing desirable products as clean alternatives for urban users, to alleviate urban air pollution, and to lead the inevitable transition to EVs across Southeast Asia. Our team is constantly pushing the boundaries of innovation and design to create an electric riding experience that doesn't compromise on quality or style.

Join the team to bring about the future of mobility with us today!"
3776609705,Frontend Developer,https://www.linkedin.com/jobs/view/3776609705,Deriv,https://www.linkedin.com/company/derivdotcom/life," ",3 weeks ago,610,,On-site,,"1,001-5,000 employees · Financial Services",https://media.licdn.com/dms/image/D4D0BAQFIOCqNdGxpPQ/company-logo_100_100/0/1683727105062/derivdotcom_logo?e=1712188800&v=beta&t=CWYY0r0kHoQUkDTCKlqYuL1ilraFgnz7LvZnKPvr9U8,"Deriv, an award-winning online trading platform, serves over 2.5 million customers globally. We make trading accessible to anyone, anywhere. Our global team of 1300+ across 20 locations in 16 countries earn accreditations such as Great Place to Work*, Best Workplace for Women**, and Investors in People Gold.

* Cyprus, France, Jordan, Malaysia, Malta, Paraguay, Rwanda, UAE and the UK | ** Paraguay & UAE

Innovation drives Deriv's 24-year success story with our culture and talent winning top workplace honors worldwide. We believe inspired teams deliver superior customer experiences. Our people-first approach provides opportunities for accelerated learning, career development, and fun at work.

Our core values of integrity, customer focus, teamwork, and competence guide everything we do. We serve customers fairly and transparently. We collaborate and innovate to deliver an exceptional trading platform. And we nurture curious, ethical professionals.

If you want to redefine the future of accessible online trading, join our award-winning team. Let's transform financial markets together.
…
show more","Dear Applicants,

This position requires relocation to our Malaysia office.

You’ll be part of our Front-end team, where we build the client-side of our web applications by translating UI/UX design wireframes into a user-centric web experience. We advocate for our client's needs and we collaborate with other teams to implement an engaging user interface for our trading platforms.

As a Front-end Developer at Deriv, you’ll build powerful front-end systems with an improved user experience for our clients worldwide. You’ll be heavily involved in the design and development phases of our applications as we aim to create the best online trading platform in the industry.

Your challenges
Find the balance between functional and aesthetic design, and create engaging user interfaces for all our products.
Ensure our products are accessible across all platforms by optimising them for speed, scalability, and usability.
Resolve web-development challenges by employing reusable components and the latest front-end frameworks.
Offer the best user experience for our clients by performing automated tests, troubleshooting issues, and making improvements.
Maintain clear and detailed technical design documentation according to our style guide.


Requirements
Hands-on experience with JavaScript, HTML, and CSS
Good grasp of diverse testing and debugging methods
Excellent spoken and written English communication skills
What’s good to have
Good grasp of UI/UX design processes
Experience in working with React library
Experience with Git
Working experience in open-source platforms like Linux
Strong knowledge of technologies such as MobX, Gatsby, WebSocket, and styled-components
Good understanding of back-end technologies


Benefits:
Exciting work challenges
Cooperative work environment
Individualised career graph
Knowledge sharing and training sessions
Competitive salary
Health benefits
Annual performance bonus
Casual dress code
Travel and internet allowances
Inspiring work environment and creative freedom

Please submit your CV in English"
3797407452,Android Engineer,https://www.linkedin.com/jobs/view/3797407452,JULO,https://www.linkedin.com/company/juloindonesia/life," ",1 day ago,161,,Remote,,"501-1,000 employees · Financial Services",https://media.licdn.com/dms/image/D560BAQFGscu0EgUFQw/company-logo_100_100/0/1689054749601/juloindonesia_logo?e=1712188800&v=beta&t=O5H-0B8e7SVA9dY7G9pTVppKZTZGbRbwqfQV4JwpgTA,"JULO is a financial technology company that is working on a financial super app.

We started off with the lending arm and have excelled at it. Hundreds of thousands of Indonesians now use JULO apps to get access to a decent credit product. It's our mission to help millions of Indonesians get a better life. That's how we'll build a company future generations will be proud of.

We have just closed our Series B round and are now tapping into other financial territories, to eventually provide a one stop financial solution to all Indonesians.

Watch it happen or be a part of it - come join us!
https://lnkd.in/gKyjajf6
…
show more","We are looking for:
Someone with CAN-DO attitude to provide customers simple, clear, and lightweight mobile app interface to track and manage various ways they obtain credit with JULO

Responsibilities:
Take ownership in developing, releasing, maintaining, and improving all aspects of JULO’s Android app according to the committed deadline.
Analyze and systematically approach requirements and bugs reported, always coming up with practical short term and long term solutions that minimize complexity and maximize value.
Design and build modular components and reusable subsystems using various suitable tools, cloud services, and libraries to increase the app quality and increase the efficiency of development. Include security, maintainability, reusability, and testability when developing software solutions and code reviewing.
Factor mobile device OS system internals, data storage, computing and memory usage in the produced software solution.
Identify things that can go wrong early but also investigate bugs and crashes reported in production.
Apply and tailor software development concepts and Android best practices and share expertise to the team.
Work closely with other JULO engineers, products, data scientists, operations.

Requirements:
Highly skilled in developing, testing, debugging, and troubleshooting with any of these programming languages: Kotlin, Java.
Highly skilled in developing, testing, debugging, and troubleshooting with any of these advanced Android development: custom view & fancy layouting, unit tests in Android, MVVM & MVP patterns, async task handling with RxJava or Kotlin Coroutines.
Highly skilled in debugging and troubleshooting backend services especially API layer and complex real world database structures in SQL.
Highly skilled in all kinds of development tools that brings source code in a text file to running code in production. Once such tool is Firebase Crashlytics.
Experience in agile development process and applications such as Jira.\
Engineering/Computer/IT degree with 3 years of diverse software development experience and teams and 2 years of Android app development.
Great team player, have excellent work ethics, and have solid technical communication skills in English.

Nice to have:
Developing, testing, debugging, and troubleshooting API layer of backend services built on these programming languages: Python, Golang, Node.js Developing, testing, debugging, and troubleshooting messaging and communications within Android phone such as EventBus"
3798040197,AI Backend Developer (Python),https://www.linkedin.com/jobs/view/3798040197,Turing,https://www.linkedin.com/company/turingcom/life," ",4 days ago,0,,Remote,,"1,001-5,000 employees · IT Services and IT Consulting",https://media.licdn.com/dms/image/D4D0BAQHB79AE71th8A/company-logo_100_100/0/1688472201595/turingcom_logo?e=1712188800&v=beta&t=uetswaiWdovNMJP7hgdfWDYzXjbSme1NRN0fa3n0zxI,"Traditional recruiting wasn’t designed for today’s software-first world. The old model is simply too slow, doesn’t allow for deep vetting and takes the control and ownership out of your hands. This is why we built Turing, the world’s most deeply vetted developers and teams, matched by AI. Turing connects world-class engineers with companies to help them achieve their respective career and business goals.

Traditional recruiting is over. Welcome to the Talent Cloud.

Turing enables:
> companies to get matched to vetted remote talent at the touch of a button
> developers to achieve their elite dream career from anywhere in the world

900+ top companies, including Pepsi, Bumble, and Dell, have trusted Turing’s Talent Cloud for their engineering needs.

Recruit Developers/Engineers:
Turing combines AI and a global reach to deliver your ideal engineers tailored to your business needs. Our Talent Cloud matches you to rigorously vetted, quality remote developers.

Try Turing.com for 2 weeks risk-free at turing.com

Turing Careers:
Turing helps you get excellent remote opportunities to build a high-growth career faster.

Find high-quality remote U.S. software jobs across 15 roles and 100+ technologies.

Apply today: turing.com/jobs

—----------------------
Co-founded by @Jonathan Siddarth and @Vijay Krishnan, Turing is an AI-powered technology company disrupting the traditional recruiting model for companies seeking to engage the most deeply vetted developers and teams.

Having raised $140 million from investors, including WestBridge Capital, Foundation Capital, Stanford StartX, and execs from Google, Meta, Microsoft, and Amazon, Turing's last round was on a $4 billion valuation cap.","Python Developer: Innovate AI's Conversational Horizons

We're mapping territories unknown in AI conversational experiences, and we seek a Python Developer, adept and ambitious, who can help us lead the way. Contribute your unique coding skillset to forging AI chatbots that surprise, engage, and innovate.

Your Agenda:

Compose targeted, intelligent Python code critical to our AI platforms.
Perform exacting code critiques, keeping in line with our standards of mastery.
Utilize Python's capabilities, blending art and science, to solve AI’s complex riddles.
Document and construct code that's not only effective now but ready for tomorrow's iterations.

Your Capabilities:

A degree in Engineering or Computer Science or rich, equivalent Python development experience.
3+ years in the Python development space, preferentially with a bend towards AI.
Competent in SQL and knowledgeable about the principles of Quality Assurance.
A reputation for outstanding problem-solving skills, particularly in algorithm development.

Our Reward for You:

Collaborate with AI developers and intellectuals globally in a cohesive remote environment.
Experience the personal advantages of remote work while honing your professional aptitude.
A respectable salary that meets with international expectations, securely in US dollars.
Work on exciting projects at the vanguard of technology that keep your skills acute.

Take the Leap:

We're calling on Python Developers with hearts set on shaping AI to beautiful and complex conversations. Join us and be at the helm, coding the future of AI dialogue and connection."
3782767931,Full-Stack Developer,https://www.linkedin.com/jobs/view/3782767931,Turing,https://www.linkedin.com/company/turingcom/life," ",3 weeks ago,2,,Remote,,"1,001-5,000 employees · IT Services and IT Consulting",https://media.licdn.com/dms/image/D4D0BAQHB79AE71th8A/company-logo_100_100/0/1688472201595/turingcom_logo?e=1712188800&v=beta&t=uetswaiWdovNMJP7hgdfWDYzXjbSme1NRN0fa3n0zxI,"Traditional recruiting wasn’t designed for today’s software-first world. The old model is simply too slow, doesn’t allow for deep vetting and takes the control and ownership out of your hands. This is why we built Turing, the world’s most deeply vetted developers and teams, matched by AI. Turing connects world-class engineers with companies to help them achieve their respective career and business goals.

Traditional recruiting is over. Welcome to the Talent Cloud.

Turing enables:
> companies to get matched to vetted remote talent at the touch of a button
> developers to achieve their elite dream career from anywhere in the world

900+ top companies, including Pepsi, Bumble, and Dell, have trusted Turing’s Talent Cloud for their engineering needs.

Recruit Developers/Engineers:
Turing combines AI and a global reach to deliver your ideal engineers tailored to your business needs. Our Talent Cloud matches you to rigorously vetted, quality remote developers.

Try Turing.com for 2 weeks risk-free at turing.com

Turing Careers:
Turing helps you get excellent remote opportunities to build a high-growth career faster.

Find high-quality remote U.S. software jobs across 15 roles and 100+ technologies.

Apply today: turing.com/jobs

—----------------------
Co-founded by @Jonathan Siddarth and @Vijay Krishnan, Turing is an AI-powered technology company disrupting the traditional recruiting model for companies seeking to engage the most deeply vetted developers and teams.

Having raised $140 million from investors, including WestBridge Capital, Foundation Capital, Stanford StartX, and execs from Google, Meta, Microsoft, and Amazon, Turing's last round was on a $4 billion valuation cap.","A rapidly-growing company that is providing automated debt management and payment solutions to enterprises is looking for a Full-Stack Developer. The developer will be expected to keep up with the most recent developments in technology and market trends to make sure the platform is innovative and competitive. Users can track loans, collect payments, and safeguard their revenue thanks to the B2B SaaS FinTech company's integrated platform. This is an amazing opportunity for candidates with brilliant technical skills to work in a dynamic environment where their talent is appreciated.

Job Responsibilities:

Create, update, and improve the Laravel-based loan servicing platform to satisfy our clients' specific requirements and uphold high standards of security and performance
Work together with project managers and engineers to design, develop, and implement new features and improvements
Investigate, diagnose, and fix technological problems to provide a flawless user experience
Respect recognized coding standards and write code that is organized, readable, and tested
Keep the codebase, procedures, and system architecture up to date in your documentation
Make the platform as efficient, performant, and scalable as possible
Help with the integration of external services, including accounting software, payment processors, and other APIs
As required, offer clients and internal stakeholders technical support
Oversee the development process and make sure that the software keeps up its high standards and changes to meet the needs of its users

Job Requirements:

Bachelor’s/Master’s degree in Engineering, Computer Science (or equivalent experience)
At least 4+ years of relevant experience as a full-stack developer 
3+ years of solid experience working as a PHP developer in a SaaS or FinTech environment
Strong familiarity with PHP web frameworks, including Symfony or Laravel
Demonstrable expertise with JavaScript, HTML, CSS, and Tailwind, among other front-end technologies
Proficiency with database management, especially with PostgreSQL
Familiarity with REST and SOAP API development and integration
Extensive familiarity with version control platforms like Git and Agile development practices like Jira and Confluence
Excellent problem-solving abilities and the capacity to function both individually and together
Exceptional interpersonal and communication abilities
Nice to have experience with loan servicing, financial accounting, or loan management software
Fluent in spoken and written English communication"
3794947163,"Odoo Developer (Akasha Wira International, Tbk)",https://www.linkedin.com/jobs/view/3794947163,Dealls,https://www.linkedin.com/company/dealls/life," ",1 week ago,2,,On-site,,See recent hiring trends for Dealls. Try Premium for IDR0,,,"🙌🏻 About Us

PT. Akasha Wira International Tbk was founded on 6th March 1985 in Jakarta, Indonesia. Our reason for being is to bring the world’s best consumer solutions to the world’s mass.

At the moment PT Akasha Wira International Tbk is engaging in two business segments :

 BEVERAGE : Akasha International currently produces and distributes Nestlé® Pure Life® in Indonesia under the license and supervision from Nestlé Water SA. In October 2011, as an answer to consumers needs, Akasha International started to produce mineral drinking water using its own trademarks, Vica Royal.
 BEAUTY CARE : In 2010 Akasha International expanded our business scope to the cosmetics business by acquiring a company engaged in the production of hair care products under the brand Makarizo.

Akasha International believes through People, System, Technology and Capital is able to craft our vision. As those four we call as an operational excellent platform. Each platform attempts to achieve world-class capabilities led by committed and obsessed leaderships supported by state-of-the-art yet practical technology and purposed-built processes. Akasha International is investing quite heavily relative to our size today and needs in scalable core capability platforms in order to support future’s acquisition and growth opportunities.

In the past five years, Akasha International has made one acquisition a year and intends to keep this acquisition pace going forwards. Currently, the Company employs +2,000 employees across Indonesia.

💰Salary

Very competitive

👑 Job Role

Migrate module odoo CE v11 to odoo CE v14
Experienced in handling HR odoo module

⛩️ Requirements

Candidate must possess at least Bachelor’s Degree Computer Science/Information Technology or equivalent.
Minimum 1 years of experience in odoo Technical (Odoo version 11/12/14)
Good knowledge of PostgreSQL
Experience using GIT or Versioning Control

🎁 Perks

Competitive Salary
THR / Bonus system
Medical Insurance
Recreational Area
Free Food / Snacks"
3607478951,Software Engineer (Mekari Talenta),https://www.linkedin.com/jobs/view/3607478951,Mekari,https://www.linkedin.com/company/mekari/life," ",8 months ago,199,,Hybrid,,"1,001-5,000 employees · Software Development",https://media.licdn.com/dms/image/D560BAQEy-QSiDSQhLQ/company-logo_100_100/0/1689148487268/mekari_logo?e=1712188800&v=beta&t=ASFmiiQJqaGA4D_OR_etEQJRg5pK5i62fYgGOoK9i1o,"Mekari is the #1 Software-as-a-Service (SaaS) company in Indonesia, aiming to empower the progress of businesses and professionals across various industries.

Our innovative cloud-based technology solution in HR (Mekari Talenta), Accounting (Mekari Jurnal), Sales (Mekari Qontak), Tax (Mekari Klikpajak), Electronic Signature (Mekari Sign), and Benefits (Mekari Flex) have been used by tens thousands of businesses in Indonesia.

To reach millions, we need more people like you —those eager to innovate, lead, and win with us.
…
show more","Mekari is Indonesia's no. 1 Software-as-a-Service (SaaS) company. Our mission is to empower businesses and professionals to progress effortlessly. Our products (Mekari Talenta, Mekari Jurnal, Mekari KlikPajak, & Mekari Qontak) have been used by tens of thousands of businesses in Indonesia.

To reach millions, we need more people like you: entrepreneurs, builders, owners inside the company who are eager to grow at scale. Join us to empower more businesses with technology.

Job Descriptions

Maintain high levels of customer engagement (including on-site meetings) with a focus on customer satisfaction and loyalty
You will work with your accounts proactively to drive product adoption as well as act as the voice of clients
Proactively spot and correct any issues that could affect customer satisfaction or retention
Facilitate periodic reviews with customers, determining new requirements and further success through engaging and consultative discussions
Continually gather feedback from our clients, then work directly with our product team to provide input on the product roadmap

Technical Requirements

Good knowledge of Ruby. Experience with Ruby frameworks (e.g. Rails, Sinatra) is a plus.
Understand basic Javascript. Experience with Javascript frameworks (e.g. VueJs, ReactJs) is a plus.
Familiarity with relational databases concepts (SQL syntax, indexing, structures, and query optimization).
Understand programming practices such as separation of concerns, unit testing, and writing self-documenting code.
Familiarity with version control systems such as Git or Mercury.
Have some experience in deploying an app to the production environment

Soft Skill Requirements

Integrity and humility is a must
Passionate about problem-solving and software engineering
Possess excellent teamwork skill
Good communication skills with technical and non-technical team members
Love to learn new things and share them with others

You Will Impress Us If You Are

Experienced with containers and orchestration (e.g. Docker & Kubernetes)
Experienced in building a high performance & highly available web application
Experienced in mentoring more junior developers
Maintain an open-source project or is an open-source contributor

What You Will Get

 Competitive salary + daily allowance.
 Premium private health insurance (outpatient, inpatient, maternity, dental).
 Early access to salary + flex installment (employee loan) via Mekari Flex.
 Allowance for sports activities and glasses/contact lenses.
 Flexible working hours and remote work culture with free co-working space services.
 Annual and unpaid leaves from day 1 of join date + unlimited sick leave with doctor note.
 Notebook Ownership Program.
 Strategic office location, accessible by MRT.
 Friendly and dynamic work environment.
 Opportunity to take part in growing Indonesia's no. 1 SaaS company

Our team will review your application and will be in touch if your application is shortlisted to the next stage. If you do not hear from us in 30 days, we will keep your resume on file in case a relevant opportunity opens up.

Don't forget to check our Recruitment FAQ at bit.ly/RecruitmentFAQ-Mekari [ENG] or bit.ly/RekrutmenMekari-FAQ [INA] to find the answers to commonly-asked questions regarding our recruitment process.

We wish you the best. Hope to see you around soon!"
