id,title,job_url,company,company_link,location,published_at,number_of_applicants_applied,employment_duration,work_location_type,work_experience_level,company_type,company_logo,company_description,about_the_job
3787770970,Senior Backend Engineer (Merchant Aggregator),https://www.linkedin.com/jobs/view/3787770970,byOrange,https://www.linkedin.com/company/byorange/life," ",2 weeks ago,24,,On-site,,51-200 employees · Advertising Services,https://media.licdn.com/dms/image/C560BAQHi-H_Q5TD6xQ/company-logo_100_100/0/1676544457439?e=1712188800&v=beta&t=iup5av_AAUY_Xeka8sz14gauXh1ngwWHy1WaOeXxjsc,"We help Indonesia’s financial industry to grow rapidly by develop, launch, and scale breakthrough ideas.

We are your all-in-all-the-time product, brand, and technology experts, hand-picked for the specific mission. We sit along with your core team and cultivate close, collaborative partnerships with all of your ecosystem partners.

We provide you the technologies made available by Orange's own proprietary information technology capabilities. Which currently serves the financial technology industry, including digital banking, fund transfer, digital payment (QR-based and e-money), insurance, and online trading platform.

With our own development team, the possibilities of services that we can offer are practically endless.
…
show more","Who We Are:

Orange provides your personalized go-to pool of strategy planners, creatives, and technologists for your brand and campaign that aren't part of your daily routine. Strategic managers, content specialists, conceptual creatives, producers, SEO experts, product managers, and others are among the impact players who are held match-fit for your brand.

We are looking for great Go developers with a strong understanding of how best to leverage and exploit the language’s unique paradigms, idioms, and syntax. Your primary focus will be on developing Go packages and programs that are efficient, scalable and maintainable. A commitment to collaborative problem solving, sophisticated design, and quality product is essential.

What You Will Do:

Writing scalable, robust, testable, efficient, and easily maintainable code.
Build new product/feature based on product requirement.
Maintain and enhance current product.
Contribution in architectural and design decisions.
Contribution in agile process and devops culture improvement.
Contribution in new product initiative.

What You Will Need:

Minimum 3 years of experience.
Strong knowledge of Go programming language, paradigms, constructs and idioms.
Knowledge of goroutine and channel patterns.
Experienced of building API with HTTP REST and or gRPC.
Strong knowledge of SQL and relational database: mysql/mariadb, postgresql.
Experienced with NoSQL database (Redis, MongoDB) is preferred.
Experienced with Containerization (Docker, Kubernetes) is preferred.
Experienced with microservices/distributed architecture is prefered.

Powered by JazzHR

DYCoMuvV2Y"
3791036663,Programmer,https://www.linkedin.com/jobs/view/3791036663,,,,,0,,On-site,,See recent hiring trends for PT. PURWANTO ASSET MANAGEMENT. Upgrade my plan,,,"Responsibilities

Job Summary: 

Software development, web development, design database, data analysis.

Duties/Responsibilities

Design, write, test code that enables computer programs and application to function.
Analysing user needs, develop algorithms, writing code in various programming languages, debugging, troubleshoot issue, and collaborating with cross-functional teams
Staying abreast of industry trends and continuously improving coding skills
Collects, analyses, and summarizes information and trends as needed to prepare project status reports.
Maintain & monitor company IT; hardware, software, network, and server.

Requirements

Experience in back-end development at least 2 years
Proficient with programming; Python, MySQL and Golang,
Fluent in Vue JS and Java programming, Figma, Familiar with Trello
Experience in microservices; design, development and testing
Excellent analytical, logical thinking, and problem-solving skills, communication skills.
Bachelor’s degree in Computer or Information Science-related field required.
At least 3 years of related experience required as a Programmer."
3791738247,Senior Java Developer,https://www.linkedin.com/jobs/view/3791738247,Staffing Ninja,https://www.linkedin.com/company/staffing-ninja/life," ",,16,,Remote,,1-10 employees · Staffing and Recruiting,https://media.licdn.com/dms/image/D4D0BAQH6VtK5Mqw5Wg/company-logo_100_100/0/1692353299796?e=1712188800&v=beta&t=Hu1qo7dcoZNNw7ZZOZc5WMMlmeuLiP_kj47p8ThKw48,"Staffing Ninja is a leading recruitment agency specializing in connecting top talent with innovative companies worldwide for recruiting.

At Staffing Ninja, we are committed to building long-term relationships with our clients and candidates. Our goal, among other industry experts, is to help our clients achieve their business objectives by providing them with the best talent available through our headhunting service and to help our candidates take their careers to the next level with the best AI jobs.

Find your next career opportunity in the AI space, contact us today!
…
show more","Job Responsibilities:
Develop, design, and implement Java-based integration solutions facilitating communication across various systems and applications.
Collaborate with cross-functional teams to gather integration requirements and translate them into technical designs.
Create and maintain APIs and connectors to enable seamless data exchange and interoperability.
Employ integration tools and platforms to craft scalable and resilient integration solutions.
Conduct code reviews and ensure adherence to coding standards and best practices.
Identify and troubleshoot integration issues, implementing effective solutions and addressing root causes.
Participate in the entire software development lifecycle, including requirements analysis, design, coding, testing, deployment, and maintenance.
Document integration processes, APIs, and technical specifications for future reference.
Collaborate with stakeholders to comprehend business needs and align integration solutions with organizational goals.

Job Qualifications:
Hold a Bachelor's degree in Computer Science, Software Engineering, or a related field (or possess equivalent practical experience).
Demonstrate proven experience as a Java Developer, with additional experience in integration projects being advantageous.
Possess a strong proficiency in the Java programming language and related frameworks (Spring, Apache Camel, etc.).
Familiarity with integration patterns, API design, and RESTful web services.
Experience with integration tools such as Apache Kafka, RabbitMQ, or MuleSoft is considered a plus.
Knowledge of data formats such as JSON and XML, coupled with experience in data transformation.
Understanding of authentication, authorization, and security principles in integration.
Showcase excellent problem-solving skills with the ability to analyze and resolve complex integration challenges.
Possess strong communication skills for effective collaboration with both technical and non-technical teams.
Ability to work independently and collaboratively within a fast-paced environment.
Experience with version control systems (e.g., Git) and continuous integration practices is advantageous."
3773087381,Backend Engineer,https://www.linkedin.com/jobs/view/3773087381,Talent Insider,https://www.linkedin.com/company/talentinsider/life," ",4 weeks ago,2,,On-site,,"11-50 employees · Technology, Information and Internet",https://media.licdn.com/dms/image/C560BAQE1tUpFj8bT_Q/company-logo_100_100/0/1630662935364/talentinsider_logo?e=1712188800&v=beta&t=Ig8ErskBeJxkTUfD86vkDJYHBAO4d9kmg2AGv8Ea3_w,"Welcome to Talent Insider. We aim to be the world’s largest professional media company, developed in Indonesia for the world.

Vision:
Empower everyone who wishes to dream higher or find their dream hire.

Mission:
Talent Insider will enhance everyone and every company, enriching them through research, insights, and industry-specific news. Our futuristic technology will enable everyone to have an equal opportunity to grow.

Who Are We?
Talent Insider began with our founder, Jacky Bhagchandani, in September 2020 and was officially launched on March 1st, 2021. He has previously worked at LinkedIn and has over 17 years of experience in the HR and Information Technology Industry.

Our values are based on the principles of Communication, Trust, and Respect, recognizing that everyone at Talent Insider and beyond can aspire to dream higher.

At Talent Insider, we believe that the future belongs to those who dare to dream and those who seek their dream careers. We are committed to providing a platform where individuals and businesses can access the latest insights, trends, and news to achieve their aspirations. Our dedicated team, led by Jacky Bhagchandani, brings a wealth of experience from the HR and IT sectors, ensuring that our content and technology are second to none.

Whether you are an aspiring professional or a forward-thinking company, Talent Insider is here to support your journey. We are driven by a vision to empower individuals to reach new heights and help businesses thrive in a dynamic world. Join us in this exciting journey toward a brighter, more inclusive future.
…
show more","Responsibilities
Address Customer-reported Issues With Urgency Based On Their Severity And Regional Impact.
Implement Innovative Features And Enhancements To Improve The Product's Functionality And Usability.
Collaborate With Fellow Developers To Deliver A Polished Product Within The Established Release Timeframe.
Maintain Clear Communication With Stakeholders To Ensure A Smooth Product Implementation Process.

Qualifications
Proficient in both written and spoken English.
Proven experience in Object-Oriented Programming using C#.
Extensive experience of over five years in developing desktop software products.
Holds a Bachelor's degree or higher in Computer Science or a related field.
Exhibits self-initiative, motivation, and a positive attitude.
Demonstrates the ability to collaborate effectively within a global team and communicate with individuals from diverse technical and cultural backgrounds.
Possesses the skills to mentor and guide junior developers.
Ideally experienced with C, C++ and .NET (Windows Presentation Foundation)
Experience developing with SQL Server and/or oracle"
3791059220,Backend Developer,https://www.linkedin.com/jobs/view/3791059220,,,,,0,,On-site,,See how you compare to 22 applicants. Upgrade my plan,,,"Requirement

 Mempunyai pengalaman sebagai backend dev, minimal 2 tahun
 Menguasai bahasa pemrograman: PHP, Laravel, Javascript
 Dapat bekerjasama dengan tim
 Dapat berkomunikasi dengan baik
 Dapat membuat laporan yang mudah dibaca & dimengerti
 Paham tentang REST-API dan pernah menggunakan
 Paham dan menguasai tentang GIT (gitlab), REST API, JSON, Node Js, MySQL
 Nilai tambahan jika bisa CI/CD, Vue 3, Nuxt 3

Job Description

 Mengembangkan sistem dan proses untuk memenuhi persyaratan aplikasi yang ditentukan
 Mengelola database, termasuk penyimpanan dan pengambilan data, merapikan data, membuat cadangan data, dan menjamin keamanan data
 Menemukan dan memperbaiki bug di kode back-end
 Mengelola API yang digunakan perusahaan agar terintegrasi dengan aplikasi, baik secara eksternal maupun internal
 Melakukan optimalisasi kinerja untuk meningkatkan efisiensi dan meningkatkan pengalaman pengguna (user experience)
 Membuat dan memelihara library kode yang dapat digunakan kembali oleh pengembang di seluruh organisasi
 Membantu mengembangkan keseluruhan arsitektur back-end aplikasi
 Menjaga aplikasi dari serangan cyber
 Bekerja sama dengan front end developer, dan pihak lain seperti web designer, IT security, dan lainnya untuk membangun aplikasi atau website"
3791688629,Senior Software Engineer,https://www.linkedin.com/jobs/view/3791688629,Hyppies.com,https://www.linkedin.com/company/hyppies/life," ",1 week ago,91,,Remote,,11-50 employees · Staffing and Recruiting,https://media.licdn.com/dms/image/C560BAQHE8iZCHUEBNg/company-logo_100_100/0/1630644050657/hyppies_logo?e=1712188800&v=beta&t=i9ZL-sR98kd7eTbAMu0iF0OKmRHuc4lAYZRnoToxEGs,"At Hyppies, we're more than just a recruitment company; we're a movement. Inspired by the ethos of hypergrowth and high potential, we're dedicated to matching the most talented individuals with the most ambitious tech companies.
Our name, Hyppies, is a nod to the revolutionary spirit of the hippie movement, reflecting our commitment to challenging the conventional approach to tech recruitment.

Our Vision
We envision a world where the right talent meets the right opportunity, creating a synergy that fuels innovation and growth in the tech sector. We believe in the power of people and their potential to transform industries, and we're here to make those connections happen.

Our Services
Recruitment : We specialize in identifying high-potential talent for roles that demand innovation and expertise. Our extensive network across the tech industry enables us to find the perfect match for both companies and candidates.

Contracting: Recognizing the need for flexibility in the fast-paced tech world, we offer staffing solutions for short-term and project-based needs.

Large-Scale Recruitment Projects: Hyppies offers streamlined, high-quality recruitment solutions for companies facing rapid expansion and large-scale hiring needs.

Offshoring: We specialize in establishing efficient offshore teams, connecting you with a global talent pool to enhance diversity and optimize costs.

Market Insights: With our finger on the pulse of Asia's tech scene, we offer valuable insights into market trends, helping companies and professionals stay ahead of the curve.

Our Presence
Headquartered in Singapore, Hyppies operates across Asia with additional offices in Malaysia and Indonesia. This strategic presence allows us to tap into diverse talent pools and offer region-specific market expertise.

Our Culture
We're proud to embody the spirit of non-conformity and freedom that marked the hippie movement. At Hyppies, creativity and out-of-the-box thinking are at the core of what we do.
…
show more","Ready to take a part of the tech landscape and make your mark? 🚀 Become a Software Engineer with a payment and software powerhouse?

A leading payment and software company is currently in search of skilled Software Engineers to join their team. With over a decade of establishment, their solutions are widely used at tens of thousands of business locations in the American region.

As a Software Engineer, you'll get the chance to contribute to significant projects using the latest tech stacks. You'll work hands-on, surrounded by a high-performing team, while exploring your passion in a dynamic environment.

What You Will Do.

Collaborate with cross-functional teams, and demonstrate excellent problem-solving skills to overcome technical challenges.
Develop and maintain high-quality code and ensure software is well-documented.
Thrive in a global projects and diverse environment, bringing innovative solutions to the table.
Contribute to the design and implementation of cloud-based architecture.
Improve the performance and scalability of the software systems.

What You Bring.

Bachelor's degree in Computer Science or a related field
Experience working on full-stack complex system projects
Strong knowledge in API design and cloud architecture
Ability to excel in an international and diverse work environment
Proficient in English communication is required
Exceptional logic and problem-solving skills

How to Apply.

Send your updated resume and cover letter here or to sandra.soenaryo@hyppies.com"
3755418701,Devops Engineer,https://www.linkedin.com/jobs/view/3755418701,Dikshatek Indonesia,https://www.linkedin.com/company/dikshatek/life," ",2 months ago,46,,On-site,,"501-1,000 employees · IT Services and IT Consulting",https://media.licdn.com/dms/image/D560BAQETv3fzwlc2Gg/company-logo_100_100/0/1696481727825/dikshatek_logo?e=1712188800&v=beta&t=8k3YGxtqFOXUrLClbuLWzVynoEIXZ4y5WwD81aNdBRU,Dikshatek Indonesia provides world-class IT Consultants and Solutions to Tier-1 Indonesian Businesses.,"Job Description

 Job Description: 

DevOps Engineer dengan spesifikasi sbb:

Pendidikan "" S1 Komputer / S1 Informatika

Deskripsi Pekerjaan

 Melakukan kegiatan CI.CD untuk kebutuhan project POC, sehingga dapat dibuktikan & diambil kesimpulan jika project POC dapat diaplikasikan dan dapat diintegrasikan ke eksisting CI.CD
 Melakukan dokumentasi laporan hasil POC dan melaporkan ke TL

Keahlian

 Berpengalaman 2 Tahun dengan hypervisor, vm-ware, docker
 Berpengalaman dalam melakukan CI/CD sebuah aplikasi mobile, web dll
 Berpengalaman menggunakan Jenkins & Pipeline
 Berpengalaman menggunakan bahasa pemrograman
 Berpengalaman mengkonnfigurasi Database
 Berpengalaman menggunakan Redis,NAS/NFS,Minio
 Berpengalaman menggunakan JSON & XML
Berpengalaman menggunakan tools Devops lainnya
 Dapat melakukan deployment CI/CD prototype secara cepat dengan timeline singkat e.g 1 minggu"
3781771966,Dotnet Developer,https://www.linkedin.com/jobs/view/3781771966,Binar Academy,https://www.linkedin.com/company/binar-academy/life," ",2 weeks ago,54,,On-site,,201-500 employees · IT Services and IT Consulting,https://media.licdn.com/dms/image/C560BAQEBEZeoowry3A/company-logo_100_100/0/1657875033201/binar_academy_logo?e=1712188800&v=beta&t=79RrolW64elCqgu2dKcvzRMR2LqJn9ud8WNl1jCkjeY,"BINAR was born in 2017 to advance Indonesia’s technology ecosystem. Our mission is to solve digital talent gap by upskilling and job matching.

We support people to build a career in digital industry or upskilling into digital related roles with the knowledge and skills needed to thrive through a structured learning journey and multiple learning styles to ensure each learner can reach mastery through their own preferred way.

Our upskilling programs are designed to provide learners with first-hand exposure to the real world and prepare them with skills critically needed by the industries in this fast-changing digital era.

Also, we help students and companies to connect and build great teams.
Fueled by industry change, BINAR for Business helps companies achieve critical business outcomes and stay competitive by offering relevant and personalized learning experiences.

Advance your career, show off your skills, grow your business and get ready to #SelangkahDiDepan with BINAR.

Learn more about us:
Website: www.binaracademy.com
Instagram: @academybinar
Youtube: https://www.youtube.com/binaracademy

BINAR Apps is available on the Google Play store and iOS. Download BINAR app on:
- Apple Store: https://bit.ly/BinarAppsAppStore
- Google Play Store: https://bit.ly/BinarAppsPlayStore
…
show more","The ideal candidate will be familiar with the full software design life cycle. They should have experience in designing, coding, testing and consistently managing applications They should be comfortable coding in a number of languages and have an ability to test code in order to maintain high-quality code. 
 Responsibilities
Design, code, test and manage various applications
Collaborate with engineering team and product team to establish best products
Follow outlined standards of quality related to code and systems
Develop automated tests and conduct performance tuning

Qualifications
Bachelor's degree in Computer Science or relevant field
2+ years of experience working with .NET or relevant experiences
Experience developing web-based applications in C#, HTML, JavaScript, VBScript/ASP, or .NET
Experience working with MS SQL Server and MySQL Knowledge of practices and procedures for full software design life cycle
Experience working in agile development environment"
3781602303,Cloud Engineer,https://www.linkedin.com/jobs/view/3781602303,Logicalis Asia,https://www.linkedin.com/company/logicalis-asia/life," "," ",69,,Hybrid,,"5,001-10,000 employees · IT Services and IT Consulting",https://media.licdn.com/dms/image/D560BAQHsdumSvmnbGQ/company-logo_100_100/0/1688541605950/logicalis_asia_logo?e=1712188800&v=beta&t=cLU-uBIOd8N5OVEZzRGp-MA-Znlr7-r6IWk-sTIDjVU,"Logicalis is an international solutions provider of digital services currently accelerating the digital transformation of its 10,000 customers around the world.

Through a globally connected network of specialist hubs, sector-leading experts (in education, financial services, government, healthcare, manufacturing, professional services, retail and telecommunications) and strategic partnerships (including Cisco, Microsoft, HPE, IBM, NetApp, Oracle, ServiceNow, and VMware), Logicalis has more than 6,500 employees focused on understanding customer priorities and enhancing their experience.

As Architects of ChangeTM, Logicalis’ focus is to design, support, and execute customers’ digital transformation by bringing together their vision with its technological expertise and industry insights. The company, through its deep knowledge in key IT industry drivers such as Security, Cloud, Data Management and IoT, can address customer priorities such as revenue and business growth, operational efficiency, innovation, risk and compliance, data governance and sustainability.

The Logicalis Group has annualised revenues of $1.7 billion, from operations in Europe, North America, Latin America, Asia Pacific, and Africa. It is a division of Datatec Limited, listed on the Johannesburg Stock Exchange, with revenues of over $4.3 billion.

For more information, please visit www.ap.logicalis.com.
…
show more","Why choose iZeno?

iZeno was founded in 2003 to provide enterprises with custom-built technology solutions they need to keep their business running seamlessly. Logicalis Asia, part of the Logicalis Group, a leading international IT solutions and managed services provider, has acquired a majority stake in iZeno, a company specialising in digital transformation, application modernisation, DevOps, customer experience and hybrid cloud solutions.

With a team of 120+ in-house innovators, we have delivered over 500 Enterprise Solutions, implemented, and optimized to enable smarter insights. Our team draws on industry experiences in accomplishing a portfolio of mission-critical applications, integrating Cloud, CRM, Data Analytics, and other leading technologies with our clients' existing IT frameworks.

With leading presence in the region, headquartered in Singapore and operation in Malaysia, Indonesia, Thailand and Philippines, no project is too complex for us, and our team is always ready for a new challenge. 

About the role:

Perform administrative tasks related to install Linux (RedHat) servers from scratch, configure, patching, and has good troubleshooting skills. 
Performance monitoring for all Linux servers (OS, CPU, Memory, Network, Disk and Process), detect, diagnose, report and resolve Linux server related hardware and OS problems. 
Perform hardening and security configuration of Linux (RedHat) servers. 
Establish and maintain documentation and standards
Works as part a team and provide the support when required

What we are looking for:

Bachelor's degree or Diploma in Computer Science, related technical field, or equivalent practical experience
RedHat certifications is preferred
Knowledge of best practice especially for RedHat OpenShift Container Platform, RedHat OS, and IT operations in an always-up, always-available service. 
Hands-on experience with Linux (RedHat) environment, managing, troubleshooting and configuring servers will be advantageous
Working experience and knowledge with automation/configuration management using ansible. 
Working experience in scripting, Bash, Shell, and basic DevOps. 
Working experience with applications such as web/proxy servers, LDAP, database (Cassandra, PostgreSQL), Kafka, etc. 
Work effectively in a fast-paced implementation environment
Good analytical and problem solving attitude, work independently and as part of a team
Understand and willing to adapt with new technology (cloud computing, container, or configuration and automation management)

What we have to offer:

An exciting job with latest technology
Continuous training& development of soft and hard skills
A competitive salary, in line with your profile
A package of benefits including healthcare insurance
An awesome team of colleagues& regular team building activities. 
The ability to work with the world’s leading companies in technology and innovation. 
An environment where we embrace openness, transparency and grab every opportunity to have fun, while always doing what is right for our customers and partners. 

Posting Code:"
