id,title,job_url,company,company_link,location,published_at,number_of_applicants_applied,employment_duration,work_location_type,work_experience_level,company_type,company_logo,company_description,about_the_job
3782771554,Senior Back-End Engineer,https://www.linkedin.com/jobs/view/3782771554,Turing,https://www.linkedin.com/company/turingcom/life," ",3 weeks ago,3,,Remote,,"1,001-5,000 employees · IT Services and IT Consulting",https://media.licdn.com/dms/image/D4D0BAQHB79AE71th8A/company-logo_100_100/0/1688472201595/turingcom_logo?e=1712188800&v=beta&t=uetswaiWdovNMJP7hgdfWDYzXjbSme1NRN0fa3n0zxI,"Traditional recruiting wasn’t designed for today’s software-first world. The old model is simply too slow, doesn’t allow for deep vetting and takes the control and ownership out of your hands. This is why we built Turing, the world’s most deeply vetted developers and teams, matched by AI. Turing connects world-class engineers with companies to help them achieve their respective career and business goals.

Traditional recruiting is over. Welcome to the Talent Cloud.

Turing enables:
> companies to get matched to vetted remote talent at the touch of a button
> developers to achieve their elite dream career from anywhere in the world

900+ top companies, including Pepsi, Bumble, and Dell, have trusted Turing’s Talent Cloud for their engineering needs.

Recruit Developers/Engineers:
Turing combines AI and a global reach to deliver your ideal engineers tailored to your business needs. Our Talent Cloud matches you to rigorously vetted, quality remote developers.

Try Turing.com for 2 weeks risk-free at turing.com

Turing Careers:
Turing helps you get excellent remote opportunities to build a high-growth career faster.

Find high-quality remote U.S. software jobs across 15 roles and 100+ technologies.

Apply today: turing.com/jobs

—----------------------
Co-founded by @Jonathan Siddarth and @Vijay Krishnan, Turing is an AI-powered technology company disrupting the traditional recruiting model for companies seeking to engage the most deeply vetted developers and teams.

Having raised $140 million from investors, including WestBridge Capital, Foundation Capital, Stanford StartX, and execs from Google, Meta, Microsoft, and Amazon, Turing's last round was on a $4 billion valuation cap.
…
show more","A U.S.-based company that is building cutting-edge technology that can track the position of anything in real time is looking for a Senior Back-End Engineer. The engineer will be helping with developing web services that provide a highly scalable location/positioning platform driven by machine learning. The company's technology monitors the whereabouts of physical assets, drones, cars, phones, and the IoT. Candidates who are a self-starter with the ability to see things through to completion would be the ideal fit for this opportunity. The company has managed to secure $16.4mn+ during their Series A round of funding.

Job Responsibilities:

Create back-end web services using AWS by designing, coding, and working
Python code to satisfy business requirements and front-end JavaScript
Provide location management features that can grow to handle millions of users at once worldwide
Create dashboards, generate web-based reports and supply design documentation
Determine and note any bugs
Take initiative and own your job from conception to implementation
Completely enable automated system/regression testing, unit testing, and integration testing
Work in a setting that encourages personal development

Job Requirements:

Bachelor’s/Master’s degree in Engineering, Computer Science (or equivalent experience)
At least 7+ years of relevant experience as a back-end engineer
7+ years of experience developing web services
Demonstrable wealth of microservice architecture framework knowledge
Extensive knowledge of the Linux/Unix programming platform
Python development experience 
Prior programming knowledge in any other language will be seen favorably, with C/C++ and Java being the most preferred
Practical expertise with a cloud platform, ideally AWS
Vast knowledge of Amazon Web Services, including Flink, Cognito, IAM, API Gateway, IoT Core, S3, EC2, and API GW
Prior expertise in developing software for commercial deployment
Strong background in data modeling and NoSQL database administration (Dynamo, Timestream) 
Practical knowledge of Continuous Integration systems
In a startup setting, interpersonal skills and respect for others' work discipline are essential
Ability to work well in an agile team setting
Ability to tune performance, profile, and debug complicated software programs
Prior knowledge of version control tools like Git
Track record of successfully implementing web services as microservices
Nice to have some prior experience and knowledge of the Kubernetes environment
Some expertise in writing IaC code on Terraform is preferred
Prior experience with web design and development and/or software application development (web or mobile) is desirable
Excellent English communication skills, both spoken and written"
3791740189,Full Stack Engineer (Go+React),https://www.linkedin.com/jobs/view/3791740189,Dikshatek Indonesia,https://www.linkedin.com/company/dikshatek/life," ",,7,,On-site,,"501-1,000 employees",https://media.licdn.com/dms/image/D560BAQETv3fzwlc2Gg/company-logo_100_100/0/1696481727825/dikshatek_logo?e=1712188800&v=beta&t=8k3YGxtqFOXUrLClbuLWzVynoEIXZ4y5WwD81aNdBRU,Dikshatek Indonesia provides world-class IT Consultants and Solutions to Tier-1 Indonesian Businesses.,"Company Description
Dikshatek Indonesia provides world-class IT Consultants and Solutions to Tier-1 Indonesian Businesses.

Role Description
This is a contract Full Stack Engineer role in Jakarta Metropolitan Area. As a Full Stack Engineer, you will be responsible for building scalable and secure web applications. You will work in a collaborative environment with product owners, designers, and other engineers to deliver high-quality products, features, and user interfaces that meet customer needs.

Qualifications
Experience developing full-stack web applications using Go and ReactJS
Strong proficiency in front-end libraries and server-side web application frameworks
Understanding of web application architecture, RESTful APIs, and design patterns
Knowledge of database principles, data modeling, and SQL
Experience with source control and continuous integration/continuous deployment (CI/CD) processes
Ability to write clean, maintainable, and well-documented code
Bachelor’s degree or higher in Computer Science, Information Technology, or related field
Strong problem-solving and analytical skills, ability to work independently as well as collaboratively, effective communication skills, and a demonstrated ability to learn quickly
Experienced in the same position for at least 3 years"
3778358664,Senior Back-End Engineer,https://www.linkedin.com/jobs/view/3778358664,Turing,https://www.linkedin.com/company/turingcom/life," ",1 month ago,2,,Remote,,"1,001-5,000 employees · IT Services and IT Consulting",https://media.licdn.com/dms/image/D4D0BAQHB79AE71th8A/company-logo_100_100/0/1688472201595/turingcom_logo?e=1712188800&v=beta&t=uetswaiWdovNMJP7hgdfWDYzXjbSme1NRN0fa3n0zxI,"Traditional recruiting wasn’t designed for today’s software-first world. The old model is simply too slow, doesn’t allow for deep vetting and takes the control and ownership out of your hands. This is why we built Turing, the world’s most deeply vetted developers and teams, matched by AI. Turing connects world-class engineers with companies to help them achieve their respective career and business goals.

Traditional recruiting is over. Welcome to the Talent Cloud.

Turing enables:
> companies to get matched to vetted remote talent at the touch of a button
> developers to achieve their elite dream career from anywhere in the world

900+ top companies, including Pepsi, Bumble, and Dell, have trusted Turing’s Talent Cloud for their engineering needs.

Recruit Developers/Engineers:
Turing combines AI and a global reach to deliver your ideal engineers tailored to your business needs. Our Talent Cloud matches you to rigorously vetted, quality remote developers.

Try Turing.com for 2 weeks risk-free at turing.com

Turing Careers:
Turing helps you get excellent remote opportunities to build a high-growth career faster.

Find high-quality remote U.S. software jobs across 15 roles and 100+ technologies.

Apply today: turing.com/jobs

—----------------------
Co-founded by @Jonathan Siddarth and @Vijay Krishnan, Turing is an AI-powered technology company disrupting the traditional recruiting model for companies seeking to engage the most deeply vetted developers and teams.

Having raised $140 million from investors, including WestBridge Capital, Foundation Capital, Stanford StartX, and execs from Google, Meta, Microsoft, and Amazon, Turing's last round was on a $4 billion valuation cap.
…
show more","A fast-growing company that enables customers to automatically gather all of their data from different data systems and put it in one place, is looking for a Senior Back-End Engineer. The engineer will take part in code reviews to uphold a culture of high-quality code, and collaborate with and mentor junior engineers on best practices. The company is using dashboards to present this data, making room for fresh perspectives that boost your business' productivity, effectiveness, and profitability. This is an amazing opportunity for candidates to prove their worth and work in a challenging environment while juggling multiple responsibilities.

Job Responsibilities:

To find answers and pinpoint problem areas, analyze the current code, data, and processes
Work with front-end programmers to create logical and coherent code that will improve user experience
Improve web servers' performance and scalability by doing so
Inform those involved in the project on a regular basis of its progress

Job Requirements:

Bachelor’s/Master’s degree in Engineering, Computer Science (or equivalent experience)
At least 3+ years of relevant experience as a back-end engineer
Prolific experience working with Angular, C#, and Ruby on Rails
Some understanding of JavaScript and PHP is desirable
Familiarity with Swift for iOS is nice to have
Excellent English communication skills, both spoken and written"
3773512050,Senior Backend Engineer,https://www.linkedin.com/jobs/view/3773512050,SQE (S-Quantum Engine),https://www.linkedin.com/company/journeywithsqe/life," "," ",279,,Hybrid,,"5,001-10,000 employees · Financial Services",https://media.licdn.com/dms/image/C560BAQFybnDwDr7gtA/company-logo_100_100/0/1678280269520/journeywithsqe_logo?e=1712188800&v=beta&t=bljJQF8g5bRcFt6O0Q8sImtykZDrnaLHDRLBLoHJgLI,"The S-Quantum Engine is Sinarmas Financial Services' Digital Factory : we are focused on transforming one of Indonesia's largest financial services groups to match the increasingly digital demands today's financial services sector.

Birds eye view of digital initiatives and developments throughout the group of Sinarmas Financial Services companies.

We want to create an environment where the best digital minds can chose what they want to digitize and not worry about anything else.

Our SQErs are seasoned leaders from global tech unicorns, top-tier consulting, and prominent financial service providers.
…
show more","The S-Quantum Engine is Sinarmas Financial Services' Digital Factory - focused on transforming one of Indonesia's largest financial services groups to match the increasingly digital demands today's financial services sector.
This position reports to the Head of Engineering of the S-Quantum Engine. The Strategy and Digital division is responsible for identifying, managing, and executing digital related initiatives for a collection of over fifty operating companies.


Specifically, the division shall:
Identify, seed and grow digital-first businesses for Sinarmas Financial Services companies
Consolidate and transform digital channels of existing portfolio of financial services products
Cultivate relevant companies and partners that accelerates the group’s overall agenda
Establish organization wide next generation digital resources (infrastructure and talent)
Set the agenda for the group’s transformation to a digital and data first company



What You Need to Do
The Senior Back-End Engineers will drive the work of software development, with focus on the server side-side of the applications. This position requires large-scale systems awareness, technical skill, planning, great communication skill, experience with software development across various platform.
You are expected to:
Work closely with Product, Design and Frontend teams to gather requirements, design and build new products, platforms and features
Contribute to every part of our product pipeline from inception to delivery
Write clean, reusable, maintainable code with a good code coverage
Drive best practices and engineering excellence.
Act as the technical subject matter expert to mentor fellow engineers and demonstrate technical expertise.
Take initiative and implement processes to create efficiency for your team and yourself
Excellent communication skills: Demonstrated ability to explain complex technical issues to both technical and non-technical audiences
A team-oriented approach, with a willingness to receive feedback and iterate on them

What You Need to Have
5+ Years of experience in software development
Skill sets needed: programming (Java/GoLang), databases (MySQL/PostgreSQL/Cassandra)
Experience with AWS or GCP is a must
Excellent system design skills to build scalable and maintainable systems
Good at problem solving and troubleshooting production issues
Scalable coding practices including peer code reviews, unit testing, and agile development
Practical knowledge of modern development principles and best practices (OOP, design patterns, unit testing, CI/CD)"
3778348742,Full-Stack Cloud Developer,https://www.linkedin.com/jobs/view/3778348742,Turing,https://www.linkedin.com/company/turingcom/life," ",1 month ago,0,,Remote,,"1,001-5,000 employees · IT Services and IT Consulting",https://media.licdn.com/dms/image/D4D0BAQHB79AE71th8A/company-logo_100_100/0/1688472201595/turingcom_logo?e=1712188800&v=beta&t=uetswaiWdovNMJP7hgdfWDYzXjbSme1NRN0fa3n0zxI,"Traditional recruiting wasn’t designed for today’s software-first world. The old model is simply too slow, doesn’t allow for deep vetting and takes the control and ownership out of your hands. This is why we built Turing, the world’s most deeply vetted developers and teams, matched by AI. Turing connects world-class engineers with companies to help them achieve their respective career and business goals.

Traditional recruiting is over. Welcome to the Talent Cloud.

Turing enables:
> companies to get matched to vetted remote talent at the touch of a button
> developers to achieve their elite dream career from anywhere in the world

900+ top companies, including Pepsi, Bumble, and Dell, have trusted Turing’s Talent Cloud for their engineering needs.

Recruit Developers/Engineers:
Turing combines AI and a global reach to deliver your ideal engineers tailored to your business needs. Our Talent Cloud matches you to rigorously vetted, quality remote developers.

Try Turing.com for 2 weeks risk-free at turing.com

Turing Careers:
Turing helps you get excellent remote opportunities to build a high-growth career faster.

Find high-quality remote U.S. software jobs across 15 roles and 100+ technologies.

Apply today: turing.com/jobs

—----------------------
Co-founded by @Jonathan Siddarth and @Vijay Krishnan, Turing is an AI-powered technology company disrupting the traditional recruiting model for companies seeking to engage the most deeply vetted developers and teams.

Having raised $140 million from investors, including WestBridge Capital, Foundation Capital, Stanford StartX, and execs from Google, Meta, Microsoft, and Amazon, Turing's last round was on a $4 billion valuation cap.
…
show more","A fast-growing company that aims to create a top-tier AI venture investing engine that can be personalized to meet the client's needs, is looking for a Full-Stack Cloud Developer. The developer will be working with a diverse and cross-functional team to develop a multi-user chatbot. The company discloses investment insights and related businesses while offering an extensive investment portfolio at a look. This is an amazing opportunity for candidates who are passionate about working with cutting-edge technologies while developing innovative solutions.

Job Responsibilities:

Be willing to redevelop utilizing a different tech stack if necessary
Finish the working MVP to help the organization present it to venture capitalists and get investment
Promote the last phase of the innovative platform
Assist in resolving the present bugs and enhancing the underperforming chatbot 
Examine the product's architecture and, if required, redesign it
Easily combine GCP and Azure cloud services
Use Pinecone for tasks involving vector databases
Use OpenAI APIs to access AI features

Job Requirements:

Bachelor’s/Master’s degree in Engineering, Computer Science (or equivalent experience)
At least 6+ years of relevant experience working on client-facing products
Prolific experience working with Python, Fast API and Langchain
Ability to build simple frontends following the design/specifications
Demonstrable experience working with Azure and OpenAI API
Must possess an aptitude for root-cause investigation in many tech stacks
Some prior knowledge of GitHub Actions and Linux-based VM administration is desirable 
Proficiency in debugging is preferred
Familiarity with Google Cloud Platform (GCP) and TypeScript is desirable
Excellent spoken and written English communication skills"
3695207159,Java Developer,https://www.linkedin.com/jobs/view/3695207159,PT. Adi Data Informatika,https://www.linkedin.com/company/pt--adi-data-informatika/life," ",4 months ago,44,,On-site,,201-500 employees · IT Services and IT Consulting,https://media.licdn.com/dms/image/C510BAQGMM-f0Q2NGnw/company-logo_100_100/0/1631334168552?e=1712188800&v=beta&t=15AIQJKvJB_zIMXBE4EMGG5Xtmxk4ii_xudeAPbNRIY,"PT. Adi Data Informatika or AdiData is an IT company focus in providing total IT Business Solutions, IT Infrastructures and IT Services to our customers. Our team has a lot of experiences in delivering the best IT Business Solutions, IT Infrastructures and IT Services with the latest trend, latest products/technologies and high quality of services.

We have been serving and supporting our customers in Financial Services Industry (banking, multi-finance, stock exchange and securities/brokerage), Manufacturing, Plantation and others. As an one stop provider, our team provides end to end IT Business Solutions, IT Infrastructures and IT Services to our customers.

In every project delivery and implementation process, our team with strong commitment to support our customers from the project initiation until the production stage with full of care and sincere attitude. This is to make sure the project will be totally meeting the customer objectives. As an IT provider, our philosophy is being the technology partner for our customers rather than just a supplier.
…
show more","Design, develop, and implement based on document gathered system specifications
To take part in software and architectural development activities
Conduct software analysis, programming, testing, and debugging
Identifying production and non-production application issues
Bug Fixing and make sure system running well

Minimum Qualifications

Bachelor Degree in Computer Engineering/ Computer Science/ Information Technology or equivalent
At least 1-3 years of experience in Java Programming
Strong capability in application (Java) programming, experiences with other object oriented languages are advantageous
Java framework : Springboot, Hibernate.
Familiar in end-to-end software development life cycle activities (planning and requirement gathering, analysis, design, coding, testing, documentation deployment)
Possess a strong logical & analytical skill in developing software"
3783660477,Fullstack Developer,https://www.linkedin.com/jobs/view/3783660477,PT Sofco Graha,https://www.linkedin.com/company/pt-sofco-graha/life," ",3 weeks ago,5,,"IDR6,000,000/yr - IDR9,000,000/yr",,51-200 employees · Software Development,https://media.licdn.com/dms/image/C560BAQGCfRjA-hVb4g/company-logo_100_100/0/1677473301278/pt_sofco_graha_logo?e=1712188800&v=beta&t=IDrVaNUfgYkSFIwN8QSuIarMhw3YdutjZnFiblgjPQk,"PT Sofco Graha didirikan pada tahun 1983, dengan visi untuk membantu perusahaan-perusahaan di Indonesia masuk ke Era Komputerisasi dalam hal penerapan Komputerisasi Akuntansi di perusahaan.Pada tahun 2012, sebagai salah satu klien terbesar, PT Konimex ikut ambil bagian dalam saham PT Sofco Graha.

Produk-produk yang telah kami hasilkan meliputi ERP (Enterprise Resources Planning) untuk Perusahaan Manufacturing dan Consumer Goods Distribution, HRIS (Human Resource Information System).
…
show more","Job Summary

Ensure the completion of quality product/module/new “Package” development work in a timely manner while saving efficiency.

Principal Accountabilities

Working alongside Tech & Product team to develop engaging & responsive user interfaces with HTML, CSS and modern JavaScript frameworks
Develop performance oriented front end & back end binding
Work with back-end developers to design and interface REST APIs
Perform code reviews and basic troubleshooting
Build reusable code and libraries for future use

Minimum Qualifications

COMPETENCY REQUIREMENT

Knowledge and experience with front-end framework (Angular)
Experience in Java, Spring Boot Framework, PostgreSQL Database, & Rest API
Good understanding of layout and basic user interface design principles.
Experience doing writing unit tests to provide sufficient testing coverage is a plus
Strong analytical and planning skills
Good communication
Excellent problem-solving skills
Have experience in IT Company especially in HRIS is a Plus

QUALIFICATION REQUIREMENT

Minimum 2 Year experience Experience in full stack developer, whether in-house, for an agency, or as freelancers.
Bachelor Degree with Computer Science, Information Technology or equivalent
Managing multiple tasks and timeline in a fast-pace environment
Having Experience as Team Leader is a Plus
Humility and excellent collaborative spirit. We are all here to learn and grow together as a team."
