id,title,job_url,company,company_link,location,published_at,number_of_applicants_applied,employment_duration,work_location_type,work_experience_level,company_type,company_logo,company_description,about_the_job
3901997854,Java Developer (Technical Consultant),https://www.linkedin.com/jobs/view/3901997854,Verint,https://www.linkedin.com/company/verint/life,Jakarta Metropolitan Area,,36,,,,,https://media.licdn.com/dms/image/D4E0BAQGnCwhFldNSjw/company-logo_100_100/0/1689013379807/verint_logo?e=1721865600&v=beta&t=NQ_ufbRjsIgjljpF9yde3HgdhckYn7Fkp1tVj5GT35U,"Verint® helps the world’s most iconic brands build enduring customer relationships by connecting work, data, and experiences across the enterprise. With this approach, brands can navigate and thrive as they adapt to the future of work, eliminate the inefficiencies created by organizational and data silos, and consistently deliver differentiated experiences at scale across every interaction.

Our solutions help brands close the gap created when they lack the resources required to deliver experiences that fulfill customer expectations. Closing this Engagement Capacity Gap™ helps them build lasting relationships with customers and drive real business results.

The Verint Customer Engagement Platform draws on the latest advancements in artificial intelligence and analytics, open integration, and the science of customer engagement to meet ever-increasing, ever-shifting consumer interactions and demands. We help our customers to drive even greater value from their technology investments by working closely with a broad ecosystem of solutions and partners.

With Verint, brands can finally unlock the potential of customer engagement across every area of the business to deliver consistently differentiated experiences to their customers and employees, and do so at scale to realize tangible business results.

Global Presence
• Headquartered in Melville, N.Y., with 40+ offices worldwide
• Powered by 4,500 dedicated professionals and a global partner network

Closing the Engagement Capacity Gap

Brands today are challenged to deliver quality customer experiences across dozens of engagement channels, hundreds of customer journeys, and millions of interactions – all with the same team and resources. This results in an Engagement Capacity Gap.

Verint solutions are uniquely geared toward closing this gap.

More than 10,000 organizations in over 175 countries—including more than 85 percent of the Fortune 100 — rely on Verint.


To learn more, visit: www.verint.com","Experience

Bachelor's degree in Computer Science or equivalent
Min. 3 years hand-on experience with Java Spring Boot Framework and API for integration
Good ability in English (Oral & Written)
For Indonesian Citizen Only (WNI)

Responsibility
  Participate in analysis & design sessions often involving architect group and product management team
Develop high quality, robust and scalable API and adaptors to external system within agreed timescale
Communicating status, issues, and risk to technical leader"
3790100167,Site Reliability Engineer (Marketplace) - Sea Labs,https://www.linkedin.com/jobs/view/3790100167,Sea,https://www.linkedin.com/company/seagrp/life,"Jakarta, Indonesia",,0,,,,,https://media.licdn.com/dms/image/C560BAQEAIrDkWI_p6g/company-logo_100_100/0/1631341864429?e=1721865600&v=beta&t=guW6dUGwOUqas_A4h9KWZAJMcu79JIKdPb5HK9Mhrn8,"Sea is the leading consumer internet company in Southeast Asia and Taiwan. Our mission is to better the lives of the consumers and small businesses of our region with technology.

Our businesses include:

Shopee, our region’s largest and most popular e-commerce platform. Launched in 2015, Shopee was designed to be mobile-first and highly social, offering buyers and sellers a trusted and enjoyable shopping experience. In 2018, Shopee recorded over 603 million orders, and GMV of $10.3 billion. Shopee was also the most downloaded shopping app in Southeast Asia and in Taiwan.

Garena, a global leading games company. Garena is the developer of Free Fire, the global smash hit mobile battle royale game with over 450 million registered users and 50 million peak daily active users as of May 2019, making it one of the most popular games in the world. Garena is also the largest games publisher in the region, bringing AAA mobile and PC titles such as Arena of Valor, League of Legends, and Speed Drifters to gamers in Southeast Asia. Garena also leads the growth of esports in our region. Its annual flagship event, Garena World, is the largest and most influential esports event in Southeast Asia.

SeaMoney, a leading digital payments and financial services provider in Southeast Asia. SeaMoney’s offerings include mobile wallet services, under the AirPay and ShopeePay brands, which provide users with easy access to digital payment services.

Sea is headquartered in Singapore, and listed on the New York Stock Exchange under the ticker symbol ‘SE’. Our IPO in October 2017 was the largest US public listing ever by a Southeast Asian technology company.","Job Description:

Deep dive into development lines, learn and understand the mechanism of every application component, and promote product scalability, stability, and performance
Set up, manage, and maintain Shopee product/middleware/big-data applications and services
Perform regular and ad-hoc server-side deployments, make improvements of the performance, and troubleshoot
Design and develop automated technical operation platform
Manage Capacity and Resource
Responsible for the full-chain stress test to enhance the performance and remove redundancy of applications
Prepare routine operation documentation


Requirements:

Bachelor's degree or above in Computer Science, Engineering, Information Systems or related fields
More than 2 years of relevant experience (candidates with no working experience are welcomed to apply)
Extensive and hands-on knowledge with Linux operating systems (Ubuntu, CentOS, etc.)
Highly familiar with Computer Network (TCP/IP, DNS, etc.), Computer Organisations, and OS
Hands-on experience with at least one of the programming languages: Bash, Python, Go
Strong analytical and problem-solving skills with the ability to thrive in a dynamic work environment
Passionate and possess a strong sense of responsibility
Fast learning ability and a good team player
Agile and detail-oriented


Skills below are optional but preferred:

Experience with automation tools like Ansible, SaltStack
Experience with monitoring tools like Prometheus, Zabbix, Grafana etc 
Experience with load balancing tools like LVS, Nginx, Openresty or HAProxy 
Experience with container technology such as Docker, Kubernetes
Experience with High Availability system design and Server Deployment Process
Experience with SRE
Experience with Ops Paas platform or Ops automation platform (ie:CMDB)"
3869494701,Software Developer (Project Based),https://www.linkedin.com/jobs/view/3869494701,Lintasarta,https://www.linkedin.com/company/lintasarta/life,"Jakarta, Indonesia",,100,,,,,https://media.licdn.com/dms/image/C4D0BAQF3SGsOQnRjVg/company-logo_100_100/0/1630536135163/pt_aplikanusa_lintasarta_logo?e=1721865600&v=beta&t=Iz4qjPP9Lu4apApgQ_gvbkRGmkazKo25ncsPDCmwOMw,"Lintasarta is an Information and Communication Technology (ICT) total solutions company founded in 1988. We have enabled companies to grow beyond their capabilities regarding digital transformation. For over three decades, we have become a pioneer in many services for all industry segments, including finance, resources, government, manufacturing, services, trading/distribution, etc.

We are proud to serve more than 2.400 corporate clients and we will continue evolving to keep delivering services and solutions in each industry. We are supported by certified experts and local support that encourage our growth to enhance businesses and government performance in accelerating digital transformation.

The challenge upon us is unforeseeable, but our commitment to bring connectivity and empower people and the nation remains steady. Lintasarta #EmpoweringYourFuture","Job Qualification:
Have experience min. 3 years in build development system, design, analyst
Have experience with stack such as Java
Have experience using Spring, Springcloud, SpringBoot, SpringMVC for framework
Have experience using mysql\oracle for databases
Have in-depth experience in using and optimizing various open source for Backend
Have good knowledge about animation for front-end
Placement: DKI Jakarta"
3889717718,Software Engineer (Backend) - Intern,https://www.linkedin.com/jobs/view/3889717718,Peakflo (YC W22),https://www.linkedin.com/company/peakflo/life,Indonesia,,0,,,,,https://media.licdn.com/dms/image/D4D0BAQFRxgQs49c2Dg/company-logo_100_100/0/1704179942629/peakflo_logo?e=1721865600&v=beta&t=rbGNRJZSeuco9Ciw46iyZ-YEQjukwRLBIe_2q7FqsdI,"Peakflo with its simple API and one-click ERP integrations, allows businesses to streamline their invoice-to-cash and procure-to-pay processes. 100+ finance teams, from scale-ups to enterprises, use Peakflo each to:

✅ Save 2000 man-hours/month on finance ops
✅ Get paid faster on customer invoices by 15-25 days
✅ Cut vendor bill payment time by 50%
✅ Automate three-way matching","Peakflo is a B2B Fintech SaaS startup part of YCombinator W22, that just raised $4.1M in seed funding and was picked by Techcrunch as their top 10 favorites out of a cohort of 400 and also in a TechCrunch exclusive

🚀 Who We Are And What We’re Building

Peakflo is a 2021 founded, Singapore headquartered B2B Fintech SaaS startup

Finance operations at any high-growth SMB or startup is plagued with resource-intensive customer collections and vendor payment processes. Teams spend hundreds of hours in manual processes and thousands of dollars on transaction fees each month

Peakflo has 2 key solutions: one is an Accounts Receivables Automation SaaS and the other is an Accounts Payable Automation SaaS, both targeted at startups and SMEs

Peakflo With Its Simple API And One-click Accounting Software Integrations, Allows Businesses To Streamline Their Customer Collections And Vendor Payments. More Than 100 Companies, Ranging From Early-stage Startups To Unicorns In SE Asia, Use Peakflo Each Week To

✅Save 100 hours/month on finance ops ⏳

✅Get paid faster on customer invoices by 10-20 days 📈

✅Streamline vendor payments and save 50-90% on fees 💰

⚙️ Engineering at Peakflo

We are looking for quick-thinking, problem-solving frontend engineers to build the next generation of fintech products. Our SaaS product is built using typescript, next.js, react.js and wordpress.

You should apply if you are interested in pixel-perfection and frontends; if you are looking to join a high-growth high-pace startup with great engineering culture; if you want to work in a passionate high-skilled team.

💪 What you’ll do

 Work directly with the CTO & Founder to help shape our product and culture. 
 Design and build new features, simplify existing services, and scale our systems as we rapidly grow and evolve. 
 Build beautiful pixel perfect frontends. 
 Write sustainable, testable, high-quality, high-performance code. 
 Write scalable, observable, and fault-tolerant features. 
 Work with our technology stack: Typescript, firebase, GCP, cypress, jest, github, github actions. 
 Collaborate with teammates through planning, pair programming, code review, and testing. 
 Partner with members of a cross-functional team and other stakeholders to contribute to setting the direction of our product: learn about our business problems, explore solutions, weigh design tradeoffs, write effective user stories, and prioritise them to deliver maximum value in a sustainable, incremental fashion. 

🕵️‍♀️ Who we’re looking for

 You are excited about building B2B fintech applications
 You are interested in building complex integrations with 3rd party finance solutions. 
 You are excited about ensuring that all of our systems—software and human—scale smoothly. 
 You work transparently and collaboratively within a distributed team. 

💻 What We’re Looking For

 Have experience with Typescript, node.js
 CS education
 You enthusiastically approach everything from backend system architecture and API design to HTML/CSS with the same level of respect and intention. You don’t need to be an expert in everything; [T-shaped](https://en.wikipedia.org/wiki/T-shaped_skills) folks with an emphasis on frontend skills are ideal for this role. 
 You write code that’s easily readable, testable, and maintainable, with an eye towards baking observability in from the start. 

➕ We’re Particularly Interested In People Who

 Hands-on experience with async backend jobs
 Strive for continuous learning and improvement for themselves and their teams. 
 Passionate about sharing knowledge
 Favor regular, incremental delivery over perfection and have experience balancing high quality with incremental delivery. 
 Brings strong communication and teamwork skills. 

Benefits

🏡 Remote - We are building a remote friendly culture centered around trust and meritocracy"
3879286801,Cloud Infrastructure Engineer,https://www.linkedin.com/jobs/view/3879286801,DKATALIS,https://www.linkedin.com/company/dkatalis/life,"Jakarta, Indonesia",,0,,,,,https://media.licdn.com/dms/image/C4E0BAQEQPE6kBmqrzA/company-logo_100_100/0/1630627927496/dkatalis_logo?e=1721865600&v=beta&t=5Pe9S2uOg-PSzXqe8_hQXCXnAlR7UQCj4lgpLWzkTPE,"DKatalis is a technology company aiming to co-create scalable digital solutions with customers and ecosystem partners. Founded in 2019, DKatalis is collaborating from all around the world, with hubs operating in Jakarta, Singapore and India.

We have created the Jago App to solve financial literacy, AMAAN App to empower women entrepreneurs, and People Xperience App to empower organizations to adapt with rapid changes.","About DKatalis
DKatalis is a financial technology company with multiple offices in the APAC region. In our quest to build a better financial world, one of our key goals is to create an ecosystem linked financial services business.
DKatalis is built and backed by experienced and successful entrepreneurs, bankers, and investors in Singapore and Indonesia who have more than 30 years of financial domain experience and are from top-tier schools like Stanford, Cambridge London Business School, JNU with more than 30 years of building financial services/banking experience from Bank BTPN, Danamon, Citibank, McKinsey & Co, Northstar, Farallon Capital, and HSBC.
We’re looking for a Senior Cloud Infrastructure Engineer to join our team and help build a stable and scale our infrastructure on Google Cloud Platform. If you’re looking to be a part of a team who tackle real-world problems, DKatalis might just be the place for you! Work alongside world-class talents and join us as we use technology to make a change in the financial world.
Cloud Infrastructure at DKatalis:
The Cloud Infrastructure Team at Dakalis is a cross cutting engineering team with a mission to grow, support and deliver an agile, secure and scalable cloud infrastructure that powers Bank Jago’s digital banking platform.
Embracing and adopting modern Cloud Native and Infrastructure as Code as fore front practices, scale up the management and simplification of a complex cloud infrastructure with the goal of scaling a platform that is experiencing rapid growth in the millions of transactions and customers.
Technologies We Use:
Cloud Infra: Google Cloud, Kubernetes, Docker
Devops: Gitlab, Terraform, Ansible, Sonarqube, Sonatype Nexus, Vault
Datastore and Service Bus: Redis, Mongo, Kafka
Monitoring: Dynatrace, Prometheus, Grafana, OpenSearch, GCP Monitoring, Pagerduty
Role and Responsibilities:
Possess deep knowledge and understanding of Kubernetes and Cloud infrastructure platforms such as GCP and AWS
5+ years of experience managing technical projects within infrastructure and cloud domains.
Experience automating infrastructure provisioning, using continuous integration/delivery tools
Experience in application containerization and deploying container orchestration technologies such as Google Kubernetes Engine (GKE).
Ability to balance doing things right with fixing things quickly. Flexible and pragmatic, while working towards improving the long-term health of the system.
You have a strong systems experience and have an analytical approach to identifying problem components based on data points.
Be passionate about security compliance, zero downtime infrastructure and highly scalable environments
Be willing to coach, mentor and grow a team of talented cloud infrastructure engineers
Have good communication skills and be comfortable working with product owners and domain experts to understand requirements
Oversee end-to-end Platform architecture and roadmap focused on best-practice approaches to design, security, testing, and performance
Comfortable working cross-functionally to ensure success of the infrastructure and operations. You will be closely collaborating with other engineering and product teams to ensure that expected system behavior is understood and monitoring exists to detect anomalies.
Lead in-depth technical and data analysis to gauge service trends and drive improvements.
You are comfortable with on-call responsibility and are able to manage a crisis working with the broader team, communicating progress and challenges during the crisis.
Participate in continuous improvement and execution of quality and timely major incident root cause analysis and blameless post-mortem activities to ensure we take action to avoid similar problems in the future.
Requirements:
You are either a Sysadmin or Infrastructure engineer ideally strong in Linux systems, networking, monitoring and automation; preferably have experience working on distributed systems at scale.
At least 5 years of hands-on-experience in architecting, designing, developing and implementing cloud solutions on Google Cloud Platform (GCE, GKE, GAE, GCS, Cloud SQL, VPC, Resource Manager, StackDriver, Cloud CDN, Cloud IAM)
Scripting - Terraform, Bash, Shell, Python (bonus)
Configuration Management - Chef, Puppet, Ansible etc
Experience with - Docker, Kubernetes, Gitlab, ELK
Exposure to relational, no-sql databases and caching solutions - Mongodb, Redis
Degree in Computer Science, Engineering, or equivalent experience.
Capable of working in a complex, fast paced environment and ability to maintain calm during stressful situations"
3841007006,Software Engineer - Backend (Hybrid),https://www.linkedin.com/jobs/view/3841007006,Flip,https://www.linkedin.com/company/flip.id/life,Jakarta Metropolitan Area,,0,,,,,https://media.licdn.com/dms/image/C4E0BAQH_rOf9zXyMDQ/company-logo_100_100/0/1631306719158?e=1721865600&v=beta&t=2httQmCqmoLsKvtMr1EUqxZ6ggvdjO5ZXmpujOECkqk,"We started in 2015 with a belief that fairness should be one thing that can be experienced by everyone. With this thought we created a free interbank transfer service which anyone could use.

Hereinafter, we build more and more to help Indonesia move money, be it for individuals and businesses. We continue to innovate in providing fair financial solutions so that everyone everywhere can do various kinds of money transactions with far better experience, seamlessly, swiftly, and securely.

To build better and better experiences, we’ll need enormous support from determined talent like you. Join our hyper growing team at https://flip.id/career

===================

To learn more about Flip, visit our website: https://flip.id

Connect with us on our social media:
Instagram: https://instagram/flip_id
Twitter: https://www.twitter.com/flip_id
Facebook: https://www.facebook.com/HaiFlip","We are looking for Software Engineer (Backend). As a software engineer, you’ll be the brain behind crafting, developing, testing, going live, and maintaining the system. You are passionate in understanding the business context for features built to drive better customer experience and adoption.

About Flip

Rafi, Luqman, and Anjar, who were college friends in Universitas Indonesia, started Flip as a project in 2015 to transfer payments to each other at a fraction of what banks would charge them. They are pioneers in the Indonesian market, with their technology now helping millions of Indonesians, both individuals and businesses, carry out bank-to-bank money transfers through a reliable and seamless app.

After seven years of operations, Flip has helped Indonesians transfer money worth several trillions of rupiah and has received double-digit funding from respectable investors such as Sequoia India, Insight Partner, and Insignia. Flip’s ultimate mission is to give Indonesians access to one of the most progressive and fairest financial services in the world.

At Flip, we always strive to provide the fairest place for you to work, learn, and grow with talented and fun people in various opportunities to advance your career and get fair rewards. We believe that we have to treat employees, customers, and all stakeholders fairly and respectfully. Fair treatment for employees means we establish clear goals, facilitate our employees to achieve them, and value their contribution to the company with equitable benefits.

About The Role

As a software engineer, you’ll be the brain behind crafting, developing, testing, going live, and maintaining the system. You are passionate in understanding the business context for features built to drive better customer experience and adoption.

What You'll Do

Work cross-functionally with the Product, Design, Operations, and Backend teams across the squads to ship world-class products and features.
Write code that's clear, concise, performant, tested, and easily understood by others.
Partner with the product management team to execute the feature roadmap.
Work with the overall backend teams to execute the engineering roadmap.
Help debug production issues across services and levels of the stack.


What You'll Need

Have a solid background in common programming problems and solutions.
Knowledge and experience in PHP or Go, Yii2 experience is a plus.
Experience in working with large data set and/or high concurrency system is a plus.
Solid understanding of algorithms, algorithmic complexities, OOP, design patterns, and clean code.
Ability to plan, prioritize, estimate, and execute a task with a good degree of predictability.
Ability to scope, review and refine user stories and/or tasks for technical completeness and to alleviate dependency risk.


P.S. if you experience problems when submitting your CV through this platform, you can send it directly to career@flip.id"
3908434435,Dotnet Developer,https://www.linkedin.com/jobs/view/3908434435,PT Berca Hardayaperkasa,https://www.linkedin.com/company/berca-hardayaperkasa/life,"Jakarta, Indonesia",,34,,,,,https://media.licdn.com/dms/image/C510BAQH0tl0DagpOig/company-logo_100_100/0/1630614854525/berca_hardayaperkasa_logo?e=1721865600&v=beta&t=DLeveruBPD6qWmyw4seX7htTcpxwTTPq8lTz02WBCP0,"Since its establishment in 1990, PT. Berca Hardayaperkasa (BHp) has been one of the leading providers of Enterprise Information & Communication Technology (IT), Communication (Telecommunication Measurement & Infrastructure / TMI & Network Service Provider / NSP) and Test & Measurement (T&M) solutions in Indonesia. BHp is also supported by other principals and has continued to excel in providing efficient ICT solutions, from hardware system to total solutions and services, to over 500 corporations of various industry disciplines nationwide.



In the last 5 years BHp has registered extraordinary growth with the establishment of strategic business units Berca Consulting Service, Berca Cakra Teknologi (with its own computer brand Relion), Berca Sistem Integrator, Berca Consulting Services, Berca TMI (Telecommunication Measurement & Infrastructure) and Berca Jasatel (Integrated Services of Telematic).

Based in Jakarta with representative offices in Bandung, Surabaya, Balikpapan, Batam, Yogyakarta, Riau and will open soon at Bali & Solo, BHp's core business activities are to provide computing system, IT consulting services, communication technology & services, and T&M products and services to corporations.

Today BHp is employing more than 500 ICT Professionals, satisfying the increasingly complex demands of diverse industries, which include manufacturing, retail & distribution, communication, financial service, earth resources, utilities and government related sectors.

PT. Berca Hardayaperkasa,
Helps you initiate, create and facilitate your changes required, Not only in technology way!! Learn and discover what we mean by 'Beyond Technology!!'
…
show more","Job Description: 
• Create and develop web and desktop applications according to external and internal needs
• Make Technical Documentation after Go Live
• Perform testing and debugging to ensure the integrity and reliability of the system or application
• Maintenance database, web server
• Mostly coordinate with clients about their needs (Client Oriented) with both Bahasa Indonesia and English
 Job Qualification:
• At least 1 year experience in designing and developing application
• Having good knowledge in C#, .Net framework, Laravel/Codeigniter, React Native/Flutter, ReactJS 
• Having good technical knowledge in ERP (Peoplesoft/SAP/Microsoft Dynamic) is a point plus
• Fast learner, able to work in team & independently
• Having good communication and strong analytical skills
• Willing to travel and mobile if needed"
