id,title,job_url,company,company_link,location,published_at,number_of_applicants_applied,employment_duration,work_location_type,work_experience_level,company_type,company_logo,company_description,about_the_job
3812317684,Software Engineer,https://www.linkedin.com/jobs/view/3812317684,PLS,https://www.linkedin.com/company/pls-asia-software/life,Indonesia,,0,,,,,https://media.licdn.com/dms/image/D560BAQHT9QVNOaOgDA/company-logo_100_100/0/1697471294252?e=1721865600&v=beta&t=Go4upExrPPFgh7b7oLbKFeLe_otzB7Rlsi84bHnoNpk,,"PLS Pte Ltd is a dynamic company committed to delivering innovative solutions across diverse industries. Our vision is to lead globally by creating impactful solutions, while our mission is to provide exceptional value through expertise, collaboration, and creativity. We offer various services, including custom software solutions, cutting-edge technology, consulting, project management, and quality assurance. Our strengths lie in innovation, expertise, customer-centricity, and integrity. Join us to transform challenges into opportunities and drive growth together.

The Role

You Will Be Responsible For

 Software Development: Design, develop, and maintain robust software solutions using C# API and JSON technologies.
 Remote Collaboration: Thrive in a remote work environment, actively participating in virtual meetings, collaborating with cross-functional teams, and demonstrating strong communication skills.
 Documentation: Create and maintain comprehensive technical documentation for software applications, ensuring clarity and accessibility.
 Problem-Solving: Analyze user requirements and provide effective, scalable solutions to meet project needs.
 Code Quality: Conduct regular code reviews to ensure high-quality, efficient, and maintainable code.

Ideal Profile

 Proven track record in software development with a minimum of 2 years of hands-on experience.
 A degree in Computer Science, Software Engineering, or a related field.
 Strong proficiency in C# API development and JSON. Experience with additional technologies is a plus.
 Ability to excel in a remote work environment, demonstrating self-motivation and effective time management.
 A proactive and analytical mindset with a focus on delivering effective solutions.
 Excellent verbal and written communication skills to facilitate collaboration in a virtual setting.
 Ability to work collaboratively within a team, fostering a positive and inclusive work culture.

What's on Offer?"
3714146391,Lead Software Engineer (Bangkok based – Relocation provided),https://www.linkedin.com/jobs/view/3714146391,Agoda,https://www.linkedin.com/company/agoda/life,"Bali, Indonesia",,0,,,,,https://media.licdn.com/dms/image/C4D0BAQGBa_7QNZNwpw/company-logo_100_100/0/1656643826660/agoda_logo?e=1721865600&v=beta&t=V_9iYXOC4Z9RgfBtEEdqYoha7IVeGlPKyJA8fk129to,"Agoda is transforming travel for millions of customers across the globe.

Headquartered in Asia, Agoda is one of the world’s largest online travel platforms. Founded in 2005 and now part of Booking Holdings (Nasdaq:BKNG), Agoda has a network of over 2,900,000 properties worldwide. Our web and mobile products provide a first-rate reservation service in 38 languages that uniquely combines local knowledge and local connections to provide the best deals for business and leisure travelers.

Agoda employs over 7,000 professionals from 90 nationalities in locations around the globe. In every department – from engineering to customer experience – we provide an environment rich with creativity, collaboration, and experimentation, and the tools to work faster and smarter.

At Agoda, we believe our people are our strength. We work hard and have fun, and we choose people who are dedicated to making things great.

For properties seeking partnership with Agoda, visit https://connect.agoda.com","About Agoda

Agoda is an online travel booking platform for accommodations, flights, and more. We build and deploy cutting-edge technology that connects travelers with more than 3.6 million accommodations globally. Based in Asia and part of Booking Holdings, our 6,000+ employees representing 90+ nationalities foster a work environment rich in diversity, creativity, and collaboration. We innovate through a culture of experimentation and ownership, enhancing the ability for our customers to experience the world.

 Our Purpose –  Bridging the World Through Travel 

We believe travel allows people to enjoy, learn and experience more of the amazing world we live in. It brings individuals and cultures closer together, fostering empathy, understanding and happiness.

We are a skillful, driven and diverse team from across the globe, united by a passion to make an impact. Harnessing our innovative technologies and strong partnerships, we aim to make travel easy and rewarding for everyone.

Get to Know our Team:

In Agoda’s Back End Engineering department, we build the scalable, fault-tolerant systems and APIs that host our core business logic. Our systems cover all major areas of our business: inventory and pricing, product information, customer data, communications, partner data, booking systems, payments, and more. These mission-critical systems change frequently with dozens of releases per day, so we must employ state-of-the-art CI/CD and testing techniques in order to make sure everything works without any downtime. We also ensure that our systems are self-healing, responding gracefully to extreme loads or unexpected input. In order to accomplish this, we use state-of-the-art languages like Scala and Go, data technologies like Kafka and Aerospike, and agile development practices. Most importantly though, we hire great people from all around the world and empower them to be successful. Whether it’s building new projects like Flights and Packages or reimagining our existing business, you’ll make a big impact as part of the Back End Engineering team.

The Opportunity:

Agoda Platform team is looking for developers to work on mission critical systems that deals with the designing and development of a system that serves millions of users a day.

What you’ll Need to Succeed:

8+ years’ experience under your belt developing performance-critical applications that run in a production environment using Scala and Java
A minimum of one year of experience with Scala
You have RDBMS knowledge (SQL Server, Oracle, MySql or other)
You have a Good command of the English language
You are passionate about the craft of software development and constantly work to improve your knowledge and skills

It’s Great if you have:

Knowledge in one or more of the following: NoSQL (especially, but not only Cassandra), Queueing system experience (Kafka, RabbitMQ, ActiveMQ, MSMQ), Play framework, Akka library 

#sanfrancisco #sanjose #losangeles #sandiego #oakland #denver #miami #orlando #atlanta #chicago #boston #detroit #newyork #portland #philadelphia #dallas #houston #austin #seattle #sydney #melbourne #perth #toronto #vancouver #montreal #shanghai #beijing #shenzhen #prague #Brno #Ostrava #cairo #alexandria #giza #estonia #paris #berlin #munich #hamburg #stuttgart #cologne #frankfurt #hongkong #budapest #jakarta #bali #dublin #telaviv #milan #rome #tokyo #osaka #kualalumpur #amsterdam #oslo #manila #warsaw #krakow #bucharest #moscow #saintpetersburg #capetown #johannesburg #seoul #barcelona #madrid #stockholm #zurich #taipei #bangkok #Phuket #istanbul #london #manchester #edinburgh #kiev #hcmc #hanoi #wroclaw #poznan #katowice #rio #salvador #IT #4 #5

Equal Opportunity Employer 

At Agoda, we pride ourselves on being a company represented by people of all different backgrounds and orientations. We prioritize attracting diverse talent and cultivating an inclusive environment that encourages collaboration and innovation. Employment at Agoda is based solely on a person’s merit and qualifications. We are committed to providing equal employment opportunity regardless of sex, age, race, color, national origin, religion, marital status, pregnancy, sexual orientation, gender identity, disability, citizenship, veteran or military status, and other legally protected characteristics.

We will keep your application on file so that we can consider you for future vacancies and you can always ask to have your details removed from the file. For more details please read our privacy policy .

To all recruitment agencies: Agoda does not accept third party resumes. Please do not send resumes to our jobs alias, Agoda employees or any other organization location. Agoda is not responsible for any fees related to unsolicited resumes."
3886633947,"Staff Data Engineer (Bangkok based, relocation provided)",https://www.linkedin.com/jobs/view/3886633947,,https://www.linkedin.com/company/agoda/life,"Bandung, East Java, Indonesia",,0,,,,,https://media.licdn.com/dms/image/C4D0BAQGBa_7QNZNwpw/company-logo_100_100/0/1656643826660/agoda_logo?e=1721865600&v=beta&t=V_9iYXOC4Z9RgfBtEEdqYoha7IVeGlPKyJA8fk129to,"Agoda is transforming travel for millions of customers across the globe.

Headquartered in Asia, Agoda is one of the world’s largest online travel platforms. Founded in 2005 and now part of Booking Holdings (Nasdaq:BKNG), Agoda has a network of over 2,900,000 properties worldwide. Our web and mobile products provide a first-rate reservation service in 38 languages that uniquely combines local knowledge and local connections to provide the best deals for business and leisure travelers.

Agoda employs over 7,000 professionals from 90 nationalities in locations around the globe. In every department – from engineering to customer experience – we provide an environment rich with creativity, collaboration, and experimentation, and the tools to work faster and smarter.

At Agoda, we believe our people are our strength. We work hard and have fun, and we choose people who are dedicated to making things great.

For properties seeking partnership with Agoda, visit https://connect.agoda.com
…
show more","About Agoda 

Agoda is an online travel booking platform for accommodations, flights, and more. We build and deploy cutting-edge technology that connects travelers with more than 3.6 million accommodations globally. Based in Asia and part of Booking Holdings, our 6,000+ employees representing 90+ nationalities foster a work environment rich in diversity, creativity, and collaboration. We innovate through a culture of experimentation and ownership, enhancing the ability for our customers to experience the world.

 Our Purpose –  Bridging the World Through Travel 

We believe travel allows people to enjoy, learn and experience more of the amazing world we live in. It brings individuals and cultures closer together, fostering empathy, understanding and happiness.

We are a skillful, driven and diverse team from across the globe, united by a passion to make an impact. Harnessing our innovative technologies and strong partnerships, we aim to make travel easy and rewarding for everyone.

About Agoda

Agoda is an online travel booking platform for accommodation, flights, and more. We build and deploy cutting edge technology that connects travelers with more than 2.5 million accommodations globally. Based in Asia and part of Booking Holdings, our 4,000+ talents coming from 90+ different nationalities foster a work environment rich in diversity, creativity, and collaboration. We innovate through a culture of experimentation and ownership, enabling our customers to experience the world

Get to Know Our Team

The Data department oversees all of Agoda’s data-related requirements. Our ultimate goal is to enable and increase the use of data in the company through creative approaches and the implementation of powerful resources such as operational and analytical databases, queue systems, BI tools, and data science technology. We hire the brightest minds from around the world to take on this challenge and equip them with the knowledge and tools that contribute to their personal growth and success while supporting our company’s culture of diversity and experimentation. The role the Data team plays at Agoda is critical as business users, product managers, engineers, and many others rely on us to empower their decision making. We are equally dedicated to our customers by improving their search experience with faster results and protecting them from any fraudulent activities. Data is interesting only when you have enough of it, and we have plenty. This is what drives up the challenge as part of the Data department, but also the reward.

Why Agoda Data Applications Team?

Our Data Engineering teams are at the intersection of business analytics, data warehousing and software engineering. Our job involves dealing with distributed systems, stream processing, computation and data governance at tens of PB Scale.

We focus on software engineering related to data replication, storage, centralized computation, and Data API’s. By providing our users with data products/tools, shared frameworks and data services, we enable our company to validate strategic decisions, make smarter choices, and react to the fast-changing world.

We are a small but passionate team with people from different nationalities working together on a single goal.

In this Role, you will get to

Lead the team technically in improving scalability, stability, accuracy, speed and efficiency of our existing Data systems
Build, administer and scale data processing pipelines
Be comfortable navigating the following technology stack: Scala, Spark, java, Golang, Python3, scripting (Bash/Python), Hadoop, SQL, S3 etc
Improve scalability, stability, accuracy, speed and efficiency of our existing data systems
Design, build, test and deploy new libraries, frameworks or full systems for our core systems while keeping to the highest standards of testing and code quality
Work with experienced engineers and product owners to identify and build tools to automate many large-scale data management / analysis tasks 

What You’ll Need To Succeed

Bachelor’s degree in Computer Science /Information Systems/Engineering/related field
5+ years of experience in Data engineering
Good experience in Apache Spark
Expert level understanding of JVM and either Java or Scala
Experience debugging and reasoning about production issues is desirable
A good understanding of data architecture principles preferred
Any other experience with Big Data technologies / tools
SQL experience
Analytical problem-solving capabilities & experience
Systems administration skills in Linux

It’s great if you have

Good understanding of Hadoop ecosystems
Experience working with Open-source products
Python/Shell scripting skills
Working in an agile environment using test driven methodologies

#telaviv #jerusalem #IT #ENG #4 #sanfrancisco #sanjose #losangeles #sandiego #oakland #denver #miami #orlando #atlanta #chicago #boston #detroit #newyork #portland #philadelphia #dallas #houston #austin #seattle #sydney #melbourne #perth #toronto #vancouver #montreal #prague #Brno #Ostrava #cairo #alexandria #giza #estonia #paris #berlin #munich #hamburg #stuttgart #cologne #frankfurt #budapest #bali #dublin #telaviv #milan #rome #venice #florence #naples #turin #palermo #bologna #osaka #malta #amsterdam #oslo #warsaw #krakow #alrayyan #riyadh #jeddah #mecca #medina #singapore #seoul #barcelona #madrid #stockholm #zurich #taipei #tainan #taichung #kaohsiung #bangkok #Phuket #istanbul #london #manchester #edinburgh #hcmc #hanoi #lodz #wroclaw #poznan #katowice #rio #salvador #newdelhi #bangalore #bandung #yokohama #nagoya #okinawa #fukuoka #jerusalem #IT #4 #bangalore #delhi #hyderabad #pune #singapore #beijing #shanghai #shenzhen #tokyo #seoul #hongkong #taipei #kualalumpur #jakarta #hochiminh #hochiminhcity #manila #instanbul #makati #dubai #riyadh #gurgaon #noida

Equal Opportunity Employer 

At Agoda, we pride ourselves on being a company represented by people of all different backgrounds and orientations. We prioritize attracting diverse talent and cultivating an inclusive environment that encourages collaboration and innovation. Employment at Agoda is based solely on a person’s merit and qualifications. We are committed to providing equal employment opportunity regardless of sex, age, race, color, national origin, religion, marital status, pregnancy, sexual orientation, gender identity, disability, citizenship, veteran or military status, and other legally protected characteristics.

We will keep your application on file so that we can consider you for future vacancies and you can always ask to have your details removed from the file. For more details please read our privacy policy .

To all recruitment agencies: Agoda does not accept third party resumes. Please do not send resumes to our jobs alias, Agoda employees or any other organization location. Agoda is not responsible for any fees related to unsolicited resumes."
3780362852,Principal Software Engineer Back End (Bangkok based – Relocation provided),https://www.linkedin.com/jobs/view/3780362852,Agoda,https://www.linkedin.com/company/agoda/life,"Bali, Indonesia",,0,,,,,https://media.licdn.com/dms/image/C4D0BAQGBa_7QNZNwpw/company-logo_100_100/0/1656643826660/agoda_logo?e=1721865600&v=beta&t=V_9iYXOC4Z9RgfBtEEdqYoha7IVeGlPKyJA8fk129to,"Agoda is transforming travel for millions of customers across the globe.

Headquartered in Asia, Agoda is one of the world’s largest online travel platforms. Founded in 2005 and now part of Booking Holdings (Nasdaq:BKNG), Agoda has a network of over 2,900,000 properties worldwide. Our web and mobile products provide a first-rate reservation service in 38 languages that uniquely combines local knowledge and local connections to provide the best deals for business and leisure travelers.

Agoda employs over 7,000 professionals from 90 nationalities in locations around the globe. In every department – from engineering to customer experience – we provide an environment rich with creativity, collaboration, and experimentation, and the tools to work faster and smarter.

At Agoda, we believe our people are our strength. We work hard and have fun, and we choose people who are dedicated to making things great.

For properties seeking partnership with Agoda, visit https://connect.agoda.com","About Agoda

Agoda is an online travel booking platform for accommodations, flights, and more. We build and deploy cutting-edge technology that connects travelers with more than 3.6 million accommodations globally. Based in Asia and part of Booking Holdings, our 6,000+ employees representing 90+ nationalities foster a work environment rich in diversity, creativity, and collaboration. We innovate through a culture of experimentation and ownership, enhancing the ability for our customers to experience the world.

 Our Purpose –  Bridging the World Through Travel 

We believe travel allows people to enjoy, learn and experience more of the amazing world we live in. It brings individuals and cultures closer together, fostering empathy, understanding and happiness.

We are a skillful, driven and diverse team from across the globe, united by a passion to make an impact. Harnessing our innovative technologies and strong partnerships, we aim to make travel easy and rewarding for everyone.

Get to Know Our Team

In Agoda’s Back End Engineering department, we build the scalable, fault-tolerant systems and APIs that host our core business logic. Our systems cover all major areas of our business: inventory and pricing, product information, customer data, communications, partner data, booking systems, payments, FinTech and more. These mission-critical systems change frequently with dozens of releases per day, so we must employ state-of-the-art CI/CD and testing techniques in order to make sure everything works without any downtime. We also ensure that our systems are self-healing, responding gracefully to extreme loads or unexpected input. In order to accomplish this, we use state-of-the-art languages like Scala and Go, data technologies like Kafka and Spark, and agile development practices. Most importantly though, we hire great people from all around the world and empower them to be successful. Whether it’s building new projects like Flights and Packages or reimagining our existing business, you’ll make a big impact as part of the Back End Engineering team.

The Opportunity

You might call yourself “full stack” or “back end” or you might consider yourself an authority in a certain field, but you have a keen interest in how the different systems work together.

We’d love to hear from you if you are skilled in any of the technologies we work with (note – we are not looking for you to have them all). We are interested in speaking to persons of any level from individuals just starting their IT careers to experts in their field, although this particular position is better suitable to veteran engineers, with expertise in certain technologies, and especially those that had lead projects, initiatives and/or teams.

In This Role, You’ll Get to

Think and own the full life cycle of our products, not just a single piece of code – from business requirements, technology selection, coding standards, agile development, unit and application testing, to CI/CD and proper monitoring
Design, develop and maintain platforms across the back end area
Improve scalability, stability, and efficiency of our existing systems
Write great code and help others write great code
Collaborate with other teams and departments

What You’ll Need To Succeed

12+ years’ experience under your belt developing performance-critical applications that run in a production environment using Scala, Java or C#
Experience in leading projects, initiatives and/or teams, with full ownership of the systems involved
Data platforms like SQL, Cassandra or Hadoop. You understand that different applications have different data requirements
Good understanding of algorithms and data structures
Strong coding ability
You are passionate about the craft of software development and constantly work to improve your knowledge and skills
Excellent verbal and written English communication skills

It’s Great If You Have

Experience with Scrum/Agile development methodologies
Experience building large-scale distributed products
Core engineering infrastructure tools like Git for source control, TeamCity for Continuous Integration and Puppet for deployment
Hands-on experience working with technology like queueing systems (Kafka, RabbitMQ, ActiveMQ, MSMQ), Spark, Hadoop, NoSQL (Cassandra, MongoDB), Play framework, Akka library 

#sanfrancisco #sanjose #losangeles #sandiego #oakland #denver #miami #orlando #atlanta #chicago #boston #detroit #newyork #portland #philadelphia #dallas #houston #austin #seattle #sydney #melbourne #perth #toronto #vancouver #montreal #shanghai #beijing #shenzhen #prague #Brno #Ostrava #cairo #alexandria #giza #estonia #paris #berlin #munich #hamburg #stuttgart #cologne #frankfurt #hongkong #budapest #jakarta #bali #dublin #telaviv #milan #rome #tokyo #osaka #kualalumpur #amsterdam #oslo #manila #warsaw #krakow #bucharest #moscow #saintpetersburg #capetown #johannesburg #seoul #barcelona #madrid #stockholm #zurich #taipei #bangkok #Phuket #istanbul #london #manchester #edinburgh #kiev #hcmc #hanoi #wroclaw #poznan #katowice #rio #salvador #IT #4 #5

Equal Opportunity Employer 

At Agoda, we pride ourselves on being a company represented by people of all different backgrounds and orientations. We prioritize attracting diverse talent and cultivating an inclusive environment that encourages collaboration and innovation. Employment at Agoda is based solely on a person’s merit and qualifications. We are committed to providing equal employment opportunity regardless of sex, age, race, color, national origin, religion, marital status, pregnancy, sexual orientation, gender identity, disability, citizenship, veteran or military status, and other legally protected characteristics.

We will keep your application on file so that we can consider you for future vacancies and you can always ask to have your details removed from the file. For more details please read our privacy policy .

To all recruitment agencies: Agoda does not accept third party resumes. Please do not send resumes to our jobs alias, Agoda employees or any other organization location. Agoda is not responsible for any fees related to unsolicited resumes."
