id,title,job_url,company,company_link,location,published_at,number_of_applicants_applied,employment_duration,work_location_type,work_experience_level,company_type,company_logo,company_description,about_the_job
3836077520,Backend Engineer (Junior or Senior Consultant),https://www.linkedin.com/jobs/view/3836077520,EY,https://www.linkedin.com/company/ernstandyoung/life," ",1 day ago,88,,On-site,,"10,001+ employees · Professional Services",https://media.licdn.com/dms/image/C510BAQGpRhkpxp5A9A/company-logo_100_100/0/1630570672166/ernstandyoung_logo?e=1717027200&v=beta&t=GB4UFvSpbwWhy4MXiSdA1ZqOc8nNEpze3NruaGeMARU,"EY exists to build a better working world, helping create long-term value for clients, people and society and build trust in the capital markets.

Enabled by data and technology, diverse EY teams in over 150 countries provide trust through assurance and help clients grow, transform and operate.

Working across assurance, consulting, law, strategy, tax and transactions, EY teams ask better questions to find new answers for the complex issues facing our world today.

Find out more about the EY global network http://ey.com/en_gl/legal-statement
…
show more","About EY:

EY, a global leader operating in more than 150 countries delivers unparalleled service in Consulting and assists clients to transform and upskill their capabilities.

We serve our clients to build a better working world, helping them to create long-term value for people and society and build trust in the capital markets. That starts with a culture that believes in giving you the training, opportunities, and creative freedom to make things better. Whenever you join, however long you stay, the exceptional EY experience lasts a lifetime. And with a commitment to hiring and developing the most passionate people, we work towards our ambition to be the best employer.

EY advises clients to understand, architect, select and implement bleeding-edge solutions required to efficiently run their businesses, with a focus on Digital and Cloud. These service areas span E-commerce, Solution Architecture, Mobile Applications, Digital Platform Architecture, Digital Technology Strategy, and Digital IT Operations.

The exceptional EY experience. It’s yours to build.

The opportunity:

The Digital & Emerging Technology team works collaboratively with clients to transform their business through disruptive innovation enablement and transformational design solutions. The team supports our clients in modernizing systems, processes and products to enhance business and customer-facing platforms and services to support high performance in a rapidly changing and competitive environment. Our team helps clients sustain competitive advantage and profitability by developing technology strategies, products, and solutions to stay ahead of the rapid pace of change and disruption and supporting the execution of complex transformations.

We're seeking a highly skilled and experienced Backend Engineer to join our dynamic team. In this role, you will play a crucial role in designing, developing, and maintaining scalable and high-performance backend systems. You will collaborate with cross-functional teams, including front-end developers, product managers, and QA engineers, to deliver robust and efficient solutions. While our teams primary focus is within the financial services industries, you will have opportunities to support other sectors including healthcare, automotive, high-tech, and media.

Your key responsibilities: 

The goal is to support our clients to transform their business through technology. As a Backend Engineer you will be collaborate with cross-functional teams to define, design, and ship new features, identify and address performance bottlenecks in the backend systems, design and optimize database schemas, develop and maintain RESTful APIs for seamless communication between front-end and back-end systems, write unit tests and participate in code reviews, collaborate with technical writers to create user and developer documentation, and operating your team's software systems in a consistently high quality manner. When working on the systems within your team's domain, you take into account the appropriate architectural patterns, code design, and infrastructure options, ensuring that you deliver a system that is secure, reliable, maintainable, extensible and very well tested. Beyond delivery to the production system, engineers will be responsible for post deployment monitoring as well.

In addition to being trusted to operate independently, you also maintain a good partnership with your technical and non-technical stakeholders for projects that you are involved in. You take an active role in your projects as a team member involved in product design to rollout, taking ownership of your work and constantly focusing on moving these projects forward.

Being an experienced team member, you are also expected to continuously help the team grow and improve either by mentoring new or junior members of your team or by introducing and adopting process improvements.

Requirements: 

Bachelor's degree (Computer Science, Computer Engineering or Mathematics) or related experience
1-3 years of Development experience
Strong knowledge of algorithms and data structures
Fluency in developing and understanding sequence diagrams, class models, etc.
Strong proficiency in programming languages such as Java, C# .Net, or Golang.
Solid understanding of database systems, both relational and NoSQL.
Strong in fundamental programming like SOLID Principle, Clean Architecture or related fundamental knowledge and practices
Experience in writing maintainable and testable code, including API design, unit testing and UI testing techniques.
Experience working in an Agile/Scrum development process.
Humble and hungry engineer. Always curious, always looking for a better way
Highly accountable and takes ownership of one's own work.

For senior software engineer:

4+ years of professional backend software development experience
Experience with Event-Driven Architecture such as Kafka or RabbitMQ
Familiarity with cloud services (e.g., AWS, Azure, Google Cloud).
Knowledge of containerization and orchestration tools (e.g., Docker, Kubernetes).
Possess excellent communication, sharp analytical abilities with proven design skills, able to think critically of the current system in terms of growth and stability
Ability to understand business requirements and translate them into technical requirements
Familiarity with modern build pipelines and tools
Identify and resolve performance and scalability issues

What we look for 

We’re interested in passionate individuals with a strong vision and a desire to stay on top of trends. If you have a genuine passion for helping businesses achieve their full potential, then these role(s) are for you. 

What We Offer

Continuous learning: You’ll develop the mindset and skills to navigate whatever comes next
Success as defined by you: We’ll provide the tools and flexibility, so you can make a meaningful impact, on your way
Transformative leadership: We’ll give you the insights, coaching, and confidence to be the leader the world needs
Diverse and inclusive culture: You’ll be embraced for who you are and empowered to use your voice to help others find theirs

If you can demonstrate that you meet the criteria above, please contact us as soon as possible.

EY is an equal opportunity, affirmative action employer providing equal employment opportunities to applicants and employees without regard to race, color, religion, age, sex, sexual orientation, gender identity/expression, national origin, protected veteran status, disability status, or any other legally protected basis, including arrest and conviction records, by applicable law.

EY is committed to providing reasonable accommodation to individuals with special needs. If you are a qualified individual with special needs and need assistance applying online or need to request an accommodation during the interview process, please speak to our HR executives, and we will be happy to help you."
3789765632,BI Developer,https://www.linkedin.com/jobs/view/3789765632,NTT Ltd.,https://www.linkedin.com/company/global-ntt/life," "," ",100,,Hybrid,,"10,001+ employees · IT Services and IT Consulting",https://media.licdn.com/dms/image/D4D0BAQF0fjPAQRj4uA/company-logo_100_100/0/1698830112594/global_ntt_logo?e=1717027200&v=beta&t=I2eLSgVkZC2SxBRNzjGW3PnYPLIGs-rUSuHFeEN_pc4,"NTT Ltd. is becoming NTT DATA. As a global IT services powerhouse, we offer an unmatched range of business and technology solutions.","Want to be a part of our team?

Plans, designs, develops, and tests software systems or applications for software enhancements and new products including cloud-based or internet-related tools.

Working at NTT

The Software Development Engineer is accountable for designing, developing, and testing software systems, modules, or applications for software enhancements and new products including cloud-based or internet-related tools. Incumbents within this job are responsible for detailed design for certain modules/sub-systems, doing prototype for multi-vendor infrastructure, and showcasing it internally or externally to clients. Design and develop functionality in a micro-services environment working with APIs, telemetry data, and running ML/AI algorithms on it, working with both structured and unstructured data.

Key Roles and Responsibilities:

Design and develop solutions and functionality that drives the growth of business
Write and test code
Execute automated testing
Participate in software deployment
Deliver software components while working in collaboration with the product team
Integrate and build solutions through automation and coding, using 3rd party software
Craft, build, and debug large scale distributed systems
Write, update and maintain the technical program, end-user documentation, and operational procedures
Refactoring code
Review code was written by other developers

Knowledge, Skills, and Attributes:

Strong understanding of cloud architecture and services in multiple public clouds like AWS, GCP, Microsoft Azure, and Microsoft Office 365
Fluent in programming languages such as C/C++, Java, Python, Node.js, etc. 
Foundation in data structures, algorithms, and software design with strong analytical and debugging skills
Good understanding of micro services-based software architecture and experience with API product development
Expertise with SQL and no-SQL data stores including Elasticsearch, MongoDB, Cassandra
Experience with container run time (Docker, LXC/LXD)
Familiar with agile practices and believes in test-driven development
Ability to mentor junior engineers
Possess a can-do attitude and one that takes initiative
Good interpersonal skills
Ability to work multi-functionally and work well as a team
Ability to work well in a diverse team with different backgrounds and experience levels
Ability to thrive in a dynamic, fast-paced environment
Experience with CI/CD concepts and tools

Academic Qualifications and Certifications:

ME/MTech in Computer Science or equivalent with related demonstrable experience or BE/BTech in Computer Science or equivalent with related demonstrable experience as a software engineer working on large scale systems

Required Experience:

Experience working with geo-distributed teams through innovation, bootstrapping, pilot, and production phases with multiple stakeholders to the highest levels of quality and performance
Experience in working with large data sets and ability to apply proper ML/AI algorithms
Two or more years developing micro-services and RESTful APIs

What will make you a good fit for the role?

Data Engineer / Business Intelligence Developer with ~5+ years of experience
Have great knowledge and proficiency in SQL and Python
Familiar with various BI Tools (like SSIS, SSAS, SSRS, PowerBI, Tableau, etc)
Have experience with cloud platform, preferably AWS
Have great analysis and problem solving skill. 

Equal Opportunity Employer

NTT is proud to be an Equal Opportunity Employer with a global culture that embraces diversity. We are committed to providing an environment free of unfair discrimination and harassment. We do not discriminate based on age, race, color, sex, religion, national origin, disability, pregnancy, marital status, sexual orientation, gender reassignment, veteran status, or other protected category"
3822719936,Android Developer,https://www.linkedin.com/jobs/view/3822719936,Wipro,https://www.linkedin.com/company/wipro/life," ",2 weeks ago,100,,On-site,,"10,001+ employees · IT Services and IT Consulting",https://media.licdn.com/dms/image/D4E0BAQEkfMUEE4caDQ/company-logo_100_100/0/1698887191930?e=1717027200&v=beta&t=32u8KYTzoI-HtnoNOiWc7-ImFLN1Ur5-4Zbe6bU2JKY,"Wipro Limited (NYSE: WIT, BSE: 507685, NSE: WIPRO) is a leading technology services and consulting company focused on building innovative solutions that address clients’ most complex digital transformation needs. Leveraging our holistic portfolio of capabilities in consulting, design, engineering, and operations, we help clients realize their boldest ambitions and build future-ready, sustainable businesses. With nearly 245,000 employees and business partners across 65 countries, we deliver on the promise of helping our clients, colleagues, and communities thrive in an ever-changing world.
Wipro is an Equal Employment Opportunity employer and makes all employment and employment-related decisions without regard to a person's race, sex, national origin, ancestry, disability, sexual orientation, or any other status protected by applicable law.
…
show more","Android Developer Skill set:
  Must have 3 to 8 years of technology experience
Hands on in Android Development
Must have experience in working in end-to-end delivery
Must have experience in delivering complex projects in a cross-geography setup
Understanding of test and build automation frameworks mobile front-ends
Build Dev Ops culture within the delivery cells
Hands-on experience with multiple CI/CD tools
Strong Problem-Solving skills and ability to solve unstructured problem and challenge status quo
Ability to work along with team distributed across geographies
Render consulting and technical support services on project implementation to the project team
Explain technical issues and IT solution strategies to stakeholders and other IT professionals
Experienced in Agile methodology
Proactive and able to work under pressure, strong problem-solving skills and positive “can do” attitude
Experience in Bank / Financial Institution Systems would be favourable
Should be well versed with Sonar, Code smells, Code coverage
Good understanding of Unit testing and TDD
Should be able apply Design patterns
Should be well versed with GIT workflow and commands/operations
Should be good with Exception Handling
Should know how on Security Aspects
Familiarity with RESTful APIs to connect Android applications to back-end services
Strong knowledge of Android UI design principles, patterns, and best practices, Material Design
Good knowledge of Android SDK, different versions of Android, and how to deal with different screen sizes
Should be Well versed with 
Activity, Fragments
Layouts, Views
MVVM
Managing Intents, App Permissions
Models
SQL Lite
Obfuscation tools
AAR"
3830988930,Back End Developer,https://www.linkedin.com/jobs/view/3830988930,Lancesoft Indonesia,https://www.linkedin.com/company/lancesoft-indonesia/life," ",1 day ago,30,,On-site,,"1,001-5,000 employees · Staffing and Recruiting",https://media.licdn.com/dms/image/C560BAQGLOAFB358F-g/company-logo_100_100/0/1632155027401/lancesoft_indonesia_logo?e=1717027200&v=beta&t=7BCr1AnPWPJo8Ll-QfpClxPix52ujCvKHcXZRcFoYqA,"Established in 2000, LanceSoft is a Certified MBE and Woman-Owned organization, and a pioneer in providing premium end-to-end Global Workforce Solutions and IT Services to diverse clients across various domains.

LanceSoft’s mission is to establish global cross-culture human connections that further the careers of our employees and strengthen the businesses of our clients. We are driven to use the power of our global network to connect businesses with the right people, and people with the right businesses without bias. We provide Global Workforce Solutions with a human touch.

LanceSoft provides Global Workforce Solutions with a human touch and a comprehensive recruiting organization, addressing the complex workforce challenges your company faces today, from contingent and permanent staffing to talent management, outsourcing, and talent development.

With currently over 3,800+ staff serving over 110+ enterprise clients worldwide including “Fortune” companies, LanceSoft serves a wide array of industries including Banking & Financial Services, Semiconductor/VLSI, Technology, Healthcare & Life Sciences, Government, Telecom & Media, Retail & Distribution, Oil & Gas and Energy & Utilities.

LanceSoft is headquartered in Herndon, VA with 27 regional offices across the U.S. and 21 offices around the globe.
Other Offices - India, Indonesia, Hongkong, Malaysia, Thailand, Philippines, Australia, Japan & Bangladesh, etc..

Office in Indonesia -
Gedung Wisma Metropolitan I, Level 3A, Jl Jend Sudirman Kav 29-31, RT. 008 RW. 003, Karet, Setiabudi, Jakarta Selatan, Indonesia, D07 P4AX
Indonesia","Full WFO at Central Jakarta (Banking Industry)
Permanent position with 3 months probation
will be provided a device (Laptop) after 3 months of probation through NOP

Requirements:
Bachelor Degree Level
Memiliki minimal 3 Tahun pengalaman menggunakan Java, springboot
Menguasai Framework Java Springboot &Bahasa Pemrograman Java
Mengerti konsep dan dapat menerapkan Java Server Page (JSP) poin plus
Memahami konsep dan dapat menerapkan web service / API
Mampu menggunakan SQL Server Database, MySQL Database, MongoDB dan Redis cache
Memiliki pengetahuan di SAP Hybris menjadi nilai tambah
Mampu menggunakan collaboration tools seperti Github dan TFS
Mampu dan memahami konsep security dalam programming"
3831594386,Back End Developer,https://www.linkedin.com/jobs/view/3831594386,Binar Academy,https://www.linkedin.com/company/binar-academy/life," ",,34,,Hybrid,,201-500 employees · IT Services and IT Consulting,https://media.licdn.com/dms/image/C560BAQEBEZeoowry3A/company-logo_100_100/0/1657875033201/binar_academy_logo?e=1717027200&v=beta&t=1KqUkRWEBQSajgDbaOnogXxQIhBF_-D_-d7OAmKysGo,"BINAR was born in 2017 to advance Indonesia’s technology ecosystem. Our mission is to solve digital talent gap by upskilling and job matching.

We support people to build a career in digital industry or upskilling into digital related roles with the knowledge and skills needed to thrive through a structured learning journey and multiple learning styles to ensure each learner can reach mastery through their own preferred way.

Our upskilling programs are designed to provide learners with first-hand exposure to the real world and prepare them with skills critically needed by the industries in this fast-changing digital era.

Also, we help students and companies to connect and build great teams.
Fueled by industry change, BINAR for Business helps companies achieve critical business outcomes and stay competitive by offering relevant and personalized learning experiences.

Advance your career, show off your skills, grow your business and get ready to #SelangkahDiDepan with BINAR.

Learn more about us:
Website: www.binaracademy.com
Instagram: @academybinar
Youtube: https://www.youtube.com/binaracademy

BINAR Apps is available on the Google Play store and iOS. Download BINAR app on:
- Apple Store: https://bit.ly/BinarAppsAppStore
- Google Play Store: https://bit.ly/BinarAppsPlayStore
…
show more","Binar Academy aims to unlock and channel human potential so we can help the world turn into a better place. One of the ways we strive to do that is to channel potential talents to impactful opportunities using our very own job connector, Binar Job Connect.

Binar Job Connect has connected up to 250 talents & candidates; whether it be young & aspirational fresh graduates to tech-savvy team leaders, individuals who decided to start from scratch, and junior engineers to skilled product managers to our experienced hiring partners. Binar Job Connect provides various options of employment, as we intend that everyone processed by us can choose the best career track for them.

We are currently looking for Backend Developer for our hiring partner.

The requirements:
Have minimum 3 years of working experience as Backend Engineer or equivalent, preferably graduated in Computer Science/Information Technology
Experience with Java
Experience working with MongoDB, MySQL, and PostgreSQL
Familiar with Redis, Memcached, Elastic Search, CI/CD, TDD, Refactor/Rewrite system, Git flow, Kubernetes
Knowledge on Event-Driven Architecture such as Kafka or RabbitMQ
Knows how to analyze log"
3811263850,Software Developer,https://www.linkedin.com/jobs/view/3811263850,Ingenico,https://www.linkedin.com/company/ingenico/life," ",3 weeks ago,100,,Hybrid,,"5,001-10,000 employees · Financial Services",https://media.licdn.com/dms/image/D4E0BAQE3ZvAX6LFwYQ/company-logo_100_100/0/1688400514141/ingenico_logo?e=1717027200&v=beta&t=ZnGzaqM8NvjyXYMKrWqlPfNluf9B-E26vRnepm2nk3Y,"Ingenico is the global leader in payments acceptance solutions, with more than three decades of experience. Its footprint gives scale to projects and talents. Innovation is part of our DNA and our diverse community of experts keep anticipating the evolution of commerce worldwide.

As the trusted technology partner for merchants, banks, acquirers, ISVs, payment aggregators and fintech customers, our world-class terminals, solutions and services enable the global ecosystem of payments acceptance.

At Ingenico, trust and sustainability are at the heart of everything we do.

Our team comprises 4,000+ people spread around the globe representing 60 different nationalities. We are proud of the diversity and professionalism of our employees. Whether they work in technical or business support functions, we believe in making the company and people successful, together.

Learn more about Ingenico at https://ingenico.com","Ingenico is a global leader in the fintech market, with more than three decades of experience and employs over 7,500 people. Its footprint gives scale to projects and talents. Innovation is part of our DNA and our diverse community of experts keep anticipating the evolution of commerce worldwide.
We provide merchants with a comprehensive and innovative range of services and solutions that eliminate payment complexity and make purchasing quick, seamless and secure for consumers, whatever the sales channel or payment method.

JOB PURPOSE/MISSION:
Software Developer to develop payment and other applications to meet clients' needs and requirements.
To guide and train junior developers as acquired
As a technical consultant to junior members in the team.

KEY RESPONSIBILITIES 
Develop and timely release embedded C/C++ applications on POS
Develop and timely release payment applications on Android POS
Provide support in the day-to-day resolution and fixes on applications for customers and new partners
Provides technical expertise and support to customers with regards to software development/coding/best practice
Train and provide technical guidance to the junior developer
Documents and demonstrates solutions by preparing documentation, flowcharts, layouts, diagrams, charts, code comments and clear code

CORE COMPETENCIES 
Good knowledge/working experience on C/C++ or C-like language such as C#, Java on device development
Good knowledge in Android development (Java, Kotlin, etc) is a plus
Has extensive knowledge of Software Development – C/C++, Software Development Lifecycle, Knowledge of credit card processing, developing applications with strict compliance with PCI DSS and EMV standards, POS application development and ISO8583 is a must.
Knowledge of managing and implementing payments processing and banking/financial projects and solutions is an advantage
Good understanding of data exchange format (XML, JSON, CSV, TLV)
Python will be a plus point
Knowledge/experience on software management tool such as JIRA, Bitbucket, Confluence

KEY PERFORMANCE OBJECTIVES/INDICATORS 
Timely and good quality software application releases.
Able to meet client’s expectations
Able to work alongside with Projects Team in achieving the team’s overall objective.

BEHAVIOUR SKILLS 
Detail-oriented
Takes initiative and proactive
Analytical and possess critical thinking
Thrives in both tight deadlines, challenges and opportunities

EDUCATION/EXPERIENCE REQUIREMENTS
Diploma/University: Degree in Computer, Electronic, or Electrical Engineering or proficiency in embedded system, application development or web programming
Years of professional experience required: 4 to 10 years in the payment industry."
