id,title,job_url,company,company_link,location,published_at,number_of_applicants_applied,employment_duration,work_location_type,work_experience_level,company_type,company_logo,company_description,about_the_job
3820169102,Senior SDET - Automation Engineering Platform,https://www.linkedin.com/jobs/view/3820169102,Gojek,https://www.linkedin.com/company/gojek/life,"Jakarta, Jakarta, Indonesia",,0,,,,,https://media.licdn.com/dms/image/C4D0BAQHCmfKRtPXKDg/company-logo_100_100/0/1658813682786/gojek_logo?e=1721865600&v=beta&t=CtYNrBXpaC2GECUUBNgHdhf98IJPRf_uGabreq3yj5Y,"Gojek is Southeast Asia’s leading on-demand platform and a pioneer of the multi-service ecosystem model, providing access to a wide range of services including transportation, food delivery, logistics and more. Gojek is founded on the principle of leveraging technology to remove life's daily frictions by connecting consumers to the best providers of goods and services in the market.

The company was first established in 2010 focusing on courier and motorcycle ride-hailing services, before launching its app in January 2015 in Indonesia. Since then, Gojek has grown to become the leading on-demand platform in Indonesia, with additional operations in Vietnam and Singapore. The Gojek platform now comprises over 2.5 million driver partners across the region. Gojek is part of the GoTo Group, the largest digital ecosystem in Indonesia, consisting of Gojek, Tokopedia and GoTo Financial.

Gojek is dedicated to solving the daily challenges faced by consumers, while improving the quality of life for millions of people across Southeast Asia, especially those in the informal sector and micro, small and medium enterprises (MSMEs).

The Gojek application is available for download via iOS and Android.
.........

*IMPORTANT*
Gojek is affiliated to the GoTo Group companies, and all authentic jobs/open positions listed by Gojek can ONLY be accessed via our official channels -- Gojek on LinkedIn, Gojek Tech on LinkedIn, Gojek on Glassdoor, and https://www.gojek.io/careers. In case you are contacted by our Talent Acquisition team, please ensure that the communication is coming from a valid Gojek domain - *****@gojek.com. If you are contacted by any third party outside of the authenticated channels highlighted above, please write to us at ethics@gotocompany.com to validate the job/open position. This is to avoid any potential instances of fraud, and to ensure your safety and security during the job application process.
…
show more","About The Role

As an engineer in Automation Engineering platform you will be responsible to lead and implement the test strategy for automation by working closely with the product engineering group, design and develop tools and frameworks that help smoother development and testing process. You will also work on the latest cutting-edge internet/software technology.

What You Will Do

Conduct feature and exploratory tests on Mobile apps (Android, iOS)and API. Engage in continuous automation throughout agile development iterations to ensure zero defects
Work closely with the cross-functional product team, including PMs, Designers, Developers, and QA managers right from the inception of features
Create and execute the test cases for features with minimum guidance and maintain and add new cases in automation frameworks on either UI/API test level and reduce manual efforts during regression testing 
Participate in iteration planning, providing input on required testing tasks, processes, and associated effort for the selected user stories
Design, develop and execute test automation for relevant areas of ownership independently
Contribute to automation framework development (Libraries / new features / extensions)
Provide automated test coverage for corner cases, revenue, impact, usability, backend services, and exploratory testing
As a fast learner and team player, you’re comfortable teaching yourself new skills quickly and can thrive in a complex and fast-paced environment while making strong technical individual contributions

What You Will Need

4-6+ years of experience in the field of professional testing
Good prior experience in Manual & Automation test methodologies
Sound knowledge of testing/automating the tests at different layers of the application
Comfortable writing clean code in one programming language (Java/Kotlin is a plus)
Good Understanding of Tools like Selenium, Appium, Cucumber BDD, TestNG Maven/Gradle, and CI/CD tools like Jenkins, GitLab, etc
Should have exposure to tools like Postman, Charles Proxy/MITM 
Working knowledge of Git
Experience in developing test automation framework from scratch is a big plus"
3851537579,Software Engineer Intern,https://www.linkedin.com/jobs/view/3851537579,SIRCLO,https://www.linkedin.com/company/sirclo/life,Indonesia,,0,,,,,https://media.licdn.com/dms/image/C560BAQGYdFrdPT9ppw/company-logo_100_100/0/1661705620592/sirclo_logo?e=1721865600&v=beta&t=km4dIlTGnoQgBOsizgtE6EW1bxMQQZApZoPNgxIJSas,"Founded in 2013, SIRCLO Group’s mission is to maximise the potential of people and businesses through integrated technology solutions, as a means to enable them to make a leap into the future.

Our super ecosystem serves a wide array of stakeholders, including enterprise businesses, small and medium businesses, micro-businesses, as well as millions of end-consumers.",This job is sourced from a job board. Learn More
3870477758,Senior Software Engineer - Data Science Platform,https://www.linkedin.com/jobs/view/3870477758,Gojek,https://www.linkedin.com/company/gojek/life,"Jakarta, Jakarta, Indonesia",,0,,,,,https://media.licdn.com/dms/image/C4D0BAQHCmfKRtPXKDg/company-logo_100_100/0/1658813682786/gojek_logo?e=1721865600&v=beta&t=CtYNrBXpaC2GECUUBNgHdhf98IJPRf_uGabreq3yj5Y,"Gojek is Southeast Asia’s leading on-demand platform and a pioneer of the multi-service ecosystem model, providing access to a wide range of services including transportation, food delivery, logistics and more. Gojek is founded on the principle of leveraging technology to remove life's daily frictions by connecting consumers to the best providers of goods and services in the market.

The company was first established in 2010 focusing on courier and motorcycle ride-hailing services, before launching its app in January 2015 in Indonesia. Since then, Gojek has grown to become the leading on-demand platform in Indonesia, with additional operations in Vietnam and Singapore. The Gojek platform now comprises over 2.5 million driver partners across the region. Gojek is part of the GoTo Group, the largest digital ecosystem in Indonesia, consisting of Gojek, Tokopedia and GoTo Financial.

Gojek is dedicated to solving the daily challenges faced by consumers, while improving the quality of life for millions of people across Southeast Asia, especially those in the informal sector and micro, small and medium enterprises (MSMEs).

The Gojek application is available for download via iOS and Android.
.........

*IMPORTANT*
Gojek is affiliated to the GoTo Group companies, and all authentic jobs/open positions listed by Gojek can ONLY be accessed via our official channels -- Gojek on LinkedIn, Gojek Tech on LinkedIn, Gojek on Glassdoor, and https://www.gojek.io/careers. In case you are contacted by our Talent Acquisition team, please ensure that the communication is coming from a valid Gojek domain - *****@gojek.com. If you are contacted by any third party outside of the authenticated channels highlighted above, please write to us at ethics@gotocompany.com to validate the job/open position. This is to avoid any potential instances of fraud, and to ensure your safety and security during the job application process.","About The Role

Data Scientists want to spend their time exploring data, crafting the right features and optimising their models… so far so good. Production requires a lot more though. What about the data pipelines? Scaling up infrastructure based on demand? Running experiments at scale? Feature data consistency? This is where you come in as a Software Engineer for Gojek’s ML platform.

Most companies embed ML engineers in data science teams to solve these problems. We do things a little differently at Gojek. We build self-service products for data scientists so they don’t have to worry about deep engineering problems. Create your model and submit it to us, our platform will scale it up/down for you.

You will be joining a team that has already built industry-leading open-source tools. Our team invented Feast which companies like Twitter and Shopify now use. MLOps is changing fast, we’re looking for engineers who are keen to build the next big thing in MLOps.

What You Will Do

Design and build our Machine Learning Platform to help Data Scientists productionize their models and features faster
Engineer high-reliability, high-performance services for sophisticated ML-driven functionality
Collaborate with Data Scientists to optimize ML models for high-throughput, low-latency use cases
Build internal tools and interfaces to improve the productivity of the team and improve the accessibility of our products

What You Will Need

At least 5 years as a Software Engineer, with fluency and experience in either Go, Python, or Java
Proven track-record building large-scale, high-throughput, low-latency production systems
Prior experience developing for and debugging Big Data and stream processing frameworks such as Spark, Kafka, and Flink
Good understanding of algorithms and data structures/ design patterns
Passion for Agile software development practices such as test-driven development, pair programming, etc.
Experience with relational databases, non-relational databases, cloud environments and cloud deployment technology (Terraform, Kubernetes, Helm)

About The Team

Gojek’s Data Science Platform team helps Data Scientists build production-scale ML applications easily. We are a team of about 10 ML and infrastructure engineers, spread across Indonesia and Singapore. You may know us as the creators of open-source MLops technologies such as Feast, Merlin and Turing. Our products are used in mission-critical parts of Gojek’s product offerings, such as driver allocation, food recommendations, and fraud prevention.

About GoTo Group

GoTo Group is the largest digital ecosystem in Indonesia with its mission to “Empower Progress’ by offering technological infrastructure and solutions for everyone to access and thrive in the digital economy. The GoTo ecosystem consists of on-demand transportation services, food and grocery delivery, logistics and fulfillment, as well as financial and payment services through the Gojek and GoTo Financial platforms.It is the first platform in Southeast Asia that hosts these crucial cases in a single ecosystem, capturing the majority of Indonesia’s vast consumer household.

About Gojek

Gojek is Southeast Asia’s leading on-demand platform and pioneer of the multi-service ecosystem with over 2.5 million driver partners across the regions offering a wide range of services such as transportation, food delivery, logistics and more. With its mission to create impact at scale, Gojek is committed to resolving consumer problems and raising standards of living by connecting consumers to the best providers of goods and services in the market.

About GoTo Financial

GoTo Financial accelerates financial inclusion through its leading financial services and merchants solutions. Its consumer services include GoPay and GoPayLater and serve businesses of all sizes through Midtrans, Moka, GoBiz Plus, GoBiz, and Selly. With its trusted and inclusive ecosystem of products, GoTo Financial is open to new growth opportunities and aims to empower everyone to Make It Happen, Make It Together, Make It Last.

GoTo and its business units, including Gojek, GoToFinancial and GoToLogistics (""GoTo"") only post job opportunities on our official channels on our respective company websites and on LinkedIn. GoTo is not liable for any job postings or job offers that did not originate from us. You should conduct your own due diligence to prevent being victims of any fake job scams, if they did not originate from GoTo's official recruitment channels."
3809343882,[ODS] Senior Software Engineer - Marketplace,https://www.linkedin.com/jobs/view/3809343882,Gojek,https://www.linkedin.com/company/gojek/life,"Jakarta, Jakarta, Indonesia",,0,,,,,https://media.licdn.com/dms/image/C4D0BAQHCmfKRtPXKDg/company-logo_100_100/0/1658813682786/gojek_logo?e=1721865600&v=beta&t=CtYNrBXpaC2GECUUBNgHdhf98IJPRf_uGabreq3yj5Y,"Gojek is Southeast Asia’s leading on-demand platform and a pioneer of the multi-service ecosystem model, providing access to a wide range of services including transportation, food delivery, logistics and more. Gojek is founded on the principle of leveraging technology to remove life's daily frictions by connecting consumers to the best providers of goods and services in the market.

The company was first established in 2010 focusing on courier and motorcycle ride-hailing services, before launching its app in January 2015 in Indonesia. Since then, Gojek has grown to become the leading on-demand platform in Indonesia, with additional operations in Vietnam and Singapore. The Gojek platform now comprises over 2.5 million driver partners across the region. Gojek is part of the GoTo Group, the largest digital ecosystem in Indonesia, consisting of Gojek, Tokopedia and GoTo Financial.

Gojek is dedicated to solving the daily challenges faced by consumers, while improving the quality of life for millions of people across Southeast Asia, especially those in the informal sector and micro, small and medium enterprises (MSMEs).

The Gojek application is available for download via iOS and Android.
.........

*IMPORTANT*
Gojek is affiliated to the GoTo Group companies, and all authentic jobs/open positions listed by Gojek can ONLY be accessed via our official channels -- Gojek on LinkedIn, Gojek Tech on LinkedIn, Gojek on Glassdoor, and https://www.gojek.io/careers. In case you are contacted by our Talent Acquisition team, please ensure that the communication is coming from a valid Gojek domain - *****@gojek.com. If you are contacted by any third party outside of the authenticated channels highlighted above, please write to us at ethics@gotocompany.com to validate the job/open position. This is to avoid any potential instances of fraud, and to ensure your safety and security during the job application process.","About The Role

As a senior software engineer, you'll work closely with the company's product, operations, and engineering teams. We value curiosity to explore deeper into the systems, libraries, and tools and look for scalable solutions. Familiarity with Event Driven Architecture would be desired.

You would be tasked with platformization of the Mobility Marketplace as a first-class problem, which requires understanding end-to-end use-cases and challenging the status quo at all times by reviewing current engineering techniques and tools and scouting for opportunities and fundamental engineering changes that would bring agility, reliability to enable more business opportunities.

What You Will Do

Takes responsibility for the entire lifecycle of their stories: development, test, production, and subsequent fixes and improvements
Reaches out to stakeholders to clarify the requirements for the story they are working on
Improves the development experience at Gojek by enhancing development tools, test coverage, and/or code structure
Manages timely delivery for own tasks consistently and actively supports their team in the tracking and reporting of execution metrics both through automation as well as disciplined adherence to processes and best practices
Has an in-depth understanding of at least one programming language and framework
Performs code reviews that follow the standards and practices of the engineering handbook and that are recognized by their team as helpful
Collaborates with other engineers, designers and QAs to flesh out implementation details based on the established pattern in the stream

What You Will Need

4-5 years of relevant experience. Hands-on in either Golang or Java
The ability to go into depth and breadth across tech stack used in the product vis-a-vis backend services, machine learning, data engineering, web development, data and analytics, infrastructure
Has worked on large-scale event-driven microservices architecture with an active use of Kafka and can architect solutions based on this pattern
Is familiar with basic programming principles such as SOLID and TDD
Has intermediate experience with Linux and is able to troubleshoot issues
Understands why we need to test code and has implemented tests
Able to understand/discuss design and performance trade-offs in complex systems

About The Team

We are a team of 4 engineers, focusing on Platform concerns, under the Mobility Marketplace group. Our prime objectives include platformization, and reliability concerns of systems within the marketplace and aim to move towards a composable architecture where new features could be shipped for experimentation by business in a matter of days. We act as a central binding agent for Pricing, Supply, and Matchmaking teams and make sure that the overall architecture and infrastructure is flexible, easily extensible, and scalable.

We keep pondering about how we could improve the availability of the systems by introducing tools to configure and operate clustered solutions. how could we be more agile in on-boarding new use cases to enable opportunities to Mobility Marketplace business? We bounce around ideas and debate with the above themes in mind. Combating remote work has brought us even closer with frequent catch-ups for chit-chat over tea and empathy for each other.

The Marketplace Product Development Team at Gojek handles the hardest quantitative problems related to improving Gojek's real-time marketplace which deeply impacts the everyday experiences of our customers (riders) and drivers.

About GoTo Group

GoTo Group is the largest digital ecosystem in Indonesia with its mission to “Empower Progress’ by offering technological infrastructure and solutions for everyone to access and thrive in the digital economy. The GoTo ecosystem consists of on-demand transportation services, food and grocery delivery, logistics and fulfillment, as well as financial and payment services through the Gojek and GoTo Financial platforms.It is the first platform in Southeast Asia that hosts these crucial cases in a single ecosystem, capturing the majority of Indonesia’s vast consumer household.

About Gojek

Gojek is Southeast Asia’s leading on-demand platform and pioneer of the multi-service ecosystem with over 2.5 million driver partners across the regions offering a wide range of services such as transportation, food delivery, logistics and more. With its mission to create impact at scale, Gojek is committed to resolving consumer problems and raising standards of living by connecting consumers to the best providers of goods and services in the market.

About GoTo Financial

GoTo Financial accelerates financial inclusion through its leading financial services and merchants solutions. Its consumer services include GoPay and GoPayLater and serve businesses of all sizes through Midtrans, Moka, GoBiz Plus, GoBiz, and Selly. With its trusted and inclusive ecosystem of products, GoTo Financial is open to new growth opportunities and aims to empower everyone to Make It Happen, Make It Together, Make It Last.

GoTo and its business units, including Gojek, GoToFinancial and GoToLogistics (""GoTo"") only post job opportunities on our official channels on our respective company websites and on LinkedIn. GoTo is not liable for any job postings or job offers that did not originate from us. You should conduct your own due diligence to prevent being victims of any fake job scams, if they did not originate from GoTo's official recruitment channels."
