id,title,job_url,company,company_link,location,published_at,number_of_applicants_applied,employment_duration,work_location_type,work_experience_level,company_type,company_logo,company_description,about_the_job
3866192036,"Principal Software Engineer, Full Stack (Bangkok based, relocation provided)",https://www.linkedin.com/jobs/view/3866192036,Agoda,https://www.linkedin.com/company/agoda/life,Jakarta Metropolitan Area,,0,,,,,https://media.licdn.com/dms/image/C4D0BAQGBa_7QNZNwpw/company-logo_100_100/0/1656643826660/agoda_logo?e=1721865600&v=beta&t=V_9iYXOC4Z9RgfBtEEdqYoha7IVeGlPKyJA8fk129to,"Agoda is transforming travel for millions of customers across the globe.

Headquartered in Asia, Agoda is one of the world’s largest online travel platforms. Founded in 2005 and now part of Booking Holdings (Nasdaq:BKNG), Agoda has a network of over 2,900,000 properties worldwide. Our web and mobile products provide a first-rate reservation service in 38 languages that uniquely combines local knowledge and local connections to provide the best deals for business and leisure travelers.

Agoda employs over 7,000 professionals from 90 nationalities in locations around the globe. In every department – from engineering to customer experience – we provide an environment rich with creativity, collaboration, and experimentation, and the tools to work faster and smarter.

At Agoda, we believe our people are our strength. We work hard and have fun, and we choose people who are dedicated to making things great.

For properties seeking partnership with Agoda, visit https://connect.agoda.com","About Agoda

Agoda is an online travel booking platform for accommodations, flights, and more. We build and deploy cutting-edge technology that connects travelers with more than 3.6 million accommodations globally. Based in Asia and part of Booking Holdings, our 6,000+ employees representing 90+ nationalities foster a work environment rich in diversity, creativity, and collaboration. We innovate through a culture of experimentation and ownership, enhancing the ability for our customers to experience the world.

 Our Purpose –  Bridging the World Through Travel 

We believe travel allows people to enjoy, learn and experience more of the amazing world we live in. It brings individuals and cultures closer together, fostering empathy, understanding and happiness.

We are a skillful, driven and diverse team from across the globe, united by a passion to make an impact. Harnessing our innovative technologies and strong partnerships, we aim to make travel easy and rewarding for everyone.

Get to Know our Team:

The Full Stack Engineering Department builds the Agoda web and app products. We have several teams in front-end focusing on different aspects of our products including accommodations, flights, payments, marketing, post-booking services, and more. Agoda’s marketplace is the world. We build localized and optimized user experiences at scale on every major internet platform. These include our mobile websites, native apps, and desktop sites. We hire people from around the world who have a passion for using technology to create and implement the best user experiences. Our teams work on the full stack and build end-to-end systems including user interfaces, APIs, backend systems, and database systems. Our products are always evolving and under experimentation. We accomplish this by having an amazing degree of automation, CI/CD systems, and use a modularized approach. As we are data driven and measure our results, we continually innovate and improve our work. We are looking for the next great talent who strives to learn and grow and has a standard of excellence, strong sense of ownership, and great technical skills.

The Opportunity:

Principal Software Engineer plays a pivotal role in our technology organization, collaborating closely with individual contributors and senior leadership. Our Principal engineers are heavily involved in the hiring and mentoring process and the go-to experts who design and implement new systems and components. We are seeking individuals who are passionate about taking on greater responsibilities and driving significant architectural changes at Agoda. It’s expected that our Principal Software Engineers will lead Agoda forward technically by adopting new technologies and setting higher standards.

In this Role, you’ll get to: 

 Maintain ownership and responsibility of mission critical systems 
Be hands on – build high volume platforms using cutting-edge technologies like React and GraphQL
Mentor and coach other software engineers
Be a major contributor to our agile and scrum practices
Design and lead crucial technical projects and initiatives cross teams and departments
Stay on the leading edge of technical know-how, industry trends and drive technical innovations

What you’ll Need to Succeed:

 12+ years of experience building large-scale web applications 
 Expertise in client-side technologies & frameworks (JavaScript/TypeScript, React) and modern server-side technologies (C#, .NET, Kotline, Java) 
 Bachelor’s degree with a preference for Computer Science degree; a master’s degree is preferred. Alternatively, a minimum of 10 years of experience in the relevant field is acceptable 
 Working experience with agile, analytics, A/B testing and/or feature flags, Continuous Delivery, Trunk-based Development 
You love new technologies and approaches and want to use the best tools available. We want people who can help us continually evolve our stack
Great communication and coordination skills
Excellent analytical thinking and problem-solving skills
You have a good command of the English language

It’s Great if you have:

 Knowledge in physical architecture at scale, building resilient, no single point of failures, highly available solutions 
 Knowledge in one or more of the following: NoSQL technologies (Cassandra, ScyllaDB, ElasticSearch, Redis, DynamoDB, etc), Queueing system experience (Kafka, RabbitMQ, SQS, Azure Service Bus, etc.) 
Working Experience with Containers and Dockerization, also K8S is a plus
Knowledge and hands on experience in CI/CD solutions would be a plus
Strong experience in all aspects of client-side performance optimization
Extremely proficient in modern coding and design practices. For example, Clean Code, SOLID principals, and TDD
Experience in multiple front-end platforms including iOS, Android, Web, and API services
Have worked on an app or internet company that is at scale with large numbers of users and transactions per second
Have experience in a data driven company with experience analyzing and working with Big Data
Lead teams and greenfield projects solving large system problems
Worked on global projects serving world markets with distributed data centers and localization of the front end and data

#IT #4 #5

#sanfrancisco #sanjose #losangeles #sandiego #oakland #denver #miami #orlando #atlanta #chicago #boston #detroit #newyork #portland #philadelphia #dallas #houston #austin #seattle #sydney #melbourne #perth #toronto #vancouver #montreal #shanghai #beijing #shenzhen #prague #Brno #Ostrava #cairo #alexandria #giza #estonia #paris #berlin #munich #hamburg #stuttgart #cologne #frankfurt #hongkong #budapest #jakarta #bali #dublin #telaviv #milan #rome #tokyo #osaka #kualalumpur #amsterdam #oslo #manila #warsaw #krakow #bucharest #moscow #saintpetersburg #capetown #johannesburg #seoul #barcelona #madrid #stockholm #zurich #taipei #bangkok #Phuket #istanbul #london #manchester #edinburgh #kiev #hcmc #hanoi #wroclaw #poznan #katowice #rio #salvador

Equal Opportunity Employer 

At Agoda, we pride ourselves on being a company represented by people of all different backgrounds and orientations. We prioritize attracting diverse talent and cultivating an inclusive environment that encourages collaboration and innovation. Employment at Agoda is based solely on a person’s merit and qualifications. We are committed to providing equal employment opportunity regardless of sex, age, race, color, national origin, religion, marital status, pregnancy, sexual orientation, gender identity, disability, citizenship, veteran or military status, and other legally protected characteristics.

We will keep your application on file so that we can consider you for future vacancies and you can always ask to have your details removed from the file. For more details please read our privacy policy .

To all recruitment agencies: Agoda does not accept third party resumes. Please do not send resumes to our jobs alias, Agoda employees or any other organization location. Agoda is not responsible for any fees related to unsolicited resumes."
3814774966,IT DEVELOPER,https://www.linkedin.com/jobs/view/3814774966,Integrasi Logistik Cipta Solusi,https://www.linkedin.com/company/integrasi-logistik-cipta-solusi/life,"Jakarta, Jakarta, Indonesia",,0,,,,,https://media.licdn.com/dms/image/C560BAQFP69qZIkSztA/company-logo_100_100/0/1673054052901?e=1721865600&v=beta&t=LZcvcKlsMcgwW7zxNA_LPQm85wA1lj-o96XSFgx0LSI,"ILCS (Integrasi Logistik Cipta Solusi) is Indonesia leading Digital Seaport and Maritime Logistics Solution company. Subsidiary of PT Pelabuhan Indonesia (Persero). ILCS uniquely placed to undertake Port Logistics Modernisation with utilise Information and Communication Network along with Technologies and Port & Logistics stakeholders. ILCS has solution across 10 port in Indonesia and many to comes and several solution in Electronic Payment, Supply Chain Solution and ICT Implementation, many of which are in collaboration with Logistics, Port, Technology and Financial stakeholder with complementary capabilities.","Key Responsibilities

Develop new web applications or customize existing applications 
Learn new skills needed in the application development process 
Doing problem solving with the team in a project. 

Qualifications, Experience and Skills 

Minimum S1 majoring in Informatics Engineering or Information Systems and other related fields, with 1-2 years work experience 
Required skill(s): PHP / HTML / CSS / PLSQL / JAVASCRIPT / WSDL. 
Have experience in Web Development using MVC Framework 
At least have 1-2 years work experience in the same field. 
Willing to Shifting 
Have strong analytical thinking. 
Have the ability to work in a team. 
Have a desire to learn something new"
3884169338,Fullstack Developer,https://www.linkedin.com/jobs/view/3884169338,FUSE GROUP,https://www.linkedin.com/company/fuse-group-indo/life,"Tanah Abang, Jakarta, Indonesia",,0,,,,,https://media.licdn.com/dms/image/C560BAQEm2lz6YmjqiA/company-logo_100_100/0/1630664191199/fuse_group_indo_logo?e=1721865600&v=beta&t=3zYAdWYYJQg0r0qu7ImOFdOU451csJ3u2nd-9biJR7I,"FUSE is an insurtech platform that connects various insurance products from many insurance companies with multiple distribution means, channels, or partners. We deploy the latest cutting edge technology to make insurance easy and affordable for anyone. Our platform support primarily 3 business models, namely Business-To-Agents/Brokers (B2A), Business-To-Customers (B2C), as well as Micro Insurance (B2B2C).

Our FUSE Pro App is tailor-made for B2A business. This App enables anyone to become an independent insurance consultant to act like an expert; to instantly curate the most suitable and best insurance products for their customers. Our B2B2C model support digital small ticket size insurance products, making insurance affordable for everyone.

FUSE is trusted by channel partners such as Tokopedia, Grab, 30+ insurance companies, along with 100,000+ registered partners. FUSE currently generates more than 2.5 million insurance policies each month.

We have more than 400 teammates, with 24 branches, across 4 countries, we strive to be the #1 insurtech platform in SEA and make insurance available for everyone in the region.","We are currently building the #1 Insurtech in Southeast Asia that helps people to reach insurance in the most efficient way. Therefore we need talent with great potential like you to join this growing organization, learning the right skills and also building great teams to reach our goals.

Responsibilities

Maintained, analyzed, and developed a design system based on user requirements.
Responsible for developing, improving, or maintaining our frontend and backend applications
Developing features to enhance the user experience
Effectively communicate and collaborate with others with our development team to ensure system consistency and to create a great user experience

Qualifications

 Strong understanding of PHP, C#, .Net, ASP.NET, SQL, Git, MySQL, HTML, CSS, JavaScript.
Familiarity with database technology such as MySQL, Oracle, and MongoDB.
Excellent verbal communication skills.
Good problem-solving skills

About FUSE

Fuse is a breakthrough company in the insurance industry. We provide one app for various insurance product types from numerous well-known and trusted insurance companies. We have expanded our business not only in Indonesia but also China and Vietnam, and are planning on an even bigger expansion to grab markets from other Southeast Asia countries.

Our vision is to deploy the latest cutting-edge technology that enables everyone to buy, claim, or sell all kinds of insurances easily and instantly.

Our mission is to be an insurance technology/platform partner that allows all online/offline channel partners to sell multiple insurance products from multiple insurance companies online in real-time.

Fuse is committed not only to make insurance easily available for everyone but also to spread awareness about the importance of having financial plans and protection through insurance.

More About FUSE

FUSE Group LinkedIn

Instagram @lifeatfuse"
3903658856,Dotnet Developer,https://www.linkedin.com/jobs/view/3903658856,Binar Academy,https://www.linkedin.com/company/binar-academy/life,Jakarta Metropolitan Area,,13,,,,,https://media.licdn.com/dms/image/C560BAQEBEZeoowry3A/company-logo_100_100/0/1657875033201/binar_academy_logo?e=1721865600&v=beta&t=ecdp3qVUusf5ULc0YiYeJDO77_zhzxL0SxzJdYtmKOc,"BINAR was born in 2017 to advance Indonesia’s technology ecosystem. Our mission is to solve digital talent gap by upskilling and job matching.

We support people to build a career in digital industry or upskilling into digital related roles with the knowledge and skills needed to thrive through a structured learning journey and multiple learning styles to ensure each learner can reach mastery through their own preferred way.

Our upskilling programs are designed to provide learners with first-hand exposure to the real world and prepare them with skills critically needed by the industries in this fast-changing digital era.

Also, we help students and companies to connect and build great teams.
Fueled by industry change, BINAR for Business helps companies achieve critical business outcomes and stay competitive by offering relevant and personalized learning experiences.

Advance your career, show off your skills, grow your business and get ready to #SelangkahDiDepan with BINAR.

Learn more about us:
Website: www.binaracademy.com
Instagram: @academybinar
Youtube: https://www.youtube.com/binaracademy

BINAR Apps is available on the Google Play store and iOS. Download BINAR app on:
- Apple Store: https://bit.ly/BinarAppsAppStore
- Google Play Store: https://bit.ly/BinarAppsPlayStore","Binar Academy aims to unlock and channel human potential so we can help the world turn into a better place. One of the ways we strive to do that is to channel potential talents to impactful opportunities using our very own job connector, Binar Job Connect.

Binar Job Connect has connected up to 250 talents and candidates; whether it be young and aspirational fresh graduates to tech-savvy team leaders, individuals who decided to start from scratch, and junior engineers to skilled product managers to our experienced hiring partners. Binar Job Connect provides various options for employment, as we intend that everyone processed by us can choose the best career track for them.

We are currently looking for a Dotnet Developer for our hiring partners: Adins and Devshore Partners

Requirements:
Bachelor’s Degree in Computer Science / Information System with GPA > 3,00
Have experience with ASP.NET, C# .NET, SQL Server is preferred
In-depth knowledge of programming for diverse operating systems and platforms using development tools
Excellent understanding of software design and programming principles
Strong passion on IT industry
Understand OOP Concepts is preferred
A team player with excellent communication skills
Self-motivated and good attitude
Have curiosity to explore and learn new things
Fresh graduates and High School graduate are welcome to apply

Job Descriptions:
Developing and implementing web applications
Optimizing web applications
Write clean, testable and maintainable code
Perform unit and integration testing before launch
Conduct functional and non-functional testing

We look forward to seeing your CV!"
3904274542,Software Engineer (Backend) - Consumer Lending,https://www.linkedin.com/jobs/view/3904274542,GoTo Financial,https://www.linkedin.com/company/gotofinancial/life,"Jakarta, Jakarta, Indonesia",,0,,,,,https://media.licdn.com/dms/image/C560BAQHPU9PayrTw7w/company-logo_100_100/0/1630657318517/gotofinancial_logo?e=1721865600&v=beta&t=gX5gaOIsbW9V1cdUh2UtDlA57xdECkn84Xw_SlW532o,"We are GoTo's fintech pillar. Together with @Gojek and @Tokopedia, we are a part of @GoToGroup - Indonesia’s largest technology ecosystem and #TIME100 most influential companies in 2022.

With operations in Indonesia, India, Singapore and Vietnam, together we are accelerating financial inclusion through our leading financial services and merchants solutions. The brand’s trusted and inclusive ecosystem of products is built to open new growth opportunities and empower everyone to realize their dream of a better life in the rapidly expanding digital economy.

Our consumer services include GoPay and GoPayLater, a leading digital wallet and financial services platform. GoTo Financial also serves businesses of all sizes, from Micro, Small and Medium Enterprises (MSMEs) to startups and large corporations, through Midtrans - a leading payment gateway, Moka and GoBiz Plus - the region’s largest POS networks, and GoBiz and Selly - platforms that enable online efficiency and competitiveness.

Read more about #GoToFinancial #unlockingpotential on https://gotofinancial.com/

We are #hiring! Check https://www.gotofinancial.com/en/join-us

============

*IMPORTANT*
GoTo Financial is affiliated to the GoTo Group companies, and all authentic jobs/open positions listed by GoTo Financial can ONLY be accessed via our official channels -- GoTo Financial on LinkedIn, GoTo Financial on Glassdoor, and https://gotofinancial.com/en/join-us. In case you are contacted by our Talent Acquisition team, please ensure that the communication is coming from a valid GoTo Financial domain - *****@gopay.co.id. If you are contacted by any third party outside of the authenticated channels highlighted above, please write to us at ethics@gotocompany.com to validate the job/open position. This is to avoid any potential instances of fraud, and to ensure your safety and security during the job application process.","About The Role

We are looking for an experienced Software Engineer to join our engineering team at GoTo Financial. You will be responsible for designing and building high-performance fintech applications. As a senior engineer, you will work on our flagship products across Goto, including Gojek, GoPay, and Tokopedia, ensuring our millions of users get the best experience.

What You Will Do

Responsible for developing Java backend applications for the company, with proficiency in Java language and expertise in mainstream frameworks such as Spring, Spring Boot, MyBatis and MySQL
Contribute to the full lifecycle of the Middle Platform's core system construction, including requirement analysis, solution design, and iterative system optimization

What You Will Need

Bachelor's degree or above in Computer Science or a related major
4+ years of Java development experience, those with large-scale project development experience are preferred
Familiar with mainstream frameworks like Spring, Spring Boot, and MyBatis
Familiar with Linux operating systems, understand database principles, and proficient in using databases like MySQL and Oracle
Good coding style and code specifications, and be able to independently complete project development
Good communication skills and teamwork spirit, and be able to collaborate effectively with other developers
knowledge of container orchestration technologies like Docker and Kubernetes, and be able to use them for application deployment and management.

About The Team

Our team works to provide responsible and sustainable financial services to millions of Indonesians. Partnering with other teams in Tokopedia and Gojek, we aim to build the best experience for our users looking for a convenient and safe way to access credit. Though we’re spread across Indonesia, India, and Singapore, we enjoy collaborative development with fast feedback cycles and prefer making pragmatic decisions despite working under many business and regulatory constraints. We work in a highly supportive work environment where we never hesitate to help each other out, unblock barriers, and have fun along the way. We love bonding over our catch-up sessions, where we learn about each other's cultures.

About GoTo Group

GoTo Group is the largest digital ecosystem in Indonesia with its mission to “Empower Progress’ by offering technological infrastructure and solutions for everyone to access and thrive in the digital economy. The GoTo ecosystem consists of on-demand transportation services, food and grocery delivery, logistics and fulfillment, as well as financial and payment services through the Gojek and GoTo Financial platforms.It is the first platform in Southeast Asia that hosts these crucial cases in a single ecosystem, capturing the majority of Indonesia’s vast consumer household.

About Gojek

Gojek is Southeast Asia’s leading on-demand platform and pioneer of the multi-service ecosystem with over 2.5 million driver partners across the regions offering a wide range of services such as transportation, food delivery, logistics and more. With its mission to create impact at scale, Gojek is committed to resolving consumer problems and raising standards of living by connecting consumers to the best providers of goods and services in the market.

About GoTo Financial

GoTo Financial accelerates financial inclusion through its leading financial services and merchants solutions. Its consumer services include GoPay and GoPayLater and serve businesses of all sizes through Midtrans, Moka, GoBiz Plus, GoBiz, and Selly. With its trusted and inclusive ecosystem of products, GoTo Financial is open to new growth opportunities and aims to empower everyone to Make It Happen, Make It Together, Make It Last.

GoTo and its business units, including Gojek, GoToFinancial and GoToLogistics (""GoTo"") only post job opportunities on our official channels on our respective company websites and on LinkedIn. GoTo is not liable for any job postings or job offers that did not originate from us. You should conduct your own due diligence to prevent being victims of any fake job scams, if they did not originate from GoTo's official recruitment channels."
3765737223,Front-end Developer (Web),https://www.linkedin.com/jobs/view/3765737223,Sagara Technology,https://www.linkedin.com/company/sagara-asia/life,"Bandung, East Java, Indonesia",,0,,,,,https://media.licdn.com/dms/image/C4E0BAQG4P7fOuax6oQ/company-logo_100_100/0/1631321068847?e=1721865600&v=beta&t=SNeS0aV9Be3kcT5AK2Mlv2e8Io0bWBPkR4x5EiUyRBg,"Sagara Technology is an industry-leading software development proficient in delivering web and mobile IT solutions, outsourced product engineering services, and a digital marketing agency to help enterprises reinvent their objectives for the digital age.

Nine years of implementing more than 150 projects, this experience provides Sagara with a great basis for a thorough understanding of processes at all project development stages. Sagara fulfills to establish complete and stable products of any complexity on the market, irrespective of its purpose.

Indonesia: PT. Sagara Asia Teknologi
Singapore: Sagara Technology Singapore Pte. Ltd","Use markup languages like HTML to create user-friendly web pages 
Maintain and improve website 
Optimize applications for maximum speed 
Design mobile-based features 
Collaborate with back-end developers and web designers to improve usability 
Get feedback from, and build solutions for, users and customers 
Write functional requirement documents and guides 
Create quality mockups and prototypes 
Help back-end developers with coding and troubleshooting 
Ensure high quality graphic standards and brand consistency 
Stay up-to-date on emerging technologies"
