id,title,job_url,company,company_link,location,published_at,number_of_applicants_applied,employment_duration,work_location_type,work_experience_level,company_type,company_logo,company_description,about_the_job
3903633994,Associate - Test Automation Engineer,https://www.linkedin.com/jobs/view/3903633994,DBS Bank,https://www.linkedin.com/company/dbs-bank/life,"Jakarta, Indonesia",,100,,,,,https://media.licdn.com/dms/image/C560BAQGR_4ugVU6t4Q/company-logo_100_100/0/1662951257963/dbs_bank_logo?e=1721865600&v=beta&t=9g-Bn39SMazVUR1SFSae5T3ikOvmov3d7b7x0fj9-uI,"DBS is a leading financial services group in Asia with a presence in 19 markets. Headquartered and listed in Singapore, DBS is in the three key Asian axes of growth: Greater China, Southeast Asia and South Asia. The bank's ""AA-"" and ""Aa1"" credit ratings are among the highest in the world.

Recognised for its global leadership, DBS has been named “World’s Best Bank” by Global Finance, “World’s Best Bank” by Euromoney and “Global Bank of the Year” by The Banker. The bank is at the forefront of leveraging digital technology to shape the future of banking, having been named “World’s Best Digital Bank” by Euromoney and the world’s “Most Innovative in Digital Banking” by The Banker. In addition, DBS has been accorded the “Safest Bank in Asia“ award by Global Finance for 14 consecutive years from 2009 to 2022.

DBS provides a full range of services in consumer, SME and corporate banking. As a bank born and bred in Asia, DBS understands the intricacies of doing business in the region’s most dynamic markets. DBS is committed to building lasting relationships with customers, as it banks the Asian way. Through the DBS Foundation, the bank creates impact beyond banking by supporting social enterprises: businesses with a double bottom-line of profit and social and/or environmental impact. DBS Foundation also gives back to society in various ways, including equipping communities with future-ready skills and building food resilience.

With its extensive network of operations in Asia and emphasis on engaging and empowering its staff, DBS presents exciting career opportunities. For more information, please visit www.dbs.com","Business Function
DBSI T&O is the backbone that supports the bank as the central of operations and technology. With the spirit of OneTeam and PRIDE! Value, we serve Institutional Banking Operations and Consumer Banking Operations, manage Customer Centre and IT, provide Group Procurement and Corporate Real Estate, coordinate bank-wide Business Continuity Management program and framework, and deliver service quality for Digibank and IBG/GTS. Our Technology & Operations organization is a vital strategic partner to the business in providing competitive advantage that propels DBSI towards being the Best Bank for a Better World (#B3W).
 Requirements:
Strong analytic skills to process complex requirement to come up with end to end scenarios and test cases
Familiar with Agile methodology, and understand the life cycle of testing in both automated and manual testing
Have experience in running or being part of an agile project team in banking industry
Experience in API testing and working on JIRA, Jenkins, Dockers etc.
Solid coding background in Java, Objective-C, JavaScript or similar with at least 3yrs of experience.
Experience with at least one of the following technologies: Cucumber, Appium, Selenium, XCode UI Automation, Espresso, (mobile testing tools and frameworks).
Experience with basic UNIX commands and working knowledge on LINUX flavor.
Hands-on experience tool like and SOAP UI, REST API.
Possess working knowledge on Bit Bucket etc. (Anything apart from Bitbucket are good to have).
Keen focus on quality output in software development
Strong knowledge on Appium, Selenium, JUNIT.
Strong coding knowledge in Java, Objective-C, JavaScript or similar.
Good experience in developing complex SQL queries.
Knowledge of SOAP UI and web service testing is a plus.
Knowledge of basic UNIX Commands and ability to work with Linux flavor.
GIT commands and their usage.
At least 3 years of working experience(s) preferably in Web and Mobile Banking solutions
 Responsibilities:
Advocate the quality culture in cross-functional teams and make sure that the best practices are followed.
Design, develop, execute and maintain test cases, for our Android and iOS applications , web browsers and REST API across different digital platform offerings.
Establish testing as an integral part of the development process within cross-functional teams.
Develop maintainable automated checks in collaboration with our development teams.
Proactively suggest improvements in testing tools for better test coverage.
Detect and report defects and close follow up to ensure closure of issues.
Use exploratory testing techniques to discover and prevent issues.
Assess and bring improvements to the quality of our applications and services"
3905699226,Back End Developer,https://www.linkedin.com/jobs/view/3905699226,PT Sahabat Mikro Fintek,https://www.linkedin.com/company/sahabatmikrofintek/life,"South Jakarta, Jakarta, Indonesia",,57,,,,,https://media.licdn.com/dms/image/C510BAQFBInhji0QlRg/company-logo_100_100/0/1630627059029?e=1721865600&v=beta&t=WDGv2bXoHI-RSAOXer37wP0FEkUMkQ26uEYNTwKOxpc,"PT Sahabat Mikro Fintech is a leading financial technology company that leverages cutting-edge technology to provide innovative financial solutions to Society.

Vision :
""To become a fintech company that can have an impact on the economy and the welfare of society.""

Mission :
""Increasing the welfare of society by making it easier for people to access the financial world.""","What will you do:
As a Backend Developer, you will be responsible for designing and developing efficient and scalable APIs and services to power our mobile applications. You will work closely with the Frontend Developers, Product Managers, and other stakeholders to understand their requirements and implement them into production-ready code. Your work will be critical in providing high-quality and reliable services to our users.

Job Description :
Collaborate with designers and IT team members to create and maintain the user interface of our digital products, including web and mobile applications.
Use front-end programming languages such as HTML, CSS, and JavaScript to develop user-friendly interfaces.
Develop and maintain coding standards and guidelines for user interface development.
Conduct user research to understand user behavior and preferences to inform interface design decisions.
Ensure that the user interface is accessible to all users, including those with disabilities.
Troubleshoot and debug issues with the user interface as needed.

Job Qualifications :
Bachelor's degree in Computer Science, Engineering or a related field.
Proven experience as a Backend Developer or similar role, with a minimum of 3 years of experience.
Strong knowledge of server-side programming languages such as Java, Python, Ruby, or Node.js.
Strong knowledge of framework spring boot. 
Experience with SQL and NoSQL databases such as PostgreSQL, MongoDB, or Redis.
Familiarity with cloud computing platforms such as AWS or Google Cloud Platform.
Experience with software development tools such as Git, Docker, and Kubernetes.
Strong problem-solving skills and attention to detail.
Excellent communication and collaboration skills.

Key Performance Indicators :
Delivery of high-quality, scalable, and reliable backend services.
Meeting project deadlines and milestones.
Continuous improvement of the backend systems' performance and scalability.
Active participation in team meetings and collaboration with other developers and stakeholders.
Keeping up-to-date with the latest technologies and trends in backend development"
3903671108,Back End Developer,https://www.linkedin.com/jobs/view/3903671108,PT Prodia Widyahusada Tbk,https://www.linkedin.com/company/pt-prodia-widyahusada-tbk/life,"Central Jakarta, Jakarta, Indonesia",,100,,,,,https://media.licdn.com/dms/image/D560BAQH0uv8tWWP9mg/company-logo_100_100/0/1704160839653/pt_prodia_widyahusada_tbk_logo?e=1721865600&v=beta&t=fG1Zc8pHOtiHojloNMPJ2PzucBukDfyWC3WZryds070,"Prodia Clinical Laboratory was established in Solo on May 7th, 1973 by a number of pharmacy-based scientists. Since the very beginning, Drs. Andi Wijaya and other founders have been consistent in holding Prodia's commitment on presenting better diagnostics with wholehearted service. This commitment led Prodia to become the best & largest clinical laboratory and to be a National Referral Laboratory in Indonesia.

The theme 'Love for Quality' was coined in 2009 as an internal tagline to inspire all employees in delivering services to our valuable customers. 'Love for Quality' is the representation of our continuous improvements based on the passion to present excellent services. Prodia believes that love and loyal customers are inseparable unity.

Mission
- Providing better diagnoses
- For those who join Prodia

Vision
- Transforming toward a reliable Next Generation Health Care
- To become a Center of Excellence

Philosophy
- Customer-oriented
- Quality as a way of life
- Keeping business and science balance
- Enhancing the 'Spirit of Prodia'
- Showing a positive mental attitude
- High performing teams
- Transparency, open-mindedness
…
show more","Minimum Qualifications and Experience:
Bachelor's degree of Informatics Engineering/Computer Engineering/Information System, Min GPA 3.00 (scale 4.00)
Have a minimum of 1-2 years experience as a Java Backend Developer.
Have a good understanding of Java, OOP, and design patterns.
Have experience with Java frameworks such as Spring Boot, Spring MVC, Hibernate, and JPA.
Have experience with databases such as MySQL, PostgreSQL, and MongoDB.
Have experience with APIs and RESTful architecture.

Job Description:
Develop back-end web and/or mobile applications that is reliable, scalable, and secure.
Ensures well-structured back-end code, easily understandable, and easy to test.
Meets company quality, safety and style standards for code.
Collaborate with other teams to ensure back-end integrates well with front-end and infrastructure other.
Keep up with the latest developments in the back-end development."
3902167762,Fullstack Developer,https://www.linkedin.com/jobs/view/3902167762,Moneta Pembayaran Teknologi,https://www.linkedin.com/company/moneta-pembayaran-teknologi/life,"South Jakarta, Jakarta, Indonesia",,100,,,,,https://media.licdn.com/dms/image/D560BAQFnKq8ajfxksQ/company-logo_100_100/0/1664355920143?e=1721865600&v=beta&t=J8Y3wvQVyVzslAnKViLmn0xB1abfArzcUyldwax9y70,"MonetaPay provides a solution for aggregating multiple payment methods
supporting most of the bank channels in the Indonesian local market and the local mainstream electronic wallets and other payment methods.","Key Responsibilities:

Design, develop, and maintain end-to-end software solutions, from front-end to back-end.
Collaborate with product managers, designers, and other stakeholders to gather requirements, define project scope, and propose technical solutions.
Develop responsive and user-friendly web interfaces using modern front-end technologies such as HTML5, CSS3, JavaScript, and frameworks like React, Angular, or Vue.js.
Build robust and scalable back-end systems using server-side languages such as Node.js, Python, or Java, along with frameworks like Express, Django, or Spring.
Design and implement RESTful APIs for seamless integration between front-end and back-end systems.
Write clean, well-documented, and maintainable code following best practices and coding standards.
Perform code reviews, testing, debugging, and troubleshooting to ensure software quality and reliability.
Work closely with DevOps and infrastructure teams to deploy and manage applications in cloud environments (e.g., AWS, Azure, or Google Cloud Platform).
Stay updated on emerging technologies, trends, and best practices in full-stack development and propose innovative solutions to improve our development processes and products.
Collaborate with team members through agile methodologies such as Scrum or Kanban to deliver features and enhancements on time and with high quality.

Qualifications:
Bachelor's degree in Computer Science, Engineering, or related field; or equivalent work experience.
Proven experience as a Full Stack Developer or similar role, with a strong portfolio of projects demonstrating proficiency in both front-end and back-end development.
Proficiency in front-end technologies such as HTML5, CSS3, JavaScript, and modern JavaScript frameworks (e.g., React, Angular, Vue.js).
Solid understanding of server-side programming languages (e.g., Node.js, Python, Java) and related frameworks.
Experience designing and implementing RESTful APIs and integrating third-party APIs.
Familiarity with database technologies such as SQL (e.g., MySQL, PostgreSQL) and NoSQL (e.g., MongoDB, Cassandra).
Experience with version control systems (e.g., Git) and collaborative development workflows.
Strong problem-solving skills and attention to detail.
Excellent communication and collaboration skills.
Ability to work effectively in a fast-paced, dynamic environment and adapt to changing priorities."
3904624829,NodeJs Developer (Level Junior),https://www.linkedin.com/jobs/view/3904624829,Skyshi Digital Indonesia,https://www.linkedin.com/company/skyshidigital/life,Greater Yogyakarta,,52,,,,,https://media.licdn.com/dms/image/C4D0BAQG53iZ3xGAitQ/company-logo_100_100/0/1630490506822/skyshi_digital_indonesia_logo?e=1721865600&v=beta&t=kM6QkbIRtX2hVX-7XCgSUIQB63eCbO4RjFeeRJvMR4Y,"Leading Software Engineers to Scale Up Your Tech Business to Speed Up Tech Development Deliverables.

Get leading software engineers on a contract basis with our service. Our team of experienced professionals will work with your company to develop and execute a successful technology strategy.","Requirement:

Pengalaman dalam pengembangan aplikasi Node.js minimal 1-2 tahun.
Pemahaman yang kuat tentang JavaScript, HTML, dan CSS.
Kemampuan untuk bekerja dengan database relasional (MySQL, PostgreSQL) dan NoSOL (MongoDB).
Pengalaman dengan kerangka kerja Node.js seperti Express.js.
Keahlian dalam pengelolaan alur kerja pengembangan menggunakan alat seperti Git.
Kemampuan komunikasi yang baik dan kemampuan bekerja dalam tim.
Hybrid Jogja"
3695205286,"IT Developer (Java, NET, Reactjs, Android, etc)",https://www.linkedin.com/jobs/view/3695205286,PT. Astra Graphia Information Technology (AGIT),https://www.linkedin.com/company/pt-astra-graphia-information-technology/life,"Jakarta, Indonesia",,0,,,,,https://media.licdn.com/dms/image/D560BAQFPU9lYt9Osiw/company-logo_100_100/0/1691028661547/pt_astra_graphia_information_technology_logo?e=1721865600&v=beta&t=bOoD_RJpwC5UNUH_lg9WDpk9yryyT9yM6Q54Zc0Ceo0,"AGIT is a Digital Service Provider, provides one stop Solution on Digital Services, both in on-premise and cloud infrastructure model. We bring the concept of digitize things (digitize everything), to help and to assist our customers in performing their digital transformation through the implementation on digital technology & digital solutions.

Since 1983, AGIT is part of PT Astra International Tbk Group, a conglomeration company in Indonesia that currently has 238 subsidiaries and affiliate companies with 7 line of businesses.

We have four main pillars in our Digital Solution Portfolios that cover the entire journey required to conduct digital transformation as follow:

1. Digital Strategy
It is a consultancy services to help our customer to formulize digital strategy, develop digital roadmap, and define their digital priorities. Basically this is the first step that has to be done by company to start its digital transformation journey

2. Digital ICT Foundation
This solution is to provide basic ICT infrastructure that becomes the foundation prior to the customer enter into digital world.
• Next Generation Infrastructure
• Enterprise Business Application
• Managed Operation Services

3. Digital Platform
To establish digital technology platform to enable digital services

AGIT focus in 4 digital technology platform:
i. Big Data & Analytics Platform including data management, data modeling, data visualization & machine learning
ii. Internet of Things & Automation Platform, including sensors, video analytics, tracking monitoring
iii. Cloud Platform, including private, public and hybrid cloud
iv. Security Platform

4. Digital Services
To provide digital services in the area of Business Process, on 4 major/critical business process in Digital Transformation:
• Customer Engagement & Customer Experiences
• Finance & Supply Chain
• Logistics & Distribution
• Talent Management & Workforce Productivity",This job is sourced from a job board. Learn More
3883810148,Full Stack Developer,https://www.linkedin.com/jobs/view/3883810148,1ENGAGE,https://www.linkedin.com/company/1engage/life,"Jakarta, Indonesia",,100,,,,,https://media.licdn.com/dms/image/D560BAQG9rr89JvSzxg/company-logo_100_100/0/1695266072985/1engage_logo?e=1721865600&v=beta&t=zA7UIyGd9NA6bFauaFFwjbzdglvL5qV91_gknj-dk7U,"1ENGAGE is the pioneer of integrated data platform and service that delivers tailored engagement solutions through conversational approach. We are a Global Business Service Provider and the fastest-growing entity of its kind in Indonesia that serves businesses of all sizes.

Our forte lies in our platform capability to generate awareness, winning the leads, up to converting them to loyal customers using WhatsApp conversational marketing data. Additionally, 1ENGAGE excels as a Marketing Campaign Agency, specializing in targeted campaign management services that drive exceptional marketing results.

Build lasting connections and achieve impactful results with 1ENGAGE.","Company Description
1ENGAGE is a Global Business Service Provider and the fastest-growing entity in Indonesia, specializing in tailored engagement solutions through conversational marketing. Our integrated data platform helps businesses of all sizes generate awareness, win leads, and convert them into loyal customers using WhatsApp. We also excel as a Marketing Campaign Agency, delivering exceptional results through targeted campaign management services. Join us and build lasting connections while achieving impactful results.

Role Description
Collaborate with cross-functional teams to understand project requirements and deliver high-quality solutions.
Write clean, maintainable, and well-documented code following coding standards and best practices.
Implement and maintain unit tests and integration tests to ensure code quality and reliability.
Participate in Agile/Scrum development processes, including sprint planning, daily stand-ups, and retrospectives.
Participate in code reviews, providing constructive feedback and maintaining code quality standards.

Requirements
3+ years of experiences as Fullstack Engineer
2+ years of experiences programming in Typescript
Familiarity using Antdesign library
Experienced using NextJs
Experienced creating Frontend Unit testing using Jest
Understand how to use server-side CSS
Experienced in Agile/Scrum development
Extensive knowledge in using RESTful and GraphQL"
3871466005,Android Developer,https://www.linkedin.com/jobs/view/3871466005,Wipro,https://www.linkedin.com/company/wipro/life,"Jakarta, Indonesia",,100,,,,,https://media.licdn.com/dms/image/D4E0BAQEkfMUEE4caDQ/company-logo_100_100/0/1698887191930?e=1721865600&v=beta&t=kPkiXL-AfYMjGpAGHzQVPh0kRZm_UPRsXbo3rV4Zkz8,"Wipro Limited (NYSE: WIT, BSE: 507685, NSE: WIPRO) is a leading technology services and consulting company focused on building innovative solutions that address clients’ most complex digital transformation needs. Leveraging our holistic portfolio of capabilities in consulting, design, engineering, and operations, we help clients realize their boldest ambitions and build future-ready, sustainable businesses. With nearly 245,000 employees and business partners across 65 countries, we deliver on the promise of helping our clients, colleagues, and communities thrive in an ever-changing world.
Wipro is an Equal Employment Opportunity employer and makes all employment and employment-related decisions without regard to a person's race, sex, national origin, ancestry, disability, sexual orientation, or any other status protected by applicable law.","Android Developer Skill set:
  Must have 3 to 8 years of technology experience
Hands on in Android Development
Must have experience in working in end-to-end delivery
Must have experience in delivering complex projects in a cross-geography setup
Understanding of test and build automation frameworks mobile front-ends
Build Dev Ops culture within the delivery cells
Hands-on experience with multiple CI/CD tools
Strong Problem-Solving skills and ability to solve unstructured problem and challenge status quo
Ability to work along with team distributed across geographies
Render consulting and technical support services on project implementation to the project team
Explain technical issues and IT solution strategies to stakeholders and other IT professionals
Experienced in Agile methodology
Proactive and able to work under pressure, strong problem-solving skills and positive “can do” attitude
Experience in Bank / Financial Institution Systems would be favourable
Should be well versed with Sonar, Code smells, Code coverage
Good understanding of Unit testing and TDD
Should be able apply Design patterns
Should be well versed with GIT workflow and commands/operations
Should be good with Exception Handling
Should know how on Security Aspects
Familiarity with RESTful APIs to connect Android applications to back-end services
Strong knowledge of Android UI design principles, patterns, and best practices, Material Design
Good knowledge of Android SDK, different versions of Android, and how to deal with different screen sizes
Should be Well versed with 
Activity, Fragments
Layouts, Views
MVVM
Managing Intents, App Permissions
Models
SQL Lite
Obfuscation tools
AAR"
