id,title,job_url,company,company_link,location,published_at,number_of_applicants_applied,employment_duration,work_location_type,work_experience_level,company_type,company_logo,company_description,about_the_job
3903623196,Senior SDET - Money Management,https://www.linkedin.com/jobs/view/3903623196,GoTo Financial,https://www.linkedin.com/company/gotofinancial/life,"Jakarta, Jakarta, Indonesia",,0,,,,,https://media.licdn.com/dms/image/C560BAQHPU9PayrTw7w/company-logo_100_100/0/1630657318517/gotofinancial_logo?e=1721865600&v=beta&t=gX5gaOIsbW9V1cdUh2UtDlA57xdECkn84Xw_SlW532o,"We are GoTo's fintech pillar. Together with @Gojek and @Tokopedia, we are a part of @GoToGroup - Indonesia’s largest technology ecosystem and #TIME100 most influential companies in 2022.

With operations in Indonesia, India, Singapore and Vietnam, together we are accelerating financial inclusion through our leading financial services and merchants solutions. The brand’s trusted and inclusive ecosystem of products is built to open new growth opportunities and empower everyone to realize their dream of a better life in the rapidly expanding digital economy.

Our consumer services include GoPay and GoPayLater, a leading digital wallet and financial services platform. GoTo Financial also serves businesses of all sizes, from Micro, Small and Medium Enterprises (MSMEs) to startups and large corporations, through Midtrans - a leading payment gateway, Moka and GoBiz Plus - the region’s largest POS networks, and GoBiz and Selly - platforms that enable online efficiency and competitiveness.

Read more about #GoToFinancial #unlockingpotential on https://gotofinancial.com/

We are #hiring! Check https://www.gotofinancial.com/en/join-us

============

*IMPORTANT*
GoTo Financial is affiliated to the GoTo Group companies, and all authentic jobs/open positions listed by GoTo Financial can ONLY be accessed via our official channels -- GoTo Financial on LinkedIn, GoTo Financial on Glassdoor, and https://gotofinancial.com/en/join-us. In case you are contacted by our Talent Acquisition team, please ensure that the communication is coming from a valid GoTo Financial domain - *****@gopay.co.id. If you are contacted by any third party outside of the authenticated channels highlighted above, please write to us at ethics@gotocompany.com to validate the job/open position. This is to avoid any potential instances of fraud, and to ensure your safety and security during the job application process.","About the Role:

As a QA engineer —you would need to be able to execute and implement the test strategy for manual as well as automation by working closely with the product engineering group. They would also work on the latest cutting-edge internet/software technology.

We are looking for passionate individuals who want to make a difference in the world, have a strong will of constant learning and development, are open and collaborative, and never stop striving to improve and develop both themselves and the products they are responsible for. Here at GTF, we want to share our passion in building the best products using amazing technology while having great fun doing it.

What you’ll do

Attend daily standup meetings, do sprint planning/backlog reviews, communicate project/development status to internal and external teams in a timely fashion
Analyze and estimate product features defined by Product Manager/Product Owner from testing point of view
Build, contribute and maintain automated test suites and frameworks on App and API utilizing Java/JavaScript or similar
Ability to understand product feature requirements and test them effectively
Ability to work on Functional, automation testing for Web, API’s, and mobile apps both Android and iOS
Work with Business, Product, and Dev teams in close coordination
Well-versed with Agile methodology, SDLC and STLC

What you’ll need

Preferably 4-6+ years of experience in professional testing in /API/Web using RestAssured with Java, Appium (Android & iOS) or Selenium or similar frameworks where the experience in service virtualization / WebServices-API testing through POSTMAN or any similar tool
Basic knowledge of Java, test Parallelisation (API and App), CrossBrowser coverage, Selenium with Java, Reporting Plugin i.e. Allure, Extent.
Hands-on experience with Selenium, Intellij and TestNG
Agile / Scrum / Kanban experience Soft Skills and able to work and communicate with cross-functional teams
Experience in CI/CT using Jenkins or similar continuous integration, release and change management tools i.e GIT or similar GitLab
Good analytical, problem solving and debugging skills

About Our Team

Consumer Payments is part of GoTo’s financial services arm. Our team works to provide responsible and sustainable financial services to our users. We operate with the fundamental belief that financial inclusion can unlock the doors to a better quality life, both in the present as well as in the long term.

We are responsible for building and growing the customers and payments made through GoPay . GoPay is South East Asia’s fastest-growing consumer payments and financial services app and serves tens of millions registered users on a variety of payment avenues, providing the most convenient payment methods in South East Asia.

As part of the Money Management team, you will be responsible for delivering essential financial solutions to help grow GoPay users. Beside the fully homemade features, the team is also working in-depth integration with bank partners.

About GoTo Group

GoTo Group is the largest digital ecosystem in Indonesia with its mission to “Empower Progress’ by offering technological infrastructure and solutions for everyone to access and thrive in the digital economy. The GoTo ecosystem consists of on-demand transportation services, food and grocery delivery, logistics and fulfillment, as well as financial and payment services through the Gojek and GoTo Financial platforms.It is the first platform in Southeast Asia that hosts these crucial cases in a single ecosystem, capturing the majority of Indonesia’s vast consumer household.

About Gojek

Gojek is Southeast Asia’s leading on-demand platform and pioneer of the multi-service ecosystem with over 2.5 million driver partners across the regions offering a wide range of services such as transportation, food delivery, logistics and more. With its mission to create impact at scale, Gojek is committed to resolving consumer problems and raising standards of living by connecting consumers to the best providers of goods and services in the market.

About GoTo Financial

GoTo Financial accelerates financial inclusion through its leading financial services and merchants solutions. Its consumer services include GoPay and GoPayLater and serve businesses of all sizes through Midtrans, Moka, GoBiz Plus, GoBiz, and Selly. With its trusted and inclusive ecosystem of products, GoTo Financial is open to new growth opportunities and aims to empower everyone to Make It Happen, Make It Together, Make It Last.

GoTo and its business units, including Gojek, GoToFinancial and GoToLogistics (""GoTo"") only post job opportunities on our official channels on our respective company websites and on LinkedIn. GoTo is not liable for any job postings or job offers that did not originate from us. You should conduct your own due diligence to prevent being victims of any fake job scams, if they did not originate from GoTo's official recruitment channels."
3835797608,DevOps Engineer - Senior or Manager Consultant,https://www.linkedin.com/jobs/view/3835797608,EY,https://www.linkedin.com/company/ernstandyoung/life,"Gambir, Jakarta, Indonesia",,0,,,,,https://media.licdn.com/dms/image/C510BAQGpRhkpxp5A9A/company-logo_100_100/0/1630570672166/ernstandyoung_logo?e=1721865600&v=beta&t=xMGm8LHbRPDavr4p6zLDWD6WjLk6Rl8MA6QVkkLQFfE,"EY exists to build a better working world, helping create long-term value for clients, people and society and build trust in the capital markets.

Enabled by data and technology, diverse EY teams in over 150 countries provide trust through assurance and help clients grow, transform and operate.

Working across assurance, consulting, law, strategy, tax and transactions, EY teams ask better questions to find new answers for the complex issues facing our world today.

Find out more about the EY global network http://ey.com/en_gl/legal-statement","About EY:

EY, a global leader operating in more than 150 countries delivers unparalleled service in Consulting and assists clients to transform and upskill their capabilities.

We serve our clients to build a better working world, helping them to create long-term value for people and society and build trust in the capital markets. That starts with a culture that believes in giving you the training, opportunities, and creative freedom to make things better. Whenever you join, however long you stay, the exceptional EY experience lasts a lifetime. And with a commitment to hiring and developing the most passionate people, we work towards our ambition to be the best employer.

EY advises clients to understand, architect, select and implement bleeding-edge solutions required to efficiently run their businesses, with a focus on Digital and Cloud. These service areas span E-commerce, Solution Architecture, Mobile Applications, Digital Platform Architecture, Digital Technology Strategy, and Digital IT Operations.

The exceptional EY experience. It’s yours to build.

The opportunity:

The Digital & Emerging Technology team works collaboratively with clients to transform their business through disruptive innovation enablement and transformational design solutions. The team supports our clients in modernizing systems, processes and products to enhance business and customer-facing platforms and services to support high performance in a rapidly changing and competitive environment. Our team helps clients sustain competitive advantage and profitability by developing technology strategies, products, and solutions to stay ahead of the rapid pace of change and disruption and supporting the execution of complex transformations.

We are looking for DevOps Engineers with Full-Stack experience who have worked with modern software solutions including node.js, REST APIs, and cloud-based Solutions. While our teams primary focus is within the financial services industries, you will have opportunities to support other sectors including healthcare, automotive, high-tech, and media.

Your key responsibilities: 

The goal is to support our clients to transform their business through technology. As a DevOps Engineer you will be responsible for designing, developing, and maintaining infrastructure automation in multi-cloud ecosystem to support development operation.

Requirements: 

Bachelor's degree (Computer Science, Computer Engineering or Mathematics) or related experience
3+ years of Development experience, 3+ years of DevOps experience
Ability to build infrastructure as code - IaaS (terraform, cloud formation, ansible, pulumi)
Ability to automate tasks from infrastructure creation to software build artifacts to multi-system complex deployment pipelines (scripting, CI/CD, Jenkins, deployment orchestration)
Hands on experience working within Enterprise grade frameworks (.net framework, java, golang, python development or other core programming languages)
Understanding of multiple DBMS an its features
Strong understanding of Azure, AWS, or GCP PaaS solutions
Experience with microservices and containerization
Command line, shell scripting and some Linux scripting required
Solid understanding of best practices around branching, repo, code management
An understanding of monitoring, alerting and logging on high availability systems
An understanding of DevOps best practices and implementing them

Ideally, you must have a:

Prior consulting experience relevant to industry-specific business and technology functions
Prior consulting experience highly preferred

What we look for 

We’re interested in passionate individuals with a strong vision and a desire to stay on top of trends. If you have a genuine passion for helping businesses achieve their full potential, then these role(s) are for you. 

What We Offer

Continuous learning: You’ll develop the mindset and skills to navigate whatever comes next
Success as defined by you: We’ll provide the tools and flexibility, so you can make a meaningful impact, on your way
Transformative leadership: We’ll give you the insights, coaching, and confidence to be the leader the world needs
Diverse and inclusive culture: You’ll be embraced for who you are and empowered to use your voice to help others find theirs

If you can demonstrate that you meet the criteria above, please contact us as soon as possible.

EY is an equal opportunity, affirmative action employer providing equal employment opportunities to applicants and employees without regard to race, color, religion, age, sex, sexual orientation, gender identity/expression, national origin, protected veteran status, disability status, or any other legally protected basis, including arrest and conviction records, by applicable law.

EY is committed to providing reasonable accommodation to individuals with special needs. If you are a qualified individual with special needs and need assistance applying online or need to request an accommodation during the interview process, please speak to our HR executives, and we will be happy to help you."
