id,title,job_url,company,company_link,location,published_at,number_of_applicants_applied,employment_duration,work_location_type,work_experience_level,company_type,company_logo,company_description,about_the_job
3886627447,"Computer Vision – Senior Engineer (Bangkok based, relocation provided)",https://www.linkedin.com/jobs/view/3886627447,Agoda,https://www.linkedin.com/company/agoda/life,"Bali, Indonesia",,0,,,,,https://media.licdn.com/dms/image/C4D0BAQGBa_7QNZNwpw/company-logo_100_100/0/1656643826660/agoda_logo?e=1721865600&v=beta&t=V_9iYXOC4Z9RgfBtEEdqYoha7IVeGlPKyJA8fk129to,"Agoda is transforming travel for millions of customers across the globe.

Headquartered in Asia, Agoda is one of the world’s largest online travel platforms. Founded in 2005 and now part of Booking Holdings (Nasdaq:BKNG), Agoda has a network of over 2,900,000 properties worldwide. Our web and mobile products provide a first-rate reservation service in 38 languages that uniquely combines local knowledge and local connections to provide the best deals for business and leisure travelers.

Agoda employs over 7,000 professionals from 90 nationalities in locations around the globe. In every department – from engineering to customer experience – we provide an environment rich with creativity, collaboration, and experimentation, and the tools to work faster and smarter.

At Agoda, we believe our people are our strength. We work hard and have fun, and we choose people who are dedicated to making things great.

For properties seeking partnership with Agoda, visit https://connect.agoda.com","About Agoda

Agoda is an online travel booking platform for accommodations, flights, and more. We build and deploy cutting-edge technology that connects travelers with more than 3.6 million accommodations globally. Based in Asia and part of Booking Holdings, our 6,000+ employees representing 90+ nationalities foster a work environment rich in diversity, creativity, and collaboration. We innovate through a culture of experimentation and ownership, enhancing the ability for our customers to experience the world.

 Our Purpose –  Bridging the World Through Travel 

We believe travel allows people to enjoy, learn and experience more of the amazing world we live in. It brings individuals and cultures closer together, fostering empathy, understanding and happiness.

We are a skillful, driven and diverse team from across the globe, united by a passion to make an impact. Harnessing our innovative technologies and strong partnerships, we aim to make travel easy and rewarding for everyone.

Agoda is an online travel booking platform for accommodation, flights, and more. We build and deploy cutting edge technology that connects travelers with more than 2.5 million accommodations globally. Based in Asia and part of Booking Holdings, our 4,000+ talents coming from 90+ different nationalities foster a work environment rich in diversity, creativity, and collaboration. We innovate through a culture of experimentation and ownership, enabling our customers to experience the world.

Get to Know Our Team

The Engineering department oversees all Agoda’s ML and software related requirements. Our goal is to enable and increase Agoda’s business through creative approaches and the implementation of powerful resources such as operational and analytical databases, ML driven solutions, queue systems and data monitoring tools. We hire the brightest minds from around the world to take on this challenge and equip them with the knowledge and tools that contribute to their personal growth and success while supporting our company’s culture of diversity and experimentation. The role the engineering team plays at Agoda is critical as business users, product managers, and many others rely on us to empower their decision making. We are equally dedicated to our customers by improving their search experience with faster results and protecting them from any fraudulent activities. Data is interesting only when you have enough of it, and we have plenty. This is what drives up the challenge as part of the ML engineering squad, but also the reward. We work across structured and non-structured data at scale. For example, our current ML models process millions of images every day to try and enhance the experience that our users get from our app.

Why Agoda Engineering Team (ML role)?

Our engineering teams are at the intersection of business analytics, ml engineering, data warehousing and software engineering. Our job involves dealing with distributed systems, stream processing, ml modeling and computation at tens of PB Scale. We focus on software engineering related to data replication, storage, centralized computation, and Data API’s. By providing our users with ML products/tools, shared frameworks, and ML services, we enable our company to validate strategic decisions, make smarter choices, and react to the fast-changing world. We are a small but passionate team with people from different nationalities working together on a single goal.

In this Role, you will get to:

 Lead the team technically in improving scalability, stability, accuracy, speed and efficiency of our existing ML systems and processes.
 Build, administer and scale ML processing pipelines.
 Be comfortable navigating the following technology stack: Python3, Pyspark, scripting (Bash/Python), Hadoop, SQL, S3 etc.
 Should be able to understand internals of ML models such as Random Forest, CNN, Regression models, etc
 Design, build, test and deploy new libraries, frameworks or full systems for our core systems while keeping to the highest standards of testing and code quality.
 Work with experienced engineers and product owners to identify and build tools to automate many large-scale data management / analysis tasks.
 We believe in end-to-end ownership; this role will involve taking ML models to production at a scale.

What You’ll need to Succeed:

 Bachelor’s degree in computer science /information systems/engineering/related field
 8+ years of experience in software engineering with a minimum of 4+ years in ML
 Good experience in Pyspark
 Expert level understanding of Python with design patterns and object-oriented programming.
 Experience debugging and reasoning about production issues is desirable.
 A good understanding of data architecture principles preferred.
 Any other experience with Big Data technologies / tools
 SQL experience
 Analytical problem-solving capabilities & experience.
 Systems administration skills in Linux
 A strong engineering driven mindset will be required to succeed in this role.

It’s great if you have:

 Good understanding of Hadoop ecosystems
 Experience working with Open-source products
 Experience with Scala development
 Working in an agile environment using test driven methodologies

#telaviv #jerusalem #IT #ENG #4 #sanfrancisco #sanjose #losangeles #sandiego #oakland #denver #miami #orlando #atlanta #chicago #boston #detroit #newyork #portland #philadelphia #dallas #houston #austin #seattle #sydney #melbourne #perth #toronto #vancouver #montreal #prague #Brno #Ostrava #cairo #alexandria #giza #estonia #paris #berlin #munich #hamburg #stuttgart #cologne #frankfurt #budapest #bali #dublin #telaviv #milan #rome #venice #florence #naples #turin #palermo #bologna #osaka #malta #amsterdam #oslo #warsaw #krakow #alrayyan #riyadh #jeddah #mecca #medina #singapore #seoul #barcelona #madrid #stockholm #zurich #taipei #tainan #taichung #kaohsiung #bangkok #Phuket #istanbul #london #manchester #edinburgh #hcmc #hanoi #lodz #wroclaw #poznan #katowice #rio #salvador #newdelhi #bangalore #bandung #yokohama #nagoya #okinawa #fukuoka #jerusalem #IT #4 #bangalore #delhi #hyderabad #pune #singapore #beijing #shanghai #shenzhen #tokyo #seoul #hongkong #taipei #kualalumpur #jakarta #hochiminh #hochiminhcity #manila #instanbul #makati #dubai #riyadh #gurgaon #noida

Equal Opportunity Employer 

At Agoda, we pride ourselves on being a company represented by people of all different backgrounds and orientations. We prioritize attracting diverse talent and cultivating an inclusive environment that encourages collaboration and innovation. Employment at Agoda is based solely on a person’s merit and qualifications. We are committed to providing equal employment opportunity regardless of sex, age, race, color, national origin, religion, marital status, pregnancy, sexual orientation, gender identity, disability, citizenship, veteran or military status, and other legally protected characteristics.

We will keep your application on file so that we can consider you for future vacancies and you can always ask to have your details removed from the file. For more details please read our privacy policy .

To all recruitment agencies: Agoda does not accept third party resumes. Please do not send resumes to our jobs alias, Agoda employees or any other organization location. Agoda is not responsible for any fees related to unsolicited resumes."
3827698239,Back End Engineer (Marketplace Order Operations) - Sea Labs,https://www.linkedin.com/jobs/view/3827698239,Sea,https://www.linkedin.com/company/seagrp/life,"Jakarta, Indonesia",,0,,,,,https://media.licdn.com/dms/image/C560BAQEAIrDkWI_p6g/company-logo_100_100/0/1631341864429?e=1721865600&v=beta&t=guW6dUGwOUqas_A4h9KWZAJMcu79JIKdPb5HK9Mhrn8,"Sea is the leading consumer internet company in Southeast Asia and Taiwan. Our mission is to better the lives of the consumers and small businesses of our region with technology.

Our businesses include:

Shopee, our region’s largest and most popular e-commerce platform. Launched in 2015, Shopee was designed to be mobile-first and highly social, offering buyers and sellers a trusted and enjoyable shopping experience. In 2018, Shopee recorded over 603 million orders, and GMV of $10.3 billion. Shopee was also the most downloaded shopping app in Southeast Asia and in Taiwan.

Garena, a global leading games company. Garena is the developer of Free Fire, the global smash hit mobile battle royale game with over 450 million registered users and 50 million peak daily active users as of May 2019, making it one of the most popular games in the world. Garena is also the largest games publisher in the region, bringing AAA mobile and PC titles such as Arena of Valor, League of Legends, and Speed Drifters to gamers in Southeast Asia. Garena also leads the growth of esports in our region. Its annual flagship event, Garena World, is the largest and most influential esports event in Southeast Asia.

SeaMoney, a leading digital payments and financial services provider in Southeast Asia. SeaMoney’s offerings include mobile wallet services, under the AirPay and ShopeePay brands, which provide users with easy access to digital payment services.

Sea is headquartered in Singapore, and listed on the New York Stock Exchange under the ticker symbol ‘SE’. Our IPO in October 2017 was the largest US public listing ever by a Southeast Asian technology company.","Job Description:

Realizing business goals through implementing features to Shopee as a platform, including but not limited to return and refund, and clearing and settlement
Designing and building distributed systems optimized for performance, availability, and user experience
Writing high-quality, clean, and maintainable code and respecting engineering best practices (unit testing, source control, continuous integration, automation, design patterns, etc.)
Researching, proposing and executing projects to enhance system functionalities, development processes, and shared middlewares
Collaborating in a highly cross-functional environment with fellow Software Engineers, Product Managers, Quality Assurance Engineers, and Operation Engineers to deliver impact


Requirements:

Bachelor's or a higher degree in Computer Science or related fields
Relevant experience in backend server development
Familiar with commonly used languages, such as Golang / Python / C++ / Java
In-depth understanding of Data Structures and Algorithms, Networking, OS and other Computer Science fundamentals
Familiar with commonly used Databases, such as MySQL
Familiar with commonly used middlewares, such as Redis and Kafka
Familiar with Kubernetes (K8S) Microservice Architecture
Familiar with HTTP/TCP protocols
Familiar with XML/JSON/Protocol Buffers
Familiar with distributed systems, performance tuning, massive concurrency handling, and caching mechanisms"
3817297664,Enterprise Sales Engineer (Bahasa Speaking),https://www.linkedin.com/jobs/view/3817297664,Datadog,https://www.linkedin.com/company/datadog/life,"Jakarta, Indonesia",,0,,,,,https://media.licdn.com/dms/image/C560BAQFLwWfI6v1OPA/company-logo_100_100/0/1657564322231/datadog_logo?e=1721865600&v=beta&t=RjJaO4ZFJMTrqI89Isl3ioHSii1NhwkwPYkAZK6XYhI,"Datadog is the essential monitoring platform for cloud applications. We bring together data from servers, containers, databases, and third-party services to make your stack entirely observable. These capabilities help DevOps teams avoid downtime, resolve performance issues, and ensure customers are getting the best user experience.

…
show more","As an Enterprise Sales Engineer, you will provide technical expertise through sales presentations, product demonstrations, and supporting technical evaluations (POVs). Sales Engineers help qualify and close opportunities with customers and partners and have a voice with the product team to help prioritize features based on input from customers, competitors, and partners.
At Datadog, we place value in our office culture - the relationships and collaboration it builds and the creativity it brings to the table. We operate as a hybrid workplace to ensure our Datadogs can create a work-life harmony that best fits them.

What You’ll Do:
Partner with the Sales team to articulate the overall Datadog value proposition, vision and strategy to customers
Own technical engagement with customers during the trial phase. Communicate Datadog’s value based on activities and work with customers on any identified issues or concerns to successful conclusion
Technically close complex opportunities through advanced competitive knowledge, technical skill, and credibility
Deliver product and technical briefings / presentations to potential clients
Maintain accurate notes and feedback in CRM regarding customer input both wins and losses
Proactively engage and communicate with customers and Datadog business/technical teams regarding product feedback and competitive landscape

Who You Are:
Someone with a minimum of 5+ years in a Sales Engineering or DevOps Engineering role
Passionate about educating customers on observability risks that are meaningful to their business, and able to build and execute an evaluation plan with a customer
Must be fluent in both Bahasa and English
Someone with strong written and oral communication skills. This role requires an ability to understand and articulate both the business benefits (value proposition) and technical advantages of our offering
Experienced in programming/scripting with any of the following: Java, Python, Ruby, Go, Node.JS, PHP, and .NET etc.
Able to sit up to 4 hours, traveling to and from client sites
Able to travel via auto, train or air up to 45% of the time
Datadog values people from all walks of life. We understand not everyone will meet all the above qualifications on day one. That's okay. If you’re passionate about technology and want to grow your skills, we encourage you to apply.

Benefits and Growth:
Best-in-breed onboarding
Generous global benefits
Intra-departmental mentor and buddy program for in-house networking
New hire stock equity (RSUs) and employee stock purchase plan (ESPP)
Continuous professional development, product training, and career pathing
An inclusive company culture, able to join our Community Guilds and Inclusion Talks
Benefits and Growth listed above may vary based on the country of your employment and the nature of your employment with Datadog.

About Datadog: 
Datadog (NASDAQ: DDOG) is a global SaaS business, delivering a rare combination of growth and profitability. We are on a mission to break down silos and solve complexity in the cloud age by enabling digital transformation, cloud migration, and infrastructure monitoring of our customers’ entire technology stacks. Built by engineers, for engineers, Datadog is used by organizations of all sizes across a wide range of industries. Together, we champion professional development, diversity of thought, innovation, and work excellence to empower continuous growth. Join the pack and become part of a collaborative, pragmatic, and thoughtful people-first community where we solve tough problems, take smart risks, and celebrate one another. Learn more about #DatadogLife on Instagram, LinkedIn, and Datadog Learning Center.

Equal Opportunity at Datadog:
Datadog is an Affirmative Action and Equal Opportunity Employer and is proud to offer equal employment opportunity to everyone regardless of race, color, ancestry, religion, sex, national origin, sexual orientation, age, citizenship, marital status, disability, gender identity, veteran status, and more. We also consider qualified applicants regardless of criminal histories, consistent with legal requirements. Here are our Candidate Legal Notices for your reference.

Your Privacy:
Any information you submit to Datadog as part of your application will be processed in accordance with Datadog’s Applicant and Candidate Privacy Notice."
3846514059,Expert Back End Engineer (Marketplace Order Ops) - Sea Labs,https://www.linkedin.com/jobs/view/3846514059,Sea,https://www.linkedin.com/company/seagrp/life,"Jakarta, Indonesia",,0,,,,,https://media.licdn.com/dms/image/C560BAQEAIrDkWI_p6g/company-logo_100_100/0/1631341864429?e=1721865600&v=beta&t=guW6dUGwOUqas_A4h9KWZAJMcu79JIKdPb5HK9Mhrn8,"Sea is the leading consumer internet company in Southeast Asia and Taiwan. Our mission is to better the lives of the consumers and small businesses of our region with technology.

Our businesses include:

Shopee, our region’s largest and most popular e-commerce platform. Launched in 2015, Shopee was designed to be mobile-first and highly social, offering buyers and sellers a trusted and enjoyable shopping experience. In 2018, Shopee recorded over 603 million orders, and GMV of $10.3 billion. Shopee was also the most downloaded shopping app in Southeast Asia and in Taiwan.

Garena, a global leading games company. Garena is the developer of Free Fire, the global smash hit mobile battle royale game with over 450 million registered users and 50 million peak daily active users as of May 2019, making it one of the most popular games in the world. Garena is also the largest games publisher in the region, bringing AAA mobile and PC titles such as Arena of Valor, League of Legends, and Speed Drifters to gamers in Southeast Asia. Garena also leads the growth of esports in our region. Its annual flagship event, Garena World, is the largest and most influential esports event in Southeast Asia.

SeaMoney, a leading digital payments and financial services provider in Southeast Asia. SeaMoney’s offerings include mobile wallet services, under the AirPay and ShopeePay brands, which provide users with easy access to digital payment services.

Sea is headquartered in Singapore, and listed on the New York Stock Exchange under the ticker symbol ‘SE’. Our IPO in October 2017 was the largest US public listing ever by a Southeast Asian technology company.","Job Description:

Lead a project team to deliver end-to-end projects across the software development life cycle
Design and develop highly scalable, available, and maintainable backend systems across various products in the Order team, including but not limited to the shopping cart, checkout process, order management, returns and refunds, and order clearing and settlement
Collaborate in a highly cross-functional environment with Software Engineers, Product Managers, Quality Assurance Engineers, and Operation Engineers to deliver impact.
Guide and review technical designs and coding outputs of the team, taking responsibility for progress and quality of projects
Optimize the process of developing, debugging, testing, releasing, documenting, monitoring and operating on the cross-stack systems in the team
Design well layered engineering architectures to model product requirements, abstract reusable components, and decouple independent modules
Set the technical direction of the backend architecture, plan deliverables and milestones to execute the team's engineering strategy
Mentor and coach team members on backend software engineering principles and practices
Cultivate technical culture and innovation, and enhance engineering quality on a cross-team level


Requirements:

Bachelor's or a higher degree in Computer Science or related qualifications
At least 6 years of experience designing and troubleshooting highly scalable and maintainable distributed systems
At least 2 years of hands-on technical leadership experience, defining technical direction and leading project teams
Hands-on proficiency in an object-oriented programming language, such as Golang, Python, Java, or C++.
Hands-on experience in backend engineering middleware internals, such as MySQL binary logs, Kafka replication details, and Redis high availability strategies.
Experience in refactoring systems based on complex product requirements, to improve maintainability and development efficiency"
3907631275,Web Developer,https://www.linkedin.com/jobs/view/3907631275,PT Prima Vista Solusi,https://www.linkedin.com/company/pt-primavista-solusi/life,"Jakarta, Jakarta, Indonesia",,0,,,,,https://media.licdn.com/dms/image/D560BAQHeqvWfj3VbIQ/company-logo_100_100/0/1695441640292?e=1721865600&v=beta&t=zAeS7dvhKutbjtmiEqzVIoTAlATukcMp0Cw_4CE3bPI,"Primavista is an end-to-end distributor and provider of payment solutions founded in 2002. Primavista focuses on providing payment systems for ""card present"" systems such as edc terminal and ""not card present"" such as internet payment and mobile payment.

Prima Vista is one of the pioneering payment companies in Indonesia introducing several innovations known as ""First in Indonesia"" such as the First ""EMV Certification"" with Bank BNI, the first ""EDC Mini ATM"" with PermataBank, the first ""Pinpad Implementation"" with Bank Mandiri, the First EDC Biometric Payment with BTPN and Danamon Simpan Pinjam, the First ""Mobile EDC GPRS"" with Bank BNI, the first ""Contactless Payment"" with Bank Mandiri.

Prima Vista is also experienced in providing solutions such as Third-Party EDC outsourcing (End-to-end management services) covering the scope of EDC Rental, Helpdesk, First Level Support, Maintenance, Network Communication, thermal paper for various banking partners and merchant partners in Indonesia.",This job is sourced from a job board. Learn More
