id,title,job_url,company,company_link,location,published_at,number_of_applicants_applied,employment_duration,work_location_type,work_experience_level,company_type,company_logo,company_description,about_the_job
3809023352,"iOS Developer, VisionPro",https://www.linkedin.com/jobs/view/3809023352,BJAK,https://www.linkedin.com/company/bjak/life," ",1 month ago,100,,Hybrid,,51-200 employees,https://media.licdn.com/dms/image/D560BAQHLdbu8pvZ5Zg/company-logo_100_100/0/1687510523771/bjak_logo?e=1717027200&v=beta&t=plCkezb6Pv5JJYpxBuirPmFhsmfRsy8uZ2T6gNyfB74,"BJAK is focused on providing access to affordable and sustainable financial services for people in ASEAN.

Headquartered in Malaysia, BJAK is the largest insurance portal in Southeast Asia. Our main portal, Bjak.com, helps millions find the insurance policy with the best value and highest coverage for them.

Using technology, our team's core strengths are in problem solving and navigating the most complex regulations and environments, creating some of the most innovative products in the world. For instance, we are the first platform globally to simplify and offer investment-linked life and health insurance online, coupled with an instant talk-to-agent service.

Our investments in technology such as Custom API, blockchain, trading systems and data science is to enable easy access to financial services, that were previously inaccessible or difficult to understand.

If you enjoy building cutting edge platforms and ecosystems to give equal access to financial services for the masses - Speak to us.","Bjak is focused on providing access to affordable and sustainable financial services for people in ASEAN. Headquartered in Malaysia, Bjak is the largest insurance portal in Southeast Asia. Our main portal, Bjak.com, helps millions find the insurance policy with the best value and highest coverage for them. Our investments in technology such as Custom API, blockchain, trading systems and data science is to enable easy access to financial services that were previously inaccessible or difficult to understand.

Our core strengths are in navigating the most complex regulations and environments, creating some of the most innovative products in the world. For instance, we are the first platform globally to simplify and offer investment-linked life and health insurance online, coupled with an instant talk-to-agent service.

Role Overview:
This role is crafted for an iOS App Developer dedicated to creating applications exclusively for the latest Vision Pro technology. The iOS App Developer will be responsible for designing and developing mobile applications tailored for iOS platforms. Working closely with cross-functional teams, they will identify and implement new features, troubleshoot issues, and optimize performance. Keeping pace with emerging trends and technologies in software development is a crucial aspect of the iOS App Developer's role.

Responsibilities:
Design and develop high-quality iOS applications using VisionPro technology.
Implement VisionPro technology to enhance visual features and functionalities within iOS applications.
Optimize application performance, ensuring smooth and responsive user experiences.
Troubleshoot and resolve issues related to VisionPro integration for optimal functionality.
Conduct regular code reviews to ensure code quality and adherence to best practices.
Develop and execute thorough testing plans for VisionPro-integrated features.

Requirements:
Required skills: Mobile Application Development, iOS Development, and iOS proficiency.
Experience in software development and mobile applications.
Proficient in Swift programming language and the Xcode development environment.
Familiarity with software development tools such as Git and Jira.
Knowledge of software design patterns and system architecture.
Strong problem-solving skills and meticulous attention to detail.
Ability to work independently and collaboratively in a fast-paced environment.
Bachelor's degree in Computer Science or a related field is required.
Experience in VR development is beneficial.
Bonus: Experience with Android development.

Benefits
 Do something meaningful; Be a part of the future of finance technology and the no.1 company in the industry!
Fast moving, challenging and unique business problems
International work environment and flat organization
Great career development opportunities in a growing company
Possibility for relocation and international transfers mid-career
Competitive salary
Flexible working hours, Casual work attire"
3809023284,"Senior iOS Engineer, VisionPro",https://www.linkedin.com/jobs/view/3809023284,BJAK,https://www.linkedin.com/company/bjak/life," ",1 month ago,94,,Hybrid,,51-200 employees,https://media.licdn.com/dms/image/D560BAQHLdbu8pvZ5Zg/company-logo_100_100/0/1687510523771/bjak_logo?e=1717027200&v=beta&t=plCkezb6Pv5JJYpxBuirPmFhsmfRsy8uZ2T6gNyfB74,"BJAK is focused on providing access to affordable and sustainable financial services for people in ASEAN.

Headquartered in Malaysia, BJAK is the largest insurance portal in Southeast Asia. Our main portal, Bjak.com, helps millions find the insurance policy with the best value and highest coverage for them.

Using technology, our team's core strengths are in problem solving and navigating the most complex regulations and environments, creating some of the most innovative products in the world. For instance, we are the first platform globally to simplify and offer investment-linked life and health insurance online, coupled with an instant talk-to-agent service.

Our investments in technology such as Custom API, blockchain, trading systems and data science is to enable easy access to financial services, that were previously inaccessible or difficult to understand.

If you enjoy building cutting edge platforms and ecosystems to give equal access to financial services for the masses - Speak to us.","Bjak is focused on providing access to affordable and sustainable financial services for people in ASEAN. Headquartered in Malaysia, Bjak is the largest insurance portal in Southeast Asia. Our main portal, Bjak.com, helps millions find the insurance policy with the best value and highest coverage for them. Our investments in technology such as Custom API, blockchain, trading systems and data science is to enable easy access to financial services that were previously inaccessible or difficult to understand.

Our core strengths are in navigating the most complex regulations and environments, creating some of the most innovative products in the world. For instance, we are the first platform globally to simplify and offer investment-linked life and health insurance online, coupled with an instant talk-to-agent service.

Role Overview:
Join us as a key player in conceiving, developing, and delivering state-of-the-art spatial computing experiences at our Indonesia branch. As a Senior Engineer, you will collaborate at the intersection of design, frameworks, operating systems, and low-level software, contributing to the creation of life-changing products. We are in search of proven expertise in delivering high-quality apps using iOS technologies. Flourish in our dynamic, agile environment as we pioneer spatial computing, exploring answers through prototyping and deploying best practices. Your leadership will be instrumental in shaping impactful code and fostering quality within our collaborative and diverse team. Make a significant impact in the evolving realm of spatial computing.

Responsibilities:
Lead the design and development of high-quality iOS applications utilizing VisionPro technology.
Implement advanced VisionPro features to enhance visual capabilities within iOS applications.
Drive optimization efforts to ensure superior performance and responsiveness of iOS applications.
Conduct comprehensive code reviews to maintain high-quality code standards.
Develop and execute thorough testing plans for VisionPro-integrated features.
Debug and resolve intricate issues identified during testing phases.

Requirements:
Proven track record of successfully building and launching complex and engaging applications or user-facing systems across various iOS platforms.
In-depth knowledge of iOS development frameworks and technologies, with proficiency in Swift or Objective-C.
Extensive expertise in modern software engineering practices, including object-oriented programming, functional programming, declarative user interfaces, and test-driven development.
Solid grounding in Computer Science fundamentals.
Meticulous attention to detail in planning, execution, and maintenance processes.
Exceptional communication skills, enabling successful collaboration with peers from diverse experiences and backgrounds.
Demonstrated ability to achieve results in a fast-paced and agile organizational environment.
Minimum of 5 years of professional experience.

Benefits
 Do something meaningful; Be a part of the future of finance technology and the no.1 company in the industry!
Fast moving, challenging and unique business problems
International work environment and flat organization
Great career development opportunities in a growing company
Possibility for relocation and international transfers mid-career
Competitive salary
Flexible working hours, Casual work attire"
3809097221,Java Software Engineer,https://www.linkedin.com/jobs/view/3809097221,Lancesoft Indonesia,https://www.linkedin.com/company/lancesoft-indonesia/life," "," ",100,,On-site,,"1,001-5,000 employees · Staffing and Recruiting",https://media.licdn.com/dms/image/C560BAQGLOAFB358F-g/company-logo_100_100/0/1632155027401/lancesoft_indonesia_logo?e=1717027200&v=beta&t=7BCr1AnPWPJo8Ll-QfpClxPix52ujCvKHcXZRcFoYqA,"Established in 2000, LanceSoft is a Certified MBE and Woman-Owned organization, and a pioneer in providing premium end-to-end Global Workforce Solutions and IT Services to diverse clients across various domains.

LanceSoft’s mission is to establish global cross-culture human connections that further the careers of our employees and strengthen the businesses of our clients. We are driven to use the power of our global network to connect businesses with the right people, and people with the right businesses without bias. We provide Global Workforce Solutions with a human touch.

LanceSoft provides Global Workforce Solutions with a human touch and a comprehensive recruiting organization, addressing the complex workforce challenges your company faces today, from contingent and permanent staffing to talent management, outsourcing, and talent development.

With currently over 3,800+ staff serving over 110+ enterprise clients worldwide including “Fortune” companies, LanceSoft serves a wide array of industries including Banking & Financial Services, Semiconductor/VLSI, Technology, Healthcare & Life Sciences, Government, Telecom & Media, Retail & Distribution, Oil & Gas and Energy & Utilities.

LanceSoft is headquartered in Herndon, VA with 27 regional offices across the U.S. and 21 offices around the globe.
Other Offices - India, Indonesia, Hongkong, Malaysia, Thailand, Philippines, Australia, Japan & Bangladesh, etc..

Office in Indonesia -
Gedung Wisma Metropolitan I, Level 3A, Jl Jend Sudirman Kav 29-31, RT. 008 RW. 003, Karet, Setiabudi, Jakarta Selatan, Indonesia, D07 P4AX
Indonesia","Hi IT Talent!

We're looking for Backend Java Developer

Job Details:
- Mastering the Java Programming Language
- Mastering the Java Spring MVC Framework
- Understand the concept and be able to implement Java Server Page (JSP)
- Understand the concept and be able to implement web service / API
- Able to use SQL Server Database, MySQL Database, MongoDB and Redis cache
- Having knowledge in SAP Hybris is a plus
- Able to use collaboration tools such as Github and TFS
- Able to understand the concept of security in programming"
3833631109,"Security Engineer Team Leader, Indonesia",https://www.linkedin.com/jobs/view/3833631109,Check Point Software Technologies Ltd,https://www.linkedin.com/company/check-point-software-technologies/life," ",3 days ago,37,,Hybrid,,"5,001-10,000 employees · Computer and Network Security",https://media.licdn.com/dms/image/D560BAQGtqN8lHnC7WA/company-logo_100_100/0/1698642229581/check_point_software_technologies_logo?e=1717027200&v=beta&t=3SiI9dFGgaynkQbsoF4EW-PoCbmB8hoclQZfm1X5pQk,"Check Point Software Technologies Ltd. is a leading provider of cyber security solutions to governments and enterprises globally. Our solutions protect over 100,000 customers from cyber attacks with an industry-leading catch rate of malware, ransomware and advanced targeted threats. By offering a multilevel security architecture, we defend enterprises’ cloud, network and mobile devices. Check Point offers the most comprehensive and intuitive one point of control security management system.
…
show more","Check Point’s mission is to provide industry-leading security solutions that redefine the security landscape. We achieve our mission by constantly developing innovative and cutting-edge technology solutions focused on real customer needs while challenging ourselves to grow and excel.

If you want to be part of the fascinating and fast-growing Cyber Security industry, where your unique talent and value will be recognized, Check Point Software Technologies is where you want to be.

This role is working with the Check Point team and our Channel Partners to drive the go-to-market programs. Ensure that our channel has the technical training and enablement to provide our customers with pre and post-sales activities. Working with the Check Point channel SE’s to drive execution on these programs
Join now and become a part of the success story that secures tens of thousands of organizations of all sizes around the globe.

Join Check Point’s leading sales team and take your career one step ahead!
 Your Impact & Responsibilities
Act as an SE Team Lead for Indonesia and be hands-on in pre-sales activity and channel enablement.
Work to develop the engineering programs together with Country Manager and regional SE managers to drive our go-to-market.
Provide technical pre-sales assistance for our partners and through our partners to our customers.
Develop existing and new partners in conjunction with the local sales team.
Respond to RFI's & RFP's with our Partners and Check Point pre-sales activities.
Coach, mentor, and lead the SE team in Indonesia
Technical Product and solution presentations
Active participation in IT security events and trade shows
Develop a solution by translating a customer’s business requirements into an integrated technical solution.
Technically close complex and competitive opportunities, through advanced competitive knowledge, technical skill, and credibility
Identify revenue impacting support escalations and engage proactively with required parties (internal/external) to ensure timely resolution and satisfactory resolution.
Work independently and collaboratively with Sales and Management, exercising judgment in developing people, technical requirements, and evaluation criteria.
Proactively engage and communicate with Product Management, Business units, Sales and Marketing
Broad understanding of Security Engineering Landscape / IT Security industry, past, present, and future

Your Knowledge & Skills
Desired Background
Minimum 8 years of relevant experience from a channel partner, IT-security-function with a customer, or for another vendor in the IT-security industry
Proven leadership
Good understanding of IT Security
Result oriented and action-driven
Well-versed in cloud architectures
Experience from navigating in dynamic and virtual organizations is a plus

What You'll Get In Return
Exposure to exciting and award-winning technologies in the Cyber Security industry
Opportunity to fulfill your potential by rolling out creative ideas and projects.
Work with and build a long-lasting relationship with a team of brilliant people.
Developing and managing a growing and dynamic team of driven cyber security experts.
If this sounds like an ideal role for you then why wait? Apply now!"
3763122844,"Systems Engineer - Commercial, Indonesia",https://www.linkedin.com/jobs/view/3763122844,,https://www.linkedin.com/company/palo-alto-networks/life," "," ",100,,On-site,,"10,001+ employees · Computer and Network Security",https://media.licdn.com/dms/image/C560BAQFZg72Sfni4SA/company-logo_100_100/0/1657225156841/palo_alto_networks_logo?e=1717027200&v=beta&t=hM0gUxO6Z8TiO8KY_FbuVtdOOwutSalYu9KZgNOx6V4,"Palo Alto Networks, the global cybersecurity leader, is shaping the cloud-centric future with technology that is transforming the way people and organizations operate. Our mission is to be the cybersecurity partner of choice, protecting our digital way of life. We help address the world's greatest security challenges with continuous innovation that seizes the latest breakthroughs in artificial intelligence, analytics, automation, and orchestration. By delivering an integrated platform and empowering a growing ecosystem of partners, we are at the forefront of protecting tens of thousands of organizations across clouds, networks, and mobile devices. Our vision is a world where each day is safer and more secure than the one before. For more information, visit www.paloaltonetworks.com.","Company Description

Our Mission

At Palo Alto Networks® everything starts and ends with our mission:

Being the cybersecurity partner of choice, protecting our digital way of life.

Our vision is a world where each day is safer and more secure than the one before. We are a company built on the foundation of challenging and disrupting the way things are done, and we’re looking for innovators who are as committed to shaping the future of cybersecurity as we are.

Our Approach to Work

We lead with flexibility and choice in all of our people programs. We have disrupted the traditional view that all employees have the same needs and wants. We offer personalization and offer our employees the opportunity to choose what works best for them as often as possible - from your wellbeing support to your growth and development, and beyond!

Job Description

Your Career

As a Pre-Sales Systems Engineer, you are an important member of our technical sales team, identifying complex security challenges in your customers’ networks and driving solutions with our market-leading security products and services.

You are the technical sales representative of the company and focus on customer satisfaction with all that you do. You and your sales partner own the customer relationship and your goal is to help them detect and prevent advanced cyberattacks and breaches while safely enabling applications by deploying the full Palo Alto Networks platform so that they can confidently pursue network, cloud, and mobile technology initiatives.

Your Impact

Understand and effectively present our security platform and solutions
Work closely with Commercial customers & partners in Indonesia
Create and deliver compelling demonstrations of Palo Alto Networks products and solutions
Educate customers and partners on the modern network security landscape
Identify and qualify new opportunities and support technical pre-sales activities to opportunity closure
Expand the Palo Alto Networks install base within existing accounts
Enable and leverage channel partners and work successfully in a channel-driven sales model
Create evaluation test plans with customers and lead the evaluation process to a successful conclusion
Differentiate from industry technologies and solution
Assist customers through the support escalation process
Continuous self-improvement and learning to maintain current technical knowledge and participate in technical communities of interest
Identify problems in customer environments - effectively engages customers at the technical field and technical management levels
Effective in customer-facing engagement, in writing, presentation, and creative problem-solving skills

Qualifications

Your Experience

BSCS or equivalent or equivalent military experience required and 6+ years of experience as a Pre-Sales Systems Engineer or Solution Consultant or Sales Engineer or Systems Integrator
Pre-sales experience handling Commercial customers & partners in Indonesia
Demonstrable experience with systems installation, configuration, and administration of routers/switches, UNIX/Linux and Windows-based systems (prior Active Directory/LDAP experience desirable)
Experience emphasizing L2-L4 Networking (L2 Switching architectures including Spanning Tree, IP routing including OSPF and BGP, L4 Load-balancing)
Industry knowledge of security and network product and technology trends
Experience selling, demonstrating, installing and/or solving network infrastructure security products
Extensive domestic travel within the territory is often required, and international travel may be required as necessary
Experience selling network infrastructure based security appliances including, but not limited to - Firewalls, SSL/IPSec VPNs, Security Proxies and Caches
Practical experience working with routing and switching products that will be installed adjacent to our appliances
Strong communication and presentation skills, both written and verbal
Strong analytical skills, ability to analyze complex multivariate problems and use a systematic approach to gain quick resolution

Additional Information

The Team

As part of our Systems Engineering team, you’ll support the sales team with technical expertise and guidance when establishing trust with key clients. You won’t find someone at Palo Alto Networks that isn’t committed to your success – with everyone pitching in to assist when it comes to solutions selling, learning, and development. As a member of our systems engineering team, you are motivated by a solutions-focused sales environment and find fulfillment in working with clients to resolve incredible complex cyberthreats.

Our Commitment

We’re trailblazers that dream big, take risks, and challenge cybersecurity’s status quo. It’s simple: we can’t accomplish our mission without diverse teams innovating, together.

We are committed to providing reasonable accommodations for all qualified individuals with a disability. If you require assistance or accommodation due to a disability or special need, please contact us at accommodations@paloaltonetworks.com.

Palo Alto Networks is an equal opportunity employer. We celebrate diversity in our workplace, and all qualified applicants will receive consideration for employment without regard to age, ancestry, color, family or medical care leave, gender identity or expression, genetic information, marital status, medical condition, national origin, physical or mental disability, political affiliation, protected veteran status, race, religion, sex (including pregnancy), sexual orientation, or other legally protected characteristics.

All your information will be kept confidential according to EEO guidelines."
