id,title,job_url,company,company_link,location,published_at,number_of_applicants_applied,employment_duration,work_location_type,work_experience_level,company_type,company_logo,company_description,about_the_job
3886625656,"Computer Vision – Senior Engineer (Bangkok based, relocation provided)",https://www.linkedin.com/jobs/view/3886625656,Agoda,https://www.linkedin.com/company/agoda/life,"Bandung, East Java, Indonesia",,0,,,,,https://media.licdn.com/dms/image/C4D0BAQGBa_7QNZNwpw/company-logo_100_100/0/1656643826660/agoda_logo?e=1721865600&v=beta&t=V_9iYXOC4Z9RgfBtEEdqYoha7IVeGlPKyJA8fk129to,"Agoda is transforming travel for millions of customers across the globe.

Headquartered in Asia, Agoda is one of the world’s largest online travel platforms. Founded in 2005 and now part of Booking Holdings (Nasdaq:BKNG), Agoda has a network of over 2,900,000 properties worldwide. Our web and mobile products provide a first-rate reservation service in 38 languages that uniquely combines local knowledge and local connections to provide the best deals for business and leisure travelers.

Agoda employs over 7,000 professionals from 90 nationalities in locations around the globe. In every department – from engineering to customer experience – we provide an environment rich with creativity, collaboration, and experimentation, and the tools to work faster and smarter.

At Agoda, we believe our people are our strength. We work hard and have fun, and we choose people who are dedicated to making things great.

For properties seeking partnership with Agoda, visit https://connect.agoda.com","About Agoda

Agoda is an online travel booking platform for accommodations, flights, and more. We build and deploy cutting-edge technology that connects travelers with more than 3.6 million accommodations globally. Based in Asia and part of Booking Holdings, our 6,000+ employees representing 90+ nationalities foster a work environment rich in diversity, creativity, and collaboration. We innovate through a culture of experimentation and ownership, enhancing the ability for our customers to experience the world.

 Our Purpose –  Bridging the World Through Travel 

We believe travel allows people to enjoy, learn and experience more of the amazing world we live in. It brings individuals and cultures closer together, fostering empathy, understanding and happiness.

We are a skillful, driven and diverse team from across the globe, united by a passion to make an impact. Harnessing our innovative technologies and strong partnerships, we aim to make travel easy and rewarding for everyone.

Agoda is an online travel booking platform for accommodation, flights, and more. We build and deploy cutting edge technology that connects travelers with more than 2.5 million accommodations globally. Based in Asia and part of Booking Holdings, our 4,000+ talents coming from 90+ different nationalities foster a work environment rich in diversity, creativity, and collaboration. We innovate through a culture of experimentation and ownership, enabling our customers to experience the world.

Get to Know Our Team

The Engineering department oversees all Agoda’s ML and software related requirements. Our goal is to enable and increase Agoda’s business through creative approaches and the implementation of powerful resources such as operational and analytical databases, ML driven solutions, queue systems and data monitoring tools. We hire the brightest minds from around the world to take on this challenge and equip them with the knowledge and tools that contribute to their personal growth and success while supporting our company’s culture of diversity and experimentation. The role the engineering team plays at Agoda is critical as business users, product managers, and many others rely on us to empower their decision making. We are equally dedicated to our customers by improving their search experience with faster results and protecting them from any fraudulent activities. Data is interesting only when you have enough of it, and we have plenty. This is what drives up the challenge as part of the ML engineering squad, but also the reward. We work across structured and non-structured data at scale. For example, our current ML models process millions of images every day to try and enhance the experience that our users get from our app.

Why Agoda Engineering Team (ML role)?

Our engineering teams are at the intersection of business analytics, ml engineering, data warehousing and software engineering. Our job involves dealing with distributed systems, stream processing, ml modeling and computation at tens of PB Scale. We focus on software engineering related to data replication, storage, centralized computation, and Data API’s. By providing our users with ML products/tools, shared frameworks, and ML services, we enable our company to validate strategic decisions, make smarter choices, and react to the fast-changing world. We are a small but passionate team with people from different nationalities working together on a single goal.

In this Role, you will get to:

 Lead the team technically in improving scalability, stability, accuracy, speed and efficiency of our existing ML systems and processes.
 Build, administer and scale ML processing pipelines.
 Be comfortable navigating the following technology stack: Python3, Pyspark, scripting (Bash/Python), Hadoop, SQL, S3 etc.
 Should be able to understand internals of ML models such as Random Forest, CNN, Regression models, etc
 Design, build, test and deploy new libraries, frameworks or full systems for our core systems while keeping to the highest standards of testing and code quality.
 Work with experienced engineers and product owners to identify and build tools to automate many large-scale data management / analysis tasks.
 We believe in end-to-end ownership; this role will involve taking ML models to production at a scale.

What You’ll need to Succeed:

 Bachelor’s degree in computer science /information systems/engineering/related field
 8+ years of experience in software engineering with a minimum of 4+ years in ML
 Good experience in Pyspark
 Expert level understanding of Python with design patterns and object-oriented programming.
 Experience debugging and reasoning about production issues is desirable.
 A good understanding of data architecture principles preferred.
 Any other experience with Big Data technologies / tools
 SQL experience
 Analytical problem-solving capabilities & experience.
 Systems administration skills in Linux
 A strong engineering driven mindset will be required to succeed in this role.

It’s great if you have:

 Good understanding of Hadoop ecosystems
 Experience working with Open-source products
 Experience with Scala development
 Working in an agile environment using test driven methodologies

#telaviv #jerusalem #IT #ENG #4 #sanfrancisco #sanjose #losangeles #sandiego #oakland #denver #miami #orlando #atlanta #chicago #boston #detroit #newyork #portland #philadelphia #dallas #houston #austin #seattle #sydney #melbourne #perth #toronto #vancouver #montreal #prague #Brno #Ostrava #cairo #alexandria #giza #estonia #paris #berlin #munich #hamburg #stuttgart #cologne #frankfurt #budapest #bali #dublin #telaviv #milan #rome #venice #florence #naples #turin #palermo #bologna #osaka #malta #amsterdam #oslo #warsaw #krakow #alrayyan #riyadh #jeddah #mecca #medina #singapore #seoul #barcelona #madrid #stockholm #zurich #taipei #tainan #taichung #kaohsiung #bangkok #Phuket #istanbul #london #manchester #edinburgh #hcmc #hanoi #lodz #wroclaw #poznan #katowice #rio #salvador #newdelhi #bangalore #bandung #yokohama #nagoya #okinawa #fukuoka #jerusalem #IT #4 #bangalore #delhi #hyderabad #pune #singapore #beijing #shanghai #shenzhen #tokyo #seoul #hongkong #taipei #kualalumpur #jakarta #hochiminh #hochiminhcity #manila #instanbul #makati #dubai #riyadh #gurgaon #noida

Equal Opportunity Employer 

At Agoda, we pride ourselves on being a company represented by people of all different backgrounds and orientations. We prioritize attracting diverse talent and cultivating an inclusive environment that encourages collaboration and innovation. Employment at Agoda is based solely on a person’s merit and qualifications. We are committed to providing equal employment opportunity regardless of sex, age, race, color, national origin, religion, marital status, pregnancy, sexual orientation, gender identity, disability, citizenship, veteran or military status, and other legally protected characteristics.

We will keep your application on file so that we can consider you for future vacancies and you can always ask to have your details removed from the file. For more details please read our privacy policy .

To all recruitment agencies: Agoda does not accept third party resumes. Please do not send resumes to our jobs alias, Agoda employees or any other organization location. Agoda is not responsible for any fees related to unsolicited resumes."
3886622775,"Lead Data Engineer (Bangkok based, relocation provided)",https://www.linkedin.com/jobs/view/3886622775,Agoda,https://www.linkedin.com/company/agoda/life,"Bali, Indonesia",,0,,,,,https://media.licdn.com/dms/image/C4D0BAQGBa_7QNZNwpw/company-logo_100_100/0/1656643826660/agoda_logo?e=1721865600&v=beta&t=V_9iYXOC4Z9RgfBtEEdqYoha7IVeGlPKyJA8fk129to,"Agoda is transforming travel for millions of customers across the globe.

Headquartered in Asia, Agoda is one of the world’s largest online travel platforms. Founded in 2005 and now part of Booking Holdings (Nasdaq:BKNG), Agoda has a network of over 2,900,000 properties worldwide. Our web and mobile products provide a first-rate reservation service in 38 languages that uniquely combines local knowledge and local connections to provide the best deals for business and leisure travelers.

Agoda employs over 7,000 professionals from 90 nationalities in locations around the globe. In every department – from engineering to customer experience – we provide an environment rich with creativity, collaboration, and experimentation, and the tools to work faster and smarter.

At Agoda, we believe our people are our strength. We work hard and have fun, and we choose people who are dedicated to making things great.

For properties seeking partnership with Agoda, visit https://connect.agoda.com","About Agoda 

Agoda is an online travel booking platform for accommodations, flights, and more. We build and deploy cutting-edge technology that connects travelers with more than 3.6 million accommodations globally. Based in Asia and part of Booking Holdings, our 6,000+ employees representing 90+ nationalities foster a work environment rich in diversity, creativity, and collaboration. We innovate through a culture of experimentation and ownership, enhancing the ability for our customers to experience the world.

 Our Purpose –  Bridging the World Through Travel 

We believe travel allows people to enjoy, learn and experience more of the amazing world we live in. It brings individuals and cultures closer together, fostering empathy, understanding and happiness.

We are a skillful, driven and diverse team from across the globe, united by a passion to make an impact. Harnessing our innovative technologies and strong partnerships, we aim to make travel easy and rewarding for everyone.

About Agoda

Agoda is an online travel booking platform for accommodation, flights, and more. We build and deploy cutting edge technology that connects travelers with more than 2.5 million accommodations globally. Based in Asia and part of Booking Holdings, our 4,000+ talents coming from 90+ different nationalities foster a work environment rich in diversity, creativity, and collaboration. We innovate through a culture of experimentation and ownership, enabling our customers to experience the world

Get to Know Our Team

The Data department oversees all of Agoda’s data-related requirements. Our ultimate goal is to enable and increase the use of data in the company through creative approaches and the implementation of powerful resources such as operational and analytical databases, queue systems, BI tools, and data science technology. We hire the brightest minds from around the world to take on this challenge and equip them with the knowledge and tools that contribute to their personal growth and success while supporting our company’s culture of diversity and experimentation. The role the Data team plays at Agoda is critical as business users, product managers, engineers, and many others rely on us to empower their decision making. We are equally dedicated to our customers by improving their search experience with faster results and protecting them from any fraudulent activities. Data is interesting only when you have enough of it, and we have plenty. This is what drives up the challenge as part of the Data department, but also the reward.

Why Agoda Data Applications Team?

Our Data Engineering teams are at the intersection of business analytics, data warehousing and software engineering. Our job involves dealing with distributed systems, stream processing, computation and data governance at tens of PB Scale.

We focus on software engineering related to data replication, storage, centralized computation, and Data API’s. By providing our users with data products/tools, shared frameworks and data services, we enable our company to validate strategic decisions, make smarter choices, and react to the fast-changing world.

We are a small but passionate team with people from different nationalities working together on a single goal.

In this Role, you will get to

Lead the team technically in improving scalability, stability, accuracy, speed and efficiency of our existing Data systems
Build, administer and scale data processing pipelines
Be comfortable navigating the following technology stack: Scala, Spark, java, Golang, Python3, scripting (Bash/Python), Hadoop, SQL, S3 etc
Improve scalability, stability, accuracy, speed and efficiency of our existing data systems
Design, build, test and deploy new libraries, frameworks or full systems for our core systems while keeping to the highest standards of testing and code quality
Work with experienced engineers and product owners to identify and build tools to automate many large-scale data management / analysis tasks 

What You’ll Need To Succeed

Bachelor’s degree in Computer Science /Information Systems/Engineering/related field
5+ years of experience in Data engineering
Good experience in Apache Spark
Expert level understanding of JVM and either Java or Scala
Experience debugging and reasoning about production issues is desirable
A good understanding of data architecture principles preferred
Any other experience with Big Data technologies / tools
SQL experience
Analytical problem-solving capabilities & experience
Systems administration skills in Linux

It’s great if you have

Good understanding of Hadoop ecosystems
Experience working with Open-source products
Python/Shell scripting skills
Working in an agile environment using test driven methodologies

#telaviv #jerusalem #IT #ENG #4 #sanfrancisco #sanjose #losangeles #sandiego #oakland #denver #miami #orlando #atlanta #chicago #boston #detroit #newyork #portland #philadelphia #dallas #houston #austin #seattle #sydney #melbourne #perth #toronto #vancouver #montreal #prague #Brno #Ostrava #cairo #alexandria #giza #estonia #paris #berlin #munich #hamburg #stuttgart #cologne #frankfurt #budapest #bali #dublin #telaviv #milan #rome #venice #florence #naples #turin #palermo #bologna #osaka #malta #amsterdam #oslo #warsaw #krakow #alrayyan #riyadh #jeddah #mecca #medina #singapore #seoul #barcelona #madrid #stockholm #zurich #taipei #tainan #taichung #kaohsiung #bangkok #Phuket #istanbul #london #manchester #edinburgh #hcmc #hanoi #lodz #wroclaw #poznan #katowice #rio #salvador #newdelhi #bangalore #bandung #yokohama #nagoya #okinawa #fukuoka #jerusalem #IT #4 #bangalore #delhi #hyderabad #pune #singapore #beijing #shanghai #shenzhen #tokyo #seoul #hongkong #taipei #kualalumpur #jakarta #hochiminh #hochiminhcity #manila #instanbul #makati #dubai #riyadh #gurgaon #noida

Equal Opportunity Employer 

At Agoda, we pride ourselves on being a company represented by people of all different backgrounds and orientations. We prioritize attracting diverse talent and cultivating an inclusive environment that encourages collaboration and innovation. Employment at Agoda is based solely on a person’s merit and qualifications. We are committed to providing equal employment opportunity regardless of sex, age, race, color, national origin, religion, marital status, pregnancy, sexual orientation, gender identity, disability, citizenship, veteran or military status, and other legally protected characteristics.

We will keep your application on file so that we can consider you for future vacancies and you can always ask to have your details removed from the file. For more details please read our privacy policy .

To all recruitment agencies: Agoda does not accept third party resumes. Please do not send resumes to our jobs alias, Agoda employees or any other organization location. Agoda is not responsible for any fees related to unsolicited resumes."
