id,title,job_url,company,company_link,location,published_at,number_of_applicants_applied,employment_duration,work_location_type,work_experience_level,company_type,company_logo,company_description,about_the_job
3811254018,Mobile Application Developer,https://www.linkedin.com/jobs/view/3811254018,LUNAPOS,https://www.linkedin.com/company/lunapos/life," ",3 weeks ago,100,,On-site,,11-50 employees · Information Technology & Services,https://media.licdn.com/dms/image/C560BAQGx-7eDtmmirQ/company-logo_100_100/0/1630602960777?e=1717027200&v=beta&t=wlRDm6Ptz2iomr-xyzD46iTbOOlvYOxIqsM4itTXl04,Aplikasi Kasir Serba Bisa Untuk Berbagai Bisnismu,"The ideal candidate will be responsible for the technical design and implementation of new products and enhancements. They will work in all phases of the development cycle: concept to implementation. 
 Responsibilities
 Develop innovative software, enchance and maintenance Existing software
Colaborate with product team to implement SDLC
Perform full life-cycle development
Adhere to agreed upon delivery schedules
Utilizes source control, continuous integration, and unit testing best practices
Work cross-functionally to define and write code for new features

Qualifications
* Required Skill(s): ReactNative, Flutter.
* Candidate must possess at least a Bachelor's Degree in Computer Science or related field.
* At least 1 years of working experience in the related field is required for this position.
* Have understanding about Version Control with Git to Collaborate with the team.
* Have understanding/experience to work with local database.
* Have Knowledge using Google Firebase services."
3833635309,Back-End-Entwickler,https://www.linkedin.com/jobs/view/3833635309,Palm Code,https://www.linkedin.com/company/palm-code/life," ",3 days ago,100,,Remote,,1-10 employees,https://media.licdn.com/dms/image/D4E0BAQFwzwOOrRHkZA/company-logo_100_100/0/1665213532128?e=1717027200&v=beta&t=sO0K4hmXyScwOI3YvbtQYhDdqZxo_O44GXJcAPa8kDo,"Schnelle Unterstützung von allen Seiten der Welt: Wir bieten dir mit unseren internationalen Talenten im Bereich Web-, App- & Online-Shop-Entwicklung eine zuverlässige Unterstützung für dein Projekt. So unterstützen wir dich und dein Unternehmen und sorgen dafür, dass du dich ganz auf dein Tagesgeschäft konzentrieren kannst.","Position: Senior Back-End Engineer

Location: Remote in Indonesia

Company: Palm Code

We are seeking a talented and experienced Back-End Engineer to join our dynamic team at Palm Code. In this role, you will be instrumental in building a platform for AI-based services, focusing on large-scale document processing. We require someone who can support the full delivery process, from document intake and processing to delivery, ensuring high-quality and scalable solutions.

Requirements:

Must-Have:
Profound knowledge and experience in Elixir, including the Phoenix and Broadway frameworks.
Experience in building up WebAPIs with GraphQL.
Proficiency in extracting and delivering data from databases to front-end services.
Solid understanding of database modeling and index structure development.
Some services and micro-services are written in Python; ability to maintain and develop these is essential.
Experience assisting Data Scientists in integrating models into the infrastructure.
Skilled in data plumbing to ensure smooth data flow between various parts of the infrastructure.

Should-Have:
Familiarity with containerization and orchestration technologies.
Experience with CI/CD pipelines for efficient development and deployment.
Understanding of cloud services and infrastructure as it relates to back-end development.
Knowledge of security best practices in back-end development and data handling.
Experience with message queuing and stream processing frameworks and technologies.

Nice-to-Have:
Familiarity with other back-end frameworks and languages for potential integration.
Experience with advanced database technologies like NoSQL or Graph databases.
Contributions to open-source projects or visible personal projects.
Understanding of AI and machine learning concepts and how they integrate with back-end systems.

Responsibilities:
Develop and maintain robust back-end applications using Elixir, Phoenix, and Broadway.
Build and manage WebAPIs using GraphQL for efficient data exchange between front-end and back-end systems.
Collaborate closely with front-end developers, data scientists, and other stakeholders to ensure seamless integration and delivery of services.
Model, design, and implement database structures and indexes to support application needs and performance.
Assist in integrating data science models into the platform, facilitating large scale document processing and AI services.
Ensure code quality, maintainability, and scalability through best practices, code reviews, and testing.
Stay updated with the latest trends and technologies in back-end development and AI services.

Preferred Qualifications:
Previous experience in a similar role, working with Elixir and Python in a production environment.
Strong problem-solving skills and ability to work in a fast-paced, innovative environment.

Join our team and contribute to the development of cutting-edge AI-based services. We offer competitive compensation, flexible working hours, and opportunities for growth and professional development.
We look forward to hearing from you!"
3818855638,Software Quality Assurance Engineer,https://www.linkedin.com/jobs/view/3818855638,Kopi Kenangan,https://www.linkedin.com/company/kopi-kenangan/life," ",2 weeks ago,100,,Hybrid,,"5,001-10,000 employees · Food and Beverage Services",https://media.licdn.com/dms/image/C4E0BAQGzZOK5bqcH7Q/company-logo_100_100/0/1646198677171/kopi_kenangan_logo?e=1717027200&v=beta&t=3IgRBYE4ZX7Mk5HJZpiG1kwRF-h3LBalWiU5d8X5zo8,"Kopi Kenangan is a non-franchise tech-enabled grab-and-go coffee chain with around 800 stores across more than 60 cities in Indonesia. We became the 1st F&B Unicorn in SE Asia in December 2021. We are Halal Certified and was named Brand of The Year winner in the Café Chain Category Indonesia by The World Branding Awards 2020 – 2021.

Our mission is to serve high quality coffee, made with the freshest Indonesia sourced ingredients to customers in Indonesia and the rest of the world.

Other brands under our umbrella are Kenangan Coffee (@kenangancoffee.,my), Chigo (@chigo.id) and Kenangan Hanyauntukmu (@kenangan.hanyauntukmu).

We have a culture that rewards results and impact. We work as a team and move fast to respond to market and consumer needs. Our people are agile, result driven, and passionate in delivering quality products and services to our customers.

For a full listing of career opportunities with us, visit http://www.kopikenangan.com/careers or follow us @insidekopikenangan","Are you a meticulous professional with a keen eye for detail and a passion for ensuring software quality? Kopi Kenangan, a leading coffee chain, is on the lookout for a Software QA Engineer to join our dynamic team.


Ideal Candidate Profile
Bachelor's Degree in Software Engineering or related field.
Minimum 1-2 years of experience in software quality assurance.
Proficient in analyzing, testing, and evaluating software applications. Mobile app experience is preferable, but website testing expertise is also valued.
Familiarity with SQL or MySQL for database testing.
Experience with manual and automated testing tools.
Strong analytical mindset with excellent problem-solving skills.
Independent, proactive, and detail-oriented personality.

Job Responsibilities
Create detailed test cases based on user acceptance, industry standards, and regulations.
Maintain SQA deliverables, including test plans, cases, and progress reports.
Analyze, test, and evaluate software applications for risk, accuracy, and quality.
Execute test cases manually or using automated testing tools.
Collaborate on User Acceptance Testing (UAT) and track production issues.
Identify areas for process improvement within the QA process.
Recommend and assist in corrective actions at all stages of the software life cycle.
Maintain records of test plans, cases, results, and defect reports.
Document and track software defects using bug tracking systems.
Create UAT documentation and related reports.

If this sound like you, please send updated resume to apac.jobs@kopikenangan.com"
3835527835,GIS Developer,https://www.linkedin.com/jobs/view/3835527835,Meridia,https://www.linkedin.com/company/meridialand/life," ",1 day ago,100,,Remote,,51-200 employees · IT Services and IT Consulting,https://media.licdn.com/dms/image/C4D0BAQHrODonvJnhBQ/company-logo_100_100/0/1630575247586/meridialand_logo?e=1717027200&v=beta&t=EuBuFJ8z0Hpdrp0kkvsggYR_41OLmDtBL_kPP_jpyG4,"Meridia is your data partner for structured, accurate and reliable field data.

Built on our expertise and technology, we offer accurate and reliable field data solutions and products at scale for soft commodity smallholder supply chains. We specialise in collecting, analysing and verifying high-quality data to accelerate our client's sustainability and ESG commitments.

With Meridia Verify, we are a first mover to offer field data quality analysis for achieving European Deforestation Regulation (#EUDR) compliance by quickly identifying risk levels of field data for verification and assurance.

Most smallholders struggle to earn a living income, fueling the deforestation and biodiversity crisis. Reliable field data is needed to drive the transformation toward confronting these challenges.

To ensure strict compliance with regulations and practices, we closely work with governments and traditional authorities.

Get in touch or book a demo: https://www.meridia.land/contact-us","About Meridia
Meridia is an agtech company contributing to inclusive, transparent and sustainable smallholder supply chains that are future-proof. 
Built on our expertise and technology, we offer accurate and reliable field data solutions and software products at scale for smallholder supply chains. We specialise in collecting, analysing and verifying high-quality data to accelerate our client's sustainability & ESG commitments. 
Accurate farm and traceability data are critical for businesses to comply with ever-stricter compliance regulations and deliver upon sustainability commitments. At the same time, most smallholders continue to struggle to earn a living income, fueling the deforestation and biodiversity crisis. Reliable field data is needed to drive the transformation toward confronting these challenges.
See https://www.meridia.land for more information on our work. 

The Role
The Mid-level GIS Developer will collaborate with the GIS Software Developers and the Head of Engineering to advance the development of Meridia’s Verify product. Verify is a Saas farm data quality validation that encompasses an entire data pipeline from ingestion, analysis to rendering. An infrastructure is under construction to scale to millions of farm polygons and geopoints from over 35 countries. This position holds significant responsibility for designing and delivering multiple GIS components in collaboration with a team of developers. You will be based in Indonesia and will work closely with our teams in The Netherlands and Lithuania as well as with colleagues across Indonesia. You will report to the Head of Engineering in the Netherlands. 

Responsibilities
The Mid-level GIS Software Developer has the following areas of work and responsibilities:
Software Development: Design, develop, and maintain GIS software applications, modules, and components using programming languages such as SQL, Python, or JavaScript.
Data Pipeline Management: Support the development and management of the data pipeline, including data ingestion, processing, transformation, and rendering. Ensure efficient and accurate handling of large volumes of geographic data.
Quality Assurance: Implement and maintain data quality validation processes to ensure the accuracy, consistency, and reliability of geospatial data. Develop automated testing procedures and conduct rigorous quality assurance checks. Troubleshooting and bug fixing GIS related issues.
GIS Integration: Support the integration of GIS software with other applications and systems, such as databases, web services, and APIs.
Collaboration and Guidance
You will work closely with the development and data teams to support project delivery, provide technical guidance and coordinate development efforts.
You will be mentored and coached by the GIS Developer and other members of the technical team
Requirements
3-5+ years of relevant GIS Developer experience 
Proficient in Python, PostGIS SQL queries, Javascript (Leaflet or Openlayers)
Experience with optimising PostGIS queries though geo index is a big plus
Ability to perform spatial analysis and create informative visualisations.
Experience with data processing and analysis tools (e.g. QGIS Processing Toolbox)
Experience with contributing to multiple GIT repositories through PRs
Verbal and written fluency in English is essential

Learning and Development
The ideal candidate should be eager and willing to learn and grow in the role. We will provide on-the-job training and development to enable you to gain both domain knowledge around land rights sector and deeply understand our data systems and workflows. You will be mentored by our GIS Developer in the Netherlands as well as by senior colleagues in Lithuania and the Netherlands.

The benefits package includes
Market rate salary commensurate with your skills and competencies
Four-day work week
Being part of a fast-growing impact venture with an informal, professional work culture
A computer or laptop for work and an external screen
Engaging with team members, clients and users in various other countries

Apply!
Applications will be processed on a rolling basis. Please apply by submitting your details: https://podio.com/webforms/12899533/879652. 
The ideal starting date is March 2024.
If you have any questions, feel free to reach out to jobs@meridia.land for more information about this position."
3831596051,Web Developer,https://www.linkedin.com/jobs/view/3831596051,Binar Academy,https://www.linkedin.com/company/binar-academy/life," ",,50,,On-site,,201-500 employees · IT Services and IT Consulting,https://media.licdn.com/dms/image/C560BAQEBEZeoowry3A/company-logo_100_100/0/1657875033201/binar_academy_logo?e=1717027200&v=beta&t=1KqUkRWEBQSajgDbaOnogXxQIhBF_-D_-d7OAmKysGo,"BINAR was born in 2017 to advance Indonesia’s technology ecosystem. Our mission is to solve digital talent gap by upskilling and job matching.

We support people to build a career in digital industry or upskilling into digital related roles with the knowledge and skills needed to thrive through a structured learning journey and multiple learning styles to ensure each learner can reach mastery through their own preferred way.

Our upskilling programs are designed to provide learners with first-hand exposure to the real world and prepare them with skills critically needed by the industries in this fast-changing digital era.

Also, we help students and companies to connect and build great teams.
Fueled by industry change, BINAR for Business helps companies achieve critical business outcomes and stay competitive by offering relevant and personalized learning experiences.

Advance your career, show off your skills, grow your business and get ready to #SelangkahDiDepan with BINAR.

Learn more about us:
Website: www.binaracademy.com
Instagram: @academybinar
Youtube: https://www.youtube.com/binaracademy

BINAR Apps is available on the Google Play store and iOS. Download BINAR app on:
- Apple Store: https://bit.ly/BinarAppsAppStore
- Google Play Store: https://bit.ly/BinarAppsPlayStore","The ideal candidate is a creative problem solver who will work in coordination with cross-functional teams to design, develop, and maintain our next generation websites and web tools. You must be comfortable working as part of a team while taking the initiative to take lead on new innovations and projects. 
 Responsibilities
Implement application development by the business needs.
Perform analysis and provide feedback on functional and business needs related to the new Branch Delivery System project, including wireframe and user flow.
Create wireframes, layout designs and mockups for back-office purposes
Create and develop angular web front-end in the form of native applications using a framework that is by the existing architecture. 
Make the necessary documentation under the work performed.

Qualifications
Bachelor's degree or equivalent experience in Computer Science
At least 3 years' of experience using HTML, Java script, CSS, bootstrap, Angular, Object-oriented programming OOP.
Familiar with Agile Methodology. 
Willing to WFO in South Jakarta."
3835240364,Senior Software Engineer - Backend (Remote),https://www.linkedin.com/jobs/view/3835240364,Carepatron,https://www.linkedin.com/company/carepatron/life," ",1 day ago,100,,Remote,,11-50 employees,https://media.licdn.com/dms/image/D560BAQHDqS_4g-CNrg/company-logo_100_100/0/1691052619134/carepatron_logo?e=1717027200&v=beta&t=Zz0ssa03FIuNwhZAWgtfYTwX0tdkOtp3kIdw6BzbjgM,"We help small health practices do more of what they love.

Carepatron is your Healthcare Workspace - Manage your clients, scheduling, and billing from one secure app.","100% remote team
Fast growing start up
Be part of a world-class international team

Carepatron is a powerful, easy-to-use workspace that helps healthcare professionals and their clients achieve better health outcomes.

At Carepatron, our mission is to accelerate the world's transition to digital healthcare. This purpose sits at the centre of everything we do. We support a global user community to succeed through better tools, information, and connections. Because when they succeed, they make a difference, and when millions of health people make a difference, the world is a better place!

What does remote working mean at Carepatron?
We believe the future is fully distributed where talented people do the best work of their lives, from anywhere in the world. A place where people develop world-class products while building lifetime friendships.

What could your day look like?
Collaborate with your team on Google Meet or slack at your daily standup
Heaps of time to code uninterrupted before lunch
Chat with colleagues across the globe
Jump into a virtual huddle with our Design or Engineering leads to workshop solutions or answer your questions
More dedicated uninterrupted time after lunch for focused work, a tech review, a design catch-up, or a peer review.

What we're looking for:
6+ years experience building production-level large scale web applications
In-depth understanding of modern technologies and architectures
Advanced experience in .Net, C#, SQL, Docker
AWS (or other cloud infrastructure and service providers)
Monitoring tools (New Relic etc)
Advanced level of English

Why Carepatron?
Join a fast-growing global start-up
Be part of a work environment that genuinely encourages continuous improvement and lots of collaboration between product, design, and engineering
Develop your skills by using the latest engineering and software delivery practices, at scale, on a global stage
Work with the latest tech at Carepatron. C#, .NET, AWS, React, TypeScript, the list goes on!
Contribute directly to our technology vision ""to accelerate the world's transition to digital health.""
Let us support your growth with heaps of training and development resources."
3819928840,Software Engineer,https://www.linkedin.com/jobs/view/3819928840,Adira Finance,https://www.linkedin.com/company/adira/life," ",2 weeks ago,100,,Hybrid,,"10,001+ employees · Financial Services",https://media.licdn.com/dms/image/D560BAQEjMcK5PAwqQw/company-logo_100_100/0/1704681600114/adira_logo?e=1717027200&v=beta&t=0LVT1G6qPjbch-ZDHSXOBCx07EQF9l5BVkIzJaar_gE,"PT Adira Dinamika Multi Finance Tbk (Adira Finance) berdiri pada tahun 1990 semula dikembangkan sebagai perusahaan pembiayaan mobil, yang kemudian sejak tahun 1997 merambah ke pembiayaan sepeda motor. Pada tahun 2004, Adira Finance mencatatkan sahamnya di Bursa Efek Jakarta (sekarang Bursa Efek Indonesia) dan diambil alih oleh PT Bank Danamon Indonesia Tbk (Bank Danamon). Saat ini kepemilikan saham Bank Danamon terhadap Perusahaan adalah sebesar 92,07%. Sebagai anak perusahaan Bank Danamon, Adira Finance menjadi bagian dari Grup MUFG.

Adira Finance telah menjadi perusahaan terkemuka di sektor pembiayaan yang melayani beragam merek dan produk. Pada tahun 2015, Adira Finance mulai memperkenalkan produk pembiayaan perlengkapan rumah tangga dan elektronik (durable) dan pembiayaan otomotif (mobil dan motor) berbasis syariah melalui Unit Usaha Syariah Adira Finance. Di tahun 2017 Adira Finance turut menghadirkan platform e-commerce pembiayaan multiguna jasa dicicilaja.com, marketplace jual beli kendaraan momobil.id, dan diikuti momotor.id pada tahun 2018. Pada tanggal 20 Februari 2020, Adira Finance meluncurkan inovasi baru di bidang digital yaitu aplikasi adiraku.

Sesuai dengan janji brand Adira Finance, “Sahabat Setia Selamanya”, perusahaan terus hadir di sisi konsumen dengan memberikan beragam solusi finansial sesuai siklus kehidupannya.

Saat ini, Adira Finance memiliki peringkat surat utang idAAA/Stable dari Pefindo, dan peringkat kredit internasional “BBB” dari Fitch Rating dan “Baa1” dari Moodys. Adira Finance melayani lebih dari 2 juta konsumen aktif di seluruh Indonesia dengan jumlah piutang yang dikelola sebesar Rp 40,4 triliun (2021). Selengkapnya kunjungi www.adira.co.id.","Responsibilities 
Execute full software development life cycle (SDLC)
Integrate software components into a fully functional software system
Optimize application for maximum performance and scalability
Build reusable code and libraries for future use
Continuously learn about new engineering techniques and technologies

Qualification
Candidate must possess at least a Bachelor's Degree, Computer Science/Information Technology or equivalent, with min. GPA 2.75.
At least having 1-year experiences
Have a strong understanding of Object-Oriented Programming (OOP).
Have at least one programming language skill Framework Flutter (Dart)/JavaScript/VueJS/ReactJS/React Native/Java SpringBoot/REST API/C#/.Net/Python and a minimum of 1 project.
Having experience using SQL Database, Query and Database Design both RDBMS (Sql Server, Oracle and Postgre Sql) and NoSql (MongoDB, etc).
Having experience using message broker technology such as Apache Kafka is a plus.
Understand the concept of microservice technology.
Especially for data engineer :
Have experience using ETL Tools Informatica PWC-BDM/Microsoft SSIS/Pentaho
Have experience using BI Tools Microstrategy/Oracle BI/SAS VA/Tableau""
Especially for mobile apps engineer and frontend engineer :
Have knowledge and experience as Mobile Apps Developer or similar role
Have a strong understanding of UI/UX Mobile Apps
Willing to work in Head Office (Sudirman, South Jakarta).



Note : To apply, please attached your CV in Ms. Word or PDF format."
