id,title,job_url,company,company_link,location,published_at,number_of_applicants_applied,employment_duration,work_location_type,work_experience_level,company_type,company_logo,company_description,about_the_job
3879704106,Junior Fullstack Developer,https://www.linkedin.com/jobs/view/3879704106,Zi.Care,https://www.linkedin.com/company/zicare/life,"Jakarta, Jakarta, Indonesia",,0,,,,,https://media.licdn.com/dms/image/C4E0BAQFpDHWCdX5WoQ/company-logo_100_100/0/1630631990440/zicare_logo?e=1721865600&v=beta&t=wJNVYheOQF62pLX2Uc5cIxW6n1aIWjtH9prevy-qLPQ,"Digitizing Healthcare

Zi.Care adalah solusi Sistem Informasi dan manajemen pelayanan kesehatan terkini yang dikembangkan oleh PT. Jejaring Tiga Artha.

Zi.Care dikembangkan secara langsung melalui riset dan pengalaman founders di rumah sakit rujukan nasional untuk menciptakan sebuah sistem informasi kesehatan yang memiliki standar tinggi.

Visi kami adalah memimpin inovasi dalam industri kesehatan dengan pendekatan holistik dalam riset dan pengembangan, sistem kami akan memberikan pengalaman unik bagi pengguna dan disaat yang sama menciptakan ekosistem dan optimalisasi keuntungan bagi seluruh stakeholder industri kesehatan.
…
show more","Company Description: Zi.Care adalah solusi Sistem Informasi dan manajemen pelayanan kesehatan terkini yang dikembangkan oleh PT. Jejaring Tiga Artha. Zi.Care dikembangkan secara langsung melalui riset dan pengalaman founders di rumah sakit rujukan nasional untuk menciptakan sebuah sistem informasi kesehatan yang memiliki standar tinggi. Visi kami adalah memimpin inovasi dalam industri kesehatan dengan pendekatan holistik dalam riset dan pengembangan, sistem kami akan memberikan pengalaman unik bagi pengguna dan disaat yang sama menciptakan ekosistem dan optimalisasi keuntungan bagi seluruh stakeholder industri kesehatan. Job Description:

Junior Fullstack Developer"
3846668346,SE - AML & ABC Control and Reporting (Sharia),https://www.linkedin.com/jobs/view/3846668346,Prudential Indonesia (PT Prudential Life Assurance),https://www.linkedin.com/company/prudential-indonesia-pt-prudential-life-assurance-/life,"Jakarta, Jakarta, Indonesia",,100,,,,,https://media.licdn.com/dms/image/C510BAQHlHbrkp6AbPg/company-logo_100_100/0/1630608436677/prudential_indonesia_pt_prudential_life_assurance__logo?e=1721865600&v=beta&t=_PhoJWP_kUzEJaLdoNVAIo_ae1G043vySglzDIdwpFU,"Listening. Understanding. Delivering.

At Prudential Indonesia we deliver excellence by consistently innovating, creating new opportunities and growing our business to cater all of our customers' needs.

With a vision of becoming truly world class, Prudential Indonesia provides quality services and proven track record of market leadership in the country.

Working at Prudential Indonesia gives you many opportunities to develop yourself and explore what you’re really capable of, as well as the perfect environment to collaborate, listen and care for others.

Ask around. The more you find out about us, the more you’ll learn that we’re an insurance company that understands you.

We are here to listen.
…
show more","Prudential’s purpose is to be partners for every life and protectors for every future. Our purpose encourages everything we do by creating a culture in which diversity is celebrated and inclusion assured, for our people, customers, and partners. We provide a platform for our people to do their best work and make an impact to the business, and we support our people’s career ambitions. We pledge to make Prudential a place where you can Connect, Grow, and Succeed.

Main Responsibilities

Assist the Manager, (Head of) AML & ABC by establishing adequate control to mitigate money laundering, bribery, and corruption-related risk exposure.
Prepare and handle AML & ABC related reporting to regulators and other stakeholders.
Provide data, analysis, and evaluation report to support the (Head of) AML & ABC in overseeing overall AML & ABC implementation program.
Perform other ad-hoc AML related tasks.


Qualification

Job Specification:

Bachelor’s degree from any major.
Good proficiency in English communication (both oral or writing), and presentation Skill.
Good sensibility on Risk & Control.
Able to work with tight deadlines and pressure.
Result-oriented. 


Experience

Min. 2 – 3 years’ experience working in Financial Services Industry (e.g Bank, Insurance, Capital Market) as Compliance or Anti-Money Laundering team.
Familiar with AML-related reporting, practice and regulations in insurance or any other financial industry.
Familiar with the Anti-Bribery and Corruption concept and practice.


Knowledge & Skill

Good Computer literate: Microsoft Visio, Excel, PowerPoint, and Word.
Detail-Oriented.
Good Communication Skill.
Capable of working independently but able to become a team player with a positive attitude.
Knowing Life Insurance business process and its product is a plus.


Prudential is an equal opportunity employer. We provide equality of opportunity of benefits for all who apply and who perform work for our organisation irrespective of sex, race, age, ethnic origin, educational, social and cultural background, marital status, pregnancy and maternity, religion or belief, disability or part-time / fixed-term work, or any other status protected by applicable law. We encourage the same standards from our recruitment and third-party suppliers taking into account the context of grade, job and location. We also allow for reasonable adjustments to support people with individual physical or mental health requirements."
3871463449,Frontend Developer,https://www.linkedin.com/jobs/view/3871463449,Wipro,https://www.linkedin.com/company/wipro/life,"Jakarta, Indonesia",,100,,,,,https://media.licdn.com/dms/image/D4E0BAQEkfMUEE4caDQ/company-logo_100_100/0/1698887191930?e=1721865600&v=beta&t=kPkiXL-AfYMjGpAGHzQVPh0kRZm_UPRsXbo3rV4Zkz8,"Wipro Limited (NYSE: WIT, BSE: 507685, NSE: WIPRO) is a leading technology services and consulting company focused on building innovative solutions that address clients’ most complex digital transformation needs. Leveraging our holistic portfolio of capabilities in consulting, design, engineering, and operations, we help clients realize their boldest ambitions and build future-ready, sustainable businesses. With nearly 245,000 employees and business partners across 65 countries, we deliver on the promise of helping our clients, colleagues, and communities thrive in an ever-changing world.
Wipro is an Equal Employment Opportunity employer and makes all employment and employment-related decisions without regard to a person's race, sex, national origin, ancestry, disability, sexual orientation, or any other status protected by applicable law.","Front-End Developer Skills and Requirements – 3-8years
Proficiency in CSS, HTML and JavaScript
Experience with CSS preprocessors such as Sass or Less
Ability to work with frontend libraries like bootstrap, ag grid
Responsive design and mobile development
Strong problem-solving and debugging skills
Knowledge and expertise in front-end frameworks and libraries such as React, Angular.
Comfortable in working with branches, merging code, and resolving conflicts.
Strong communication skills in order to work with designers, back-end developers, and other members.
Knowledge of browser developer tools such as Chrome DevTools
Should be able to write code that works across browsers and solve any issues that may arise."
3633356022,Front-End Software Engineer,https://www.linkedin.com/jobs/view/3633356022,Mekari,https://www.linkedin.com/company/mekari/life,"Jakarta, Jakarta, Indonesia",,0,,,,,https://media.licdn.com/dms/image/D560BAQEy-QSiDSQhLQ/company-logo_100_100/0/1689148487268/mekari_logo?e=1721865600&v=beta&t=xvZ6Jeh10sw_Acs2w_cFnhQE2bYiFP3ikZSeWi-utlc,"Mekari is the #1 Software-as-a-Service (SaaS) company in Indonesia, aiming to empower the progress of businesses and professionals across various industries.

Our innovative cloud-based technology solution in HR (Mekari Talenta), Accounting (Mekari Jurnal), Sales (Mekari Qontak), Tax (Mekari Klikpajak), Electronic Signature (Mekari Sign), and Benefits (Mekari Flex) have been used by tens thousands of businesses in Indonesia.

To reach millions, we need more people like you —those eager to innovate, lead, and win with us.","Mekari is Indonesia's no. 1 Software-as-a-Service (SaaS) company. Our mission is to empower businesses and professionals to progress effortlessly. Our products (Mekari Talenta, Mekari Jurnal, Mekari KlikPajak, & Mekari Qontak) have been used by tens of thousands of businesses in Indonesia.

To reach millions, we need more people like you: entrepreneurs, builders, owners inside the company who are eager to grow at scale. Join us to empower more businesses with technology.

Essential Technical Skills

Extensive experience in frontend development using Vue.js (Strong web design skills preferred)
At least 2 years of experience in building and deploying web applications using MVC, MVVM etc.(MVW) architecture using Vue.js.
Familiarity with tools such as Babeljs, WebPack Configuration module, etc.
Familiarity working with web frameworks such as Yii2/Laravel in PHP, or Ruby on Rails.
Proficient understanding of code versioning tools (like Git or SVN)

Essential Soft Skills

Worked in startups like environments with high levels of ownership and commitment
Have a penchant for solving complex and interesting problems
The ability to do deep problem solving and build elegant, maintainable solutions to complex problems
Collaborate with a team to define, design, and ship new features in a well-defined time period.

Desirable

Experience working with remote design teams across the globe
Past experience with Test Driven Development (TDD) process for software development

What You Will Get

 Competitive salary + daily allowance.
 Premium private health insurance (outpatient, inpatient, maternity, dental).
 Early access to salary + flex installment (employee loan) via Mekari Flex.
 Allowance for sports activities and glasses/contact lenses.
 Flexible working hours and remote work culture with free co-working space services.
 Annual and unpaid leaves from day 1 of join date + unlimited sick leave with doctor note.
 Notebook Ownership Program.
 Strategic office location, accessible by MRT.
 Friendly and dynamic work environment.
 Opportunity to take part in growing Indonesia's no. 1 SaaS company

Our team will review your application and will be in touch if your application is shortlisted to the next stage. If you do not hear from us in 30 days, we will keep your resume on file in case a relevant opportunity opens up.

Don't forget to check our Recruitment FAQ at bit.ly/RecruitmentFAQ-Mekari [ENG] or bit.ly/RekrutmenMekari-FAQ [INA] to find the answers to commonly-asked questions regarding our recruitment process.

We wish you the best. Hope to see you around soon!"
3883862178,Software Engineer (Financial Service),https://www.linkedin.com/jobs/view/3883862178,Mekari,https://www.linkedin.com/company/mekari/life,"Jakarta, Jakarta, Indonesia",,0,,,,,https://media.licdn.com/dms/image/D560BAQEy-QSiDSQhLQ/company-logo_100_100/0/1689148487268/mekari_logo?e=1721865600&v=beta&t=xvZ6Jeh10sw_Acs2w_cFnhQE2bYiFP3ikZSeWi-utlc,"Mekari is the #1 Software-as-a-Service (SaaS) company in Indonesia, aiming to empower the progress of businesses and professionals across various industries.

Our innovative cloud-based technology solution in HR (Mekari Talenta), Accounting (Mekari Jurnal), Sales (Mekari Qontak), Tax (Mekari Klikpajak), Electronic Signature (Mekari Sign), and Benefits (Mekari Flex) have been used by tens thousands of businesses in Indonesia.

To reach millions, we need more people like you —those eager to innovate, lead, and win with us.","Mekari is Indonesia's no. 1 Software-as-a-Service (SaaS) company. Our mission is to empower businesses and professionals to progress effortlessly. Our products (Mekari Talenta, Mekari Jurnal, Mekari KlikPajak, & Mekari Qontak) have been used by tens of thousands of businesses in Indonesia.

To reach millions, we need more people like you: entrepreneurs, builders, owners inside the company who are eager to grow at scale. Join us to empower more businesses with technology.

Job Descriptions

Maintain high levels of customer engagement (including on-site meetings) with a focus on customer satisfaction and loyalty
You will work with your accounts proactively to drive product adoption as well as act as the voice of clients
Proactively spot and correct any issues that could affect customer satisfaction or retention
Facilitate periodic reviews with customers, determining new requirements and further success through engaging and consultative discussions
Continually gather feedback from our clients, then work directly with our product team to provide input on the product roadmap

Technical Requirements

Good knowledge of Ruby. Experience with Ruby frameworks (e.g. Rails, Sinatra) is a plus.
Understand basic Javascript. Experience with Javascript frameworks (e.g. VueJs, ReactJs) is a plus.
Familiarity with relational databases concepts (SQL syntax, indexing, structures, and query optimization).
Understand programming practices such as separation of concerns, unit testing, and writing self-documenting code.
Familiarity with version control systems such as Git or Mercury.
Have some experience in deploying an app to the production environment

Soft Skill Requirements

Integrity and humility is a must
Passionate about problem-solving and software engineering
Possess excellent teamwork skill
Good communication skills with technical and non-technical team members
Love to learn new things and share them with others

You Will Impress Us If You Are

Experienced with containers and orchestration (e.g. Docker & Kubernetes)
Experienced in building a high performance & highly available web application
Experienced in mentoring more junior developers
Maintain an open-source project or is an open-source contributor

What You Will Get

 Competitive salary + daily allowance.
 Premium private health insurance (outpatient, inpatient, maternity, dental).
 Early access to salary + flex installment (employee loan) via Mekari Flex.
 Allowance for sports activities and glasses/contact lenses.
 Flexible working hours and remote work culture with free co-working space services.
 Annual and unpaid leaves from day 1 of join date + unlimited sick leave with doctor note.
 Notebook Ownership Program.
 Strategic office location, accessible by MRT.
 Friendly and dynamic work environment.
 Opportunity to take part in growing Indonesia's no. 1 SaaS company

Our team will review your application and will be in touch if your application is shortlisted to the next stage. If you do not hear from us in 30 days, we will keep your resume on file in case a relevant opportunity opens up.

Don't forget to check our Recruitment FAQ at bit.ly/RecruitmentFAQ-Mekari [ENG] or bit.ly/RekrutmenMekari-FAQ [INA] to find the answers to commonly-asked questions regarding our recruitment process.

We wish you the best. Hope to see you around soon!"
3908058097,Senior Frontend Developer,https://www.linkedin.com/jobs/view/3908058097,PT Integra Pratama,https://www.linkedin.com/company/pt-integra-pratama/life,"West Jakarta, Jakarta, Indonesia",,13,,,,,"data:image/gif;base64,R0lGODlhAQABAIAAAAAAAP///yH5BAEAAAAALAAAAAABAAEAAAIBRAA7","PT Integra Pratama is an information technology and services company based out of Jakarta, Indonesia in operation since 2002 as a privately held company. We are one of the leading partners in the fast-growing market of Indonesia in extending solution and services for digital and conventional payment business.","Responsibilities :
* Develop new user-facing features.
* Build reusable code and libraries for future use.
* Ensure the technical feasibility of UI/UX designs.
* Optimize application for maximum speed and scalability.
* Assure that all user input is validated before submitting to back-end.
* Collaborate with other team members and stakeholders.
* Be able to do testing, debugging, and problem-solving

Requirements :
* Have an Excellent Fundamental on either Java, Golang or JS
* Have a good Understanding on several Programming Principles s.a S.O.L.I.D, Dependency
Injection, Clean Architecture.
* Have a deep knowledge on Framework Spring, Springboot, Spring AOP, Spring JPA
* Understand how to Secure the BE/API using several method s.a basik Auth, bearer Token or
Active Directory
* Understand how to Integrate the BE with any form of Integration (Sync: REST, Async: JMS,
Message Broker)
* Understand on how the Dependency Manager such as Maven/Gradle works.
* Understand how to use Git base Version Control, and branches strategy s.a Git Flow or Trunk
Based
* Strong proficiency in JavaScript, Asynchronous JS sa: Callback, Async Await, and Promise.
* Strong proficiency in TypeScript, including type definitions, interfaces, and generics.
* Deep understanding of React fundamentals such as JSX, components, state, and props.
* Experience with React lifecycle methods, hooks, and context API.
* Experience in integrating with RESTful APls and understanding of HTTP protocols, AJAX, and JSON"
3902618498,Database Engineer,https://www.linkedin.com/jobs/view/3902618498,PHINCON,https://www.linkedin.com/company/phintraco-consulting/life,"Jakarta, Indonesia",,100,,,,,https://media.licdn.com/dms/image/C560BAQGlo4pZo6rcaQ/company-logo_100_100/0/1631379820861?e=1721865600&v=beta&t=_kf79s2sIvz31p5ApINXJP9P1dRKGQE9klLz6QL9yPY,"Phincon (Phintraco Consulting), a company member of Phintraco Group, is an Information Technology (IT) consulting and services company.

Established in 2008, we are focusing on providing customers with all spectrums of Customer Relationship Management (CRM), Middleware, HR, Big Data, RPA, and ERP solutions.
…
show more","• Candidate must be possess at least bachelor degree majoring Information Technology/ Information System with minimum GPA 3.00 of 4.00
• Having minimum 1 year experiences in reporting, dashboard and databases.
• Good analytical thinking and problem solving; initiative or high energy; good interpersonal skill.
• Have knowledge about dashboard reporting and contact center solution.
• Good written and verbal communication skills.
• Ability to work collaboratively with other departments and thrive in a fast-paced and dynamic environment
• Must have 1+ year of experience working with BI tools like Tableau, Google Data Studio, Microstrategy or Microsoft Power BI, etc.
• Experience with SQL query.
• Proficient with the Microsoft Office suite of tools (Word, Excel, PowerPoint, and Visio).
• Good in Problem Solving and Critical Thinking.
• Strong foundation in reporting, statistical methods, database and can analyze trend and give insight from dashboard.
• English is a plus."
3901021747,Database Engineer,https://www.linkedin.com/jobs/view/3901021747,PHINCON,https://www.linkedin.com/company/phintraco-consulting/life,"Jakarta, Indonesia",,100,,,,,https://media.licdn.com/dms/image/C560BAQGlo4pZo6rcaQ/company-logo_100_100/0/1631379820861?e=1721865600&v=beta&t=_kf79s2sIvz31p5ApINXJP9P1dRKGQE9klLz6QL9yPY,"Phincon (Phintraco Consulting), a company member of Phintraco Group, is an Information Technology (IT) consulting and services company.

Established in 2008, we are focusing on providing customers with all spectrums of Customer Relationship Management (CRM), Middleware, HR, Big Data, RPA, and ERP solutions.","• Candidate must be possess at least bachelor degree majoring Information Technology/ Information System with minimum GPA 3.00 of 4.00
• Having minimum 1 year experiences in reporting, dashboard and databases.
• Good analytical thinking and problem solving; initiative or high energy; good interpersonal skill.
• Have knowledge about dashboard reporting and contact center solution.
• Good written and verbal communication skills.
• Ability to work collaboratively with other departments and thrive in a fast-paced and dynamic environment
• Must have 1+ year of experience working with BI tools like Tableau, Google Data Studio, Microstrategy or Microsoft Power BI, etc.
• Experience with SQL query.
• Proficient with the Microsoft Office suite of tools (Word, Excel, PowerPoint, and Visio).
• Good in Problem Solving and Critical Thinking.
• Strong foundation in reporting, statistical methods, database and can analyze trend and give insight from dashboard.
• English is a plus."
