id,title,job_url,company,company_link,location,published_at,number_of_applicants_applied,employment_duration,work_location_type,work_experience_level,company_type,company_logo,company_description,about_the_job
3816005201,"Staff Data Engineer (Fintech team) (Bangkok based, relocation provided)",https://www.linkedin.com/jobs/view/3816005201,Agoda,https://www.linkedin.com/company/agoda/life," "," ",26,,Full-time,,"5,001-10,000 employees · Software Development",https://media.licdn.com/dms/image/C4D0BAQGBa_7QNZNwpw/company-logo_100_100/0/1656643826660/agoda_logo?e=1717027200&v=beta&t=vPlS2bkbYZytwO9Ar0ZYMPyT_DyMjPtqChcc4MKsjAY,"Agoda is transforming travel for millions of customers across the globe.

Headquartered in Asia, Agoda is one of the world’s largest online travel platforms. Founded in 2005 and now part of Booking Holdings (Nasdaq:BKNG), Agoda has a network of over 2,900,000 properties worldwide. Our web and mobile products provide a first-rate reservation service in 38 languages that uniquely combines local knowledge and local connections to provide the best deals for business and leisure travelers.

Agoda employs over 7,000 professionals from 90 nationalities in locations around the globe. In every department – from engineering to customer experience – we provide an environment rich with creativity, collaboration, and experimentation, and the tools to work faster and smarter.

At Agoda, we believe our people are our strength. We work hard and have fun, and we choose people who are dedicated to making things great.

For properties seeking partnership with Agoda, visit https://connect.agoda.com
…
show more","About Agoda 

Agoda is an online travel booking platform for accommodations, flights, and more. We build and deploy cutting-edge technology that connects travelers with more than 3.6 million accommodations globally. Based in Asia and part of Booking Holdings, our 6,000+ employees representing 90+ nationalities foster a work environment rich in diversity, creativity, and collaboration. We innovate through a culture of experimentation and ownership, enhancing the ability for our customers to experience the world.

About Agoda

Agoda is an online travel booking platform for accommodation, flights, and more. We build and deploy cutting edge technology that connects travelers with more than 2.5 million accommodations globally. Based in Asia and part of Booking Holdings, our 4,000+ talents coming from 90+ different nationalities foster a work environment rich in diversity, creativity, and collaboration. We innovate through a culture of experimentation and ownership, enabling our customers to experience the world

 Get to Know Our Team 

Fintech is one of the fastest growing areas in Agoda and we are rapidly expanding our tech team. We work closely with the finance business team and our Fintech product owners to reduce risk, drive efficiencies and move on new market opportunities in this exciting field. We have a wide range of projects from traditional finance or cutting-edge customer fintech. For example, reconciliation using Big Data technologies, growing and optimizing customer payments options, tax calculations in milli-second response times and a mesh of supplier payment options like vertical credit cards. Its a hot field and the perfect mix of data engineering and backend engineering.

 The Opportunity 

We are looking for engineers with experience in the fintech area. This can be a year or two at a fintech startup right through to an expert in this domain. You might have a background as ‘ back end ’ or ‘data’ engineer , either way we are looking for smart engineers who can be super agile, move fast and have an eye for detail. We’d love to hear from you if you are skilled in any of the technologies we work with and excited at building new fintech technology.

In this Role, you will get to

Lead the team technically in improving scalability, stability, accuracy, speed and efficiency of our existing Data systems
Build, administer and scale data processing pipelines
Be comfortable navigating the following technology stack: Scala, Spark, java, Golang, Python3, scripting (Bash/Python), Hadoop, SQL, S3 etc
Improve scalability, stability, accuracy, speed and efficiency of our existing data systems
Design, build, test and deploy new libraries, frameworks or full systems for our core systems while keeping to the highest standards of testing and code quality
Work with experienced engineers and product owners to identify and build tools to automate many large-scale data management / analysis tasks 

What You’ll Need To Succeed

Bachelor’s degree in Computer Science /Information Systems/Engineering/related field
5+ years of experience in Data engineering
Good experience in Apache Spark
Expert level understanding of JVM and either Java or Scala
Experience debugging and reasoning about production issues is desirable
A good understanding of data architecture principles preferred
Any other experience with Big Data technologies / tools
SQL experience
Analytical problem-solving capabilities & experience
Systems administration skills in Linux

It’s great if you have

Good understanding of Hadoop ecosystems
Experience working with Open-source products
Python/Shell scripting skills
Working in an agile environment using test driven methodologies

#telaviv #jerusalem #IT #ENG #4 #sanfrancisco #sanjose #losangeles #sandiego #oakland #denver #miami #orlando #atlanta #chicago #boston #detroit #newyork #portland #philadelphia #dallas #houston #austin #seattle #sydney #melbourne #perth #toronto #vancouver #montreal #shanghai #beijing #shenzhen #prague #Brno #Ostrava #cairo #alexandria #giza #estonia #paris #berlin #munich #hamburg #stuttgart #cologne #frankfurt #hongkong #budapest #jakarta #bali #dublin #telaviv #milan #rome #venice #florence #naples #turin #palermo #bologna #tokyo #osaka #kualalumpur #malta #amsterdam #oslo #manila #warsaw #krakow #doha #alrayyan #riyadh #jeddah #mecca #medina #singapore #seoul #barcelona #madrid #stockholm #zurich #taipei #tainan #taichung #kaohsiung #bangkok #Phuket #istanbul #london #manchester #edinburgh #hcmc #hanoi #lodz #wroclaw #poznan #katowice #rio #salvador #newdelhi #bangalore #bandung #yokohama #nagoya #okinawa #fukuoka #jerusalem #IT #4

Equal Opportunity Employer 

At Agoda, we pride ourselves on being a company represented by people of all different backgrounds and orientations. We prioritize attracting diverse talent and cultivating an inclusive environment that encourages collaboration and innovation. Employment at Agoda is based solely on a person’s merit and qualifications. We are committed to providing equal employment opportunity regardless of sex, age, race, color, national origin, religion, marital status, pregnancy, sexual orientation, gender identity, disability, citizenship, veteran or military status, and other legally protected characteristics.

We will keep your application on file so that we can consider you for future vacancies and you can always ask to have your details removed from the file. For more details please read our privacy policy .

To all recruitment agencies: Agoda does not accept third party resumes. Please do not send resumes to our jobs alias, Agoda employees or any other organization location. Agoda is not responsible for any fees related to unsolicited resumes."
3818883097,Dev Ops Engineer,https://www.linkedin.com/jobs/view/3818883097,PT Lima Titik Satu,https://www.linkedin.com/company/pt-lima-titik-satu/life," ",2 weeks ago,100,,Hybrid,,11-50 employees,https://media.licdn.com/dms/image/C4E0BAQEcd4U_w5YQKg/company-logo_100_100/0/1631303996369?e=1717027200&v=beta&t=uYu66wiXtIIAsJ8DWGNpEqbPMEumwcMrJ63Q8LnipvY,"software & applications developer, system integrator, e-learning & school system specialist.","We are challenge you to join our dynamic team with an independent working environment for skilled DevOps Engineers to join our dynamic team in Jakarta. If you have a minimum of 1 year of relevant experience, regardless of gender, and possess a strong skill set in the following areas, we want to hear from you!

**Responsibilities:**
- Design, build, monitor and maintain efficient deployment pipelines and infrastructure.
- Collaborate with development and operations teams to streamline processes.
- Implement automation tools for continuous integration and continuous deployment (CI/CD).
- Monitor system performance and troubleshoot issues proactively.

**Requirements:**
- Minimum of 1 year of hands-on experience in a DevOps or similar role.
- Proficiency in scripting languages such as Python, Shell, PowerShell or others.
- Experience with containerization tools like Docker, Kubernetes or others
- Familiarity & Certified xwith cloud platforms (AWS, Alibaba Cloud & Indoensian Cloud) and infrastructure as code (IaC) tools like Terraform or Ansible.
- Strong understanding of CI/CD pipelines and related tools (Jenkins, GitLab CI/CD, etc.).
- Knowledge of monitoring and logging tools such as Prometheus, ELK Stack, etc.

*To apply, please submit your resume and cover letter to info@limabit.com with the subject line: ""DevOps Engineer Application - Jakarta.""*

Don't miss this chance to be part of a vibrant team driving technological excellence in Jakarta! Apply now and take your DevOps career to the next level."
3819769952,Senior Data Engineer,https://www.linkedin.com/jobs/view/3819769952,VLink Inc,https://www.linkedin.com/company/vlink-inc/life," ",3 weeks ago,91,,On-site,,201-500 employees · IT Services and IT Consulting,https://media.licdn.com/dms/image/C4E0BAQHAMUYx5jqZ1w/company-logo_100_100-alternative/0/1630643463375/vlink_inc_logo?e=1717027200&v=beta&t=38F8wJibihAzBVtKBngCpXGGAkYcQSGUyRh-v_0Dm9M,"VLink Inc. is a global software engineering and IT staffing partner, delivering innovative solutions with the most highly vetted expert software development teams. We leverage the latest technologies and the best IT talent to drive business growth for Fortune-500, Large and SMB clients by delivering a customized, personal approach, to ensure their unique technology needs are met.
Founded in 2006, VLink takes pride in our highly revered workforce whose productivity, tech agility, and expertise produce transformative customer success stories year-after-year.

Why Choose VLink?
- 100% Customer Retention
- 7+ Delivery Locations with Onshore/Offshore/Nearshore IT Talent
- 48 Hrs. TAT for Candidates Profiles on New Hiring Requests
- 18+ Years of Software Engineering Excellence
- 600+ Software Engineers & Consultants
- 250+ Global Fortune-500, Large & SMB Clients Served


Our core competencies and global service offerings include:
*DIGITAL TRANSFORMATION & CONSULTING*
(Data & Analytics| DevOps & Automation| Blockchain, AI/ML, IoT| Re-engineering Legacy Apps | Enterprise Portal Upgrades & Migrations)

*CUSTOM SOFTWARE DEVELOPMENT & MAINTENANCE*
(Web & Mobile Apps| Product Engineering| Maintenance & Support| QA & Testing)

*DEDICATED TEAMS & IT STAFF AUGMENTATION*
(Delivery Centers Onshore, Offshore & Nearshore| Short & Long-term Assignments| 24x7 Time Zone Alignment| Attrition Management| Speedy delivery)


**AWARD-WINNING WORKFORCE**
- Inc Magazine 500/5000 Fastest Growing Privately Owned Companies
- Connecticut’s 40 Fastest-Growing Tech Companies by Connecticut Technology Council’s Marcum TT 40
- Consistent Top Five Winner of Hartford Business Journal’s Best Places to Work in CT (2023)
- Great Place to Work® Certified™ 2023
- 2023 Best Software Development Companies in Hartford CT, by Expertise.com

***OUR INTELLECTUAL PROPERTIES***
- SimplyEDI
- VLinkCare
…
show more","Job Role
Senior Data Engineer

Scope of Work
Big Data Analytics, Backend Engineer, DevOps

Product
Payment Gateway, Digital Payment Platform

Elevator Pitch 
Responsible for leading and overseeing the development of scalable, efficient, and innovative software solutions, with a specific focus on implementing and enhancing the Fraud Detection System (FDS). Your role will involve managing a team of skilled engineers, driving technological strategies, leveraging Big Data technologies, and overseeing the creation of back-end APIs and microservices to enhance the platform's performance and capabilities

Requirements
Bachelor's or Master's degree in Computer Science, Software Engineering, or a related field
Proven experience in a leadership role within Product Management, Back-End Software Engineering with a focus on Big Data technologies
In-depth knowledge of Data Warehouse, ETL and Big Data technologies
Proficient in Java, Go, Python, Bash scripting languages
Experience of streaming technologies such Kafka, Spark, Pub/Sub, Rabbitmq
Experience with back-end APIs and microservices scalable and modular architectures
Preferred experience with delivering code using (CI/CD) best practices and DevOps technologies (Jenkins Pipelines, Docker)
Experience with cloud computing platforms (GCP) is an advantage 
Good understanding of payment gateway, digital transaction platform, FDS (Fraud Detection Systems) area

Responsibilities
Develop back-end API for multiple use cases leveraging Java, Go language
Build data-warehouse, ETL processing using PySpark, KafkaStream
Develop efficient software code for multiple use cases leveraging Spark and Big Data technologies for various use cases built on the platform
Champion DevOps methodologies, emphasising CI/CD, while maintaining the highest standards of security and performance
Writes and executes complete testing plans, protocols, and documentation for assigned portion of data system or component
Participate in development of data infrastructure capable of ingesting and storing petabytes of data and serving thousands of queries a day within seconds on that data
Prioritise a security-centric mindset within all teams, imparting knowledge on secure coding practices and relevant tools
Oversee the entire software development lifecycle, from requirements gathering to deployment, ensuring timely delivery of high-quality software solutions
Oversee the creation of back-end APIs and microservices that support the Fraud Detection System

Technologies
Java, ETL tools, PySpark, Git, KafkaStream, Microsoft SQL Server, Docker, Containers, Kubernetes Cluster, Jenkins, Postgres, GCP (Pub/Sub, Server less)"
3816001714,"Lead Data Engineer (Fintech team) (Bangkok based, relocation provided)",https://www.linkedin.com/jobs/view/3816001714,Agoda,https://www.linkedin.com/company/agoda/life," "," ",5,,Full-time,,"5,001-10,000 employees · Software Development",https://media.licdn.com/dms/image/C4D0BAQGBa_7QNZNwpw/company-logo_100_100/0/1656643826660/agoda_logo?e=1717027200&v=beta&t=vPlS2bkbYZytwO9Ar0ZYMPyT_DyMjPtqChcc4MKsjAY,"Agoda is transforming travel for millions of customers across the globe.

Headquartered in Asia, Agoda is one of the world’s largest online travel platforms. Founded in 2005 and now part of Booking Holdings (Nasdaq:BKNG), Agoda has a network of over 2,900,000 properties worldwide. Our web and mobile products provide a first-rate reservation service in 38 languages that uniquely combines local knowledge and local connections to provide the best deals for business and leisure travelers.

Agoda employs over 7,000 professionals from 90 nationalities in locations around the globe. In every department – from engineering to customer experience – we provide an environment rich with creativity, collaboration, and experimentation, and the tools to work faster and smarter.

At Agoda, we believe our people are our strength. We work hard and have fun, and we choose people who are dedicated to making things great.

For properties seeking partnership with Agoda, visit https://connect.agoda.com
…
show more","About Agoda 

Agoda is an online travel booking platform for accommodations, flights, and more. We build and deploy cutting-edge technology that connects travelers with more than 3.6 million accommodations globally. Based in Asia and part of Booking Holdings, our 6,000+ employees representing 90+ nationalities foster a work environment rich in diversity, creativity, and collaboration. We innovate through a culture of experimentation and ownership, enhancing the ability for our customers to experience the world.

About Agoda

Agoda is an online travel booking platform for accommodation, flights, and more. We build and deploy cutting edge technology that connects travelers with more than 2.5 million accommodations globally. Based in Asia and part of Booking Holdings, our 4,000+ talents coming from 90+ different nationalities foster a work environment rich in diversity, creativity, and collaboration. We innovate through a culture of experimentation and ownership, enabling our customers to experience the world

 Get to Know Our Team 

Fintech is one of the fastest growing areas in Agoda and we are rapidly expanding our tech team. We work closely with the finance business team and our Fintech product owners to reduce risk, drive efficiencies and move on new market opportunities in this exciting field. We have a wide range of projects from traditional finance or cutting-edge customer fintech. For example, reconciliation using Big Data technologies, growing and optimizing customer payments options, tax calculations in milli-second response times and a mesh of supplier payment options like vertical credit cards. Its a hot field and the perfect mix of data engineering and backend engineering.

 The Opportunity 

We are looking for engineers with experience in the fintech area. This can be a year or two at a fintech startup right through to an expert in this domain. You might have a background as ‘ back end ’ or ‘data’ engineer , either way we are looking for smart engineers who can be super agile, move fast and have an eye for detail. We’d love to hear from you if you are skilled in any of the technologies we work with and excited at building new fintech technology.

In this Role, you will get to

Lead the team technically in improving scalability, stability, accuracy, speed and efficiency of our existing Data systems
Build, administer and scale data processing pipelines
Be comfortable navigating the following technology stack: Scala, Spark, java, Golang, Python3, scripting (Bash/Python), Hadoop, SQL, S3 etc
Improve scalability, stability, accuracy, speed and efficiency of our existing data systems
Design, build, test and deploy new libraries, frameworks or full systems for our core systems while keeping to the highest standards of testing and code quality
Work with experienced engineers and product owners to identify and build tools to automate many large-scale data management / analysis tasks 

What You’ll Need To Succeed

Bachelor’s degree in Computer Science /Information Systems/Engineering/related field
5+ years of experience in Data engineering
Good experience in Apache Spark
Expert level understanding of JVM and either Java or Scala
Experience debugging and reasoning about production issues is desirable
A good understanding of data architecture principles preferred
Any other experience with Big Data technologies / tools
SQL experience
Analytical problem-solving capabilities & experience
Systems administration skills in Linux

It’s great if you have

Good understanding of Hadoop ecosystems
Experience working with Open-source products
Python/Shell scripting skills
Working in an agile environment using test driven methodologies

#telaviv #jerusalem #IT #ENG #4 #sanfrancisco #sanjose #losangeles #sandiego #oakland #denver #miami #orlando #atlanta #chicago #boston #detroit #newyork #portland #philadelphia #dallas #houston #austin #seattle #sydney #melbourne #perth #toronto #vancouver #montreal #shanghai #beijing #shenzhen #prague #Brno #Ostrava #cairo #alexandria #giza #estonia #paris #berlin #munich #hamburg #stuttgart #cologne #frankfurt #hongkong #budapest #jakarta #bali #dublin #telaviv #milan #rome #venice #florence #naples #turin #palermo #bologna #tokyo #osaka #kualalumpur #malta #amsterdam #oslo #manila #warsaw #krakow #doha #alrayyan #riyadh #jeddah #mecca #medina #singapore #seoul #barcelona #madrid #stockholm #zurich #taipei #tainan #taichung #kaohsiung #bangkok #Phuket #istanbul #london #manchester #edinburgh #hcmc #hanoi #lodz #wroclaw #poznan #katowice #rio #salvador #newdelhi #bangalore #bandung #yokohama #nagoya #okinawa #fukuoka #jerusalem #IT #4

Equal Opportunity Employer 

At Agoda, we pride ourselves on being a company represented by people of all different backgrounds and orientations. We prioritize attracting diverse talent and cultivating an inclusive environment that encourages collaboration and innovation. Employment at Agoda is based solely on a person’s merit and qualifications. We are committed to providing equal employment opportunity regardless of sex, age, race, color, national origin, religion, marital status, pregnancy, sexual orientation, gender identity, disability, citizenship, veteran or military status, and other legally protected characteristics.

We will keep your application on file so that we can consider you for future vacancies and you can always ask to have your details removed from the file. For more details please read our privacy policy .

To all recruitment agencies: Agoda does not accept third party resumes. Please do not send resumes to our jobs alias, Agoda employees or any other organization location. Agoda is not responsible for any fees related to unsolicited resumes."
3673529508,"Software Engineer II (C++, Unix)",https://www.linkedin.com/jobs/view/3673529508,FIS,https://www.linkedin.com/company/fis/life," "," ",98,,On-site,,"10,001+ employees · Information Technology & Services",https://media.licdn.com/dms/image/C4E0BAQEok08w8MNWeg/company-logo_100_100/0/1630604009918/fis_logo?e=1717027200&v=beta&t=b71YBMGk6Wngbh5tQMTQfS8z-Q9a6Upi--sL6IsfjqY,"FIS is at the heart of the commerce and financial transactions that power the world’s economy. We are passionate about helping businesses and communities thrive by advancing the way the world pays, banks and invests, serving more than 20,000 clients and more than one million merchant locations in over 130 countries. For more information about FIS, visit http://www.fisglobal.com.
…
show more","Position Type

Full time

Type Of Hire

Experienced (relevant combo of work and education)

Education Desired

Bachelor of Computer Engineering

Travel Percentage

10 - 15%

We are FIS. Our technology powers the world’s economy and our teams bring innovation to life. We champion diversity to deliver the best products and solutions for our colleagues, clients and communities. If you’re ready to start learning, growing and making an impact with a career in fintech, we’d like to know~ Are you FIS?

About The Role

As a Software Engineer you could work with bleeding edge technology as you build innovative fintech products that change the way the world pays, banks and invests. This will involve developing core versions of software applications, identifying client requirements and technical specifications, interacting with engineering groups and training clients on applications.

What You Will Be Doing
 Designing, programming, debugging and modifying software enhancements
 Interacting with product managers and users to define requirements and modifications
 Participating in software design meetings to determine technical requirements
 Working with internal Client Training, Client Relationship and Sales teams

What You Will Need
 At least 5 years of experience in Unix / Linux, Shell scripting, C++ and Oracle database. 
 Experience with end-to-end systems development life cycles and standards
 Knowledge of payments & financial industry practices, regulations and operations
 Fluency in sequence diagrams, class models, etc
 Proficiency in solutions design and requirements definition disciplines
 Knowledge of financial industry practices, regulations and operations
 Proficiency in solutions design and requirements definition disciplines

What We Offer You

A career at FIS is more than just a job. It’s the change to shape the future of fintech. At FIS, we offer you~
 A voice in the future of fintech
 Always-on learning and development
 Collaborative work environment
 Opportunities to give back
 Competitive salary and benefits

 #Banking CX 

Privacy Statement

FIS is committed to protecting the privacy and security of all personal information that we process in order to provide services to our clients. For specific information on how FIS protects personal information online, please see the Online Privacy Notice .

Sourcing Model

Recruitment at FIS works primarily on a direct sourcing model; a relatively small portion of our hiring is through recruitment agencies. FIS does not accept resumes from recruitment agencies which are not on the preferred supplier list and is not responsible for any related fees for resumes submitted to job postings, our employees, or any other part of our company.

#pridepass"
