id,title,job_url,company,company_link,location,published_at,number_of_applicants_applied,employment_duration,work_location_type,work_experience_level,company_type,company_logo,company_description,about_the_job
3761846810,Security Engineer,https://www.linkedin.com/jobs/view/3761846810,Packet Systems Indonesia ,https://www.linkedin.com/company/packet-systems-indonesia/life," "," ",100,,On-site,,201-500 employees · IT Services and IT Consulting,https://media.licdn.com/dms/image/D4D0BAQEEUT-QQ5Nejw/company-logo_100_100/0/1705941224744/packet_systems_indonesia_logo?e=1717027200&v=beta&t=dXHNixlskNui5L3AP0svlXO6pBF_1q3jUaRi0YkpPnE,"Packet Systems Indonesia (PSI), which commenced operations in 2004, is a leading ICT systems integrator and service company in Indonesia focusing in the area of Data Center/Virtualization, Collaboration, Service Provider & Enterprise Network Infrastructure, Information Security, and Software Solution. Its spectrum of advanced services include assessment; technical advisory; planning & design; project management, deployment, integration; and maintenance.

PSI has partnerships with some of the most advanced technology companies in the world, such as Cisco Systems where it is certified as a Gold Partner. PSI is headquartered in Jakarta and has presence in Surabaya.

In September 2017, PSI has become a Logicalis-Metrodata company.

Logicalis (www.logicalis.com) is an international multi-skilled solution provider providing digital enablement services to help customers harness digital technology and innovative services to deliver powerful business outcomes. Its customers span industries and geographical regions; and our focus is to engage in the dynamics of our customers’ vertical markets; including financial services, TMT (telecommunications, media and technology), education, healthcare, retail, government, manufacturing and professional services, and apply the skills of our 4,000 employees in modernising key digital pillars; data centre and cloud services, security and network infrastructure, workspace communications and collaboration, data and information strategies, and IT operation modernisation.

P.T. Metrodata Electronics, Tbk (“Metrodata”; www. metrodata.co.id)— is a public company listed at PT. Bursa Efek Indonesia since 1990 (IDX: MTDL) and is one of the leading Information Communications Technology (ICT) companies in Indonesia. It has built strategic alliances with world-class information technology companies. Metrodata has four main business lines, operating through its subsidiaries: Distribution Business Unit handles distribution to dealer partners, warranty, and ICT solution company; Solution Business Unit provides Information and Communication Technology total solutions from design, implementation, IT managed services, consultation and training; Consulting Business Unit which offers innovative business solutions from conceptualizing, defining, commissioning and implementation, and supporting for business transformation; and E-Commerce Business Unit covering modern IT Retail E-Commerce.
…
show more","Job Specification:
Requirement:
Hold a bachelor's degree (S-1 degree) in Information Technology Computer Engineering or Telecommunication from a reputable university with a minimum IPK of 3.0.
Minimum 3 years of experience in security technology deployment/maintenance
Having knowledge in Security technology such as Firewall and IPS (Checkpoint/PaloAlto/Cisco/Fortigate/McAfee)
Having knowledge of Load Balance technology (F5)
Having knowledge of Proxy Technology (Bluecoat)
Having knowledge of Netscout technology.
Having Professional Level Certification is a must (CCNP Security, PCNSE, NSE 7, etc.)
Preferable having knowledge in Routing Switching
Preferably having Vetscout certification.
Excellent interpersonal & communication skills
Competent with Microsoft Office applications i.e. Microsoft Visio, Word, Excel, and PowerPoint.
Ability to perform under pressure and tight time constraints; work under limited guidance in line with a comprehensive plan, or strategy.
Leadership, teamwork, commitment, and service excellence are personal qualities
Willing to be positioned as resident engineer on customer site (Option)

The role shall cover the following:
For Project based:
Support for a new installation, integration into the existing system, migration, and monitoring.
Including all documentation related to the project (Site Survey, MoP, UAT, as build documentation).
For Maintenance based:
Support for troubleshooting problems in all PSI customers.
Also, support for change requests in the customer network.
Including reporting, documentation, and standby monitoring."
3816011032,"Lead Data Engineer (Bangkok based, relocation provided)",https://www.linkedin.com/jobs/view/3816011032,Agoda,https://www.linkedin.com/company/agoda/life," "," ",9,,Full-time,,"5,001-10,000 employees · Software Development",https://media.licdn.com/dms/image/C4D0BAQGBa_7QNZNwpw/company-logo_100_100/0/1656643826660/agoda_logo?e=1717027200&v=beta&t=vPlS2bkbYZytwO9Ar0ZYMPyT_DyMjPtqChcc4MKsjAY,"Agoda is transforming travel for millions of customers across the globe.

Headquartered in Asia, Agoda is one of the world’s largest online travel platforms. Founded in 2005 and now part of Booking Holdings (Nasdaq:BKNG), Agoda has a network of over 2,900,000 properties worldwide. Our web and mobile products provide a first-rate reservation service in 38 languages that uniquely combines local knowledge and local connections to provide the best deals for business and leisure travelers.

Agoda employs over 7,000 professionals from 90 nationalities in locations around the globe. In every department – from engineering to customer experience – we provide an environment rich with creativity, collaboration, and experimentation, and the tools to work faster and smarter.

At Agoda, we believe our people are our strength. We work hard and have fun, and we choose people who are dedicated to making things great.

For properties seeking partnership with Agoda, visit https://connect.agoda.com
…
show more","About Agoda 

Agoda is an online travel booking platform for accommodations, flights, and more. We build and deploy cutting-edge technology that connects travelers with more than 3.6 million accommodations globally. Based in Asia and part of Booking Holdings, our 6,000+ employees representing 90+ nationalities foster a work environment rich in diversity, creativity, and collaboration. We innovate through a culture of experimentation and ownership, enhancing the ability for our customers to experience the world.

About Agoda

Agoda is an online travel booking platform for accommodation, flights, and more. We build and deploy cutting edge technology that connects travelers with more than 2.5 million accommodations globally. Based in Asia and part of Booking Holdings, our 4,000+ talents coming from 90+ different nationalities foster a work environment rich in diversity, creativity, and collaboration. We innovate through a culture of experimentation and ownership, enabling our customers to experience the world

Get to Know Our Team

The Data department oversees all of Agoda’s data-related requirements. Our ultimate goal is to enable and increase the use of data in the company through creative approaches and the implementation of powerful resources such as operational and analytical databases, queue systems, BI tools, and data science technology. We hire the brightest minds from around the world to take on this challenge and equip them with the knowledge and tools that contribute to their personal growth and success while supporting our company’s culture of diversity and experimentation. The role the Data team plays at Agoda is critical as business users, product managers, engineers, and many others rely on us to empower their decision making. We are equally dedicated to our customers by improving their search experience with faster results and protecting them from any fraudulent activities. Data is interesting only when you have enough of it, and we have plenty. This is what drives up the challenge as part of the Data department, but also the reward.

Why Agoda Data Applications Team?

Our Data Engineering teams are at the intersection of business analytics, data warehousing and software engineering. Our job involves dealing with distributed systems, stream processing, computation and data governance at tens of PB Scale.

We focus on software engineering related to data replication, storage, centralized computation, and Data API’s. By providing our users with data products/tools, shared frameworks and data services, we enable our company to validate strategic decisions, make smarter choices, and react to the fast-changing world.

We are a small but passionate team with people from different nationalities working together on a single goal.

In this Role, you will get to

Lead the team technically in improving scalability, stability, accuracy, speed and efficiency of our existing Data systems
Build, administer and scale data processing pipelines
Be comfortable navigating the following technology stack: Scala, Spark, java, Golang, Python3, scripting (Bash/Python), Hadoop, SQL, S3 etc
Improve scalability, stability, accuracy, speed and efficiency of our existing data systems
Design, build, test and deploy new libraries, frameworks or full systems for our core systems while keeping to the highest standards of testing and code quality
Work with experienced engineers and product owners to identify and build tools to automate many large-scale data management / analysis tasks 

What You’ll Need To Succeed

Bachelor’s degree in Computer Science /Information Systems/Engineering/related field
5+ years of experience in Data engineering
Good experience in Apache Spark
Expert level understanding of JVM and either Java or Scala
Experience debugging and reasoning about production issues is desirable
A good understanding of data architecture principles preferred
Any other experience with Big Data technologies / tools
SQL experience
Analytical problem-solving capabilities & experience
Systems administration skills in Linux

It’s great if you have

Good understanding of Hadoop ecosystems
Experience working with Open-source products
Python/Shell scripting skills
Working in an agile environment using test driven methodologies

#telaviv #jerusalem #IT #ENG #4 #sanfrancisco #sanjose #losangeles #sandiego #oakland #denver #miami #orlando #atlanta #chicago #boston #detroit #newyork #portland #philadelphia #dallas #houston #austin #seattle #sydney #melbourne #perth #toronto #vancouver #montreal #prague #Brno #Ostrava #cairo #alexandria #giza #estonia #paris #berlin #munich #hamburg #stuttgart #cologne #frankfurt #budapest #bali #dublin #telaviv #milan #rome #venice #florence #naples #turin #palermo #bologna #osaka #malta #amsterdam #oslo #warsaw #krakow #alrayyan #riyadh #jeddah #mecca #medina #singapore #seoul #barcelona #madrid #stockholm #zurich #taipei #tainan #taichung #kaohsiung #bangkok #Phuket #istanbul #london #manchester #edinburgh #hcmc #hanoi #lodz #wroclaw #poznan #katowice #rio #salvador #newdelhi #bangalore #bandung #yokohama #nagoya #okinawa #fukuoka #jerusalem #IT #4 #bangalore #delhi #hyderabad #pune #singapore #beijing #shanghai #shenzhen #tokyo #seoul #hongkong #taipei #kualalumpur #jakarta #hochiminh #hochiminhcity #manila #instanbul #makati #dubai #riyadh #gurgaon #noida

Equal Opportunity Employer 

At Agoda, we pride ourselves on being a company represented by people of all different backgrounds and orientations. We prioritize attracting diverse talent and cultivating an inclusive environment that encourages collaboration and innovation. Employment at Agoda is based solely on a person’s merit and qualifications. We are committed to providing equal employment opportunity regardless of sex, age, race, color, national origin, religion, marital status, pregnancy, sexual orientation, gender identity, disability, citizenship, veteran or military status, and other legally protected characteristics.

We will keep your application on file so that we can consider you for future vacancies and you can always ask to have your details removed from the file. For more details please read our privacy policy .

To all recruitment agencies: Agoda does not accept third party resumes. Please do not send resumes to our jobs alias, Agoda employees or any other organization location. Agoda is not responsible for any fees related to unsolicited resumes."
3816008324,"Lead Data Engineer (Bangkok based, relocation provided)",https://www.linkedin.com/jobs/view/3816008324,Agoda,https://www.linkedin.com/company/agoda/life," "," ",12,,Full-time,,"5,001-10,000 employees · Software Development",https://media.licdn.com/dms/image/C4D0BAQGBa_7QNZNwpw/company-logo_100_100/0/1656643826660/agoda_logo?e=1717027200&v=beta&t=vPlS2bkbYZytwO9Ar0ZYMPyT_DyMjPtqChcc4MKsjAY,"Agoda is transforming travel for millions of customers across the globe.

Headquartered in Asia, Agoda is one of the world’s largest online travel platforms. Founded in 2005 and now part of Booking Holdings (Nasdaq:BKNG), Agoda has a network of over 2,900,000 properties worldwide. Our web and mobile products provide a first-rate reservation service in 38 languages that uniquely combines local knowledge and local connections to provide the best deals for business and leisure travelers.

Agoda employs over 7,000 professionals from 90 nationalities in locations around the globe. In every department – from engineering to customer experience – we provide an environment rich with creativity, collaboration, and experimentation, and the tools to work faster and smarter.

At Agoda, we believe our people are our strength. We work hard and have fun, and we choose people who are dedicated to making things great.

For properties seeking partnership with Agoda, visit https://connect.agoda.com
…
show more","About Agoda 

Agoda is an online travel booking platform for accommodations, flights, and more. We build and deploy cutting-edge technology that connects travelers with more than 3.6 million accommodations globally. Based in Asia and part of Booking Holdings, our 6,000+ employees representing 90+ nationalities foster a work environment rich in diversity, creativity, and collaboration. We innovate through a culture of experimentation and ownership, enhancing the ability for our customers to experience the world.

About Agoda

Agoda is an online travel booking platform for accommodation, flights, and more. We build and deploy cutting edge technology that connects travelers with more than 2.5 million accommodations globally. Based in Asia and part of Booking Holdings, our 4,000+ talents coming from 90+ different nationalities foster a work environment rich in diversity, creativity, and collaboration. We innovate through a culture of experimentation and ownership, enabling our customers to experience the world

Get to Know Our Team

The Data department oversees all of Agoda’s data-related requirements. Our ultimate goal is to enable and increase the use of data in the company through creative approaches and the implementation of powerful resources such as operational and analytical databases, queue systems, BI tools, and data science technology. We hire the brightest minds from around the world to take on this challenge and equip them with the knowledge and tools that contribute to their personal growth and success while supporting our company’s culture of diversity and experimentation. The role the Data team plays at Agoda is critical as business users, product managers, engineers, and many others rely on us to empower their decision making. We are equally dedicated to our customers by improving their search experience with faster results and protecting them from any fraudulent activities. Data is interesting only when you have enough of it, and we have plenty. This is what drives up the challenge as part of the Data department, but also the reward.

Why Agoda Data Applications Team?

Our Data Engineering teams are at the intersection of business analytics, data warehousing and software engineering. Our job involves dealing with distributed systems, stream processing, computation and data governance at tens of PB Scale.

We focus on software engineering related to data replication, storage, centralized computation, and Data API’s. By providing our users with data products/tools, shared frameworks and data services, we enable our company to validate strategic decisions, make smarter choices, and react to the fast-changing world.

We are a small but passionate team with people from different nationalities working together on a single goal.

In this Role, you will get to

Lead the team technically in improving scalability, stability, accuracy, speed and efficiency of our existing Data systems
Build, administer and scale data processing pipelines
Be comfortable navigating the following technology stack: Scala, Spark, java, Golang, Python3, scripting (Bash/Python), Hadoop, SQL, S3 etc
Improve scalability, stability, accuracy, speed and efficiency of our existing data systems
Design, build, test and deploy new libraries, frameworks or full systems for our core systems while keeping to the highest standards of testing and code quality
Work with experienced engineers and product owners to identify and build tools to automate many large-scale data management / analysis tasks 

What You’ll Need To Succeed

Bachelor’s degree in Computer Science /Information Systems/Engineering/related field
5+ years of experience in Data engineering
Good experience in Apache Spark
Expert level understanding of JVM and either Java or Scala
Experience debugging and reasoning about production issues is desirable
A good understanding of data architecture principles preferred
Any other experience with Big Data technologies / tools
SQL experience
Analytical problem-solving capabilities & experience
Systems administration skills in Linux

It’s great if you have

Good understanding of Hadoop ecosystems
Experience working with Open-source products
Python/Shell scripting skills
Working in an agile environment using test driven methodologies

#telaviv #jerusalem #IT #ENG #4 #sanfrancisco #sanjose #losangeles #sandiego #oakland #denver #miami #orlando #atlanta #chicago #boston #detroit #newyork #portland #philadelphia #dallas #houston #austin #seattle #sydney #melbourne #perth #toronto #vancouver #montreal #prague #Brno #Ostrava #cairo #alexandria #giza #estonia #paris #berlin #munich #hamburg #stuttgart #cologne #frankfurt #budapest #bali #dublin #telaviv #milan #rome #venice #florence #naples #turin #palermo #bologna #osaka #malta #amsterdam #oslo #warsaw #krakow #alrayyan #riyadh #jeddah #mecca #medina #singapore #seoul #barcelona #madrid #stockholm #zurich #taipei #tainan #taichung #kaohsiung #bangkok #Phuket #istanbul #london #manchester #edinburgh #hcmc #hanoi #lodz #wroclaw #poznan #katowice #rio #salvador #newdelhi #bangalore #bandung #yokohama #nagoya #okinawa #fukuoka #jerusalem #IT #4 #bangalore #delhi #hyderabad #pune #singapore #beijing #shanghai #shenzhen #tokyo #seoul #hongkong #taipei #kualalumpur #jakarta #hochiminh #hochiminhcity #manila #instanbul #makati #dubai #riyadh #gurgaon #noida

Equal Opportunity Employer 

At Agoda, we pride ourselves on being a company represented by people of all different backgrounds and orientations. We prioritize attracting diverse talent and cultivating an inclusive environment that encourages collaboration and innovation. Employment at Agoda is based solely on a person’s merit and qualifications. We are committed to providing equal employment opportunity regardless of sex, age, race, color, national origin, religion, marital status, pregnancy, sexual orientation, gender identity, disability, citizenship, veteran or military status, and other legally protected characteristics.

We will keep your application on file so that we can consider you for future vacancies and you can always ask to have your details removed from the file. For more details please read our privacy policy .

To all recruitment agencies: Agoda does not accept third party resumes. Please do not send resumes to our jobs alias, Agoda employees or any other organization location. Agoda is not responsible for any fees related to unsolicited resumes."
3814165549,Security Engineer,https://www.linkedin.com/jobs/view/3814165549,PT. Intikom Berlian Mustika,https://www.linkedin.com/company/pt-intikom-berlian-mustika/life," ",3 weeks ago,100,,On-site,,201-500 employees · IT Services and IT Consulting,https://media.licdn.com/dms/image/D560BAQFlacuXefySmQ/company-logo_100_100/0/1680335218963/pt_intikom_berlian_mustika_logo?e=1717027200&v=beta&t=qNGKogo4XeZneNLe-dxb849r3bOl26qBcvrZSX7XJJ0,"PT Intikom Berlian Mustika was officially established in 1 April 1990. This national company majors in Information and Communications Technology Solutions and Services.

Intikom works in partnerships with the world’s leading companies to provide a comprehensive range of IT services and products for a broad client base. Its main services and products are consultancy, software customization & implementation assistance, education & training, software and hardware, system integration, e-commerce, networking and communication, IT Security and maintenance service.

Intikom integrates its in-house application software and product for video recording , named Stream (finance, property, payroll, etc) and IVR for voice recording. Intikom special focus is on banking, finance, manufacturing, distribution, hospital, pharmaceutical, chemical, insurance, retail, automotive, and mining industries--both for government and private sector.
…
show more","Responsibilities:
Implement security solutions, such as DLP, IAM, MDM, and PAM.
Analyze security events from the SIEM platform.
Report possible threats or software issues.
Research weaknesses and find ways to counter them.
Do preventive and corrective maintenance if needed.
Assist fellow employees with cybersecurity, software, hardware, or other IT needs.
Work from the Office at South Jakarta.

Qualifications
At least 2 years of experience in the cybersecurity industry.
Excellent communication skills.
Strong network skills, and willingness to learn.
Experience with SIEM, DLP, and IAM is a must.
Knowledge of MDM, PAM, MAM, EPP, EDR, MTD, and other IT Security solutions is a plus.
Critical thinking skills and the ability to solve problems as they arise."
