id,title,job_url,company,company_link,location,published_at,number_of_applicants_applied,employment_duration,work_location_type,work_experience_level,company_type,company_logo,company_description,about_the_job
3797436163,Finance Controller,https://www.linkedin.com/jobs/view/3797436163,,,,,0,,Full-time,,See how you compare to 16 applicants. Try Premium for IDR0,,,"PERSOLKELLY is one of the largest recruitment firms in Asia Pacific providing clients with comprehensive end-to-end workforce solutions, enabling us to leverage their connections as one of the largest recruiting firms in Asia Pacific.

We are now seeking a position as a FInancial Controller who will handle the following key responsibilities as below :

 Financial reporting and oversight of weekly reporting, and month-end and year-end close process
 Support annual strategic planning and forecasting processes including setting operational & financial targets
 Monitor business control effectiveness and develop/execute improvement plans to ensure accurate financial reporting
 Work with Budget Owners to get an understanding of performance, analyze variances and prepare forecasts/budget.
 Lead budget variance commentary and reporting
 Treasury & Secretarial
 Ensure compliance of Company operations to all applicable laws, regulations and standards, regulations and standards, good business practices and company documented procedures (including but not limited to Financial Data Quality Management, ISO 9001, ISO 14001, OHSAS 18001 and OHSAS 14001)
 Engage others, promote, and participate in Environmental, Health, and Safety initiatives, focusing on continuous improvement
 Act as strong business partner to the Head of Departments (HOD), challenging and debating business ideas and tactics to help develop the business to deliver the group’s business performance objectives.
 Support the plants in East Java & Central Java in the development and articulation of a short and medium term performance delivery strategy and providing the financial input required to that process

We are looking for prospective talents to meet the requirements as below :

 At least 10 years of experience in financial controlling and finance operation manufacturing manager.
 Qualified Chartered Accountant from a recognized professional accountancy body is preferred.
 Experience of working in well-established manufacturing with matrix reporting structures. 
 Strong exposure to financial control; budgeting and management reporting; and ensuring adherence to statutory requirements
 Ability to lead a team of 5-6 Accountants, leads 2 manufacturers in East Java & Central Java
 Eye for details and understand cost drivers in a manufacturing environment
 Willing to be placed in Central Java."
3792905212,Senior Accounting & Tax,https://www.linkedin.com/jobs/view/3792905212,,,,,0,,On-site,,See how you compare to 29 applicants. Try Premium for IDR0,,,"Company Description: PT. MAJU BERSAMA GEMILANG terletak di KIK Industrial Park, Semarang, dan merupakan perusahaan teknologi tinggi yang mengkhususkan diri dalam produksi serat optik, kabel optik dan kabel bawah laut. Perusahaan memiliki peralatan produksi yang maju dan peralatan pengujian, menggunakan peralatan produksi yang maju secara internasional dan proses produksi yang matang dan stabil. Seluruh proses produksi secara ketat menerapkan prosedur yang ditentukan untuk memastikan kualitas tinggi dari semua produk. Job Description:

 Melakukan transaksi keuangan dan mencatatnya dalam buku besar umum.
 Menjalankan tugas administratif yang berkaitan dengan akuntansi
 Meninjau keabsahan, rasionalitas dan keaslian dari dokumen asli
 Bertanggung jawab atas manajemen keuangan dari aset tetap, melakukan penyusutan aset tetap sesuai rencana bulanan, dan mengatur pekerjaan verifikasi
 Melakukan rekonsiliasi buku besar umum
 Menyiapkan permintaan data audit internal dan eksternal untuk audit keuangan, pemeriksaan tahunan, dll
 Rekonsiliasi data keuangan dan rekonsiliasi pembayaran.
 Merekam dan melaporkan laporan keuangan (bulanan, tahunan).
 Pencatatan dan pelaporan pajak (pasal 21, 23, 24, 25, 26, dan PPN) (bulanan, tahunan, dan permintaan data pajak baik secara internal maupun eksternal).
 Membantu atasan dalam menyiapkan laporan akuntansi bulanan dan triwulanan.
 Bertanggung jawab atas tugas bisnis lain yang diberikan oleh atasan.
 Mengumpulkan dan mengarsipkan dokumen akuntansi, buku, dan laporan, dll. secara tepat waktu."
3677049650,IFS - Manager - Tax,https://www.linkedin.com/jobs/view/3677049650,PwC,https://www.linkedin.com/company/pwc/life," ",7 months ago,100,,On-site,,"10,001+ employees · Professional Services",https://media.licdn.com/dms/image/D4D0BAQH3qXh7nyImoQ/company-logo_100_100/0/1697100791441/pwc_logo?e=1717027200&v=beta&t=_Ua29SBI0zNMv1FKH1FzuGYyNnYfvWSYizZMvewdMpk,"At PwC, our purpose is to build trust in society and solve important problems. We’re a network of firms in 152 countries with over 327,000 people who are committed to delivering quality in assurance, advisory and tax services. Find out more and tell us what matters to you by visiting us at www.pwc.com. PwC refers to the PwC network and/or one or more of its member firms, each of which is a separate legal entity.

Content on this page has been prepared for general information only and is not intended to be relied upon as accounting, tax or professional advice. Please reach out to your advisors for specific advice.","Line of Service

Industry/Sector

Specialism

Management Level
Manager

Job Description & Summary


To really stand out and make us fit for the future in a constantly changing world, each and every one of us at PwC needs to be a purpose-led and values-driven leader at every level. To help us achieve this we have the PwC Professional; our global leadership development framework. It gives us a single set of expectations across our lines, geographies and career paths, and provides transparency on the skills we need as individuals to be successful and progress in our careers, now and in the future.

As a Manager, you'll work as part of a team of problem solvers, helping to solve complex business issues from strategy to execution. PwC Professional skills and responsibilities for this management level include but are not limited to:

Oversee tax issues to ensure completeness of tax obligations and in compliance with the local tax laws, including transfer pricing issues.
Ensure all tax filings and reports and tax payments are submitted accurately and on time.
Manage tax audits and provide guidance on audit defence strategy on issues arise and propose solutions.
Provide timely functional guidance and advice to support operations and initiatives.
Monitor legislative and regulatory developments that may impact the operations and tax positions.Plan and execute tax risk management, including risk identification and report, assessment of exposure, provisioning, risk mitigation plans.


Requirements: 
Bachelor degree in Accounting or Finance or equivalent
Minimum 10 years of experience as qualified tax professional with solid relevant working experiences
Possess general knowledge of tax reporting and Accounting Standards
Highly motivated, self starter who drives results, strong problem solving and analytical skills
Have strong leadership skills, good interpersonal skill and a good team player
Excellent communication and presentation skills in English
Certified with Brevet A, B, C 

Education (if blank, degree and/or field of study not specified)
Degrees/Field of Study required:

Degrees/Field of Study preferred: Bachelor Degree - Accounting and Taxation

Certifications (if blank, certifications not specified)

Required Skills

Optional Skills

Desired Languages (If blank, desired languages not specified)

Travel Requirements
0%

Available for Work Visa Sponsorship?
No

Government Clearance Required?
No

Job Posting End Date"
3831257871,Financial Controller,https://www.linkedin.com/jobs/view/3831257871,,,,,0,,Hybrid,,See how you compare to 11 applicants. Try Premium for IDR0,,,"Requirements

Bachelor's Degree in Finance, or Accounting from reputable University.
Minimum of 1 year experience
Excellent in Ms. office and knowing SAP system

Work Location : Around Soekarno Hatta Intl Airport

Responsibilities

Revenue & Cost Control – ensure the completeness and accuracy of item revenues and Cost efficiency and effectiveness
Budget – to coordinate, review, and ensure of the Budgeting process on related BU, and ensuring Budget Financial Statement
Review Performance Management Report and variance analysis
Analyze company’s business process in all departments to optimize business efficiency and continuous improvement"
