id,title,job_url,company,company_link,location,published_at,number_of_applicants_applied,employment_duration,work_location_type,work_experience_level,company_type,company_logo,company_description,about_the_job
3784412117,Data Science Lead,https://www.linkedin.com/jobs/view/3784412117,iZeno,https://www.linkedin.com/company/izeno-pte-ltd/life," ",1 week ago,79,,Hybrid,,51-200 employees · IT Services and IT Consulting,https://media.licdn.com/dms/image/C560BAQGLSFkDunzJiA/company-logo_100_100/0/1630650207516/izeno_pte_ltd_logo?e=1712188800&v=beta&t=ijbdE4oQmiJaRA0eHmek8GSVq0rF6PjPDnAcGFzXgGA,"iZeno was founded in 2003 to provide enterprises with the best-in-class technology solutions they need to keep their business running seamlessly. With a team of 150+ in-house innovators, iZeno has delivered, implemented, and optimised over 500 Enterprise Solutions to enable smarter insights and better business outcomes.

iZeno’s team draws on industry experiences in delivering a portfolio of mission-critical applications, integrating AI & machine learning, DevOps, ITSM, cloud, CRM & CX, data analytics, and other leading technologies within its clients existing IT frameworks.

With a leading presence in the region, the business is headquartered in Singapore and has operations in Malaysia, Indonesia, Thailand, and the Philippines.

In the year 2023, iZeno Singapore achieved the certification as a Great Place To Work.

Visit our website to learn more about iZeno and discover how we can collaborate with you to expedite your Digital Transformation journey.

Please also take note that iZeno will never request recruitment fees from candidates under any circumstances. Please be cautioned that individuals or organizations are misusing the iZeno brand name to demand money in exchange for interviews or employment opportunities with iZeno. Please note that these fraudulent entities are unlawfully using iZeno's brand and copyright on fake job advertisements and emails to deceive innocent victims.

As a responsible organization, iZeno places great importance on conducting ethical and transparent recruitment processes. We advise all potential candidates to remain vigilant and report any suspicious activity encountered during their job search. Our commitment is to protect the interests of our candidates and our organization, and we will remain vigilant against these fraudulent attempts.
…
show more","Responsibilities:
Take a leadership role in pre-sales activities of AI projects, including the development and execution of AI POCs, end-user workshops, and RFP responses
Lead and provide guidance for AI project delivery, from project definition, client management, and communication of key insights.
Collaborate with the Head of Data Analytics, and project managers to identify skill sets required for successful project delivery.
Maintain up-to-date knowledge of industry trends, emerging technologies, and competitive landscapes.
Participate and host events and conferences in Indonesia.


What We Look For:
BS degree or above in a quantitative discipline (e.g., Statistics, Mathematics, CS) or equivalent practical experience.
Minimum 6+ years in the data industry, with people management experience.
Proficiency in Python/R, and handling large datasets.
Strong analytical and problem-solving ability with attention to detail.
Familiarity with PySpark is a plus.
Familiarity with leading data science and data warehouse technologies is a plus.


As a Data Science Team Lead, you will be responsible for establishing trusted advisor relationships with C-level executives in key accounts across Indonesia. Your role involves shaping executives' perspectives on AI and Machine Learning, aligning solutions with current and future AI needs. Collaborating closely with iZeno’s Indonesia sales teams, you will strategize on pipeline development, go-to-market plans, and execution strategies. You will not only be required in pre-sales activities but also in providing executive coverage and leadership during the post-sales implementation of these AI projects.

Interested applicants please submit your application with your expected salary and notice period to be considered for the role.

We regret that only shortlisted candidates will be notified.

As part of any recruitment process, we collect and processes personal data relating to job applicants. We are committed to being transparent about how we collect and use that data and to meeting our data protection obligations. By applying to this post and sending us your resume, you agree to the collection, use and/or disclosure of your personal data in the manner as set out in our Data Protection Notice for Job Applicants which can be found

Logicalis is committed to protecting your privacy.

Click below to view the data protection notice.

https://ap.logicalis.com/sites/default/files/2022-10/PIMS-A7.3-01%20Attachment%20I%20DP%20Notice%20for%20Job%20Applicants_updated9sept22.pdf.

Posting code :

#LI-JW1"
3794171097,AI Chatbot Python Developer,https://www.linkedin.com/jobs/view/3794171097,Turing,https://www.linkedin.com/company/turingcom/life," ",5 days ago,19,,Remote,,"1,001-5,000 employees · IT Services and IT Consulting",https://media.licdn.com/dms/image/D4D0BAQHB79AE71th8A/company-logo_100_100/0/1688472201595/turingcom_logo?e=1712188800&v=beta&t=uetswaiWdovNMJP7hgdfWDYzXjbSme1NRN0fa3n0zxI,"Traditional recruiting wasn’t designed for today’s software-first world. The old model is simply too slow, doesn’t allow for deep vetting and takes the control and ownership out of your hands. This is why we built Turing, the world’s most deeply vetted developers and teams, matched by AI. Turing connects world-class engineers with companies to help them achieve their respective career and business goals.

Traditional recruiting is over. Welcome to the Talent Cloud.

Turing enables:
> companies to get matched to vetted remote talent at the touch of a button
> developers to achieve their elite dream career from anywhere in the world

900+ top companies, including Pepsi, Bumble, and Dell, have trusted Turing’s Talent Cloud for their engineering needs.

Recruit Developers/Engineers:
Turing combines AI and a global reach to deliver your ideal engineers tailored to your business needs. Our Talent Cloud matches you to rigorously vetted, quality remote developers.

Try Turing.com for 2 weeks risk-free at turing.com

Turing Careers:
Turing helps you get excellent remote opportunities to build a high-growth career faster.

Find high-quality remote U.S. software jobs across 15 roles and 100+ technologies.

Apply today: turing.com/jobs

—----------------------
Co-founded by @Jonathan Siddarth and @Vijay Krishnan, Turing is an AI-powered technology company disrupting the traditional recruiting model for companies seeking to engage the most deeply vetted developers and teams.

Having raised $140 million from investors, including WestBridge Capital, Foundation Capital, Stanford StartX, and execs from Google, Meta, Microsoft, and Amazon, Turing's last round was on a $4 billion valuation cap.
…
show more","Python Developer Wanted: Help Us Engineer the Conversational Bots of the Future!

Are you intrigued by the potential of artificial intelligence to unlock new ways we interact with technology? We’re a cutting-edge company on a mission to develop intelligent chatbots that aren't just innovative but are a leap forward in how we experience learning and entertainment through conversation. We're scouting for a talented Python Developer who thrives in an inventive and fast-evolving landscape, someone ready to leave their mark on the AI world.

The Role Awaits:

Develop durable, clear-cut code that will be a backbone for our AI-driven products.
Take part in detailed code reviews ensuring we uphold the high bar for quality and functionality.
Leverage Python to devise solutions to intricate challenges, showcasing your coding finesse.
Produce code that’s not just functional but is carefully documented and constructed with future expansion in focus.

Your Credentials:

Completed a Bachelor's or Master's degree in Engineering or Computer Science, or demonstrate equivalent professional experience.
Have a minimum of 3 years of shaping software with a focus on Python development.
Proficient in Python with expertise in its application to data science and machine learning initiatives.
Adept in SQL and have an understanding of the essentials of QA.
Bonus points for hands-on experience with software testing strategies and frameworks.
Known for your aptitude in problem-solving, particularly in crafting algorithms.
Background in data science or data engineering is massively favorable.
A proven track record of building sleek, operable software applications.
The fluent, articulate communicator in English, both verbal and written.

Why You'll Love Working With Us:

Engage and learn from top-tier researchers and developers from every part of the world, all from the comfort of your home.
Revel in the freedom of remote work — find productivity in your personal haven.
Receive a competitive salary that matches global standards, with the assurance of US dollars.
Dive into boundary-pushing projects that will routinely challenge and excite you, keeping you at the cutting edge of tech advancements.
Join Our Journey: If you’re driven to shape the way we interact with machines and eager to contribute to the next wave of AI advancements, we're waiting for you."
3782374945,[ODS] Software Engineer - Engineering Platform,https://www.linkedin.com/jobs/view/3782374945,Gojek,https://www.linkedin.com/company/gojek/life," "," ",56,,On-site,,"1,001-5,000 employees · Technology, Information and Internet",https://media.licdn.com/dms/image/C4D0BAQHCmfKRtPXKDg/company-logo_100_100/0/1658813682786/gojek_logo?e=1712188800&v=beta&t=yQB9vj7jakbwBeSRhOKn8GWhuk_iW5If25yWvnke33A,"Gojek is Southeast Asia’s leading on-demand platform and a pioneer of the multi-service ecosystem model, providing access to a wide range of services including transportation, food delivery, logistics and more. Gojek is founded on the principle of leveraging technology to remove life's daily frictions by connecting consumers to the best providers of goods and services in the market.

The company was first established in 2010 focusing on courier and motorcycle ride-hailing services, before launching its app in January 2015 in Indonesia. Since then, Gojek has grown to become the leading on-demand platform in Indonesia, with additional operations in Vietnam and Singapore. The Gojek platform now comprises over 2.5 million driver partners across the region. Gojek is part of the GoTo Group, the largest digital ecosystem in Indonesia, consisting of Gojek, Tokopedia and GoTo Financial.

Gojek is dedicated to solving the daily challenges faced by consumers, while improving the quality of life for millions of people across Southeast Asia, especially those in the informal sector and micro, small and medium enterprises (MSMEs).

The Gojek application is available for download via iOS and Android.
.........

*IMPORTANT*
Gojek is affiliated to the GoTo Group companies, and all authentic jobs/open positions listed by Gojek can ONLY be accessed via our official channels -- Gojek on LinkedIn, Gojek Tech on LinkedIn, Gojek on Glassdoor, and https://www.gojek.io/careers. In case you are contacted by our Talent Acquisition team, please ensure that the communication is coming from a valid Gojek domain - *****@gojek.com. If you are contacted by any third party outside of the authenticated channels highlighted above, please write to us at ethics@gotocompany.com to validate the job/open position. This is to avoid any potential instances of fraud, and to ensure your safety and security during the job application process.
…
show more","About The Role

This role is for Platform Engineering team under Data Engineering vertical of Gojek. You’ll have the responsibilities to build, ship and grow Platform products that are core pillars of Data engineering. The roles comprises of responsibilities towards products like Authentication/Authorization, Infrastructure, Observability, orchestration and more.

What You Will Do

Code, Design, prototype, perform reviews and consult in the process of building highly scalable, reliable, and fault-tolerant systems
Containerization and deployment of microservices on Kubernetes
Auto scaling and monitoring performance of the streaming Infrastructure and applications by using Prometheus and Grafana or similar tools
Collaborate with the team to ensure that the service level objectives and agreements are achievedCommunicate and collaborate effectively with product, data science teams
Continue to stay abreast of the latest technologies in Event processing and Big Data space to inform/suggest new technologies and best practices to trial
Mentor and guide other engineers in the team

What You Will Need

At least 4 years of software engineering experience
Experience with containerization, including Docker and Kubernetes
DevOps experience in implementing large-scale data stacks using Gitlab and Docker
Must have hands-on experience using any of the cloud platforms (AWS, GCP, Azure), with thorough knowledge of cloud concepts
Demonstrated ability to take initiative and accountability for achieving results
Strong interpersonal and communication skills
Passion for learning new things and solving complex engineering blockers

About The Team

We are a team of developers, designers and product managers with diverse academic, professional and personal backgrounds but united by the passion to enrich Data Platform & Analytics at Gojek through sound methods and ease of use. Working alongside the Product Managers, BI Analytics and Product Engineers, we are predominantly concerned with utilizing and translating data into critical information that can be used to make sound business decisions.

This includes gathering any new data points, and working closely with various business teams to capture, connect, and convert any data changes into useful knowledge in guiding our next steps to create a meaningful business impact.

Combating remote work has brought us even closer, with frequent catch-ups over tea and sharing ways we have been keeping ourselves sane. Along with our desire to utilize smart technology and innovative engineering strategies to make people’s lives easier, our team also bonds over our shared love for reading, gaming, and drinking lots of coffee. We work hard and play hard, and believe it or not, we actually enjoy each other’s company!

About GoTo Group

GoTo Group is the largest digital ecosystem in Indonesia with its mission to “Empower Progress’ by offering technological infrastructure and solutions for everyone to access and thrive in the digital economy. The GoTo ecosystem consists of on-demand transportation services, e-commerce, food and grocery delivery, logistics and fulfillment, as well as financial and payment services through the Gojek, Tokopedia and GoTo Financial platforms.It is the first platform in Southeast Asia that hosts these crucial cases in a single ecosystem, capturing the majority of Indonesia’s vast consumer household.

About Gojek

Gojek is Southeast Asia’s leading on-demand platform and pioneer of the multi-service ecosystem with over 2.5 million driver partners across the regions offering a wide range of services such as transportation, food delivery, logistics and more. With its mission to create impact at scale, Gojek is committed to resolving consumer problems and raising standards of living by connecting consumers to the best providers of goods and services in the market.

About GoTo Financial

GoTo Financial accelerates financial inclusion through its leading financial services and merchants solutions. Its consumer services include GoPay and GoPayLater and serve businesses of all sizes through Midtrans, Moka, GoBiz Plus, GoBiz, and Selly. With its trusted and inclusive ecosystem of products, GoTo Financial is open to new growth opportunities and aims to empower everyone to Make It Happen, Make It Together, Make It Last.

About Tokopedia

Tokopedia is an Indonesian technology company with a mission to democratize commerce through technology. It has been a driving force behind Indonesia's digital development since its foundation in 2009, with more than 99% of districts and empowered around 12 million merchants listed nationwide. With Nakama ranging all across Indonesia, Tokopedia aims to simplify the lives of many to #FindYourPurpose together.

GoTo and its business units, including Gojek, Tokopedia, GoToFinancial and GoToLogistics (""GoTo"") only post job opportunities on our official channels on our respective company websites and on LinkedIn. GoTo is not liable for any job postings or job offers that did not originate from us. You should conduct your own due diligence to prevent being victims of any fake job scams, if they did not originate from GoTo's official recruitment channels."
3788281830,Consultant / Senior Consultant - Artificial Intelligence & Data (Data Engineer) - ID 1,https://www.linkedin.com/jobs/view/3788281830,,,,,0,,,,,,,
3789412145,"Customer Solutions Consultant, Duet AI, Google Cloud",https://www.linkedin.com/jobs/view/3789412145,,,,,0,,,,,,,
3782768884,Python Data Scientist,https://www.linkedin.com/jobs/view/3782768884,Turing,https://www.linkedin.com/company/turingcom/life," ",3 weeks ago,23,,Remote,,"1,001-5,000 employees · IT Services and IT Consulting",,,
3787635308,Data Engineer,https://www.linkedin.com/jobs/view/3787635308,,,,,0,,,,,,,
3786137768,Startup Founder - Data Scientist,https://www.linkedin.com/jobs/view/3786137768,,,,,0,,,,,,,
3756940997,Data Scientist,https://www.linkedin.com/jobs/view/3756940997,,,,,0,,,,,,,
3775601975,Data Engineer,https://www.linkedin.com/jobs/view/3775601975,,,,,0,,,,,,,
3789845591,Data Engineer Expert,https://www.linkedin.com/jobs/view/3789845591,,,,,0,,,,,,,
3792697560,Data Scientist,https://www.linkedin.com/jobs/view/3792697560,,,,,0,,,,,,,
3791233172,Data Analyst Risk,https://www.linkedin.com/jobs/view/3791233172,,,,,0,,,,,,,
3767576333,Data Scientist - Risk Platform,https://www.linkedin.com/jobs/view/3767576333,Cermati.com,https://www.linkedin.com/company/cermati/life," "," ",241,,On-site,,"1,001-5,000 employees · Financial Services",https://media.licdn.com/dms/image/D560BAQE1jHTV9MYtEA/company-logo_100_100/0/1667277070391/cermati_logo?e=1712188800&v=beta&t=e0jD1ZkG4fKOYPanm0fC7xHT-Vr56w8LS8B0G8zbKOg,"We are a technology startup that engages in the Indonesian financial technology area. We are based in Jakarta and we're founded by ex-silicon valley engineers. Our vision is to use technology to make financial information more available and more useful to everyone. Our mission is to enable people to take control of their financial situation and save a lot of money by doing so. Our products allow people to easily make the best financial decision for their situation. Come join our adventure in transforming Indonesian financial landscape through technology.

We're hiring! Check out our job openings at www.cermati.com/karir
…
show more","Job Description

We’re looking for fresh graduates with experience in manipulating datasets and building statistical models for credit risk by leveraging machine learning techniques. You will partner with business, product, and engineering team to explore, determine, analyze, propose, and solve some of the most challenging business problems in lending and reduce risk. You will perform deep-dive exploration and analysis to find improvements in our existing framework. You will be submerged in a fast-paced environment working tightly in a strong team of data scientists and experience firsthand our robust data infrastructure.

Responsibilities

Perform features selection, parameter binning, and optimize custom predictive machine learning models for credit risk scoring
Query, process, cleanse, and verify the integrity of data used for analysis
Analyze key metrics to determine risk and explore areas for improvements
Create reports and dashboards to monitor model impact and performance
Help build the variety of data ingredients needed to do modelling effectively
Maintain the credit risk model platform which is utilized by the team
Provide advice and guidance on potential efficiency gains and new state-of-the-art credit risk modelling methodologies

Qualifications

Bachelor degree in an analytical or quantitative discipline (e.g. math, statistics, engineering, computer science), however other disciplines will be considered
Experienced in using statistical computer languages such as R, Python SAS, SQL, or advanced MS Excel skills is a plus.
Have good communication skills and able to work together in a team
Excellent problem-solving skills and have the drive to learn and master new technologies and techniques
Willingness to learn new skills independently and have a strong sense of project ownership
Not afraid to get your hands dirty to explore data and build statistical models"
3764750035,"Data Science Lead, Visa Consulting & Analytics, Indonesia",https://www.linkedin.com/jobs/view/3764750035,,,,,0,,,,,,,
3741270100,Analytics Engineer - Business Intelligence,https://www.linkedin.com/jobs/view/3741270100,Shopee,https://www.linkedin.com/company/shopee/life," "," ",835,,On-site,,"5,001-10,000 employees · Technology, Information and Internet",https://media.licdn.com/dms/image/C560BAQE0iX_dgdH7nA/company-logo_100_100/0/1672279162763/shopee_logo?e=1712188800&v=beta&t=YOOfP8buLRx8UmTaRks5zte1XLjE_Srdn7i45b-zmOU,"Shopee is the leading e-commerce platform in Southeast Asia and Taiwan. It is a platform tailored for the region, providing customers with an easy, secure and fast online shopping experience through strong payment and logistical support.

Shopee aims to continually enhance its platform and become the region’s e-commerce destination of choice via ongoing product optimisation and localised user-centered strategies.

Shopee, a Sea company, was first launched in Singapore in 2015, and has since expanded its reach to Malaysia, Thailand, Taiwan, Indonesia, Vietnam and the Philippines. Sea is a leader in digital entertainment, e-commerce and digital financial services across Greater Southeast Asia. Sea's mission is to better the lives of consumers and small businesses with technology, and is listed on the NYSE under the symbol SE.

The Shopee team is rapidly expanding across the region and we are constantly on the lookout for talents who have the passion and drive to become part of a fast-moving and dynamic team. Do check out our career website http://careers.shopee.sg/ for our available positions!
…
show more","Job Description

Design and implement data architecture solutions that are cost effective 
Work closely with many other Business Intelligence departments on creation centralized key reports
Develop and maintain self service tools for our key stakeholders
Provide consultative guidance for data management and governance within our Internal team
Working closely with Regional data team for the development of our tools and data product

Requirements

Min Bachelor's degree in quantitative fields or a relevant field of study
Min 2+ years working in analytics or related field
Experience on advanced SQL manipulation and optimization techniques
Familiarity with Python is preferred
Strong experience in handling data modeling and data pipeline"
3789817292,Data Scientist,https://www.linkedin.com/jobs/view/3789817292,,,,,0,,,,,,,
3791743442,Data Scientist,https://www.linkedin.com/jobs/view/3791743442,,,,,0,,,,,,,
3747625316,Business Intelligence & Data Analytics,https://www.linkedin.com/jobs/view/3747625316,,,,,0,,,,,,,
3789798234,Data Privacy Advisor,https://www.linkedin.com/jobs/view/3789798234,,,,,0,,,,,,,
